date,text,id
2019-10-17 20:59:56,Me quiero bañar pero el agua del departamento sale tibia pic.twitter.com/HPyQejRDml,1184982406895419392
2019-10-17 20:59:55,"Señor Alberto y en la matanza quien condenó a los sectores más humildes a q estén con más de un metro de agua adentro de sus casas y pierdan todo??? Pero bueno, muchos dirán q las obras son solo cemento https://twitter.com/todonoticias/status/1184966380405309448 …",1184982404081033216
2019-10-17 20:59:52,Eu amo ela tbm kkkkkkkkkk falha tentativa de tirar foto embaixo da água,1184982390889955328
2019-10-17 20:59:51,Me traes de cabeza mi vida… y también 5 de pastor y un agua de horchata,1184982384665485312
2019-10-17 20:59:48,"Motivo de eu não aguentar ir pra aula, é tu ficar das 19h as 20:40 apreendendo sobre como pegar a pipeta na mão e pipetar água, sendo que ele explicou em 10min e o resto a gente ficou viajando na aula, e nem embora a gente podia pq a chamada ele faz no último minuto https://twitter.com/thaiengels_/status/1184915910282416134 …",1184982372648919040
2019-10-17 20:59:45,"Ni siquiera se preocupa por los hospitales, ni el desastre de la gasolina y ahora promete una Catedral. La seguridad, el agua, el gas, todo es un caos en Bolívar! https://twitter.com/JustoNogueraP/status/1184910822172250112 …",1184982362914021377
2019-10-17 20:59:44,Cuando bebo agua dejo de tener sed https://twitter.com/anaa_g15/status/1184979061543702528 …,1184982357364920327
2019-10-17 20:59:44,[17/10 20:43] Pretinha: Já busquei meu balde de novo antes q eu visse alguém bebendo água nele kk [17/10 20:43] mimi : [17/10 20:44] mimi : Ai crlho [17/10 20:44] mimi : Eu nao guentoo [17/10 20:44] Pretinha: [17/10 20:44] mimi : Agr ta um amor so. Sabe bem,1184982356437983233
2019-10-17 20:59:43,"Breve análisis de ""El fondo del mar"" de Damián Szifron y el agua como hábitat natural del protagonista: https://letterboxd.com/cinedelabestia/film/the-bottom-of-the-sea/ … PD: este es el plano del hotel reflejado en un charco de agua que destaco en el texto pic.twitter.com/4XbCLdPTvi",1184982351627112449
2019-10-17 20:59:41,@ Transmasivo_Mex ¿por qué no informan que hay retraso en su servicio? Pará ojo de agua está muy saturado!!,1184982345734066179
2019-10-17 20:59:41,"com qual elemento você me associa? terra: agradável, confiável, equilibrado e honesto água: sincero, introspectivo, observador e curioso fogo: dominante, carismático, energético e expressivo ar: despreocupado, espirituoso, charmoso e ponderado achei legal, vamo la",1184982344354152449
2019-10-17 20:59:40,bebi tanta agua p engolir o choro q vou passar a noite toda mijando,1184982340516352003
2019-10-17 20:59:40,"Qual elemento você associa a mim? • TERRA: agradável, confiável, equilibrado, & sincero • ÁGUA: ingênuo, introspectivo, cauteloso, & curioso • FOGO: dominante, carismático, energético, & expressivo • AR: despreocupado, espirituoso, charmoso, & cheio de ideias",1184982340436680705
2019-10-17 20:59:40,"Que mudança da água pro vinho no Santos. Um primeiro tempo morto, e uma segunda etapa em que o time amassa o Ceará, jogando com praticamente um só defensor. A audácia valeu, pelo menos até agora, a virada.",1184982338796740615
2019-10-17 20:59:39,"""a água tava responsa"" é ótimo KKKKKKKKKKK https://twitter.com/princelazy_/status/1184560625177038848 …",1184982334732419072
2019-10-17 20:59:34,Sera q ja tomei 2 litros de agua hj,1184982314746552326
2019-10-17 20:59:34,"oi catt fiscal de almoço eu também me preocupo bastante com a questão da alimentação de uns tempos pra cá, mas fui mt humilhado hj eu sempre levo almoço e como logo no estágio, mas tava sem água no meu bairro e n fiz comida. Fui depender do ru...",1184982313521893376
2019-10-17 20:59:31,eu AMO água com gás,1184982304126652416
2019-10-17 20:59:29,"para todas as perguntas sim e vou beber água dnv, por conta do remédio ;/",1184982296132313091
2019-10-17 20:59:29,Esperando a água ferver tem uns 10 min o fogão tava desligado Já n tenho mais sanidade,1184982294374821888
2019-10-17 20:59:23,Bueno no aprendas a calentar el agua. Pero arroz si comes y necesitas saber como se hace,1184982270102425600
2019-10-17 20:59:23,No. Lo q se cayó fue Caracas con el palo d agua https://twitter.com/AlirioRafaelCap/status/1184932505310248960 …,1184982267459977216
2019-10-17 20:59:17,Donde está la gobernadora y sus botas?! La provincia bajo agua y ella desaparecida! https://twitter.com/pabloduggan/status/1184812140974219264 …,1184982244479385605
2019-10-17 20:59:16,12 horas de jejum começando uma hora atrás e eu loca por um copinho de água,1184982239160999937
2019-10-17 20:59:14,"Oye, pero yo renové la semana pasada y entre los documentos que solicitaban no había certificación de multas. Sólo acta de nacimiento, tarjeta de SS, bill de agua o luz a nombre de uno, certificado médico y sellos y comprobantes. Pedí cita por Internet y fue un élcito...",1184982233200971778
2019-10-17 20:59:14,o soro fisiológico como água micelar é melhor do que a própria água micelar,1184982232617889793
2019-10-17 20:59:11,Si no fuera por la ayuda de La Nación ya los hubiese tapado el agua a los inundados POR FALTA DE OBRAS en La Matanza. La Magario está muy ocupada en hacer campaña para sus secuaces. https://twitter.com/TalibanArgento2/status/1184973300436525056 …,1184982219389046785
2019-10-17 20:59:09,"Pues cada vez que escucho agua marfil sonrío, por mi tan hermoso amor de verano",1184982211214430209
2019-10-17 20:59:06,"Ves kumpa? Primero dejan que te tape el agua y la mierda después aparecen y te la llevan en bidones con las pecheras para buscar tú voto, Así Funciona Verónica desde Puerto Madero. Cada ves más convencido # MM19pic.twitter.com/ee1cPXDuJu",1184982196005883904
2019-10-17 20:59:05,"- Te dije que que te fijaras si tenía agua el radiador - Bueno me olvidé, ya está. pic.twitter.com/0CFzxBszu4",1184982191585017856
2019-10-17 20:59:04,"La gente que está entre el agua, no entiende palabras, mejor dicho su cerebro no entiende palabras, porque el lenguaje del cerebro es simbólico. Creo que la experiencia le ha dejado mucha enseñanza a la gente. Algunos, estarán en condiciones de hacer el cambio,otros, capaz que no",1184982187977953280
2019-10-17 20:59:02,Mano eu fui tomar água só,1184982180579217409
2019-10-17 20:59:00,"# ConRodulfoZamoraAvanza @ ZamoraGobierno y su Alcalde @ rodulfohumberto. Con su equipo de trabajo instalaron pozo de agua del Alberto Smith que beneficiarán a las comunidades de: La Represa, calle Guarico y Páez del Centro de # VillaDeCura, con apoyo del Gobernador @ RMarcoTorrespic.twitter.com/wEWKlF904V",1184982173478207489
2019-10-17 20:58:58,"Vengo saliendo del trabajo y van dos señores caminando con su respectiva caguama XX, se me hizo agua la bocaaaa",1184982165924106240
2019-10-17 20:58:58,Conhecendo teu analisto ele não vai reforçar tua necessidade de ser prioridade e não oferece nem água,1184982165538398208
2019-10-17 20:58:58,Quien jala para Culiacán? Ya con lo que me lei del libro del chapo ya se como corre el agua,1184982163315232768
2019-10-17 20:58:57,"Quero participar qual elemento você associa a mim? – terra: agradável, confiável, equilibrado, & sincero – água: ingênuo, introspectivo, cauteloso, & curioso – fogo: dominante, carismático, energético, & expressivo – ar: despreocupado, espirituoso, charmoso, & cheio de ideias",1184982160824045568
2019-10-17 20:58:56,Faz cera aí seus cabeça de Caixa Caixa D'água do caralho,1184982157665751041
2019-10-17 20:58:55,¿Para qué ir a Venecia si toda la Matanza está bajo el agua?,1184982153609842688
2019-10-17 20:58:54,da onde tem tanta água no céu? que chove desde domingo. Num guento mais essa chuva,1184982147398033408
2019-10-17 20:58:54,Mi tio:anto limpiaste asi nada mas? Con agua sola? Anto:no pa ! Con cloro y lavandina Jajajajjajajajjajaja no paro mas,1184982145686749186
2019-10-17 20:58:54,na moral não é possível que tenha tanta água assim pra cair do céu. simplesmente não dá mais.,1184982145409921024
2019-10-17 20:58:53,"Pues yo me ducho con agua templada, soy aqui el puto thanos",1184982145120518147
2019-10-17 20:58:46,esto en verano sería la fiesta del agua pero ahora con el fresquete ya no es tan gracioso https://twitter.com/LaVanguardia/status/1184825549560123392 …,1184982114716082182
2019-10-17 20:58:44,eu não consigo ver esses vídeos até ao fim sem parar pelos menos duas vezes para respirar e beber um copo de água,1184982105186590720
2019-10-17 20:58:41,Mas não é errado tomar água na garrafa,1184982094084227072
2019-10-17 20:58:38,"E eu que fui ver endgame no avião, e chorei e solucei TANTO que o comissário de bordo foi até levar água p mim e perguntar o que tava acontecendo pra tentar me acalmar Ele era mt gente boa e no final de tudo ele ainda me zoou na saída pq eu tava chorando por um personagem KKKK https://twitter.com/starkavel/status/1184703004915703808 …",1184982081794957312
2019-10-17 20:58:38,Estudiante mexicano desarrolla pavimento que se regenera con el agua http://bit.ly/2MmRrPk,1184982079857188866
2019-10-17 20:58:37,As meninas morrendo de medo do metanol e eu só lembrando que no meu tcc a gente tratava como se fosse água,1184982075566370817
2019-10-17 20:58:33,Só lembrando que choveu e que você pode tomar 1L de água a cada mililitro que choveu,1184982060794109952
2019-10-17 20:58:33,"E as novidades não param!! Paletas de sombra e blush, água termal e primer skin care rubyrose_oficial pincéis # sabrinasatto pó dallamakeup cílios missfrandyoficial blush maxloveoficial serum @ fenzzamakeup Que vcs… https://www.instagram.com/p/B3vRT18nvs5/?igshid=ftbvq11xe1iu …",1184982057929170945
2019-10-17 20:58:32,"Meu check-up deu: lindo e maravilhoso. então não preciso ir pra academia para me reafirmar (cof cof), é só continuar comendo as cenourinhas e os alfaces tudo, 3 litros de água por dia e continuar estudando marxismo",1184982054800384001
2019-10-17 20:58:29,"depende tu inodoro, si tiene el agua muy potente, te mojas todo el orto jajajaja",1184982041617719297
2019-10-17 20:58:28,Pagamos a conta de água,1184982038698450944
2019-10-17 20:58:27,[17/10/2019 20:57:41] Nicole: Eu tô chorando por mim [17/10/2019 20:57:46] Nicole: Se eu choro por vc [17/10/2019 20:57:49] Nicole: Eu fico sem água no corpo [17/10/2019 20:57:57] Fraan: É vdd kakakaka,1184982033019392007
2019-10-17 20:58:27,"a cara de quem toma banho, bebe dois litros de água por dia e faz carinho em cachorro de rua https://twitter.com/TheSebNews/status/1184971185232195584 …",1184982032734216192
2019-10-17 20:58:25,"Nossa agora q eu parei pra pensa eu já fiz muitas merda com os meus amigos, mas a melhor foi quebra o registro de água na casa do meu melhor amigo pqp aquele dia foi loko",1184982026363031552
2019-10-17 20:58:24,Quise verme bien malota diciéndole a la señora de los esquites que le dejara dos chiles de árbol. Adivinen quien no traía agua y ahora tiene los labios hinchados.,1184982019706642438
2019-10-17 20:58:22,"qual elemento você associa a mim? – terra: agradável, confiável, equilibrado, & sincero – água: ingênuo, introspectivo, cauteloso, & curioso – fogo: dominante, carismático, energético, & expressivo – ar: despreocupado, espirituoso, charmoso, & cheio de ideias",1184982011628457986
2019-10-17 20:58:21,"qnd vejo alguem no instagram cheio de brinco, colar e anel na praia eu tenho ctz q ou essa pessoa não entra na agua ou foi assim pronta pro clique pq ne possivel",1184982009078263808
2019-10-17 20:58:21,Bebe agua etc,1184982008100990976
2019-10-17 20:58:21,se é tao pouco assim fica 2 ano sem beber agua,1184982007312502784
2019-10-17 20:58:18,"Hoy me convierto en lo que siempre quise ser: Una persona con una bicicleta playera verde agua. Y encima la pinte yo solita, me van a tener que fumar mi chochera de acá a dos años pic.twitter.com/qZ5WQLSzjW",1184981997095194624
2019-10-17 20:58:16,"Os pássaros olhavam para a portinhola aberta. Não entendiam aquilo, mas ao mesmo tempo entendiam. Podia sentir suas mentes minúsculas tentando funcionar. Tinham comida e água bem ali, mas o que era aquele espaço aberto? (Bukowski)",1184981986122883073
2019-10-17 20:58:14,"E toda dieta que eu fiz essa semana foi por água abaixo em alguns minutos, incrível",1184981980007587842
2019-10-17 20:58:13,"uma vez joguei agua pela janela da escola, a coordenação me chamou e disse que ia colocar no meu historico. eu pedi que nao porque queria estudar em stanford e eles nao colocaram https://twitter.com/angelxmeI/status/1184237639823757312 …",1184981977201627136
2019-10-17 20:58:12,uma vontade de agua de coco,1184981972751474689
2019-10-17 20:58:10,foda eh quando a bosta bate na água e a água no cu.... posso nem confiar no vaso,1184981964677353472
2019-10-17 20:58:08,Juro te que te mato se voltas a espalhar água,1184981955932233733
2019-10-17 20:58:07,Guayaquil es un animal aparte siempre que hay algo allá saquean y hacen huevadas!! Pero que el Vargas se tome un pozo petrolero es terrorismo aquí y en la luna...sabotear el agua en Ambato es terrorismo y fueron los indígenas no los saqueadores de GYE!,1184981951171715072
2019-10-17 20:58:05,"qual eu sou terra: agradável, confiável, equilibrada e honesta água: sincera, introspectiva, observadora e curiosa fogo: dominante, carismática, energética e expressiva ar: despreocupada, espirituosa, charmosa e ponderada",1184981943412236291
2019-10-17 20:58:05,Simm uma prainha com agua de coco tudo pra mim,1184981941155782657
2019-10-17 20:58:03,"# 17Octubre Amado Dios que está agua que derramas desde tu cielo en esta noche, sea para limpiar y traer bendiciones a Venezuela # Sanidad # Libertad # Paz # Amor # Prosperidad Elimina la mala hierba sembrada en nuestra nación",1184981934746849282
2019-10-17 20:58:02,"Camina con calma bajo tu paraguas, respira el aire húmedo, mira las transparentes cortinas de agua",1184981930447519745
2019-10-17 20:58:02,"ZONA LESTE não se acostuma com esse cotidiano violento, por que essa vida não foi feita pra voce rapazz voce foi feito pra correr nos campos, andar de cavalo, andar entre crianças, cachorros, velhos, entendeu rapaz, flores, natureza, rios, agua limpa pra beber rapaz",1184981928518270980
2019-10-17 20:58:01,Acho que meu corpo acostumou a beber 2L de água todo dia que agora acho q sou capaz de virar 5L por dia,1184981924080738305
2019-10-17 20:58:00,"sim, maravilhoso, eles deixam toda a água da panela mas eu tiro praticamente toda e fica show",1184981921589317632
2019-10-17 20:57:59,Por mí...que siga lloviendo hasta fin de año...asi no pueden salir mas del agua que tanto les gusta! No entienden nada....,1184981915293622273
2019-10-17 20:57:55,Habrá estado absorbiendo agua para aliviar a los matanceros...,1184981901288845312
2019-10-17 20:57:55,Agua con sal!,1184981898675789826
2019-10-17 20:57:54,"Más claro ni el agua, Lopez pactó con el CJNG!!!",1184981897018888193
2019-10-17 20:57:54,Entramos em casa uma maçã no meio do chão e o isqueiro á beira do fogão cheio de água,1184981894326312961
2019-10-17 20:57:53,"# AguaÉdireito - QUASE LÁ: avançando no sonho da comunidade de TAPARÁ MIRI, região da Várzea do Amazonas, nos mutirões pra levantar o sistema de abastecimento de água, com a chegada das caixas de 5 mil litros. # SaudeAlegria # Sapopema",1184981892472492032
2019-10-17 20:57:53,Estas merviosho juanchi que pasa querido.....duele no? Envidia?...ah no la viste a magario x ahí....entre nosotros la están buscando..... Otra visita llevate x la matanza están con el barro y el agua hasta el cuello....se vemos un abrazo y tranqui,1184981890861862919
2019-10-17 20:57:52,@ 2meninanumamoto comendo chia com agua https://twitter.com/wtfmiu/status/1184981008896221184 …,1184981885384048640
2019-10-17 20:57:51,"@ ANDASV en la zona de Montecielo, Lomas de Miralvalle estamos ya a 4 días sin agua y no avisan que sucede, cuando restablecerán el servicio?",1184981882511024128
2019-10-17 20:57:50,"El GAZNAPIRO Lozasno , cuidado @ Jaime_BonillaV no vaya a ir a municipios de BC a querer bisnear con el agua potable como lo hizo en Cholula!!!! @ MBarbosaMX",1184981877502959617
2019-10-17 20:57:48,"Estamos cansados de las alzas, la luz, el agua, el gas, el pasaje.... tienen que cortar la wea los de arriba.... sino en poco tiempo más nos van a cobrar por respirar, por trabajar y hasta por vivir",1184981870997585920
2019-10-17 20:57:42,"AHORA: El @ DirectorServiu3 , junto a equipo técnico, legal y social del @ serviuatacama , se reúne con directivas de los comités habitacionales que integran el proyecto @ Minvu “Copa de Agua I” para informar estado de la obra, en la comuna de Caldera. pic.twitter.com/8btxulp036",1184981844741279751
2019-10-17 20:57:42,[17/10 20:40] Atos Dias: já comeu então???? [17/10 20:48] Atos Dias: já passou a dor? [17/10 20:48] Atos Dias: tomou banho? [17/10 20:48] Atos Dias: tá descansando e bebeu água hj? o atos sem dúvidas é a melhor pessoaaaaa do mundo,1184981843650715653
2019-10-17 20:57:41,"Dicen ""lo muchacho del General"" que la gente no come cemento, tienen razón, el cemento no se come, evidentemente es más fácil tomar el agua. Mientras tanto eyos y eyas están de party en La Pampa. Son geniales !!!",1184981843042619396
2019-10-17 20:57:40,Minha mão com cheiro de água sanitária <//////3,1184981835937406977
2019-10-17 20:57:39,Me quise hacer la sociable tomando mate pero me quemé la boca y ahora me duele LPM quién toma con el agua a 90°C ??,1184981832531619841
2019-10-17 20:57:39,"Sin duda la mejor parte del día es cuando me limpio la cara con agua miselar, me pongo la mascarilla y después me baño...",1184981832246407168
2019-10-17 20:57:39,"Y con esa pendejada solucionaron los problemas ahora El metro Dr Caracas, funciona,.no hay cortes de Luz ni agua,.ahora alcanza El sueldo hay alimentos y medicinas",1184981832166719488
2019-10-17 20:57:36,Que guitarreas si no tenés cuerda eh mira que vo calenta la pava y ni el agua usa eh ñeri,1184981820556922880
2019-10-17 20:57:35,"Pau gostoso da pelga, chega da até água na boca",1184981815515406337
2019-10-17 20:57:34,Y el chorro de agua?? Jajajajaja,1184981812134711296
2019-10-17 20:57:32,"Espero te llegue el agua al cuello,ahí viven inundados por esa laguna q es una mugre!",1184981804266196992
2019-10-17 20:57:32,cara a sensação de passar água termal no rosto é muito gostosa,1184981801812529152
2019-10-17 20:57:31,"Quando venho na minha mãe eu que falo ""ninguém enche as garrafas de água nessa casa"" Ora ora",1184981797349855234
2019-10-17 20:57:28,Rule Sets & Games for the tournament this Wednesday 10/23/19! 21+ | No Entry Fee | Registration @8PM | Agua Caliente Rancho Mirage | Live DJ | Happy Hour Food & Drinks # confluxgaming # aguacalientecasinos # coachellavalley # esportspic.twitter.com/OgniA43FBe,1184981785907609600
2019-10-17 20:57:27,"netbook en lugares que no habia luz...jaja hay qyue ser cinica. Jubilacion de amas de casa,no es del gobierno de los k,animal!!! Ensanchado de la gral Paz? lo hicieron tan bien que cuando lluve fuerte ,el agua te llega a la mitad de la puerta....TODO VERSO",1184981781797314560
2019-10-17 20:57:25,"dormir 8 horitas al día, tomar 4 piezas de fruta, beber 2 litros de agua, una hora de ejercicio y meterme una buena rayoncia de cocaína al levantarme, mi self care routine para ser una persona nueva",1184981774214012928
2019-10-17 20:57:25,— irmão eu moro em belém se eu usasse meia assim eu perdia 70% da água do corpo em suor shwjsjwjs # curiouscathttps://curiouscat.me/ceciliaramxs/post/1004951970?t=1571356645 …,1184981772888629254
2019-10-17 20:57:24,"Quienes te conocemos sabemos el gran ser humano que eres. Dejar que el agua corra, Dios siempre nos respalda",1184981770430758913
2019-10-17 20:57:23,"Quanto mais triste eu tô no dia, mais quente eu quero a água",1184981766639095813
2019-10-17 20:57:22,"no la cobarde estupidez del pavo que amaina su plumaje al primer ruido. Procede como Dios que nunca llora; como Lucifer, que nunca reza; o como el robledal, cuya grandeza necesita del agua, y no la implora... Que muerda y vocifere vengadora, ya rodando en el polvo, tu cabeza",1184981762436489216
2019-10-17 20:57:21,"ando de antojada. quiero coctel de elote, tostilocos, horchata, agua de tamarindo, y un reboltijo",1184981758044803072
2019-10-17 20:57:19,"Jaja bueno, te creo. Pero mira, para que no recurras tanto a los domicilios: El olor a ajo se va frotando los dedos con algo metalico, como el cuchillo por ejem, bajo el chorro frio de agua. Comprobado",1184981750226792448
2019-10-17 20:57:19,"La matanza merece que le caiga un asteroide... Para que se valla el agua, ojo",1184981747521540096
2019-10-17 20:57:19,@ jisIix olha o q a vet colocou na cirurgia da haru to tentando tirar com água morna com algodão e NÃO SAI!!! pic.twitter.com/JdKRIPYVo5,1184981747336921088
2019-10-17 20:57:18,absolutamente nadie: alumno: Miss cuando vos puedas anda a una fuente de agua y tira una moneda así podes pedir el deseo de ser más ALTA. yo: Ok.,1184981743218106370
2019-10-17 20:57:16,ja deitada pra esquecer que so me alimentei de azeitona cenoura club social e agua hoje,1184981736821870592
2019-10-17 20:57:08,Odio tener ganas de llorar pero ser tan escorpiana que no te lloro ni una gota de agua,1184981703745527811
2019-10-17 20:57:08,"Porfa a los zurdos, hagan una huelga, no consuman agua, con una semanita estamos ok, así quiebran a las sanitarias. =D...",1184981700847296512
2019-10-17 20:57:05,sim :( você tá bem? comeu? bebeu água?,1184981691674382339
2019-10-17 20:57:03,tomar banho ao som de jão >>>>> chorar até a água que cai do chuveiro,1184981681821888513
2019-10-17 20:57:02,Pqp deu água boca já. 50 centavos? Perfeição,1184981677514412032
2019-10-17 20:57:02,"qual elemento você associa comigo? – terra: agradável, confiável, equilibrado, & sincero – água: ingênuo, introspectivo, cauteloso, & curioso – fogo: dominante, carismático, energético, & expressivo – ar: despreocupado, espirituoso, charmoso, & cheio de ideias",1184981677434650625
2019-10-17 20:57:00,Buenas noches mutuals uwu Duerman bien y sueñen con algo lindo uwu Tomen mucha agua para no deshidratarse Y abríguense bien para no enfermarse uwu Los quiero mucho mucho mucho mucho♡ pic.twitter.com/GIj7bE7AVu,1184981670530895873
2019-10-17 20:57:00,Só vai beber da minha água quem passou sede junto comigo. pic.twitter.com/50UY8XAtgh,1184981669431914496
2019-10-17 20:56:59,"Ojalá a que al muy inconciente de mi vecino despilfarrador de agua la cuenta del IDAAN le venga por $56,80 este mes y no por los míseros $5,68 que de a vaina paga. Xu** lleva más de 2 horas echando agua a un piso de no más de 4 metros cuadrados dizque ""lavándolo"".",1184981666525265920
2019-10-17 20:56:59,Oración para rociar la casa con agua bendita https://www.catholicmagazine.net/2019/04/oracion-para-rociar-la-casa-con-agua.html …,1184981663710883846
2019-10-17 20:56:57,"Fui jogar uma água no rosto, os olhos vermelhosss, parecia que eu tinha fumado um beck",1184981656739995648
2019-10-17 20:56:57,eu consigo ter mais gás que essa água com gás que vende no avante. e olha que nem é tão difícil assim me passar,1184981655104229380
2019-10-17 20:56:57,"qual elemento você associa comigo? – terra: agradável, confiável, equilibrado, & sincero – água: ingênuo, introspectivo, cauteloso, & curioso – fogo: dominante, carismático, energético, & expressivo – ar: despreocupado, espirituoso, charmoso, & cheio de ideias",1184981654693203970
2019-10-17 20:56:54,"Jovino postou ft no stts tomando batida,pqp mnh boca encheu d'água",1184981642957512706
2019-10-17 20:56:51,"valentin la va cagando dos veces, no se acuerda cuando es mi cumpleaños y dijo, “los signos de agua son re maricones” sin saber que soy escorpio y es un signo de agua . cada fav es un amiga date cuenta",1184981632345935873
2019-10-17 20:56:50,"Gente, quando vou pra casa da minha avó mal tem água, pqp",1184981626742288384
2019-10-17 20:56:48,"qual elemento você associa comigo? – terra: agradável, confiável, equilibrado, & sincero – água: ingênuo, introspectivo, cauteloso, & curioso – fogo: dominante, carismático, energético, & expressivo – ar: despreocupado, espirituoso, charmoso, & cheio de ideias",1184981618907373569
2019-10-17 20:56:47,"@ ANDASV señores de ANDA, ya van 3 días que no echan el agua en bosques de Prusia Soyapango, hasta cuando van a tener a nuestras casas sin agua. @ SoyacitySV @ nayibbukele @ porttada @ ultimahsv @ ElMundoSV @ soyjoseyoutuber @ tcsnoticias @",1184981614931132418
2019-10-17 20:56:46,@ OmarVillalbaG buenas noches y para cuando el agua en el Cafetal,1184981609390465024
2019-10-17 20:56:44,"Como um país inteiro corre o risco de ficar sem água potável https://youtu.be/S9lb2pqBSkk via @ YouTube Sério e preocupante isso. Dizem que a próxima grande guerra será motivada pela falta de recursos naturais, principalmente a água.",1184981600716673024
2019-10-17 20:56:43,Díganme qué no soy la única que se baña con agua hirviendo hasta el punto de salir con los pies rojos,1184981599865233408
2019-10-17 20:56:43,o deus q n multiplica o peixe na água?,1184981599353479168
2019-10-17 20:56:43,Más claro agua https://twitter.com/BonniChics/status/1184531168231874563 …,1184981597382205441
2019-10-17 20:56:43,"Estoy podrida de leer a este señor platinado balbucear y mascar el agua... Ya sabemos de su oprobioso proceder ético y moral durante su ejercicio ""profesional"" en la cuarta y quinta república... https://twitter.com/PoleoRafael/status/1184763518635171840 …",1184981596866273280
