date,text,id
2019-10-17 11:07:32,Eu vi isso ontem e a água que essas pessoas bebem tá contaminada demais pic.twitter.com/jB452CToDh,1184833326663786496
2019-10-17 11:05:43,I contaminada!,1184832869551824896
2019-10-17 10:58:24,"Després de tants anys, començo a entendre el que els passa als governants spanyords. Tenen una matèria gris de procedència sospitosa d'haver estat contaminada, per no dir més...",1184831028046811136
2019-10-17 10:58:08,“Provavelmente estou a poluir todas as minhas plantações e matar os animais com água contaminada“ http://sicnoticias.pt/pais/2019-10-17-Provavelmente-estou-a-poluir-todas-as-minhas-plantacoes-e-matar-os-animais-com-agua-contaminada-2 …,1184830961445494785
2019-10-17 10:56:34,"Entiendo. Pero claro, efectivamente, es que yo no pretendo dirigirme ahora, porque ni yo nadie puede para realmente construir revolución, a ""los barrios"", sino a la vanguardia, contaminada hasta la médula de nacionalismo.",1184830566534909952
2019-10-17 10:46:59,1er día en Bolivia que puedo escuchar la radio ver la TV sin estar contaminada de políticos mentirosos que en la mayoría solo prometen sin entender que no son alcaldes no tienen la magia de una transformación muy pocos proponen educación de calidad que es la base para un cambio,1184828151609864193
2019-10-17 10:45:31,El antes y el después de la contaminada playa de Versova en la India no deja indiferente a nadie... https://www.cinconoticias.com/playa-de-versova-ejemplo-union-medio-ambiente/ …,1184827784759316480
2019-10-17 10:29:59,"kpito, fue a tomarse examen. Por su compromiso YEGUAPARK KKNARO, debería haberse escusado de hacerlo. La docencia, no puede estar contaminada con la política, más aún, cuando se trata de un examen de conocimientos!!!!!!",1184823874623590400
2019-10-17 10:29:08,"Em cinco anos, doenças por falta de saneamento custam R$ 1 bi ao SUS. Para pesquisadores, gasto com ocorrências ligadas ao contato com água contaminada é subestimado https://www1.folha.uol.com.br/cotidiano/2019/10/em-cinco-anos-doencas-por-falta-de-saneamento-custam-r-1-bi-ao-sus.shtml …",1184823663331295234
2019-10-17 10:28:39,"La miel de abeja natural y orgánica puede fácilmente estar contaminada con clostridium, aparte de ser pura azúcar. Aprende mas en el podcast : https://longevitycoach.com.mx/podcast https://www.instagram.com/p/B3uJOacnztZ/?igshid=1esp5f5nmnvj3 …",1184823538827563010
2019-10-17 10:24:11,"Ante distribución de agua contaminada, convocan a Erssan http://www.sanlorenzohoy.com/2019/10/ante-distribucion-de-agua-contaminada.html … vía @ sanlorenzohoy17",1184822415827832832
2019-10-17 10:23:48,"Jajajajaja así es, se están perdiendo los valores en esta sociedad contaminada. No imagino mi panecito de muerto remojado en Salsa roja y limón :(",1184822320558432256
2019-10-17 10:21:09,El antes y el después de la contaminada playa de Versova en la India no deja indiferente a nadie... https://www.cinconoticias.com/playa-de-versova-ejemplo-union-medio-ambiente/ …,1184821652498079744
2019-10-17 10:20:00,"SANEAMENTO NO BRASIL | Para pesquisadores, gasto com ocorrências ligadas ao contato com água contaminada é subestimado https://www1.folha.uol.com.br/cotidiano/2019/10/em-cinco-anos-doencas-por-falta-de-saneamento-custam-r-1-bi-ao-sus.shtml?utm_source=twitter&utm_medium=social&utm_campaign=twfolha …",1184821361912504320
2019-10-17 10:11:45,to contaminada com uma modinha galera pic.twitter.com/SDQtrBZL8h,1184819287237767168
2019-10-17 10:07:55,"KKKKKKK tive uma professora que pedia para os pacientes fazerem esse exame, um dia o paciente voltou do banheiro logo após ""o procedimento"", entregou para ela e deu um tapinha no ombro dela com a mão, ela ficou v neura o dia todo achando que a mão estava contaminada",1184818322090725376
2019-10-17 10:07:53,El antes y el después de la contaminada playa de Versova en la India no deja indiferente a nadie... https://www.cinconoticias.com/playa-de-versova-ejemplo-union-medio-ambiente/ …,1184818314243170304
2019-10-17 10:00:00,2ª Turma do @ TRTRJ_Oficial mantém indenização a copeira contaminada por hepatite C em clínica → http://bit.ly/MantidaIndenizacao …pic.twitter.com/Ap3wvIIVGF,1184816329926287362
2019-10-17 09:56:21,CUANDO LLEGUE HAY QUE DECIRLE SI TRAE REMEDIOS PARA LA GENTE DE ARICA CONTAMINADA CON LOS DESECHOS DE SI PAIS QUE BOTARON ALLÍ. pic.twitter.com/l6brJYFgeR,1184815412900519937
2019-10-17 09:47:15,"Bueno con Eduardo, Santiago se engrandecerá. NOTA: él NO da un chele! Entiéndanlo bien. Trabajará sin descanso y devolverá la esperanza de que aún queda gente no contaminada con la corrupción. https://twitter.com/Juls555/status/1184588548781101057 …",1184813122789560320
2019-10-17 09:43:07,"Essa polêmica sobre condenação em segunda instância está contaminada pela luta partidária. A torcida a favor conta com o apoio da direita e dos lavajatistas, que hoje se sabe, fizeram campanha para o atual... https://www.facebook.com/pedrosadireitoshumanos/posts/2366432453618350 …",1184812080639205376
2019-10-17 09:38:25,Estimado alcalde hay que fortalecer de una manera agresiva la amistad entre quiteños y VECINOS por siempre impulse esta idea vi su entrevista hoy dia no se preste a esa prensa contaminada de odio queriendo direccionar hacia donde quiere la entrevistadora equivocadamente,1184810896436137986
2019-10-17 09:38:15,"Que todos os militares se manifestem e exerçam sim, uma pressão sobre essa instituição contaminada. Eles precisam saber que por bem ou por mal, os interesses da população seja atendido.",1184810855105548290
2019-10-17 09:32:07,"Buenos días desde Barcelona, una ciudad destrozada, quemada, contaminada y como siga así inhabitable. Y como si fuese poco, Torras en su despacho ajeno a la realidad.",1184809314701185024
2019-10-17 09:26:54,"Pronto, não preciso ver nada no Twitter hoje. Peguei minha dose de alegria e vazei antes que ela seja contaminada!!!! As mulheres são gigantes. # amantesdofutebolfeminino",1184808000206393345
2019-10-17 09:19:20,"Cuando una sociedad está contaminada x ésta lacra se narcos y delincuentes, amparadas x políticos y protegidas x jueces corruptos, ya no hay nada q hacer sino se cambia a quienes son responsables d administrar justicia y a quienes deben corregir las leyes, los políticos..!!! pic.twitter.com/fN46vgluay",1184806096038498305
2019-10-17 09:17:26,"@ ConElMazoDando R T Kiyosaki, gringo-japonés, dice que ""el dólar es tóxico y hace que los negocios y la gente se enfermen que es como beber agua contaminada y después preguntar por qué te enfermas"". Uds son soberanos pueden elegir otras monedas, pero colombianos, no. Adelante uds",1184805618252693507
2019-10-17 09:16:02,El antes y el después de la contaminada playa de Versova en la India no deja indiferente a nadie... https://www.cinconoticias.com/playa-de-versova-ejemplo-union-medio-ambiente/ …,1184805263582416898
2019-10-17 09:09:14,"EL MAGO DEL FIN DEL MUNDO SE SUMERGIRÁ EN AGUA CONTAMINADA PARA CREAR CONCIENCIA AMBIENTAL DURANTE LA PRÓXIMA COP25 https://ift.tt/2po73cd # Ciencia, Educación, Noticias, # cop25, # jeanpaulolhaberry, # medioambiente, MAGIA",1184803554030227462
2019-10-17 09:03:55,Não vejo pq não há o que ver ....a não ser besteiras e intrigas e disparates de asneira no twitter que contamina até vc já tá contaminada graças a liberdade de escolha escolhi ficar imune a isto abço,1184802216705740804
2019-10-17 08:54:27,El antes y el después de la contaminada playa de Versova en la India no deja indiferente a nadie... https://www.cinconoticias.com/playa-de-versova-ejemplo-union-medio-ambiente/ …,1184799832583618560
2019-10-17 08:53:33,¿Porque los diputados se la pasan proponiendo puras estupideces? ¿Sera que el agua de la asamblea ests contaminada y por eso todos tienen el cerebro del tamaño de un mani?,1184799608876290048
2019-10-17 08:48:56,"Digan la verdad al soberano que ya se ha dado cuenta! La revolución están tan infiltrada y contaminada de corrupción que permiten a los malandros comercios hacer lo que quiera sin ser enjuiciados ,es por ellos que los dirigentes evitan hablar de estos temas!",1184798444583575553
2019-10-17 08:48:37,"Es inaudito que quien se la pasa jugando con su celular en el congreso y nulo en aspectos ambientales, vaya a decidir privarnos de agua no contaminada a los santandereanos.",1184798363759337473
2019-10-17 08:43:15,Ela deve ter sido contaminada pela esclerosidade do FHC.,1184797016548892672
2019-10-17 08:42:08,Ela deve ter sido contaminada pela esclerosidade do FHC.,1184796734129672194
2019-10-17 08:41:51,En este orden de ideas no tenemos porque votar por gente contaminada y comprometida con cuestionamientos que arrastran malos momentos y procedimientos para la democracia. Llegó el momento de hacer un alto y de poner una barrera muralla entre un pasado que ha sido nefasto y uno.,1184796662490898433
2019-10-17 08:31:09,"I ben contaminada. I ben submissa. I, sobretot, que t'asseguri el teu xollo molt ben remunerat. Sobretot això últim.",1184793970540503040
2019-10-17 08:31:03,"El pueblo de a pie tambien tiene derecho a oler Flores y inmundicias como lo hace la conunidad de Antimano con su quebrada ubicada a la altura del ivss Antimano ya va a cumplir 2 años de estar tapada, desbordada y contaminada la Zona C le agradece estar al dia con. Ccs VENEZUELA",1184793943621459968
2019-10-17 08:27:25,"Y pronto estará contaminada por dioxinas, furanos, metales pesados y demas partículas cancerígenas, cortesía de la polemica incineradora que el PNV y el PSOE, en pleno siglo XXI, nos obligan a comernos con patatas. Gracias por mi futuro cáncer. # ErrausketarikEZhttps://twitter.com/Donostilandia/status/1184791242405765121 …",1184793029548396544
2019-10-17 08:23:47,Entre cielo y tierra hay una atmósfera densa y contaminada.,1184792115416653824
2019-10-17 08:22:54,"""Para pesquisadores, gasto com ocorrências ligadas ao contato com água contaminada é subestimado."" https://www1.folha.uol.com.br/cotidiano/2019/10/em-cinco-anos-doencas-por-falta-de-saneamento-custam-r-1-bi-ao-sus.shtml …",1184791895102414850
2019-10-17 08:20:58,já está contaminada,1184791409116753920
2019-10-17 08:20:29,Despres cambieu-se la roba que estarà contaminada! Molt bona feina!,1184791286706069504
2019-10-17 08:20:29,"mais uma praia contaminada Pituba, Rio Vermelho e Ondina. O litoral do Nordeste sofrendo com esse crime, sem respostas... A galera tá trabalhando pesado {voluntários, prefeitura, governo...}, mas, provavelmente, só teria uma rápida solução se fosse no sudeste/sul",1184791284726292480
2019-10-17 08:19:29,"Não tem jeito, não consigo usar verde e amarelo, ainda esta contaminada!",1184791032682168320
2019-10-17 08:06:10,"Boirosa i contaminada, bàsicament.",1184787681919864833
2019-10-17 08:01:02,Detectan agua del grifo contaminada con químicos en California https://www.elmundo.es/ciencia-y-salud/ciencia/2019/10/16/5da6f4e9fc6c8331488b4577.html …,1184786388937560064
2019-10-17 07:58:20,"Oh, common’ Jo l’únic que hi veig aquí és una ciutat ultra contaminada. https://twitter.com/polmorillas/status/1184758997871669248 …",1184785711175753729
2019-10-17 07:54:33,"O contexto em 1914 era outro, mas o problema é o mesmo. Parabéns General! As reações contrárias são nada mais que esperneio agonizante da estrutura contaminada que vai perecer. Viva à justiça e à democracia. Vamos acompanhar hoje o STF que vai mostrar o que vem por diante. https://twitter.com/Gen_VillasBoas/status/1184601278590210048 …",1184784761266425856
2019-10-17 07:53:20,Começo o dia com um copo de água contaminada pelos “defensivos agrícolas “.,1184784454394548224
2019-10-17 07:52:44,Mas contaminada el agua esa https://twitter.com/VeroAlmiron0/status/1184198119455678464 …,1184784303726694401
2019-10-17 07:51:30,"Que se jodan ,votaron a Magario y la tipa en vez d hacer OBRAS como tenia q hacer con la plata q le dio Vidal se la guardo para ella mientras ustedes estan en el agua contaminada magario vive en P Madero Vivisima",1184783990147993601
2019-10-17 07:39:15,Um pouco de alento pra humanidade tão contaminada pelo ódio. Bom dia povo do bem https://twitter.com/PapaiBozo/status/1184749711544205313 …,1184780909263966208
2019-10-17 07:36:31,Así es .. no hay libertad de expresión .. eso no es la democracia que queremos en el país.. toda la política está contaminada,1184780220412370944
2019-10-17 07:24:32,"Jajaja el frente comprometido con los temas ambientales? Jajajaj contaminación del agua y las napas, Aratirí, regasificadora, UPM y UPM2 en los primeros 3 años de gobierno el agua potable paso a ser agua contaminada. Cuál es el tema ambiental del FA. Arruinar el país? Más https://twitter.com/Frente_Amplio/status/1174773787927240704 …",1184777203462086657
2019-10-17 07:14:42,Las usarán como bolas de playa en la nueva “playa”. Porque nada más dice que la ciudad mejora que hacer una playa falsa con agua contaminada,1184774732761182208
2019-10-17 06:57:20,"Buen día, es cierto que está contaminada esa salina? Porque están extrayendo esa sal para la venta sin controles sanitarios.",1184770362183172099
2019-10-17 06:37:45,El antes y el después de la contaminada playa de Versova en la India no deja indiferente a nadie... https://www.cinconoticias.com/playa-de-versova-ejemplo-union-medio-ambiente/ …,1184765430428323841
2019-10-17 06:31:27,"PD(Post Data): Los fascistas que vivís en Catalunya sois los que más asco me dais. Desde fuera de Catalunya la prensa está contaminada, incluso TV3, y la gente puede que no vea la realidad. Pero vosotros vivís aquí y no lo veis porque no queréis. Ni olvido, ni perdón.",1184763845694382086
2019-10-17 06:12:54,"Bé, sí que passaria alguna cosa: guanyaríem una ciutat més amable pels ue hi viuen, amb menys sorolls i menys contaminada",1184759179648602112
2019-10-17 06:11:34,También odio que estes tan contaminada que me tengo que lavar el pelo casi todos los días porque se me ensucia.,1184758841910673409
2019-10-17 05:57:23,"Saneamento no Brasil Em cinco anos, doenças por falta de saneamento custam R$ 1 bi ao SUS Para pesquisadores, gasto com ocorrências ligadas ao contato com água contaminada é subestimado E o governo do @ ptbrasil ficou 16 anos e não resolveu este problema ???",1184755273761787904
2019-10-17 05:48:23,"El puente Pueyrredón sobre el Riachuelo levantado el 17 de octubre para que los tjdores no entraran a la CF . No sirvió El agua putrefacta y contaminada fue atravesada a nado, en botes y sobre tablones de madera. Tuvieron que bajarlo. pic.twitter.com/92doZhM3MY",1184753006912458752
2019-10-17 05:00:33,水 - みず/すい (Mizu/Sui): Agua (fría) 湯 - ゆ (Yu): Agua caliente 淡水 - たんすい (Tan sui): Agua dulce 海水 - かいすい (Kai sui): Agua salada 飲用水 - いんようすい (Inyō sui): Agua potable 汚染水 - おせんみず (Osen mizu): Agua contaminada,1184740970019069952
2019-10-17 04:29:28,El antes y el después de la contaminada playa de Versova en la India no deja indiferente a nadie... https://www.cinconoticias.com/playa-de-versova-ejemplo-union-medio-ambiente/ …,1184733149823143936
2019-10-17 04:05:14,"Dissolució immediata de la BRIMO, contaminada totalment per la ultradreta espanyolista. # SpainIsAFascistEstate # tsunamidemocractic",1184727050185256960
2019-10-17 04:03:47,ANSE y WWF piden no bombear más agua dulce contaminada por nitratos # MedioAmbientehttp://bit.ly/2IVmmzY,1184726684802732033
2019-10-17 03:56:15,"O problema não é estar de mãos dadas e sim a simpatia dele por essa gente globalista, financiadora do caos na terra e que defendem uma nova ordem mundial.A igreja está contaminada seu fim já está próximo.",1184724787161174016
2019-10-17 03:51:18,"Yo también, no está contaminada de ideas feministas, LGTB, globalistas y toda la basura de hoy.",1184723543524872192
2019-10-17 03:30:05,El antes y el después de la contaminada playa de Versova en la India no deja indiferente a nadie... https://www.cinconoticias.com/playa-de-versova-ejemplo-union-medio-ambiente/ …,1184718203102154753
2019-10-17 03:24:07,Como dijo un caballero sangre nueva contaminada con la vieja; viene cargado con los mismos corruptos que están ahora. Entonces... ¿donde está el cambio?,1184716701440581632
2019-10-17 03:12:05,El antes y el después de la contaminada playa de Versova en la India no deja indiferente a nadie... https://www.cinconoticias.com/playa-de-versova-ejemplo-union-medio-ambiente/ …,1184713675116072960
2019-10-17 02:57:56,"A ver, que el otro día explicaban que la guerrilla colombiana vuelve a actuar porque está contaminada por el procés. El infinito es el límite.",1184710112306487296
2019-10-17 02:52:02,Menino tem infecção grave após engolir água contaminada no Pará https://www1.folha.uol.com.br/cotidiano/2019/10/menino-tem-infeccao-grave-apos-engolir-agua-contaminada-no-para.shtml?utm_source=twitter&utm_medium=social&utm_campaign=twfolha …,1184708629062176768
2019-10-17 02:46:10,El antes y el después de la contaminada playa de Versova en la India no deja indiferente a nadie... https://www.cinconoticias.com/playa-de-versova-ejemplo-union-medio-ambiente/ …,1184707153103327232
2019-10-17 02:41:25,Entrando água contaminada no nosso cu owm,1184705954799075329
2019-10-17 02:27:32,"Que tiene RUC de palmicultor, allá irá a parar nuestra agüita limpia a la palma y la minería, para salir sucia y contaminada https://twitter.com/YASunidosCuenca/status/1184485649535119360 …",1184702464056090624
2019-10-17 02:25:39,"Don Chamuco, se volvió a pasar! Ya vio que la bruja no tiene guantes? Toda esa agua de calzón contaminada con sus asquerosas manos, quien sabe dónde las había metido antes! pic.twitter.com/84zT4YRtnZ",1184701989965295617
2019-10-17 02:23:42,"Casi nunca funciona Asuntos Internos pero esta vez parece ser que si, aunque toda la escena está 'contaminada', @ mh_plataochohttps://twitter.com/Delta25MX/status/1184591197345603585 …",1184701500188061696
2019-10-17 02:15:03,Menino tem infecção grave após engolir água contaminada no Pará https://www1.folha.uol.com.br/cotidiano/2019/10/menino-tem-infeccao-grave-apos-engolir-agua-contaminada-no-para.shtml?utm_source=twitter&utm_medium=social&utm_campaign=twfolha …,1184699319707938816
2019-10-17 02:03:21,"Conversa, aff, fui contaminada",1184696377034625025
2019-10-17 01:40:40,El antes y el después de la contaminada playa de Versova en la India no deja indiferente a nadie... https://www.cinconoticias.com/playa-de-versova-ejemplo-union-medio-ambiente/ …,1184690669648076800
2019-10-17 01:01:08,o cara com radiação no nível mais pesado e a mina beijando ele AMADA TU QUER SER CONTAMINADA É AMADA????????? porra gente apaixonada é foda,1184680719957790725
2019-10-17 01:00:20,El antes y el después de la contaminada playa de Versova en la India no deja indiferente a nadie... https://www.cinconoticias.com/playa-de-versova-ejemplo-union-medio-ambiente/ …,1184680518991912960
2019-10-17 01:00:15,"...partidarizada. Nossas praias sendo tomadas por óleo, animais morrendo, água contaminada e não se vê matérias com a ênfase que deveria abordando isso.",1184680495210291202
2019-10-17 00:59:23,"Con @ EnriquePenalosa en la alcaldía bogota es una selva de cemento,llena de inseguridad,intransitable,contaminada,corrupta y llena de malandros",1184680279551758336
2019-10-17 00:33:37,Mosquito tomate el palo por tu bien te lo digo mi sangre está contaminada lv,1184673794079821824
2019-10-17 00:32:17,Eso si creo que fue karma no creyeron en tu palabra y hasta ahora mueres en tu ley (yo si te creí) y mira lo que le pasó xd la taza contaminada # MagalyTvLaFirme,1184673458707402754
2019-10-17 00:24:54,"¿A Loretito? ¿El rey de los montajes ""periodísticos"" (Florence Cassez y Frida Sofía)? Deja el Twitter Luis y ponte a trabajar como director del organismo.operador del agua en Nacozari, para resolver el problemon de agua ""potable"" contaminada. pic.twitter.com/MqZEZYD0HR",1184671601993932800
2019-10-17 00:18:38,Confirma Medio Ambiente mortandad de peces en el río Escondido por agua contaminada https://k911noticias.com/confirma-medio-ambiente-mortandad-de-peces-en-el-rio-escondido-por-agua-contaminada …pic.twitter.com/TLO0RMuRFE,1184670022981029888
2019-10-17 00:18:25,El antes y el después de la contaminada playa de Versova en la India no deja indiferente a nadie... https://www.cinconoticias.com/playa-de-versova-ejemplo-union-medio-ambiente/ …,1184669968157364224
2019-10-17 00:14:38,"Sua opinião está contaminada pela idéia de que qualquer coisa que desagrade determinada autoridade é desacato. Isso não é verdade. Inclusive, há julgados do STF e do STJ que entendem que o crime de desacato nem foi recepcionado pela CF, pois restringe a liberdade de expressão.",1184669018608848896
2019-10-17 00:10:10,"Bueno si la fruta cae cerca del árbol Ya vendrá contaminada? Ojalá no venga contaminado. Como va a gobernar junto a la coalición ? Manini, Talvi, sanguíneo, mieres Uff todos juntos Como se van a acomodar ?",1184667893818122240
2019-10-16 23:51:01,El antes y el después de la contaminada playa de Versova en la India no deja indiferente a nadie... https://www.cinconoticias.com/playa-de-versova-ejemplo-union-medio-ambiente/ …,1184663074122489856
2019-10-16 23:50:03,tô contaminada pela febre do cancelamento,1184662829665849344
2019-10-16 23:38:42,"Dioss que equivocada está la gente al pensar que como no ven tan contaminada la ciudad o el lugar donde viven, no tienen que comenzar a tomar ciertas medidas que ayudan a que esto no ocurra. Parece que esperan estar en un ambiente súper contaminado y tóxico para cuidarlo.",1184659973206401024
2019-10-16 23:36:36,Yo quisiera que @ ComiteSanturban realmente subiera a California y vieran que el agua ya está contaminada. Se irían de culo porque se les acaba el show de que están defendiendo el agua jajajajaja,1184659447219658762
2019-10-16 23:32:00,"COMO AYUDAR.. ●Usar energia sustentable o solar ●Desconecta cosas que no esten en uso ●La industria ganaderia contaminada muchisimo y es una de las primeras causas de calenta betito glival,ten dos dias sin comer carne a la semana.",1184658288572583939
2019-10-16 23:14:24,Ainda bem que eu não fui contaminada por essa doença.,1184653859505000448
2019-10-16 23:09:16,La linda noche de hoy en la contaminada ciudad de Bogotá pic.twitter.com/euTJgTvVya,1184652565394403328
2019-10-16 22:59:19,"Esa tipa, hija de Diosdado está contaminada! No tiene remedio!!! https://twitter.com/migdaliatupano/status/1184535806452649984 …",1184650063857029120
2019-10-16 22:56:15,"La izquierda atomizada que, en un tiempo atrás, fuera la esperanza de un pueblo. Hoy sectaria y egoísta no puede unirse para llevar la esperanza de ese pueblo. Además contaminada de corrupción se acusan de traición.",1184649290964197377
2019-10-16 22:52:20,# MatanzaNoAvanza # DondeEstaMagario los tapo el agua contaminada https://twitter.com/TalibanArgento2/status/1184464922014617600 …,1184648307928436737
2019-10-16 22:50:15,A mídia no Brasil é tão contaminada que passaram 2 meses falando groselha e fazendo alarde com queimadas na Amazônia e agora culpam a o Chefe do Poder Executivo da União pelo despejo de petróleo da Venezuela no mar brasileiro,1184647780624678913
2019-10-16 22:37:03,Amada??? Vc era sendo contaminada msm???,1184644461529358336
2019-10-16 22:29:29,Ay dios!!!! seguro los votas a los peronchos. no entendes nada. hablo de agua de lluvia q esta a 1 metro y vos queres q den la luz? vos queres hacer un asado con gente calcinada entonces Agua? si hubiera agua saldria toda contaminada . segui votando asi vos y los 2millones,1184642554266038272
2019-10-16 22:21:54,ESTE ES UN MERCENARIO DE LA OLIGARQUÍA Y PRIMACÍA. ES UN LACAYO. DESGRACIADAMENTE ESTA AL MANDO DE LA OEA. ORGANIZACION CONTAMINADA POR EL IMPERIALISMO YAKEE.,1184640647996825600
2019-10-16 22:19:34,El antes y el después de la contaminada playa de Versova en la India no deja indiferente a nadie... https://www.cinconoticias.com/playa-de-versova-ejemplo-union-medio-ambiente/ …,1184640060756500480
2019-10-16 22:18:53,Jajjaja siempre tiene una respuesta mi presidente me iso la noche me e reído esta bien no se deje chupar nada esa saliba. Puede estar contaminada y se nos puede enfermar. Y si un día se le pasa serca. Échese desinfectante,1184639888521596929
2019-10-16 22:07:53,Acho que fui contaminada pelo ódio da Gabrielly n é possível que esteja odiando tanto tudo,1184637118922014720
2019-10-16 22:02:11,"Si tienes una botella de agua pura y cristalina, con un dedal de aguas fecales que le añadas, ese agua ya no la bebes; no está un poco contaminada, está contaminada entera. Así el pecado por pequeño que sea, nos mata. Gracias a Dios que nos Da la Victoria por medio de Cristo.",1184635684675567616
2019-10-16 21:53:40,"Agrotóxicos, cianobacterias, cuenca del santa Lucia contaminada, pasteras ... seguimos?",1184633540471865349
2019-10-16 21:50:25,"Hay qué ver qué tu si eres, un vil degenerado,lengua ponsoñosa, contaminada, . ya quisieras tu, tener la decencia del tino, honrado trabajador, y una gloria de colombia. https://twitter.com/Betocoralg/status/1184192215100416001 …",1184632722175729669
2019-10-16 21:43:37,O fruto quase apodreceu porque a raiz foi contaminada,1184631010929053697
2019-10-16 21:39:21,esq españa es una democracia contaminada plena y plena y de las mejores contaminaciones del mundo,1184629937627684864
2019-10-16 21:34:14,"Isso que eu chamo de transfobia gritante. Essa foi contaminada pelos germes dos bolsominions só pode. Não vai ter jeito, vai ter que sacrificar. https://twitter.com/suplineyall/status/1184205686756007936 …",1184628653382098944
