date,text,id
2019-10-20 20:51:51,"i love u , and you deserve more of happiness , whatever happened i love u and whatever the reason i don’t hate u and I know I’m not being your person who you want in sometimes but I’m trying to be the best and I failed in most cases, I’m sorry for making you sad in any day . https://twitter.com/salma_darwishh/status/1162897069474013184 …",1186067538385526784
2019-10-20 20:51:50,Yea I feel the same way you can read it and Study it yourself but ppl think the only way to Learn is to go to Church when it’s not the case necessarily,1186067534660935680
2019-10-20 20:51:49,"Oh, yeah! In this case, save your money.",1186067526981173248
2019-10-20 20:51:45,Criminal case overlaps uncomfortably with Trump impeachment probe https://www.msnbc.com/rachel-maddow/watch/criminal-case-overlaps-uncomfortably-with-trump-impeachment-probe-71650885761 … via @ msnbc,1186067512980574209
2019-10-20 20:51:44,"i mean honestly i feel kike the first time you go to a beautician for anything, you don’t tip overly well the first time, in case they f ed up and you don’t notice at first. when you go back that’s when you tip better. i don’t do this but i should bc i’ve been fucked before lmao",1186067505900642304
2019-10-20 20:51:43,I carry a case of whoopass with me.,1186067503472136194
2019-10-20 20:51:42,In case you all forgot! https://twitter.com/SLAMonline/status/1185962430528184322 …,1186067498350907393
2019-10-20 20:51:42,She sounds like a case of r/notliketheothergirls.,1186067497583284226
2019-10-20 20:51:41,"@ paligoccms just sent over a request for a trial. i don't have a personal website, so i just entered http://website.com ....just wanted to let you know in case you thought it was spam",1186067496098508800
2019-10-20 20:51:40,"One might argue that you can't take every single person who has helped you in data analysis as co-authors, including those provided general suggestions. This may be true but I would still think there are a lot of cases where they deserve authorship. (3/n)",1186067490461437953
2019-10-20 20:51:39,yixing’s era was monster i rest my case,1186067487600852992
2019-10-20 20:51:39,"the script says ""bank robberies belong to the past. Today the loot is in the Budgets."" In this case to: ""National Security"". Check the contemporary world history. Including USA, UK, Israel, Australia or Argentina # YourRightToKnow # PressFreedom # righttoknowpic.twitter.com/matTLbFvwh",1186067485424009218
2019-10-20 20:51:37,"@ biggyTW- Hi, thanks for following us. Have a Blessed Day Let's Grow Together! Again, we thank you. # Sunday # SundayFeelings In case you missed it pic.twitter.com/E7lWPn9Z4G",1186067479262416896
2019-10-20 20:51:37,Scotland situation is as in any case different. The case of Catalonia more unfair than ours as C voters utterly rejected Spanish government parties more so than we have here. Your prejudice not to perceive Catalonia as a country is fine but you can't impose it on others by force.,1186067478629289991
2019-10-20 20:51:35,"in that case we may well need a heck of a lot more prisons, instead of the hospitals",1186067471696060417
2019-10-20 20:51:34,Homicide Squad: New York Cases https://www.g5e.com/fb_detect/135/?picture=http%3A%2F%2Fpromo.g5e.com%2Fhspg%2Ficon_homicide_squad.png&description=I%27m+playing+Homicide+Squad%3A+Hidden+Crimes.+Will+you+come+and+join+me%3F&locale=en_US …,1186067465564033025
2019-10-20 20:51:34,"Singapore dengue tally tops 13,000. This is the highest number of # dengue cases in Singapore in 3 years. The good news is the number of weekly dengue cases has declined, from a high of 664 in the 2nd week of July to this past week of 193. http://outbreaknewstoday.com/singapore-dengue-tally-tops-13000-conductor-lin-ah-leck-dies-96885/ …pic.twitter.com/cCRFkQhRPq",1186067463965855747
2019-10-20 20:51:33,"So the guy who settled a 26 million dollar fraud case , was not going to take any money from foreign nationals at his hotel ????",1186067462590287879
2019-10-20 20:51:31,"Even in 2019, there are people who treat the number of case fans in one's computer as some kind of dick-measuring contest. Mine has three. I guess I'm not an enthusiast because I don't have at least seven.",1186067453605888000
2019-10-20 20:51:28,"Do not presume to know what ""the public"" wants. Some ppl may want what you want, other people may want something else. It's quite simple, stop making assumptions & stop making over generalisations to suit your argument. In this case you are wrong.",1186067441299918848
2019-10-20 20:51:27,"Gender isn't biological, it's a social construct. I believe you're thinking of biological or genetic sex (which, by the way, is not actually entirely binary). In case you'd like to learn something https://youtu.be/MitqjSYtwrQ",1186067438112251904
2019-10-20 20:51:26,Homicide Squad: New York Cases https://www.g5e.com/fb_detect/135/?picture=http%3A%2F%2Fpromo.g5e.com%2Fhspg%2Ficon_homicide_squad.png&description=Can+you+help+me+find+these+items%3F+I%27m+having+trouble+finding+them%3A+Billiard+balls%2C+Stack+of+photos%2C+Two+crossed+cues%2C+Light+kite%2C+Professional+kite.&locale=en_US …,1186067433674678273
2019-10-20 20:51:24,In that case I say.................. Naming myself? Ye,1186067425533530112
2019-10-20 20:51:24,Before you get obsessed make sure bih like you so you don’t catch a case,1186067422152929283
2019-10-20 20:51:23,I'm not planning a storm of areola 51 and feel like that might be the high ground in this case,1186067419116138497
2019-10-20 20:51:21,"In this case, Shirou really was the friends we made along the way.",1186067409343524864
2019-10-20 20:51:20,Building a case for Putin.,1186067405354569728
2019-10-20 20:51:18,"Pobre David lo casé del cuello de la remera, una estirada bárbara jajajajaj",1186067400443269121
2019-10-20 20:51:18,"If you say so. In the meantime, look for a good shrink just in case it doesn't turn out as you fantasize.",1186067396857094145
2019-10-20 20:51:18,What’s your case for New York?,1186067396605435904
2019-10-20 20:51:15,"New book just got released called "" Animal Game Park "" Swahili Version "" Mbuga ya Wanyama"" In case you missed the Memo.",1186067384487989248
2019-10-20 20:51:15,I once scolded a protester while he was in progress of refurbishing - I don’t agree with the tactic in some cases - and he responded politely and made his argument. This is how safe I feel around them.,1186067384404041728
2019-10-20 20:51:15,If that were the case it would not be rape in the UK where penetration by a penis is an element of the crime.,1186067384005611521
2019-10-20 20:51:14,In case I get varified again here's my tumblr (need an account to view) https://www.tumblr.com/blog/backup-stupidude …,1186067382600531969
2019-10-20 20:51:14,Z&Z weren't on Most Wanted in case that got confused,1186067381778632705
2019-10-20 20:51:13,Check out Disney Princess Pilot Case Rolling Luggage Carry on Approved https://www.ebay.com/ulk/itm/153683928246 … ⁦ @ eBay⁩,1186067377177485312
2019-10-20 20:51:13,Im American and it’s not offensive to me. Don’t try to speak for all Americans. Too much evidence to ignore in this case.,1186067375780708354
2019-10-20 20:51:12,"Maybe next time you go off on other people you should check your pathetic 30k a year salary and stop defending people who make ""real"" money. That's what your doing here. In case you didn't know what you were rabidly demeaning a stranger about on the internet.",1186067375184965634
2019-10-20 20:51:11,Rest my case.. iPhones were made by slaves in China and you worried about these ducks going down a tiny slide.. I'm crying rn,1186067368839122945
2019-10-20 20:51:08,In 45's case # POTUScouldAlsoStandFor Pompous Orange Turd Unleashes Scandals.,1186067355811696640
2019-10-20 20:51:08,Sotomayor breaks new two-minute rule as Supreme Court hears immigration case https://thehill.com/legal/466391-sotomayor-breaks-new-two-minute-rule-as-supreme-court-hears-immigration-case#.Xazy6mvVO8c.twitter …,1186067354754699271
2019-10-20 20:51:08,"Ok cool. Well in that case, I think they ARE married.",1186067354561798146
2019-10-20 20:51:06,"I definitely agree that we should be mindful of language. It's usually easy to tell from the context whether somebody means non-black or non-binary. In cases where it's ambiguous, you can just spell out the whole word.",1186067349733924864
2019-10-20 20:51:04,"They exposing @ todrick for being racist towards blacks, not paying his dancers/drag queens & for sexual assault! I never liked his phony ass from the start!!! Grab some popcorn ladies. This is a case for the FBI. pic.twitter.com/YNC6nC1Kus",1186067340116389891
2019-10-20 20:51:04,Where I live that isn't the case. One can work two jobs and really not have enough money to meet all expenses.,1186067337851625472
2019-10-20 20:51:02,"Síp, para que te cases conmigo también. https://twitter.com/PoxtryTori/status/1186049265438732289 …",1186067330935263232
2019-10-20 20:51:02,"It feels correct to me to say you've just leveled up than you're uncaring. Personally. That doesnt seem to be the case based on our limited interactions, anyhow.",1186067330083803136
2019-10-20 20:51:01,NGL it's usually drink related in my case,1186067326707351553
2019-10-20 20:50:56,"ahhhhhhhh!!! Ahora sí les acomoda la fórmula: ""NO ES LA FORMA""... Relativismo puro. I rest my case.",1186067304104316930
2019-10-20 20:50:53,Im confused? Does that make him a MAGA bitch? Cause in that case I would agree with him,1186067295069585408
2019-10-20 20:50:53,"In case anyone needs a recap from last time, a sampling of our current goals, players, and other plot points. If you’re confused, that’s okay. So are we. pic.twitter.com/1ItmDlQkBn",1186067294625026049
2019-10-20 20:50:52,Shit in that case ima plan something again soon!!,1186067288908132353
2019-10-20 20:50:50,Jx1! WTA ADA YANG JUAL CASE HANDPHONE YANG KAYA PUNYANYA WOOSEOK?,1186067281438109697
2019-10-20 20:50:50,I rest my case https://twitter.com/nlghtlovers/status/1186061204659281920 …pic.twitter.com/02RvhvfAGE,1186067281136308225
2019-10-20 20:50:49,Does the 2nd season deal with the same case or a different case?,1186067278493822977
2019-10-20 20:50:48,"Because suits running companies don't consider the case part of the product. I don't agree with it, but I don't get to make the decisions.",1186067272571375616
2019-10-20 20:50:48,Right! Broke down rides! Always high up sheesh! I can handle some but others like that nope! I want a fighting chance just in case.,1186067270654709760
2019-10-20 20:50:47,"Good sequel to # burnergate, by @ bdetrick - you should enlist @ legsanity and Sixers twitter to close the case. https://twitter.com/ashleyfeinberg/status/1186050468499333120 …",1186067269694230529
2019-10-20 20:50:47,Check out what I just added to my closet on Poshmark: Vintage Belgian Floral Hand Beaded Glasses Case. https://poshmark.com/listing/5dacf2d0510bca38e17f925c?utm_campaign=referral_code%3DSAINTSVINTAGE&utm_source=tw_sh&utm_content=feature%3Dsh_li_cl_web%26rfuid%3D53948bcfdd7b7f44081f4d1d%26ext_trk%3Dbranch … via @ poshmarkapp # shopmycloset,1186067269194928128
2019-10-20 20:50:47,If I could not eat for 3 years then I would want to die and that’s just me. End of life decisions are difficult. New technology—this was not a problem in 1900. Us human creatures must wrestle with complex decisions in these cases.,1186067268083560448
2019-10-20 20:50:47,they all really had matching phone cases that said happy together pic.twitter.com/evR8yidGIt,1186067267525713921
2019-10-20 20:50:47,Did you read that article? How gross is a flesh phone case?,1186067266657538048
2019-10-20 20:50:45,"Unless it's DDLC, in which case I'd call it more of an interactive, ""point and click"" visual novel",1186067261322334209
2019-10-20 20:50:45,Kung anong kina ganda ng phone case ko sya naman ikinasira ng screen ko,1186067259208257536
2019-10-20 20:50:44,"remember jim comey's secret twitter account..... i used to follow that one, just in case something lol happened, but it appears to have been suspended in the meantime",1186067254917640193
2019-10-20 20:50:43,Some folks only hear what they want to hear & understand what they want to understand. Well just in case you didn’t know that is classified as a personal problem.,1186067252954710016
2019-10-20 20:50:41,"# Rattlers in case you haven't had enough drama following today's football overtime win, join us at @ FAMUTheatre for tonight's performance of KING HEDLEY!pic.twitter.com/xy3HILlXk4",1186067244058587136
2019-10-20 20:50:41,"... -25 in this case, that the unadjusted number was simply too far off where it would be if adjusted. In other words, you can look at actual Coors HR and be able to adjust the numbers and it would still look somewhat reasonable. With tallied +/-, it does not. ...",1186067243043643393
2019-10-20 20:50:41,New photo shows # FelicityHuffman in a # Prison uniform as she serves 13 days in # CollegeCheating case | 13-days & $30k? She got away with murder! Nice to know justice is served when you have a high-priced lawyer! # Justice? # collegeadmissionsscandalhttps://apple.news/A4zuowl_MRrWaMuvN4Raxvg …,1186067241172733952
2019-10-20 20:50:40,If it’s raining at the front door my dog goes to the back door just in case.,1186067240271134723
2019-10-20 20:50:40,"The Curious Case of Penn State's Disappearing Offense: -- vs. Pitt, 7 points in the final 30 minutes -- vs. Iowa, 10 points in the final 38 minutes -- vs. Michigan, 7 points in the final 37 minutes For all the gory details (plus Noah Cain): http://bit.ly/2BtMtdb",1186067238060777473
2019-10-20 20:50:38,I always keep a case and screen protector for these reasons,1186067231773515779
2019-10-20 20:50:37,"Sadly, say that thing to any protest in any country, like most European countries or LatinAmerican, it's not even a majority of people anyway, it's like in the most of cases, shitty people doing shitty things fucking the protest",1186067227272978432
2019-10-20 20:50:37,"This is by far one of the worst MBP cases I've ever read up on, if you've got a good bit of extra time on your hands, it's a great read. https://kiwifarms.net/threads/kristina-paige-klein-krissy-klein-klein-journey-of-hope.61409/ …",1186067226547359749
2019-10-20 20:50:36,"No I’m not defending Juul. I don’t use it. I don’t smoke. I quit cold turkey 3 yrs ago. I drink a glass of wine once or twice a month. I used to drink a 30 can case one night. Not anymore. If guns don’t kill people, using the same logic, Juul doesn’t kill people. Let that sink in",1186067224026583041
2019-10-20 20:50:36,File a case? Not the Liberals but the NUPL. pic.twitter.com/ybqxKrlgfe,1186067221874786304
2019-10-20 20:50:36,"CASE COSTUM make your imagination ----------------------- Spesial banget buat kamu girls Case cute cantik, seperti cantiknya kamu ______________________ Tersedia: 3D Case Softcase Anti Crack Flip-Flop … https://www.instagram.com/p/B32-yVIAcAr/?igshid=dvljgim324gs …",1186067220465639426
2019-10-20 20:50:33,"Violin iphone case, Samsung Case | http://teecases.com - awesome phone cases Get ... https://teecases.com/awesome-phone-cases/violin-iphone-case-samsung-case-iphone-7-case-ipod-case-htc-cases/ …",1186067209040400384
2019-10-20 20:50:33,"Then by that logic, does every one converted to that religion at any time acknowledges their alignment to terrorism proscribed and approved as Jihad to eradicate all other schools of thought / religion? Is it similar in case of the religions from the western world as well? https://twitter.com/Sanjay_Dixit/status/1184867299360030722 …",1186067208906002435
2019-10-20 20:50:33,2019 Phoenix Football *16-BOX* FULL MASTER CASE BREAK! NEW ORLEANS SAINTS! #8: $6.99 (0 Bids) End Date: Sunday Oct-20-2019 18:25:06 PDT Bid now | Add to watch list http://rover.ebay.com/rover/1/711-53200-19255-0/1?ff3=2&toolid=10039&campid=5337810312&customid=WaxPacks&item=264494785703&vectorid=229466&lgeo=1&utm_source=dlvr.it&utm_medium=twitter …pic.twitter.com/5uPbN94rRp,1186067207903576064
2019-10-20 20:50:29,"Canon EOS 5D Mark IV 30.4MP Digital SLR Camera (Black) - Battery, Charger, Case ( 68 Bids ) # Canonhttp://rover.ebay.com/rover/1/711-53200-19255-0/1?ff3=4&pub=5575505208&toolid=10001&campid=5338537623&customid=&mpre=https://www.ebay.com/itm/Canon-EOS-5D-Mark-IV-30-4MP-Digital-SLR-Camera-Black-Battery-Charger-Case-/153684757282 …",1186067191441035264
2019-10-20 20:50:27,in case anyone was curious i’m never drinking again,1186067183413190657
2019-10-20 20:50:25,"Pssst... I absolutely loved @ MultiverseCon! I burned myself out. Yes! It was THAT stimulating. I wanted to tell you about it in case you might be interested next year, whether you're a seasoned pro or more like me! ... (1/5) # writingcommunity # writerscommunity",1186067177633452035
2019-10-20 20:50:24,you go in pipers suit case and i’ll go in jades,1186067172591845376
2019-10-20 20:50:23,So # MittTheStiff calls himself... Pierre ....Delecto!!! Sounds like a bad case of Carlos Danger syndrome. Whatta POMitt! # RiNOsAreExtincthttps://twitter.com/ashleyfeinberg/status/1186050468499333120 …,1186067165901926402
2019-10-20 20:50:22,Having a readily-available tool for pulverizing garlic seems like a very worthwhile investment in case of vampires,1186067165021003776
2019-10-20 20:50:21,# technology # case Wireless Gaming Mouse with 7 Buttons pic.twitter.com/X55QIkCZR0,1186067159929294849
2019-10-20 20:50:20,School choice is just common sense. Get the union out of our schools. Get federal government out of our schools. Get back to basics. ‘Glad your family had an option’: Betsy DeVos uses Rep. Ocasio-Cortez’s story as a case for school choice https://twitchy.com/jacobb-38/2019/10/20/glad-your-family-had-an-option-betsy-devos-uses-rep-ocasio-cortezs-story-as-a-case-for-school-choice/ … via @ twitchyteam,1186067154522791937
2019-10-20 20:50:19,"//HI my name is Vincent and if you werent already aware i am a basket case that needs a service dog to function. I, however, have very little money to take care of a dog. if you would like to help, all procedes from my shop go to getting a pupper, training it, and feeding it.",1186067150420762625
2019-10-20 20:50:18,"Maybe vote Trump or another Republican, because had he (or you) read the article, all cases happened under the Obama Administration.",1186067145886703623
2019-10-20 20:50:18,Case study from InfoStrat -- Children's Health Services Grant Management and Fraud Prevention http://www.infostrat.com/childrens-services …,1186067145647636480
2019-10-20 20:50:16,"I mean.. I guess your right .. well in that case . Don’t worry , I forgive you. We were all under a lot of stress at the time , Alex. And the fact that the operator came in as well.. not all of it was your fault . https://twitter.com/ParanoiacSavior/status/1186065525153112064 …",1186067139133722625
2019-10-20 20:50:16,"If not, they really gonna need years of filler cases in order to delay catching up.",1186067138823499776
2019-10-20 20:50:16,# NewRelease $0.99 YOUR PRECIOUS SIGHT: An Optometrist's Most Memorable Cases =>> http://bit.ly/YourPreciousSight … Are you petrified by the thought of permanently living in COMPLETE DARKNESS? GET YOUR COPY! # Glaucomapic.twitter.com/8T2ZjWk3iI,1186067136835411968
2019-10-20 20:50:15,- no matter how much I fwu I will always keep my guard up just in case .,1186067133236682752
2019-10-20 20:50:14,"Bahaha. That's sounds like an Obama related case for 10, I see...as in Obama raiding the Gibson factory in TN.",1186067131567366144
2019-10-20 20:50:14,"I’ll be in Münich today (Monday), just in case any Agile coach is around and wanted to meet.",1186067128492986373
2019-10-20 20:50:13,It’s still news as long as he reveals his source which in this case is “well connected Republican.” Also it helps if you’re reputable and I believe Chris Wallace is.,1186067125485690882
2019-10-20 20:50:13,"The boy an girl looks a lot like the pair from Twin Star Exorcists when they come together to make an attack that requires them to be close. I could be wrong, of course, but it really looks to me like it could be the case.",1186067125041061888
2019-10-20 20:50:12,Haha right. Just in case you wanted to figure it out yourself.,1186067123426054144
2019-10-20 20:50:11,In case you were curious about the reason for Zuck not wanting to take down that ad.. “Hand that feeds” yadda yadda https://twitter.com/kevinroose/status/1185926813966454784 …,1186067119437471747
2019-10-20 20:50:11,"Hell to the yeah. He just saved you enough to buy a case of diapers. Nice work, future dad!",1186067119143825408
2019-10-20 20:50:11,He'll probably be added in a couple of years down the line. That's pretty much always been the case when it comes to playable Vergil.,1186067117432606720
2019-10-20 20:50:11,"In that case, and these are just a small handful of picks, but Bloodstained: Ritual of the Night is a good game with a lot of replay value (and upcoming free content updates), and the Max Payne games are fun, classic shooters. Code Vein is also really good, but it is a new game",1186067116753149952
2019-10-20 20:50:11,"Yes, there are numerous cases of people being treated for an # eatingdisorder here in Australia (and elsewhere) receiving varying and even invasive, harmful and traumatic care. We need better oversight of treatment and professionals to work within guidelines and competence...",1186067115280760832
2019-10-20 20:50:10,in case yallst wanna date https://twitter.com/astrogrIz/status/1092907174987292673 …,1186067114131632131
2019-10-20 20:50:10,Huzurnagar by polls : Case filed on Uttam Kumar Reddy for election code violation - TV9 # HuzurnagarByPolls # UttamKumarReddy # TV9TeluguLivehttps://www.youtube.com/watch?v=6O6Nd_Y54eg …,1186067113733017601
2019-10-20 20:50:09,Why are we having this discussion now? Why was the positive case for the EU never made in the past 3 years?,1186067110620991489
2019-10-20 20:50:08,my old friend just told me i don’t have social anxiety so i wouldn’t understand her post. bitch you don’t have it either. you just are a shitty friend. case closed.,1186067105025798144
2019-10-20 20:50:08,"Though if he left he didn’t know where or when he would run into Hitoshi again. It was only eleven, he didn't have to work until tomorrow at noon he had the time to wait, worst case he could have someone cover for him.",1186067103889154049
2019-10-20 20:50:07,Is there a warning just in case I see it on my tl because I don’t want to see it at all,1186067100806324224
2019-10-20 20:50:07,"# AegisFS # DeepFAKE # Intelligence offers our clients and on a case-by-case basis training for malware, malvertising, attachments, links that can infect your systems causing a # RedScreen. Here is a good link to a piece that may help. http://Aegisfinserv.com https://lnkd.in/eKzzrAW",1186067100122669056
2019-10-20 20:50:07,"@ marcowenjones 10k accts sending out 20k tweets- 2 each is not a bot operation. When for example, big U.S. star like Madonna injects herself into case against Pussy Riot infringing on babushkas' right to a quiet service, who is waging influence war against whom?",1186067099749191680
2019-10-20 20:50:05,Same dilemma for me. I think I’m going Gallup in case Amari tweets something in the first qtr,1186067093789302784
2019-10-20 20:50:05,"Nagy is not on the hot seat, and shouldn’t be, but after his week people are definitely gonna start looking for the outlet in case the seat needs to be plugged in.",1186067092426113024
2019-10-20 20:50:04,I want that phone case,1186067087489257473
2019-10-20 20:50:03,Yes my username is travis_elias in case ya’ll want to add me,1186067084469592064
2019-10-20 20:50:03,read my dn just in case u forgot who her real crush is...,1186067084243013634
2019-10-20 20:49:58,and u already did if that’s the case,1186067061471989760
2019-10-20 20:49:56,"You make a passionate case but remember: without a strong private sector, there is no tax base for social programs. Our manufacturing sector has been gutted by the ON Liberals. The Trudeau Liberals are killing our resource sector. What's left? 'real estate'? That won't last.",1186067055402991616
2019-10-20 20:49:56,huge court case today this is gonna be a long one but let hope we can win the trial,1186067054190845953
2019-10-20 20:49:55,Really beginning to think that is the case.,1186067050986381318
2019-10-20 20:49:54,One of my biggest pet peeves is when people assume I’m going to give them a ride somewhere. Especially when it’s out of my way. Ask maybe.,1186067047601627141
2019-10-20 20:49:54,Who do you think is covering anything up here? I think you'll find from looking up Allende and others that the US has been very happy to cover up (or in some cases not even try) its actions for many decades. Yang has been transparent. His focus is on stopping Russian aggression.,1186067045026107392
2019-10-20 20:49:53,I need the target version. I want the metal case,1186067040106213376
2019-10-20 20:49:51,Nuremberg. The steps Hitler walked down. Rallies. Chilling. At the museum I stood for a long time looking at those cases holding tapes. A room devoted to the trials. Not all Nazis got to live openly in Argentina like Josef Mengele. # NurembergTrialspic.twitter.com/ihOVqPZDDK,1186067031902150657
2019-10-20 20:49:49,time for a case baby!! pretend it never happened https://twitter.com/aIexandor/status/1186056414881599489 …,1186067026412003329
2019-10-20 20:49:48,"Case Cookus the Northern Arizona QB had a great game yesterday. 20-34, 359 YDS, 4 TD His favorite target was Stacy Chukwumezie 3 REC, 167 YDS, 2 TD",1186067019713650688
