date,text,id
2019-10-10 20:27:15,Es re dulce!! Me ha contestado varias veces y juro que es la más amorosa,1182437467028369408
2019-10-10 20:27:11,Me dieron ganas de unas mates con algo dulce,1182437449391325186
2019-10-10 20:27:01,"bueno no, si tu te lo vas a comer!! jajajaja pero la verdad no se antoja mezclar el dulce del pan con la carne al pastor",1182437407519625216
2019-10-10 20:27:00,"Nooo, para nada, muy cliché y dulce! @ weareoneEXO",1182437402746376193
2019-10-10 20:26:17,"Mi adorad dulce creo que eso a ti no debe de preocuparte porque tienes ambas, aunado a un bello rostro",1182437225302093824
2019-10-10 20:26:13,"Sos un boludo, te pensas q voy a reaccionar así si me mirara de esa forma??? Fue muy dulce e inocente la sonrisa, te lo puedo jurar. Era precioso",1182437208160194561
2019-10-10 20:26:12,"¡Upa cachete! como que hay corazón y del bueno, que palabras más tiernas, para mí dulce y adorable Lili. Bendiciones",1182437203110256640
2019-10-10 20:26:11,Dulce answers everyone but me HATE fake ass cousins damn,1182437200266452992
2019-10-10 20:26:08,150 me interesa,1182437187666796546
2019-10-10 20:26:06,nada más dulce que el deseo en cadena,1182437175943671811
2019-10-10 20:26:03,Ayyy bellaaaa te amo mas!,1182437165357121536
2019-10-10 20:25:51,"Claro que sí, termino dulce amor y la arranco",1182437116132892672
2019-10-10 20:25:30,"Ótima viagem! Que sua fé seja renovada. Que a intercessão da Irmã Dulce, fortaleça toda nação brasileira.",1182437028488761345
2019-10-10 20:25:30,Tengo el pelo color dulce de leche Lpm,1182437027020771329
2019-10-10 20:25:16,de por sí es dulce para qué le vas a poner más dulce tantas ganas de tener diabetes iba a tener,1182436968371802112
2019-10-10 20:25:08,Comitiva dos três Poderes vai à canonização de Irmã Dulce na Itália https://ricmais.com.br/noticias/comitiva-dos-tres-poderes-vai-a-canonizacao-de-irma-dulce-na-italia/ …,1182436935844990978
2019-10-10 20:25:03,dulce viejecita jajaja,1182436914793779200
2019-10-10 20:25:01,Sí,1182436906442854400
2019-10-10 20:25:00,"No se acerca la ""temporada"" de tomar chocolate caliente con pan de dulce. EL CHOCOLATE CALIENTE Y EL PAN DE DULCE SE DISFRUTAN TODO EL PUTO AÑO. OK? OK.",1182436902298771456
2019-10-10 20:24:53,Joaquin es la persona más dulce y especial del mundo:( # JoacoEnPerfecTour,1182436869860184071
2019-10-10 20:24:35,Porsupuesto hermosa Eva,1182436795277103104
2019-10-10 20:24:33,Bendita la salsa de dulce de maiz,1182436788159287296
2019-10-10 20:24:32,Aunque te guste el pan dulce te amo muchísimo más,1182436785563099136
2019-10-10 20:24:31,"Viagem ao Vaticano terá ópera, reza e jantares https://www.oantagonista.com/?p=262036 . Irmã Dulce, dessa vez, dos ""ricos"". O corpo de irmã Dulce deve estar se revirando no tumulo.",1182436779296804864
2019-10-10 20:24:31,Magali que le dice duki a dulce me cago de risa jajajajajaja,1182436777778393088
2019-10-10 20:24:28,Que ganas de comer algo dulce,1182436768328671232
2019-10-10 20:24:28,La gelatina es mi salvación a que me este bajando un pote de dulce de leche en este momento,1182436765732347904
2019-10-10 20:24:11,Perdí toda mi dignidad en ese frasco de dulce :'((,1182436693669892097
2019-10-10 20:24:09,Si mami,1182436686120144896
2019-10-10 20:24:01,"JAJAJAJAJAJA la violencia jamás será una vía de escape positiva a los problemas, Dulce",1182436654188941312
2019-10-10 20:23:41,"Jajajaajajajja , mate dulce? Q es eso? Me extraña amigo",1182436569854205952
2019-10-10 20:23:21,"si me escribo otra cosa linda en mi muro, juro que le pediré matrimonio con un anillo de dulce y le daré mimitos hasta que el mundo se acabe, ese chico me trae muy soft, lloro.",1182436485049606146
2019-10-10 20:23:20,chorrillo por mezclar dulce con salado!!! jum!!!,1182436480637165568
2019-10-10 20:23:18,Tem comunicólogo chamando irmã Dulce de PRIMEIRA CEO CANONIZADA MDSSS,1182436471984275456
2019-10-10 20:23:18,"Nhonho, o senhor representa o oposto que irmã Dulce fez! https://twitter.com/rejannealb/status/1182435482527064066 …",1182436471275429888
2019-10-10 20:23:15,"Maria Rita, sobrinha de irmã Dulce e continuadora de sua obra.",1182436461188177920
2019-10-10 20:23:12,"Nueva Smore's cake, crema de marshmallows, galleta, crema de chocolate semiamargo con el balance de dulce perfecto y muchas texturas en cada bocado. Te sorprenderá! ° ° Sedes : Norte : Av 9N #16-11, Barrio… https://www.instagram.com/p/B3dLs9pjqHY/?igshid=1it08ckqxekct …",1182436449284698112
2019-10-10 20:23:10,Me dulce la cintura horrible :(,1182436440472510464
2019-10-10 20:23:06,"— ¿Por qué tanta consideración conmigo, mi dulce Mel? Acarició con el anular su mejilla con lentitud.",1182436422550278145
2019-10-10 20:22:59,Excelente decisión. @ Telmex y @ Telcel @ mdzjr @ elBotitas @ xymoxdcd @ hecleyes @ Calzada97Luis @ andresmg2207,1182436393068519425
2019-10-10 20:22:56,Cabron traime almenos un dulce https://twitter.com/richard_a24/status/1182433884400766976 …,1182436381789970432
2019-10-10 20:22:51,"Irmã Dulce Irmã Dulce (1914-1992) foi uma religiosa católica brasileira que dedicou a sua vida a ajudar os doentes e os mais necessitados. Foi beatificada pelo Papa Bento XVI, no dia 10 de dezembro de 2010,... https://www.facebook.com/jose.flor.filho/posts/2999799040034270 …",1182436360843599873
2019-10-10 20:22:45,I'm missing 2 of them,1182436335237419009
2019-10-10 20:22:40,Es una porquería telmex yo hice lo mismo y me arrepenti,1182436314475458560
2019-10-10 20:22:40,"Hoy me tocó partir leña y sacar los apastes; pero todo vale pena, nada como un ayote dulce con jocotes para estas tardecitas lluviosas. ¿Cómo van ustedes con los preparativos del # fiambre y los # dulces?pic.twitter.com/EwvPRePE4M",1182436313309548546
2019-10-10 20:22:40,"Cual es tu duda Ale? En un embarazo, comes chocolate, es increible lo que se mueven. Para la eco de los 7 meses, le di cositas dulce a mi mujer y el bebe se movio tanto que por fin logramos verla bien",1182436312999251969
2019-10-10 20:22:31,A irmã Dulce vai entrar para a história se nos livrar de todos esses corruptos...,1182436276554928133
2019-10-10 20:22:28,que si la persona como piña el semen sale dulce,1182436263435132929
2019-10-10 20:22:27,Cuteeeee,1182436258204643328
2019-10-10 20:22:26,No temeré porque tu dulce voz me guiará hoy y siempre https://www.bibliatodo.com/ImagenesCristianas/no-temere-porque-tu-dulce-voz-me-guiara-hoy-y-siempre/ …,1182436255776280576
2019-10-10 20:22:19,"< envoltorio y le daba una probada. Sonrió incluso al dulce porque amaba demasiado el chocolate. Era un goloso.— Si tú no se lo pides no son ni serán novios porque a tu edad las chicas son así, quieren que los hombres siempre den el primer paso. Oh, y antes de que me digas >",1182436226781069312
2019-10-10 20:22:18,Llegaron mis 10 lbs de dulce pic.twitter.com/UO2Z78PurC,1182436220326031360
2019-10-10 20:22:08,Ya me olvidé de su dulce sabor.,1182436178429173760
2019-10-10 20:22:06,"all hail the mexican candy, dulce pic.twitter.com/QB7B7itsTy",1182436172368363521
2019-10-10 20:21:53,Que ganas de un helado de dulce de leche granizado,1182436115774689280
2019-10-10 20:21:46,Gracias por todo el apoyo Perú !!!,1182436087492501504
2019-10-10 20:21:45,Estan esos novios divinos que suben fotos “hots” con sus novias presumiendolas re orgullosos y bueno después esta el dulce de mi novio jajaja pic.twitter.com/YdN6yzWZaY,1182436083147202565
2019-10-10 20:21:38,Que cosa más dulce... Es muy genia. Sabe toda la letra de la canción. Como no amarla a Emilita...,1182436054722330624
2019-10-10 20:21:35,", amiga querida soy ADICTA A LO DULCE!!!!!",1182436039673176064
2019-10-10 20:21:29,Por que palabras nos faltan para describir lo mucho que te admiramos @ GressLovers @ alejandraaste1 @ DheisenA @ MenesesBlue @ DYongHwa @ lilitaa_12 @ Lili_Gress @ Lisbethre18 @ pameladaya @ yaya_bonlife @ Dulce_JBG @ Gabriel_Arzadum @ CarrotGress @ naomijoaco123 # JoacoEnPerfecTourpic.twitter.com/DWz54RqHcg,1182436017028173825
2019-10-10 20:21:19,"02:27 Desde que lo conocí. [ # namjinau # namjin] Pd:""Me va a dar diabetes"" es una expresión que quiere decir que es muy dulce o que es tan adorable que da ""asco"". pic.twitter.com/Ah2dUvudhy",1182435974862835712
2019-10-10 20:21:14,Mais um milagre de Irmã Dulce. Impedir que o Brasil passe vergonha internacional mais uma vez,1182435955011137538
2019-10-10 20:21:10,Irmã Dulce tem poder. Conseguiu tirar o ardiloso do seu caminho. https://www.facebook.com/alexandreaquino/posts/10220946687917319 …,1182435935327342592
2019-10-10 20:21:08,"Coitada da Irmã Dulce, que sempre fez o melhor uso possível das doações que recebeu, para cuidar dos doentes e menos favorecidos, sendo usada como desculpa para canalhas esbanjarem o nosso dinheiro. Ela que sempre foi um exemplo de virtude, sendo usada desta forma tão vergonhosa.",1182435926015926272
2019-10-10 20:21:07,"calma o ""termina não"" ta ganhando",1182435921813295105
2019-10-10 20:20:54,"Y la galletita no dulce,??",1182435870911160324
2019-10-10 20:20:54,Espectacular belleza,1182435867903832069
2019-10-10 20:20:53,@ Vanity_Sexx dulce no entiendo entonces?,1182435864896573440
2019-10-10 20:20:48,mi amor mi amor mi dulce amor,1182435842838544385
2019-10-10 20:20:45,ありがとうございます。私の頭痛は喘息からくるものなので、ちょっと違うのです,1182435832596029441
2019-10-10 20:20:45,esa dosis perversa entre dulce y veneno,1182435830285115396
2019-10-10 20:20:39,Tía !!! Gracias por siempre apoyar al chamaco # JoacoEnPerfecTour # JoaquinBondoni,1182435808206348288
2019-10-10 20:20:17,">> y no tanto Frankie según entiendo —una persona risa amenazó con escapar de sus labios sintiendo como este la intentaba peinar, eso era sumamente dulce se su parte. Iba a responderle juraba que si pero los pequeños besos ajenos se hicieron presente por lo que ella >>",1182435714300108800
2019-10-10 20:20:12,Anel y Jose Jose eran tal para cual y se merecían! El senor no era una perita en dulce. Por que la atacaba y se quejaba pero y por que no toma encuenta lo que el hizo ser un borracho y drogadicto que acabo con su matrimonio.,1182435693223497729
2019-10-10 20:20:09,Ya se viene la temporada de comer pan dulce con chocolatito calientito pic.twitter.com/8Cm1Q4jaLT,1182435678912692224
2019-10-10 20:20:08,Lo feo de trabajar en la cadena alimenticia es q t manden a hacer pan dulce ahora.. culia me derrito,1182435678111567873
2019-10-10 20:20:08,+ dulce de chocolate brrrrr https://twitter.com/hastalabergs/status/1182148492262858752 …,1182435675125231616
2019-10-10 20:20:01,[¿ESTÁ EMBARAZADA?] Cora Debarbieri se descompuso en @ involucradostv y debieron asistirla. Mariano Iúdica sospecha que está en la dulce espera. Mirá los videos. https://buff.ly/35k7CEl,1182435646847225858
2019-10-10 20:19:59,Surdos podem conhecer o legado de Irmã Dulce através de música - http://midiabahia.com.br/entretenimento/2019/10/10/surdos-podem-conhecer-o-legado-de-irma-dulce-atraves-de-musica/ …http://midiabahia.com.br/entretenimento/2019/10/10/surdos-podem-conhecer-o-legado-de-irma-dulce-atraves-de-musica/ …,1182435640388018177
2019-10-10 20:19:59,el pan dulce de cualquier tipo es lo más asquerosos qué hay fin del comunicado https://twitter.com/Luishrnandez/status/1180246609101115392 …,1182435639121338368
2019-10-10 20:19:54,# JoacoEnPerfecTour,1182435617163972608
2019-10-10 20:19:43,Amo amo amo !!!! El apoyo que le das Siempre llénalo de ese amor y calidez ES UNA ORDEN PÁRRAFOS # JoacoEnPerfecTour # JoaquinBondoni,1182435572482228225
2019-10-10 20:19:42,@ rwolf_8 @ dulce_picha @ samarulee no entiendo cómo no nos estamos comiendo la boca en este preciso momento. Ahí tenéis la respuesta.,1182435566731907072
2019-10-10 20:19:39,"Gracinha Caiado não irá à canonização da Irmã Dulce, em Roma, e Baldy será único goiano na comitiva http://bit.ly/35oGPqq",1182435552941019137
2019-10-10 20:19:38,Já tô até venho quem vai ficar sem aliança,1182435549396848646
2019-10-10 20:19:19,Olha que absurdo,1182435471869300737
2019-10-10 20:19:08,"—Que fuera tan dulce en esa situación podía con él, pues pese a la dulzura estaba presente la lujuria y eso era maravilloso. Aún avergonzado ayudó a sacar la erección ajena con su diestra, volviendo la vista a este para comenzar a dejar tímidos besos por su extensión—",1182435424851185664
2019-10-10 20:18:56,Mi mejor amiga trabaja en una panaderia y no paro d mandarle msjes para q no se olvide d traerme los conitos con dulce d leche Gorda s nace,1182435374787956736
2019-10-10 20:18:54,así no me dijiste cuando estábamos merendando mientras forrábamos dulce de maní MALDITA,1182435364105007110
2019-10-10 20:18:51,"A ver mis 2 únicas debilidades en este coso, qué van a querer? Granizado clásico o con dulce de leche? @ DimakopoulosV @ bibiscookiepic.twitter.com/gom6aEa5jC",1182435351723462657
2019-10-10 20:18:43,"Abortistas em peso indo acompanhar, sob os auspícios de Francisco, o Argentino, a beatificação de Maria Rita Lopes Pontes, a Irmã Dulce.",1182435321117663233
2019-10-10 20:18:28,"Porque nadie te conoce realmente bien. A mi me falta mucho para hacerlo. Pero veo el dulce en tu interior -Le besó los labios con ternura, una sonrisa divertida en sus labios-",1182435256080764928
2019-10-10 20:18:24,Me passe o grau de importância para o desenvolvimento da nação a canonização da irmã Dulce. Será que a santa ajudará a clarear a mente desses políticos?,1182435239706148866
2019-10-10 20:18:23,"Tudo orquestrado: sínodo da Amazônia, óleo nas praias do Nordeste, incêndio da Amazônia, beatificação da irmã Dulce e ainda combinado com muitos deputados e Senadores lá em Roma, enquanto isso a previdência e outras pautas importante espera. # EuSouBolsonaro",1182435235516112896
2019-10-10 20:18:08,Reward increased to $52K as search for missing 5-year-old Dulce Alavez nears 1 month https://trib.al/sB7k8z6,1182435172584701953
2019-10-10 20:17:59,"Alguém do ES vai na cerimônia da canonização de Irmã Dulce, em Roma??",1182435134353690629
2019-10-10 20:17:47,PAN DULCE ASÍ QUE SHHH https://twitter.com/jimi95__/status/1182076607969804288 …,1182435084206514178
2019-10-10 20:17:38,"—Pf. Qués nutritivo. Es típico en un desayuno mexicano. Salado, más dulce. Son combinaciones raras. Lo sé. — ¿Sabes qué? No lo voy a hacer. El pan ya es demasiado pesado por si solo como para comer otra cosa, ni siquiera se si podré terminar mi parte. Creo que hice demasiado.",1182435046520741888
2019-10-10 20:17:11,Irmã Dulce ficaria muito feliz com essa gastança de $ pública... Quantos pobres serão beneficiados com essas viagens?,1182434934327271425
2019-10-10 20:17:04,"—Sonríe inmensamente feliz, era como un sueño hecho realidad. Estar a su lado era lo máximo, ella era su princesa.— ¡Mi chica delivery! Para siempre juntos. —Dijo con voz dulce aferrándose a ella en su abrazo.— pic.twitter.com/5Yz11Rx9hQ",1182434904660946946
2019-10-10 20:17:02,"Que más un cafécito con pan de dulce, después de haber saqueado el país",1182434894280122374
2019-10-10 20:17:01,Today we face the end.pic.twitter.com/xCfFAuSkFi,1182434893831081984
2019-10-10 20:16:57,Manto de agua dulce bendita naturaleza,1182434874801774593
2019-10-10 20:16:49,A dulce só quer o teu bem jovem!,1182434842560159744
2019-10-10 20:16:48,"Si se te ofrece,con gusto te puedo ayudar",1182434838118387712
2019-10-10 20:16:39,"Creo que están comparándolo con el peinado, la coleta. Me asusté bien feo. No me agrada mucho... como sea jimin es un ser humano unico, e increíble que ama de verdad y ayuda a los demás, es una cosita tan dulce, sincera, es precioso, sexy. Y tranquilas Armys.",1182434801510440965
2019-10-10 20:16:34,minnie es un dulce de leche la adoro,1182434780727652352
2019-10-10 20:16:32,"No entiendo lo necesario de la chicana, si te gustan tanto podés revisar los discursos de Mauri q ahí tenés para hacer dulce",1182434772401999872
2019-10-10 20:16:30,IRMÃ DULCE DOS POBRES - no GLOBO REPÓRTER amanhã! Não percam! Estarei no programa testemunhando minha fé em Deus e na sua pequena GRANDE SERVIDORA! em Obras Sociais Irmã Dulce https://www.instagram.com/p/B3dK72jhzpTwCgeVNbcOcZnN59e6TBoAtgG1ms0/?igshid=1c2frcwkrbj6b …,1182434760863485957
2019-10-10 20:16:29,"Stitch me recuerda tanto a mí, por dulce pero envergado",1182434758346838017
2019-10-10 20:16:24,"Santiago 3:10-11 RVA [10] De una misma boca proceden bendición y maldición. Hermanos míos, no conviene que estas cosas sean así hechas. [11] ¿Echa alguna fuente por una misma abertura agua dulce y amarga?",1182434737249542144
2019-10-10 20:16:21,Reward increased to $52K in Dulce Maria Alavez missing girl case https://nypost.com/2019/10/10/reward-increased-to-52k-in-dulce-maria-alavez-missing-girl-case/?utm_source=twitter_sitebuttons&utm_medium=site%20buttons&utm_campaign=site%20buttons … via @ nypmetro,1182434723039068160
2019-10-10 20:16:17,"# Repost @ jeabello • • • • • Cuando eres capaz por las mañanas, sin importar lo que esté pasando, tener una buena imagen y/o un buen recuerdo, algo dulce para levantar tu mirada, es porque las cosas se están transformando. TÚ te estás transformando pic.twitter.com/TJfY3O8jGd",1182434707927121920
2019-10-10 20:16:17,"Una voz venenosa, me tienta, me drena, hace que sangre. Me deja agrietado y vacío, me arrastra como una dulce gravedad.",1182434706605924352
2019-10-10 20:16:16,"NUEVO LANZAMIENTO Mameluco Dulce Madre no te alejes Tallas de 0 a 24 meses SSL http://www.catolicosjhs.com Paga en linea PSE, Visa, MasterCard y otros Pagos confiables a través de PayU Chat en linea… https://www.instagram.com/p/B3dK6IyFOtc/?igshid=1jwf1w836w5pq …",1182434702118010880
2019-10-10 20:15:56,Outro milagre da irmã Dulce: afastar demônio. https://oglobo.globo.com/brasil/bolsonaro-cancela-ida-missa-por-irma-dulce-na-bahia-1-24006992?utm_source=Facebook&utm_medium=Social&utm_campaign=compartilhar …,1182434617573433345
2019-10-10 20:15:55,"Les saldrá el Tiro por la culata, por aquello de lo dulce de lo prohibido https://twitter.com/NoticiasUno/status/1182392859862810624 …",1182434616852078592
2019-10-10 20:15:53,Que bkn saber que igual resulta sin azúcar y sin gotas. Es optimista saberlo porque yo también soy re dulce y me da miedo. Gracias!!!,1182434604990521344
2019-10-10 20:15:50,(VIDEO) Lucía Méndez y Dulce aclaran motivo de risas durante homenaje a José José http://www.marcrixnoticias.com/video-lucia-mendez-y-dulce-aclaran-motivo-de-risas-durante-homenaje-a-jose-jose/ …pic.twitter.com/qJSV3jQmoD,1182434592831094785
2019-10-10 20:15:40,Feliz Cumpleaños! Eso es tan dulce,1182434554117836801
2019-10-10 20:15:30,Se Irmã Dulce estivesse viva ela iria rejeitar toda essa bajulação e pedir que todo esse dinheiro gasto fosse doado a quem realmente dele precisa.,1182434510056689666
2019-10-10 20:15:28,Mais um milagre da Irmã Dulce https://glo.bo/2IDoaNT,1182434501990981633
2019-10-10 20:15:27,Irmã Dulce: menina que acolhia doentes aos 13 anos vira santa no domingo https://exame.abril.com.br/brasil/irma-dulce-menina-que-acolhia-doentes-aos-13-anos-vira-santa-no-domingo/ …,1182434499843502080
2019-10-10 20:15:25,Los sobrinos cuando sacas un dulce para ver quién te quiere más https://twitter.com/ActualidadRT/status/1182421297088757761 …,1182434489370337281
2019-10-10 20:15:09,"Que vergonha ! Até o Velho Sarney está indo pra Roma . Na canonização de Irmã Dulce . Ela que foi um anjo para os pobres , deve estar envergonhada com os políticos oportunistas .",1182434424249561088
2019-10-10 20:15:09,"Canal Brasil exibe ""Irmã Dulce"" no dia em que a religiosa será canonizada https://belojardim.me/2019/10/10/canal-brasil-exibe-irma-dulce-no-dia-em-que-a-religiosa-sera-canonizada/ …",1182434424144703495
2019-10-10 20:14:45,Y pq me lo envías a mi?!jajaja yo soy un pancito dulce relleno de chocolate,1182434322311196672
2019-10-10 20:14:38,"O mais absurdo dos paradoxos nobre @ augustosnunes Na canonização da Irmã Dulce, defensora dos pobres, estarão os ladrões que roubaram desses pobres a esperança de agradecerem aos céus por alguma dignidade.",1182434292430979078
2019-10-10 20:14:24,Awwwww # JoacoEnPerfecTour # JoacoEnPerfecTour,1182434232951607297
2019-10-10 20:14:23,"« cosas con él, pero ese registro era diferente al que acostumbraba. Posó una mano en su pecho y su tono de voz, como un mecanismo de defensa contra sus propias palabras, se volvió coqueto, más dulce. —Si no me encontráis en ningún otro amante, comenzad a buscarme en mi lecho »",1182434227754819584
2019-10-10 20:14:20,Una porción de mi tarta y te agarra diabetes jajajaja re dulce me quedo la webada xd,1182434216979644416
2019-10-10 20:14:18,"Faltó »Frances con dulce de atado« + ""Tortilla de ayer con limon""... Esto x experiencia propia. Y todavía aquí jodiendo la tripa.",1182434207626334209
2019-10-10 20:14:17,"No les ha pasado que le dan una mordida a un postre, platillo, dulce, etc. Pero ni está tan bueno así que se lo sacan de la boca o simplemente lo dejan ahí porque pues si vas a engordar por lo menos que sea con algo que te guste. Jaja",1182434204556152832
2019-10-10 20:14:05,"@ viridianaHls si te tomas tu medicina niña, te llevo por un dulce va ? https://twitter.com/alanxelmundo/status/1182417224058847232 …",1182434151808434176
2019-10-10 20:14:04,"Me haces tanta falta, mí dulce hombrecito",1182434149866491904
2019-10-10 20:13:53,"Acariciando la ausencia ,mil veces mi castigo . Tansolo el recuerdo como dulce consuelo . Y esa alma dejada entre el abrazo de tú cálido pecho .",1182434102882062336
2019-10-10 20:13:31,Que canción tan preciosa # SiempreTeNecesito @ LuceroMexico me encantó! Amé tu voz tan dulce,1182434010020171778
2019-10-10 20:13:29,"— inconscientemente con cada paso que daban, el se aferraba con mas cariño a su antebrazo, hasta llegar a pegar su cabeza en el brazo de el trígono con una dulce sonrisa, cerro los ojos unos segundos apreciando cada segundo que estaba cerca del adverso (+)",1182434003523198976
2019-10-10 20:13:25,siempre tan dulce https://twitter.com/IriVolveremos/status/1182430917131952128 …,1182433985139531776
2019-10-10 20:13:22,"O pior de tudo é que eu duvido que estes deputados tenham conhecido a irmã Dulce, ou melhor, que tenham ido visitar e ajudado, o trabalho da freira. Me poupem, excelências.",1182433974691467264
2019-10-10 20:13:10,"[Irmã Dulce] A Bahia canta a sua santa, por Confraria da Música https://www.youtube.com/watch?v=4rm-GlvX5eo&feature=share …",1182433921797185537
2019-10-10 20:13:09,"Tomar agüita es súper importante para el buen funcionamiento del cuerpo, no hay nada mejor que lo natural.pic.twitter.com/fhIVddG4mR",1182433920450736128
2019-10-10 20:13:04,"Moría por ir a Dulce Granada antes de que inauguraran, y ahora que lo hicieron sé que no iré hasta un año después JAJA",1182433898837368834
2019-10-10 20:12:54,no como dulce,1182433858064658434
2019-10-10 20:12:53,Sabes reconocer a un amante del dulce xD,1182433853169909763
2019-10-10 20:12:50,"Carne, fruta, verdura, leche, dulce de leche, café, te y azúcar (sé que no todo va a la heladera, pero bue)",1182433839274217472
2019-10-10 20:12:47,- abrazar perritos. - comer algo con dulce/chocolate. - subirme a un columpio. - dar el primer sorbo de una cerveza.,1182433824682037249
2019-10-10 20:12:45,Muchas gracias Tulsa Dulce suenos y hasta manana,1182433817010806794
2019-10-10 20:12:34,"Eso no es nutritivo. ―Observó cada movimiento, con curiosidad. ― Lindo. ―Mencionó al ver el decorado.― ¿Pan dulce con huevo?",1182433772764950528
2019-10-10 20:12:33,Una dulce tarde para ustedes mis amig@s!! https://www.instagram.com/p/B3dKe-ghw2nYGy3OWpgQJzlLDBHu-cYHN2FwTw0/?igshid=1h6mhcnihvmr8 …,1182433767941693440
2019-10-10 20:12:33,,1182433765919993856
2019-10-10 20:12:32,Irmã Dulce e o povo de bem! O de bem de verdade!! Agradece!!,1182433762610700290
2019-10-10 20:12:22,Jajajaja mi Rafita y Dulce Fabiola nos tienen abandonados,1182433723872096257
2019-10-10 20:12:13,Que antojos de un buen dulce y de Makis,1182433683023773696
2019-10-10 20:12:10,si dulce y lavado,1182433670113779712
2019-10-10 20:12:08,"Té de Dunkin, DULCE MANJAR",1182433663771906048
2019-10-10 20:12:06,"Y un dulce sabor a victoria . Eso si huele bien culero jeje, cada que llego al aeropuerto recuerdo aaash ahora así huele donde vivo ggg. https://twitter.com/Dianuts/status/1182408057164369937 …",1182433653714014208
2019-10-10 20:12:04,"Irmã Dulce vale uma missa, a MichellQUE Bolsonaro é que não vale nada.",1182433647628034048
2019-10-10 20:11:53,está claro que de dulce de leche,1182433601335545857
2019-10-10 20:11:45,"La de dulce de leche me queda buenísima, eh...",1182433567563042816
2019-10-10 20:11:38,soy de arg... pero el de dulce de leche está en segundo puesto,1182433538722979840
2019-10-10 20:11:35,"Vos te tomas el vino, te comes lo dulce, te llevas el perro al trabajo....",1182433526341390337
2019-10-10 20:11:33,Comitiva dos três Poderes vai à canonização de Irmã Dulce na Itália https://politicalivre.com.br/2019/10/comitiva-dos-tres-poderes-vai-a-canonizacao-de-irma-dulce-na-italia/ …,1182433518258937859
2019-10-10 20:11:24,"A ver cuando me cocinas un postre de oreo, dulce de leche, crema chantillí y chocolate y me lo mandas por DAC, gracias",1182433477809070080
2019-10-10 20:11:21,How Much I Love You Mi Dulce Flaquito@ricky_martin,1182433467600166912
2019-10-10 20:11:17,Acabo de salir de entrenar y en lo único que puedo pensar es en un panqueque de dulce de leche JAJAJAJA,1182433450344812544
2019-10-10 20:11:04,"|| Pero si eres un pedazo de pie de manzana , dulce y soft. https://twitter.com/THEGIRLXFSTEEL/status/1182433201521942534 …",1182433393574924289
2019-10-10 20:11:03,# JoacoEnPerfecTour,1182433388503977986
