date,text,id
2019-10-21 20:59:58,Got more help than you need,1186431969011404801
2019-10-21 20:59:48,Alguém lava.meu cabelo e depois seca .. por favor.,1186431925600342016
2019-10-21 20:59:40,Sapo não lava o pé,1186431893706809349
2019-10-21 20:59:40,"So Mr Superior, who doesn't even know what Article 13 is about, i will ask you this.. 6 people debated for a month to be electedn but the person elected never appeared in any debates.. She was put forward as the only candidate... Democracy Comin?",1186431892406591489
2019-10-21 20:59:31,Grande lava c* kkkkkkk,1186431854246801410
2019-10-21 20:59:27,WAIT THATS MY FAVORITE THING EVER IM GONNA CRY LETS WATCH SHARK BOY AND LAVA GIRL AND MAKE OUT DURING THE SCARY PARTS,1186431835254845440
2019-10-21 20:59:25,Eating green chile stew made out of lava and if it doesn’t kill my flu Idk what will,1186431827864457216
2019-10-21 20:59:19,@ EchoThruMe this is why you have a lava hound in your cc... pic.twitter.com/0XNIzKCQzg,1186431804955398144
2019-10-21 20:59:18,Apoia a Lava Jato e talvez volte a ter apoio do povo! @ jairbolsonaro perdeu o povo qd virou as costas p combate à corrupção,1186431800387784704
2019-10-21 20:58:57,André Guede Querem saber o que parece coisa do Foro de São Paulo? Petista na PGR Narrativas contra procurador da lava-jato Narrativas contra a própria lava-jato Narrativas contra lava-toga Enfraquecimento da COAF CPMI das fake news,1186431709811744769
2019-10-21 20:58:38,Deltan abre mão de promoção para ficar na Lava Jato https://www.jornal21brasil.com.br/2019/10/deltan-abre-mao-de-promocao-para-ficar.html#.Xa5GKXuOVR0.twitter …,1186431631722274817
2019-10-21 20:58:29,Agora lava a louça amada,1186431594246082561
2019-10-21 20:58:06,Deltan Dallagnol abre mão de promoção para ficar na Lava Jato https://istoe.com.br/deltan-dallagnol-abre-mao-de-promocao-para-ficar-na-lava-jato/ …,1186431498888663040
2019-10-21 20:58:02,Querem saber o que parece coisa do Foro de São Paulo? Petista na PGR Narrativas contra procurador da lava-jato Narrativas contra a própria lava-jato Narrativas contra lava-toga Enfraquecimento da COAF CPMI das fake news,1186431480974708737
2019-10-21 20:57:54,"No, f**k the Europhiles.. The arrogance. Just because i haven't heard of some references that you have, that makes you somehow superior, wrong lol.",1186431446103285760
2019-10-21 20:57:35,"# Rewinside: Niemals GLAUBT IHR, was SPIELER in 24h aus einer MINECRAFT WELT voller LAVA gemacht haben! https://is.gd/kRzCwA # YouTube # LetsPlay # LetsPLEX",1186431365694345216
2019-10-21 20:57:21,André Guedes Querem saber o que parece coisa do Foro de São Paulo? Petista na PGR Narrativas contra procurador da lava-jato Narrativas contra a própria lava-jato Narrativas contra lava-toga Enfraquecimento da COAF CPMI das fake news,1186431309608112139
2019-10-21 20:57:05,"Mt Erebus 3794m, southernmost active volcano on Earth, from C-17 returning to Christchurch. Inner Crater, containing one of only a handful of long-lived lava lakes in the world, rises above Main Crater; at left, Erebus ice tongue floats in McMurdo Sound; pic 304th EAS @ usairforcepic.twitter.com/SDBQ6wVfxW",1186431242197057536
2019-10-21 20:56:37,Deltan recusa hipótese de promoção para continuar na Lava-Jato em Curitiba https://oglobo.globo.com/brasil/deltan-recusa-hipotese-de-promocao-para-continuar-na-lava-jato-em-curitiba-24032438?utm_source=Twitter&utm_medium=Social&utm_campaign=compartilhar …,1186431124278562817
2019-10-21 20:56:34,"Uma pessoa que se julga sua amiga, em um momento de surto seu, além de te expor, lava tua cara e te bloqueia. E jura que não vai te piorar nadinha, mas na verdade só quis tirar o cu do ponto",1186431110810669056
2019-10-21 20:56:29,"Como assim ""quer ficar na Lava Jato""? A Lava Jato não está sendo sepultada? Então,...!?",1186431088874475520
2019-10-21 20:56:23,"Miga, as vezes é o sabonete que você usa, a forma que você lava influência muito!! Cê usa aqueles sabonetes íntimos?",1186431065327624192
2019-10-21 20:56:04,THE FLOOR IS LAVA AVOID AT ALL COST,1186430987200352262
2019-10-21 20:55:55,Vai lava as teta com kisuco,1186430949548052481
2019-10-21 20:55:54,Não lava,1186430943965405184
2019-10-21 20:55:45,"Eso se llama lava cerebro , eso es porque la gente es ignorante ,y se deja influenciar nos falta educación",1186430907361714176
2019-10-21 20:55:44,VAZA JATO É BOMBA: Deltan recebeu R$ 1 milhão e salvou empresária na Lava Jato https://www.youtube.com/watch?v=o8JyksROh_Q&feature=share …,1186430903230304256
2019-10-21 20:55:17,Deltan recusa hipótese de promoção para continuar na Lava-Jato em Curitiba https://www.blogbueno.com.br/blogbueno/deltan-recusa-hipotese-de-promocao-para-continuar-na-lava-jato-em-curitiba/ …pic.twitter.com/P0ln13VY0w,1186430788407046144
2019-10-21 20:55:01,Lo único que se es que nuevamente otro presidente se lava las manos y convoca a que haya una guerra sin fin # FueraPiñera .,1186430723080765440
2019-10-21 20:54:53,Ud es un comunista disfrazado de ong. Lava perros triple ho,1186430688452632581
2019-10-21 20:54:50,Que carita tan tiernahttps://twitter.com/betopasillas/status/1186331029721755648 …,1186430676440178688
2019-10-21 20:54:38,"You know that feeling when you mine some diamonds, then they immediately fall in the lava?",1186430624137125890
2019-10-21 20:54:28,استغفرالله,1186430583876046849
2019-10-21 20:54:14,"a mi tío le entraron a robar en Montevideo, y el chorro era el que le lava el auto, le tuvo que pedir perdón y que no deje de ir al negocio que era buen cliente. Yo no lo puedo creer jajajajaja",1186430524644118528
2019-10-21 20:53:58,"she's only a bit smaller than aurex, so this lava dragons foreclaw is perfect to hug, and quite warm too!",1186430459091259392
2019-10-21 20:53:57,Lava toga também??Cuidado com o partido esse partido é...,1186430455199010816
2019-10-21 20:53:31,STF censura revista pró-Lava-Jato por denúncia contra Dias Toffoli https://www.esquerdadiario.com.br/STF-censura-revista-pro-Lava-Jato-por-denuncia-contra-Dias-Toffoli?fbclid=IwAR1Ax20ma5Sxe3ILuJc5dlBlgb2tZkiGNbQt5h7XlSFSTePfLPVAQArc5SQ …,1186430343714349056
2019-10-21 20:53:26,Amiga de vdd é aquela que lava a casa com vc que tá td suja dps da social pic.twitter.com/1IrfxarXmt,1186430324655493121
2019-10-21 20:53:21,lava ele,1186430303625273345
2019-10-21 20:53:19,"You can't answer a question with a question. Why did the remainer parties decline a general election. I put it to you that its because they know they would lose. If you have a different theory, now is the time to offer it.",1186430292216700928
2019-10-21 20:52:38,"Esse bglh de uma mão lava a outra é mó parada, sempre que chega na minha vez a água acaba .....",1186430122884288512
2019-10-21 20:52:15,Deltan recusa hipótese de promoção para continuar na Lava-Jato em Curitiba https://oglobo.globo.com/brasil/deltan-recusa-hipotese-de-promocao-para-continuar-na-lava-jato-em-curitiba-24032438?utm_source=Twitter&utm_medium=Social&utm_campaign=compartilhar …,1186430024188125186
2019-10-21 20:52:02,Deltan Dallagnol abre mão de promoção para ficar na Lava Jato - ISTOÉ DINHEIRO https://www.istoedinheiro.com.br/deltan-dallagnol-abre-mao-de-promocao-para-ficar-na-lava-jato/#.Xa5Ej8fCWVY.facebook …,1186429971536973830
2019-10-21 20:52:02,"VOCÊ É AQUELE GENERAL QUE CORAJOSAMENTE NO GOVERNO LULA MANIFESTOU DE MANEIRA CONTRARIA A DEMARCAÇÃO DE TERRAS CPNTINUA NA AMAZONIA E DEPOIS FICOU EM SILÊNCIO E OMISSO. OS ANOS PASSARAM, A LAVA JATO CHEGOU E JUNTO VEIO MUITAS DENUNCIAS BOMBASTICAS. O SEU NOME APARECE NESTA LISTA",1186429971205705728
2019-10-21 20:51:34,"...e preso pela Operação Lava-Jato em Abril de 2018, condenado em segunda instância no caso do Tríplex no Guarujá-SP. https://twitter.com/Denishits/status/1186429786501070848 …",1186429854679535616
2019-10-21 20:51:27,"Ricardo Barros fez duras críticas à Lava Jato, Sérgio Moro e Dallagnol, a resposta foi rápida @ requiaopmdb @ gleisihttps://twitter.com/MarcioR_Silva/status/1186427143301095427 …",1186429824388288513
2019-10-21 20:51:20,"Eu com ciumes, sou pior que a Operação Lava Jato kkkkkkkkkkkkkk",1186429794038222848
2019-10-21 20:51:09,Pero pues el presidente es el comandante supremo de las fuerzas armadas. Ya les dijo “incompetentes” a los militares y él se lava las manos. No es justo para ustedes @ Luis_C_Sandoval,1186429749201166340
2019-10-21 20:51:00,Procurador Deltan Dallagnol abre mão de promoção para ficar na Lava-Jato http://bit.ly/2W1whcu,1186429709623713792
2019-10-21 20:50:46,She won’t do anything unless the world care about it. # HKGov # StandWithHongKong,1186429651956056064
2019-10-21 20:50:44,Always wanted a lava lamp tbh ima get one,1186429642951016448
2019-10-21 20:50:36,Deltan recusa hipótese de promoção para continuar na Lava-Jato em Curitiba https://ift.tt/2My04qj,1186429608146681862
2019-10-21 20:50:28,"It is treasonous, and I'm not going to say otherwise just because you said so.",1186429575531782144
2019-10-21 20:50:27,Pizza Rolls = Italian Lava Pockets,1186429573417844738
2019-10-21 20:50:26,"Chorar lava a alma, Tmj nenê",1186429566753148928
2019-10-21 20:49:59,CCJ da Alerj vota pela soltura de deputados presos na Lava Jato https://www.noticiasaominuto.com.br/politica/1092510/ccj-da-alerj-vota-pela-soltura-de-deputados-presos-na-lava-jato?utm_medium=social&utm_source=twitter.com&utm_campaign=buffer … via @noticiaaominutobr,1186429456040255488
2019-10-21 20:49:51,To the terrible manners of truthhttps://open.spotify.com/track/5mxGkmYDOQlnb4yGjaS7oH?si=XZKnyPPTTNq0AMfEauVI_Q …,1186429421445533701
2019-10-21 20:49:49,"Porque estadio não e parâmetro de grandeza...a proposito pague o estádio lava jato, POBRE , CALOTEIRO E FALIDO, depois venha dizer que ""'tem estádio"" pic.twitter.com/AeGBCHf6o1",1186429412419477506
2019-10-21 20:49:47,pic.twitter.com/rEQiIfAujQ,1186429404727005188
2019-10-21 20:49:29,Lava girl!,1186429328768356352
2019-10-21 20:49:23,"You never ansered my question. I said if remain had win this 'once in a generation' vote Comin, we could vote for Brexit again if the government changed? I mean that goes both ways right?",1186429302696480768
2019-10-21 20:49:17,I love how you can see 0.2% of my cosplay in the cornerpic.twitter.com/iXh3s09EE7,1186429277291479040
2019-10-21 20:49:16,"Professo', guarda che te sto a da 'na dignità te sto a fa' lava' i cessi al mensa, non al Vespasiano de casa tua.",1186429275777523712
2019-10-21 20:49:00,@ SinarOnline @ mstaronline @ staronline @ mkini_bm @ tv3malaysia @ ntv7malaysia @ TvHijrah @ 501Awani @ MediaPrima @ bharianmy @ harakahdailyHD,1186429207666020352
2019-10-21 20:48:34,Adam: *si lava* Ronan: chi sei non ti riconosco,1186429099813883904
2019-10-21 20:48:28,Lava a toga Lava a câmara Lava o senado Lava os traíras Lava o Brasil .,1186429072181747712
2019-10-21 20:48:19,Amanda Lava Girl esta a punto de volver.,1186429034328154112
2019-10-21 20:48:14,"Nossa eu acho que nunca tive um cansaço mental psicológico tão grande como esse semestre, eu realmente só quero chegarno meu TFG na paz de Lana Del Rey",1186429014195486725
2019-10-21 20:48:13,Hot Lava IRL # AppleArcadehttps://twitter.com/thecultureofme/status/1186341085465006082?s=09 …,1186429009510326274
2019-10-21 20:48:10,Lava Jato: Deltan rejeita interesse em promoção que o afastaria do comando da Lava Jato https://www1.folha.uol.com.br/poder/2019/10/deltan-rejeita-interesse-em-promocao-que-o-afastaria-do-comando-da-lava-jato.shtml?utm_source=twitter&utm_medium=social&utm_campaign=comphometw …,1186428996008972300
2019-10-21 20:47:56,Bouta drink the shit inside of a lava lamp,1186428939201384448
2019-10-21 20:47:46,"Pelo menos nos bons filmes, a gente lava a alma. # UcranizaBrasilpic.twitter.com/aSbOE3BJ1h",1186428895282761733
2019-10-21 20:47:29,"Es creer o reventar....Soros les financia la joda a los rojos, los medios estan ""embargados"" durante Cris y el gato socialdemócrata; entonces, NECESITAN una hiper con un dolar a $4000; Tienen que licuar pasivos. Simple. Una mano lava la otra. Aunque es mas complejo que esto.",1186428827725172737
2019-10-21 20:47:28,"Como a Lava Jato inventou uma segunda pena para prender Lula, por Luis Nassif - GGN https://jornalggn.com.br/justica/como-a-lava-jato-inventou-uma-segunda-pena-para-prender-lula-por-luis-nassif/ …",1186428821433655296
2019-10-21 20:47:26,Saudades do irmãozao de Comu que nem a louca não lava,1186428815205158913
2019-10-21 20:47:14,This guy lost all of his friends off taking the floor is lava to seriously https://twitter.com/betmybookie/status/1186322207166910466 …,1186428761102639106
2019-10-21 20:46:52,pic.twitter.com/I37ZwgFaIu,1186428671713841153
2019-10-21 20:46:51,"A mulher do meu Ingles hj: vc lava o cabelo com cebola? Eu: nossa, não pq? Ela: Pq essa cor ta linda!",1186428666135359493
2019-10-21 20:46:25,各位手足好勁，follower一下子多咗好多，俾啲時間我follow back # FightForFreedom # StandWithHongKong,1186428556529684480
2019-10-21 20:46:10,Deltan Dallagnol decide recusar promoção e permanece na Lava Jato https://mblnews.org/noticia/deltan-dallagnol-decide-recusar-promocao-e-permanece-na-lava-jato/ …,1186428496152797184
2019-10-21 20:46:02,"It would not be a subtle effect! The Moon is closer to Earth's centre than Io is to Jupiter's. Io is volcanic because of Jupiter's tidal effects, and it is significantly smaller than Earth. So, I would guess lots of molten lava on the surface!",1186428460266348550
2019-10-21 20:45:58,"Lixo e louça é uma coisa infinita.. você cata; lava e nunca acaba, pqp",1186428444021870597
2019-10-21 20:45:57,Eu falei que ia dar uma descansadinha e acordei 3 hrs dps,1186428439093485569
2019-10-21 20:45:50,@ lava_airiの質問箱です https://peing.net/ja/lava_airi # 質問箱 # peing,1186428410374979584
2019-10-21 20:45:42,"# TodaForçaÀLavaJato Advogado dá aula de ética, decência e direito a ministros do STF e a advogados de criminosos da Lava Jato (Vídeo) https://rota2014.blogspot.com/2019/10/em-7-minutos-advogado-da-aula-de-etica.html?spref=tw …",1186428376644538370
2019-10-21 20:45:06,CCJ da Alerj vota pela soltura de deputados presos na Lava Jato http://ht.ly/sawR30pKVsg,1186428223992881154
2019-10-21 20:44:58,PERO SI SE TE LAVA EL MATE,1186428191063367680
2019-10-21 20:44:53,"Agora eu sei porque meu nome não sai da sua boca, cê tá lavando a cara aonde a gente lava a rola",1186428172834951168
2019-10-21 20:44:47,Some more of Teotihuacán and the experience afterwards. Attended a pre-hispanic ritual in a lava cave and saw a medicine woman do a cleansing. # teotihuacan # piramides # prehispanic # culture # history # anthropology… https://www.instagram.com/p/B35i6VCBz1w/?igshid=16654n22pui8 …,1186428144682536960
2019-10-21 20:44:34,Lava or fall damage?,1186428093440888836
2019-10-21 20:44:27,"Ei, tu é?pic.twitter.com/rh5rP4ufRi",1186428062042415104
2019-10-21 20:44:23,Boa! Lava Jato preservada!,1186428043826475008
2019-10-21 20:44:22,"Estamos com Olímpio e Bolsonaro, temos que acabar com os fundos partidários e eleitorais. Lava toga.",1186428039409946624
2019-10-21 20:44:21,CONTRA A PARCIALIDADE ABUSIVA NA OPERAÇÃO LAVA JATO: MANIFESTO ASSINADO POR JURISTAS EXIGE A RENÚNCIA DE SÉRGIO MORO https://blogzecarlosborges.blogspot.com/2019/10/contra-parcialidade-abusiva-na-operacao.html …pic.twitter.com/umIkjclUOx,1186428039133044737
2019-10-21 20:44:04,Lmao it was just a prop for cosplay pics,1186427965401227264
2019-10-21 20:44:00,"VC tem que colocar um protetor de colchão que não vai molhar o colchão, mas pega um pouco de detergente lava o pedaço e passa um pouco de conforte com pouco de vinagre depois seca com o secador e depois coloca no sol bjos boa sorte , não esquece de comprar um protetor",1186427951031697409
2019-10-21 20:43:52,New post (Flash Stock Rom on Lava X17 S109) has been published on Ultimate Guide - https://www.gogorapid.com/flash-stock-rom-on-lava-x17-s109/ …,1186427915313041409
2019-10-21 20:43:34,"A Cedae [ @ CedaeRJ] poderia aproveitar a oportunidade para ‘cortar’ as águas dos lava jatos da rua Leopoldo Bulhões. Aliás, bem em frente à ENSP/Fiocruz, sentido Bonsucesso-Benfica, jorra água na rua há mais de cinco meses - desperdício total.",1186427841048694785
2019-10-21 20:43:30,Going from tablet to traditional.... and that double tap erase isn’t a thing. # Procreate # mygif # GIF # procreategif # drawing # digitalartpic.twitter.com/SZbqSd6ecj,1186427821280727040
2019-10-21 20:43:23,Art is everywhere at anytime,1186427792038060032
2019-10-21 20:43:19,Deltan recusa promoção e fica na Lava Jato - O Antagonista https://www.oantagonista.com/brasil/deltan-recusa-promocao-e-fica-na-lava-jato/ …,1186427776594841601
2019-10-21 20:43:15,"Chiedilo a burgerborghiclick, cos'è il mensa. Lui lo sa. Tu no, perché al max c'è poi lava i cessi là dentro.",1186427760308301824
2019-10-21 20:43:07,"Si obvio como institución que les lava la cabeza, ni siquiera pueden agremiarse para no respetar la jornada laboral de 48 hs, porque te pensas que laburan 24 hs un día otro día no y así, es inhumano,y mas en un estado donde se devalúa la guita y no queda otra que hacerse gorra",1186427725751422976
2019-10-21 20:43:04,FAUSTÃO NA LAVA JATO # meteoro.dochttps://youtu.be/KscLx-Yrj4w,1186427714405842945
2019-10-21 20:43:02,"Procurador Deltan Dallagnol abre mão de promoção para ficar na Lava-Jato De acordo com Dallagnol, decisão leva em conta 'aspectos pessoais e profissionais' https://www.em.com.br/app/noticia/politica/2019/10/21/interna_politica,1094649/deltan-dallagnol-abre-mao-de-promocao-para-ficar-na-lava-jato.shtml?utm_source=FANPAGE …",1186427707938222087
2019-10-21 20:42:45,eu to lendo um texto medieval p n lava minha louça só lavei oq tava fedendo KKKKKKK o resto tá ali ainda pois se elas quiserem elas q se lavem sozinhas lalalalal,1186427632562388994
2019-10-21 20:42:39,Deltan dobra a aposta e agora só sairá da Lava-Jato se for tirado do cargo. https://veja.abril.com.br/blog/radar/deltan-dobra-a-aposta-e-agora-so-saira-da-lava-jato-se-for-tirado-do-cargo/ …,1186427609976061954
2019-10-21 20:42:37,"Now that's how you play, The Floor is Lava!",1186427603000930304
2019-10-21 20:42:29,Deltan abre mão de promoção para continuar na Lava Jato https://pleno.news/brasil/deltan-abre-mao-de-promocao-para-continuar-na-lava-jato.html?utm_source=Social&utm_medium=facebook …,1186427567764623360
2019-10-21 20:42:25,Deltan recusa promoção e fica na Lava Jato https://www.oantagonista.com/?p=266988,1186427552551882753
2019-10-21 20:42:25,Deltan recusa promoção pra ficar na Lava Jato https://republicadecuritibaonline.com/2019/10/21/deltan-recusa-promocao-pra-ficar-na-lava-jato/ …,1186427548626051073
2019-10-21 20:42:14,agora vamo se lava no churrascao vivi,1186427502597693440
2019-10-21 20:42:01,Mano tengo una madre non stop quejándose que los nenes se les mancha el pantalón con pinturas que SE LAVA FULL BLAST. pic.twitter.com/QRUEOWBtUS,1186427449472622592
2019-10-21 20:42:00,No seas Ridículo cual diálogo....con este Lava perros del PSUV ?,1186427446909919232
2019-10-21 20:42:00,lava toga vai ser a mesma coisa,1186427444296855557
2019-10-21 20:41:54,Deadass my life right now.. thought I was working with something,1186427422394204160
2019-10-21 20:41:45,"""Mesmo sob pressão, Deltan recusa promoção e vai continuar à frente da Lava Jato"" https://www.gazetadopovo.com.br/republica/deltan-recusa-promocao-lava-jato/?utm_source=facebook&utm_medium=midia-social&utm_campaign=gazeta-do-povo …",1186427381399117827
2019-10-21 20:41:15,Deltan abre mão de promoção para continuar na Lava Jato https://pleno.news/brasil/deltan-abre-mao-de-promocao-para-continuar-na-lava-jato.html?utm_source=Social&utm_medium=facebook …,1186427256228503558
2019-10-21 20:41:06,"que pena tener un presidente tan manipulador y que le lava el cerebro a la gente de una manera impresionante, todo el día las noticias mostrando el supuesto caos para que este wn remate con su discurso de mierda",1186427220933468166
2019-10-21 20:41:04,كلامك والله يمثلني بقوة,1186427210850295809
2019-10-21 20:41:00,"El peor Joker de la historia, del mundo mundial, de la humanidad, desde el big bang Que exageración, pero así fue. Era más un traqueto, un lava perros o algo así.",1186427192668033025
2019-10-21 20:40:49,"Exato, inclusive não assinando a CPI da Lava Toga e estourando cartões corporativos, não é mesmo? Pois isso é coisa de traíra ou petralha, não? # sqn",1186427147503702017
2019-10-21 20:40:46,Dizem que chorar lava a alma...,1186427136460165120
2019-10-21 20:40:45,"Aprendam, seus filhos da puta!!! Se vc não lutar para impedir que coisas boas sejam destruídas, vc esta beneficiando a porra do esquerdismo A destruição da Lava Jato é uma das coisas que não pode ser destruída https://twitter.com/BrunoGarschagen/status/1186400613543927809 …",1186427132299436035
2019-10-21 20:40:16,Vai dar *muito* trabalho. Não podemos desanimar ou desistir. Mas vamos nos livrar dessa corja toda e mudar este país. https://twitter.com/VemPraRua_br/status/1186420467143528450 …,1186427011566395399
2019-10-21 20:40:13,Deltan Dallagnol abre mão de promoção para ficar na Lava Jato - ISTOÉ Independente https://istoe.com.br/deltan-dallagnol-abre-mao-de-promocao-para-ficar-na-lava-jato/#.Xa5B2NnsDHI.twitter …,1186426997238616064
2019-10-21 20:39:58,be best you can be : a dead body kept in lava what's happened to you my flower?,1186426933682331652
2019-10-21 20:39:52,Daniel Urresti: “Rosa Bartra tiene que ser investigada por los millones que gastó la Comisión Lava Jato” | VIDEO http://prensaperu.info/politica/daniel-urresti-rosa-bartra-tiene-que-ser-investigada-por-los-millones-que-gasto-la-comision-lava-jato-video/ …,1186426908298416128
2019-10-21 20:39:44,"Em 7 minutos, advogado dá aula de ética, decência e direito a ministros do STF e a advogados de criminosos da Lava Jato (Veja o Vídeo). O vídeo lava a alma do povo brasileiro. Uma lição nos senhores de togas negras e nos advogados de corruptos. https://www.jornaldacidadeonline.com.br/noticias/16933/em-7-minutos-advogado-da-aula-de-etica-decencia-e-direito-a-ministros-do-stf-e-a-advogados-de-criminosos-da-lava-jato-veja-o-video …",1186426876492963840
2019-10-21 20:39:37,Deltan recusa promoção e fica na Lava Jato https://news.vemprarua.net/www.oantagonista.com/brasil/deltan-recusa-promocao-e-fica-na-lava-jato/ …,1186426844649787392
2019-10-21 20:39:25,Qual a sugestão para o q o Cong Nacional e o STF estão fazendo com o país? Ficarmos calados e assistindo paralisados as chantagens e sabotagens deles a próprio PR. @ jairbolsonaro e ao seu Governo? Esperarmos o Sepultamento da Lava Jato e a soltura de milhares de criminosos? https://twitter.com/visaomacro/status/1185866938477621248 …,1186426794527875072
2019-10-21 20:39:08,Deltan Dallagnol abre mão de promoção para ficar na Lava Jato https://istoe.com.br/deltan-dallagnol-abre-mao-de-promocao-para-ficar-na-lava-jato/ …,1186426724185186304
2019-10-21 20:39:08,"Como siempre se lava las manos. Enfermo, siempre culpa a alguien mas.",1186426723119714304
2019-10-21 20:39:02,"No sé por que te molesta,si es paraguayo,lo llaman paraguayo,al chileno chileno,al boliviano bolita,al chino chino al argentino argentino,no veo por que creés que los tomamos como extraterrestres...ahh lo dices por que se lava las manos? y boeh pobre si él no tiene la culpa",1186426701250727937
2019-10-21 20:38:52,"""I think it's the lava lamp juice that is making me grow..."" ""OR MAYBE I'M FINALLY GETTING MY GROWTH SPURT!!!""",1186426656266903557
2019-10-21 20:38:42,１５周年おめでとう ラバのスタッフ皆さま、いつも笑顔で接客してくれて、楽しくヨガやってます,1186426614529196032
2019-10-21 20:38:36,Lava Lamps,1186426591875719168
2019-10-21 20:38:35,"Deltan permanece no cargo e o atual presidente tem q apoiar,por q toda a população apoiam todo grupo da lava jato ok.",1186426587459145730
2019-10-21 20:38:34,"Eu já perdi umas 4 calças jeans por causa de ácido... Na hora parece que tá tudo lindo, aí vc lava e sua calça fica parecendo uma peneira pic.twitter.com/NTBTZ8Q5h4",1186426582480674816
2019-10-21 20:38:32,"Ese es el plan maestro, libreto de Joao Santana, preso en la Cárcel de Brasil por el expediente de Lava Jato, quien recibe y recibió cuantiosas sumas de dinero del erario para gestionar campaña publicitaria del ""Gobierno Dominicano""",1186426575019008002
2019-10-21 20:38:10,Hahahahaha dude i be like alright let me get my weight down and we can try this. Ka kapau koe atunga e fkkaukaui e jack in the box he po kotoa ikai pe lava ha fkholo ia,1186426482043674624
2019-10-21 20:38:04,@ STF_oficial @ STJnoticias @ TRF4_oficial @ MPF_PGR @ MPF_PRPR A Operação Lava-jato é uma organização criminosa e assassina enraizada no judiciário brasileiro liderada por Sérgio Moro e Deltan Dallagnol. pic.twitter.com/F2zxDhnXmo,1186426454931902465
2019-10-21 20:37:54,"@ georgelopez wait, so you met THE shark boy and lava girl??",1186426414855262215
2019-10-21 20:37:37,Code: TheCampingRusher @ TheCampingRushpic.twitter.com/bY7dKo1yjk,1186426343967330304
2019-10-21 20:37:35,お得なキャンペーン中♪ ホットヨガスタジオ LAVA 当日入会で入会金＆登録金０円 ↓ ↓ ↓ http://hot-yoga.info/index.html,1186426334584590336
2019-10-21 20:37:17,"Vergonha é ter o nome na lista da lava jato né Humberto bósta vulgo DRÁCULA ,kkk",1186426260228055042
2019-10-21 20:37:17,Lava lamp,1186426258990735360
2019-10-21 20:37:15,"Mesmo sob pressão, Deltan recusa promoção e vai continuar à frente da Lava Jato # TopbuzzBrasilhttp://va.topbuzz.com/s/wYwjfk",1186426250119843840
