date,text,id
2019-10-21 19:55:15,"Yo hace siglos presenté los ECAES y a lo bien que a mi no me tocaron preguntas taaaaaan lava cerebros, si habían unas MUY clasistas y full religiosas pero ajá, según veo, este año estuvieron pasándose de conchudas.",1186415679550951424
2019-10-21 19:55:10,Deltan Dallagnol abre mão de promoção para ficar na Lava Jato https://ift.tt/2W2GO7s,1186415660664020992
2019-10-21 19:54:46,"Deus lhe confiou uma missão. À frente da Lava Jato, Deltan e Moro resgatam a Dignidade do nosso pivo, do nosso país. Obrigada, Deltan. Deus te guarde https://twitter.com/VemPraRua_br/status/1186414058007941121 …",1186415558302060544
2019-10-21 19:54:44,"Remember 16th September 1992? Properties sky high. Lots of buy to rent adventures. Was just talking to the bank about a mortgage and buying, was I lucky or what. Demand goes away, so does house value.",1186415549447921664
2019-10-21 19:54:42,"Steaming hot and full of scorching lava... I could get used to this place! If only we could hold the champions' tournament in a place like this... Hey, Risen! Next time you fall from the sky, try to aim for Arena Ferox! Ba ha ha!",1186415543856713728
2019-10-21 19:54:32,esse papo de uma mão lava outra é foda. chega na minha vez a água sempre acaba rs,1186415499187556354
2019-10-21 19:54:20,"Em 7 minutos, advogado dá aula de ética, decência e direito a ministros do STF e a advogados de criminosos da Lava Jato (Veja o Vídeo) https://www.jornaldacidadeonline.com.br/noticias/16933/em-7-minutos-advogado-da-aula-de-etica-decencia-e-direito-a-ministros-do-stf-e-a-advogados-de-criminosos-da-lava-jato-veja-o-video …",1186415451066253313
2019-10-21 19:54:19,Lava (Source),1186415447001812992
2019-10-21 19:54:14,"RIO de JANEIRO, ""Furna da Onça"" CCJ da Alerj vota pela liberaçao deputados presos na Lava Jato pic.twitter.com/xd0St6KGqx",1186415422914138117
2019-10-21 19:54:08,Anita lava la tina. De mis favoritos,1186415401212743680
2019-10-21 19:54:07,"Entendi perfeitamente ....o inicio de Lula contra a ditadura,a segunda uma foto mais recente que nos lembra toda farsa da lava jato e a terceira nem precisa explicar https://twitter.com/eualine84/status/1186414591045230594 …",1186415395923734528
2019-10-21 19:53:58,Dondosha- masauti ft lava lava,1186415358074408961
2019-10-21 19:53:50,Deltan recusa promoção e fica na Lava Jato https://www.oantagonista.com/?p=266988,1186415322598952960
2019-10-21 19:53:47,Además de aburrido es un lava cerebros. Ahora entiendo lo de sus hijos...,1186415310410305537
2019-10-21 19:53:40,Parabéns!!! A lava jato precisa muuuuito de vc e o Brasil tb!!! Força e que Deus continue te protegendo!!! @ deltanmd,1186415280634978306
2019-10-21 19:53:38,"Deltan Dallagnol recusou uma promoção e preferiu permanecer como coordenador da Lava Jato. Deltan não é somente um homem honrado e corajoso, ele também é um exemplo a ser seguido pelas gerações que virão. O Brasil precisa de muitos Deltans. Vamos apoiar seu trabalho na Lava Jato!",1186415274297311232
2019-10-21 19:53:37,"Juiz era ladrão! Procuradores eram ladrões! Agentes da PF eram ladrões! Desembargadores eram ladrões! Delatores eram ladrões! Por incrível que pareça, na lava jato, o único inocente é o reu! # LulaLivreJÁpic.twitter.com/4VAHu9SozS",1186415270384017413
2019-10-21 19:53:23,"Parabéns, @ deltanmd ! Isso NÃO foi promoção. Isso foi ESTRATÉGIA para enfraquecer a Operação Lava Jato. https://twitter.com/claudioedantas/status/1186400158667476992 …",1186415212171321344
2019-10-21 19:53:21,This explains a lot,1186415201706373121
2019-10-21 19:53:05,Lava a louça q é bom nadaaaaaaaaaa,1186415133557493765
2019-10-21 19:52:58,Haber traigan a Cantinflas para que nos ayude a entender ?? Quien es quien ?? Ósea que el inepto de @ lopezobrador_ No participó en nada y se lava las manos,1186415106508410880
2019-10-21 19:52:46,"Yo, pero nunca me da gripe, una mano lava la otra. https://twitter.com/VikCo90/status/1185910328078536707 …",1186415056969519104
2019-10-21 19:52:45,Querem afastá-lo da Lava Jato a qualquer custo.,1186415049893711873
2019-10-21 19:52:32,"Kjkkkk toma água, lava o rosto bebê e bons estudos",1186414996613410816
2019-10-21 19:52:16,Lava! I win! https://twitter.com/realPOISONkill/status/1186411701366853632 …,1186414931324952576
2019-10-21 19:52:04,Deltan Dallagnol recusa promoção e pede para ficar na Lava Jato em Curitiba https://paranaportal.uol.com.br/politica/deltan-dallagnol-recusa-promocao-lava-jato-em-curitiba/ …,1186414878392799234
2019-10-21 19:51:29,@ LavaMobile want to know about Android pie update in Lava z61?,1186414734851002369
2019-10-21 19:51:29,Ok hear me out: vegetarian taquitos. Molten lava cheese ONLY,1186414733248741377
2019-10-21 19:51:18,Sabemos de quem foi o erro! Pra mim seria o @ AiltonBenedito o PGR perfeito ou @ deltanmd também pela sua história na lava jato,1186414684875964422
2019-10-21 19:51:09,"You link your mind to a wall of lava above 1 pound of lead. If viewing a location downriver, this spell understands and obeys your commands.",1186414647747993604
2019-10-21 19:51:07,We’re coming at you live from the Floor is Lava Championship! https://twitter.com/RexChapman/status/1186304467613995009 …,1186414641599143936
2019-10-21 19:50:55,n vo lava meus cabelo n ele q lute amanha,1186414588641923072
2019-10-21 19:50:54,"Ha ñ vagabundo, lava a boca pra do Dr Sergio Moro https://twitter.com/senadorhumberto/status/1186387431597248519 …",1186414587870171137
2019-10-21 19:50:37,Lava lamp shakes: Not even once,1186414515669352449
2019-10-21 19:50:19,CCJ da Alerj vota pela soltura de deputados presos na Lava Jato https://www.noticiasaominuto.com.br/politica/1092510/ccj-da-alerj-vota-pela-soltura-de-deputados-presos-na-lava-jato?utm_medium=social&utm_source=twitter.com&utm_campaign=buffer … via @noticiaaominutobr,1186414438003466240
2019-10-21 19:50:09,Who cares.,1186414396379140096
2019-10-21 19:50:00,Dallagnol recusa promoção e quer ficar na Lava Jato https://www.conversaafiada.com.br/brasil/dallagnol-recusa-promocao-para-ficar-na-lava-jato … via @ ConversaAfiada,1186414358450057216
2019-10-21 19:49:57,Ou a mulher faz comida lava louça etc ou fica com a unha feita.. meu sonho ter os dois mas é praticamente impossível,1186414348396314624
2019-10-21 19:49:47,Deltan Dallagnol abre mão de promoção para ficar na Lava Jato https://bit.ly/2By76VO pic.twitter.com/GwHEkSa30J,1186414304935010305
2019-10-21 19:49:46,Cheese on top of pizza is as hot as boiling lava. This brave man is catching hot lava with his bare hands.,1186414298861658114
2019-10-21 19:49:43,Uma ação positiva no meio de ataques a lava-jato e ajudas para o projeto de corrupção do sistema e você quer que o Nando coloque ele como um cara bom. Vá se lascar.,1186414288921083905
2019-10-21 19:49:27,lava sua boca de esgoto pra falar da aricia,1186414220126097408
2019-10-21 19:49:25,[ # SkyPorn] The sky is lava https://www.reddit.com/r/SkyPorn/comments/dl3xck/the_sky_is_lava/ …pic.twitter.com/jmGaGaxob8,1186414210751832068
2019-10-21 19:49:05,há bué gente q Lava,1186414130263220225
2019-10-21 19:48:52,Deltan recusa hipótese de promoção para continuar na Lava-Jato em Curitiba https://www.agoranoticiasbrasil.com.br/deltan-recusa-hipotese-de-promocao-para-continuar-na-lava-jato-em-curitiba/ … via @ AgoraNoticiasBr,1186414075351392257
2019-10-21 19:48:47,Cara corajoso.É disso que o Brasil precisa e não de gente querendo acabar com a Lava Jato.,1186414052135882752
2019-10-21 19:48:45,No asistió .. y después critica y se lava las manos fuera y fueraaaaaaa,1186414042942005248
2019-10-21 19:48:43,"Ao invés da Prisão, Promoção! Deltan Dallagnol, rejeitou nesta segunda-feria 21/10 concorrer a uma vaga de procurador regional da República, o que significaria uma promoção. Disse ele em carta ao conselho do MPF, que prefere ficar na Lava-Jato. https://oglobo.globo.com/brasil/deltan-recusa-hipotese-de-promocao-para-continuar-na-lava-jato-em-curitiba-24032438 …",1186414036646277120
2019-10-21 19:48:35,Chove chuva chove Vem lavar essa saudade Lava do meu peito As lembranças e me invade De uma vez,1186414001795817472
2019-10-21 19:48:28,Deltan abre mão de promoção para ficar na Lava Jato https://politica.estadao.com.br/blogs/fausto-macedo/deltan-abre-mao-de-promocao-para-ficar-na-lava-jato/?utm_source=estadao:twitter&utm_medium=link …,1186413974520258562
2019-10-21 19:48:26,"O Globo: ""Deltan recusa hipótese de promoção para continuar na Lava-Jato em Curitiba. Procurador pediu nesta a segunda-feira ao Conselho Superior do MPF para não integrar lista de aptos a serem promovidos."" Deixe aqui o seu aplauso.",1186413965368352768
2019-10-21 19:48:23,"eu fico um pouco incomodada quando esse tipo de tuíte aparece na minha tl pq geralmente os cara tem 30 anos, mora com a mãe e não lava nem a cueca https://twitter.com/braga048/status/1185867265134252033 …",1186413951199907841
2019-10-21 19:48:06,quem é que lava com agua quente https://twitter.com/olasouadiana/status/1186412701905555456 …,1186413881285136389
2019-10-21 19:47:57,RAPARIGA NAO RAPAROGA NAAAO LAVA A SUA BOCA COM AGUA E SABAO,1186413842311663619
2019-10-21 19:47:41,Promoção??? Estavam falando que iriam tirar ele a força da Lava Jato.,1186413778516283392
2019-10-21 19:47:34,"Em 7 minutos, advogado dá aula de ética, decência e direito a ministros do STF e a advogados de criminosos da Lava Jato (Veja o Vídeo) https://www.jornaldacidadeonline.com.br/noticias/16933/em-7-minutos-advogado-da-aula-de-etica-decencia-e-direito-a-ministros-do-stf-e-a-advogados-de-criminosos-da-lava-jato-veja-o-video …",1186413746060742659
2019-10-21 19:47:31,Lava toga o KCT!,1186413734077648898
2019-10-21 19:47:29,"Esse discurso de Barroso lava nossa alma , e poderia ser repetido nessa quarta-feira . https://www.facebook.com/100002189381565/posts/2449632515119704/ …",1186413726565568512
2019-10-21 19:47:25,"Esquerdopatas nunca mais. Foram 13 anos sem saúde, educação, emprego, segurança e desesperança. Chega de enganação. Queremos exterminar a corrupção e políticos corruptos. Apoiamos Moro, Dellangnol, lava jato. Sabemos o que queremos e não seremos mais manipulados.",1186413709540941824
2019-10-21 19:47:16,Heading to the surface of this beauty for a look around. Fields of lava vents make such interesting sounds. # elite # elitedangerous # edpostcardspic.twitter.com/y5DggYy2Cv,1186413672106807296
2019-10-21 19:47:13,"Lava Shtuff @ Incendiaa1 and @ Kazuupai are the most cutest couples! Heck, they won't stop arguing on who's more cuter.",1186413657271369729
2019-10-21 19:46:37,"ela só lava o cabelo dela no quarto dia depois da primeira lavagem, assim como eu",1186413506108768258
2019-10-21 19:46:32,Eu sou da filosofia cada um lava oq sujou,1186413485179199489
2019-10-21 19:46:31,quién se lava el cabello a ésta hora¿ luego me quejo cuando me da gripe,1186413481303707651
2019-10-21 19:46:30,lava a boca pra falar de arianos,1186413477394558977
2019-10-21 19:46:18,"# Rio | CCJ da @ Alerj vota pela soltura de deputados presos na Lava Jato # oreporterhttps://oreporter.com/CCJ-da-Alerj-vota-pela-soltura-de-deputados-presos-na-Lava-Jato,12795198970.htm …",1186413429663383552
2019-10-21 19:45:33,"Auditor da Lava Jato, que multou o Instituto Lula, tem R$ 11 milhões escondidos na conta de mãe https://antropofagista.com.br/2019/10/04/auditor-da-lava-jato-que-multou-o-instituto-lula-tem-r-11-milhoes-escondidos-na-conta-de-mae/?fbclid=IwAR24Oma3JPQnju9_9ywAli4I2L5mAcQrp0VQ_ZewKrRyq34HA2tWJdwmC5k …",1186413240294805507
2019-10-21 19:45:30,Deltan recusa promoção e fica na Lava Jato - https://www.oantagonista.com/brasil/deltan-recusa-promocao-e-fica-na-lava-jato/ …,1186413225841221632
2019-10-21 19:45:19,a gnt vive p conta os minuto p chega em casa lava o cabelo e fica pelada na frente do ventilador am i right ladies,1186413180823785474
2019-10-21 19:45:17,Deltan recusa promoção e fica na Lava Jato - O Antagonista https://www.oantagonista.com/brasil/deltan-recusa-promocao-e-fica-na-lava-jato/ …,1186413173466906624
2019-10-21 19:45:10,The floor is Lava!!!! Check it out https://twitter.com/realPOISONkill/status/1186411701366853632 …,1186413145276813312
2019-10-21 19:45:03,"Currently, there are seven lava lakes in the world. Since 2000 there have existed 14 more short-lived and also long-lived lava lakes. # lavalake https://buff.ly/2MWnnZR pic.twitter.com/Dr0jKB7jfJ",1186413112897036296
2019-10-21 19:45:00,Dallagnol rejeita prêmio de consolação para afastar-se do comando da Lava Jato https://www.diariodocentrodomundo.com.br/essencial/dallagnol-rejeita-premio-de-consolacao-para-afastar-se-do-comando-da-lava-jato/ …,1186413100163043328
2019-10-21 19:45:00,Deltan rejeita interesse em promoção que o afastaria do comando da Lava Jato https://bit.ly/2MAPO0z pic.twitter.com/uNTYnVqFRA,1186413100095983616
2019-10-21 19:44:56,Lava tua boca mule feia,1186413085298438144
2019-10-21 19:44:34,"Preciso lava a minha bag, ela tá imundaaaaa",1186412992839245826
2019-10-21 19:44:33,destroy this artifact of the dark ages or i will cast it into the fires of New Jersey's Great Generato,1186412988653166592
2019-10-21 19:44:18,Deltan recusa promoção e fica na Lava Jato - O Antagonista https://www.oantagonista.com/brasil/deltan-recusa-promocao-e-fica-na-lava-jato/ …,1186412926393036800
2019-10-21 19:44:15,[21/10 7:42 PM] momolado : coe revermar [21/10 7:42 PM] momolado : lava minha cueca ai,1186412912103047171
2019-10-21 19:44:06,Já vão começar a fritura de Moro também ou o filhote de ditador ja disse que agora são contra a lava jato? https://twitter.com/coachsandrolima/status/1186408369399193600 …,1186412874840924160
2019-10-21 19:44:06,Prefiero Lava Spike O ME VAS A DECIR QUE TAMPOCO ESTÁ¿,1186412874165637120
2019-10-21 19:43:10,"Meu sonho é meus sogros falarem isso pq minha mãe já falou q se o Arthur come aqui em casa e lava a louça, pode já colocar o sobrenome Guimarães https://twitter.com/TheSTOLENMemes1/status/1186302395342557184 …",1186412640249241600
2019-10-21 19:43:06,"los lava perfecto, no sé, ni cuenta me había dado hasta que lo vi en la calle con bastón y guiado por su esposa que es la que cobra",1186412621605437440
2019-10-21 19:42:55,"Mesmo sob pressão, Deltan recusa promoção e vai continuar à frente da Lava Jato https://www.gazetadopovo.com.br/republica/deltan-recusa-promocao-lava-jato/?utm_source=facebook&utm_medium=midia-social&utm_campaign=gazeta-do-povo …",1186412576713990144
2019-10-21 19:42:48,"Que bonzinho... A palestra paga mais na lava jato, né?",1186412548360421376
2019-10-21 19:42:46,Mientras Yael se lava la cola.. pic.twitter.com/CWyJCJLxe6,1186412540550680577
2019-10-21 19:42:46,kkkkkkkk vai lava essa cara,1186412539275632640
2019-10-21 19:42:45,"PRESIDENTE , PRESIDENTE É VERDADE QUE VC GASTOU 2 MILHÃO POR MÊS NO CARTÃO CORPORATIVO ? COMO PRESIDENTE ? VOCÊ LAVA A PRÓPRIA ROUPA , USA CANETA BIC , COME NO BANDEJÃO , TO ACHANDO QUE É ARMAÇÃO DO PT ESSA HISTÓRIA .",1186412533852397569
2019-10-21 19:42:44,"Siendo chile podría hacerse un esquema similar con un volcán en erupción, y debajo, la lava y el manto de fuego De costado, un tsunami de revuelta popular estaría por destruir al esquema",1186412530471768064
2019-10-21 19:42:17,Quien lava y desinfecta colchones en Neiva?,1186412416315334656
2019-10-21 19:42:16,Lava Jato odiada pelos LADRÕES tem toda lógica! Mas ODIADA POR MINISTROS STF não tem NENHUMA explicação no mínimo “ razoável”,1186412415048699904
2019-10-21 19:42:08,I think you could do a very cool Seraphon army with the scales/skin mirroring the lava effect on the base.,1186412378927386629
2019-10-21 19:42:03,"@ jairbolsonaro @ BolsonaroSP @ CarlosBolsonaro @ FlavioBolsonaro @ GeneralMourao @ SF_Moro @ rsallesmma @ PauloGuedesReal sabem pq Dep e Sen Corruptos atacam tanto o Governo do Pres Bolsonaro? 1) Nao querem Lava Jato 2) Rombo de Bi no BNDES, CAIXA e BB sem garantias 3) Pacote Anti Crime",1186412360833159168
2019-10-21 19:41:46,"I lived through Thatcherism, came from mining stock, generations down the pits. That was never going to change, we’d always need coal, honest work, a man could provide for his family on that wage. Things change.",1186412286661005314
2019-10-21 19:41:43,Dois erros basicos: primeiro promover esse vagabundo é segundo deixá-lo na lava jato. Cadeia seria o correto. https://twitter.com/exame/status/1186399292417806336 …,1186412275378376705
2019-10-21 19:41:28,"Assista a ""CRISE AUMENTA!!! DELTAN DESAFIA O STF!!!!!! REJEITA CARGO E DIZ QUE NÃO SAI DA LAVA JATO"" no YouTube https://youtu.be/N7lrnI21S3M Fora Deltan!!!",1186412210823876611
2019-10-21 19:41:20,"A lava jato ñ é a única operação de combate corrupção no país, existe várias outas, a lava jato é a mas conhecida! Mas concordo com vc tem vários nomes bons, menos o desse Augusto Ares!",1186412179152654337
2019-10-21 19:41:18,"More annoying lava in @ Skuggo's ""Demolition Crew"". Sometimes it hurts, sometimes it doesn't. I just can't understand what's going on here. # IndieSelect # indiegamespic.twitter.com/PM0AeuwjmN",1186412168251658240
2019-10-21 19:41:01,pausa no trabalho q vai demorar horas para ser finalizado( e q por acaso eh p amanha) pois preciso lava o cabelo ouvindo taylor swift fodase,1186412099091738624
2019-10-21 19:40:57,"""this is why we dont plant a tree on top of a lava block Sharon """,1186412081106415616
2019-10-21 19:40:45,New post (Flash Stock Rom on Lava A32 V21) has been published on Ultimate Guide - https://www.gogorapid.com/flash-stock-rom-on-lava-a32-v21/ …,1186412030170980352
2019-10-21 19:40:40,Sigo aca. Me parece pauperrimo que hayas dicho de usar cosas de tela o algo asi como dijiste mas arriba. No seas cavernicola por dios. El dia que tengas un pibe usa pañales de tela y lava mierda todo el dia.,1186412011594375168
2019-10-21 19:40:29,". Lava Toga caçaria o Moro, como a própria esquerda que encabeça esta CPI anunciou, por não haver fato específico para a instauração. . COAF foi enfraquecido pelo STF, já que no BC terá ainda mais poder devido à futura independência do Banco. . CPMI das Fake News é da esquerda.",1186411966388199425
2019-10-21 19:40:27,I had to go out there to get the Fenty Body Lava .. everybody else sold out,1186411954618818562
2019-10-21 19:40:23,CRISE AUMENTA!!! DELTAN DESAFIA O STF!!!!!! REJEITA CARGO E DIZ QUE NÃO SAI DA LAVA JATO - YouTube https://m.youtube.com/watch?v=N7lrnI21S3M … só sai no pau?,1186411938705793024
2019-10-21 19:40:14,# POLÍTICA | Deltan rejeita interesse em promoção que o afastaria do comando da Lava Jato - https://mla.bs/da010fd9 pic.twitter.com/e2NIEaFq1S,1186411903721054214
2019-10-21 19:40:02,been sitting here for the past 10 minutes just watching my lava lamp,1186411851372027904
2019-10-21 19:39:56,"Cara, isso é grave demais! Envie urgentemente esse vídeo à OrCrim da Lava Jato. O ético @ deltanmd está doidésimo para encontrar algo concreto contra Lula, para que não se tenha de fazer mais malabarismo jurídico, como condená-lo por una reforma num apê que nunca foi ou será dele.",1186411826751430657
2019-10-21 19:39:52,enverdad el que me lo lava me cobra 25$ y yo le doy $5 al q la lave y le ponen hasta quick wax,1186411807751262208
2019-10-21 19:39:51,"não bastasse o sufoco de tomar chuva, chego em casa e tenho que lidar com um vagabundo que não faz nada sendo que tô fora das 7 as 7 e essa peste não lava uma louça estando o dia todo em casa",1186411805515624453
2019-10-21 19:39:51,"Lula: ""Lava Jato foi criada para entregar o nosso petróleo aos EUA"" - CartaCapital https://www.cartacapital.com.br/politica/lula-lava-jato-foi-criada-para-entregar-o-nosso-petroleo-aos-eua/ …",1186411803397541888
2019-10-21 19:39:39,"Ao sr Deltan mais uma vez gratidão pelo trabalho não aceitou promoção como presente , vai continuar seu trabalho na lava jato até fim.",1186411756593336320
2019-10-21 19:39:26,# MarioKart and a floor of lava on @ WatchMixer?! Live now?!pic.twitter.com/D5hg0mA5hV,1186411701366853632
2019-10-21 19:39:18,Imagine being in the final build-up strokes of a choice bust and then a wave of lava washes your door away and kills you https://twitter.com/historylvrsclub/status/1185903753070829569 …,1186411665635581954
2019-10-21 19:39:06,"Ñ sei quem escreveu isso, mas narrativa contra Moro e lava-jato já corre há muito tempo na boca pequena. Só não saíram do armário ainda.",1186411617627582465
2019-10-21 19:38:48,"apparently lava is like, the consistency of syrup so I'm going to have a real weird time applying this",1186411541039480832
2019-10-21 19:38:48,"maluco desceu uma guria no ônibus q eh literalmente um cosplay de lava girl só que com cabelo chanel, wtf kkkkkkkkkkkkkmk",1186411540649598976
2019-10-21 19:38:41,"É verdade esse bilhete! CPI da lava toga, lei de abuso autoridade e vetos frouxos na lei eleitoral mandam lembranças...",1186411513344614406
2019-10-21 19:38:38,"Just playing some more ""Demolition Crew"" from @ Skuggo. I've got to say this harmless lava is a bit annoying when the lava on the other side damages the player and there's really nothing to indicate the difference between the two. # IndieSelect # indiegamespic.twitter.com/M95D1zRh8M",1186411499520249856
2019-10-21 19:38:21,"I have Lava Golems, Veilers, Instants, Thousand-Eyes, and Pankratops that I intend to use with these but I forgot them when I moved.",1186411427923279872
2019-10-21 19:38:19,"Jjajajajaj veneca veneca, lava mier https://www.facebook.com/willysPro/posts/3070235939659112 …",1186411417789960193
2019-10-21 19:37:58,". Aras na PGR foi um erro. . Dallagnol transfere dinheiro apreendido pela Lava Jato para ONGs de esquerda e, segue diversos esquerdistas e quase nenhum direitista. Excelente procurador, mas também não serve para PGR. . Somente a esquerda tem narrativa contra a Lava Jato. +",1186411330623983616
2019-10-21 19:37:57,Desembargador que ampliou pena de Lula assume o 'Tribunal da Lava Jato' https://noticias.uol.com.br/ultimas-noticias/agencia-estado/2019/06/25/victor-laus-assume-presidencia-do-tribunal-da-lava-jato.htm …,1186411329181102081
2019-10-21 19:37:45,But you then conclude that they can’t make reasonable judgements. You know that used to be the reason women were denied the vote. Seems silly now doesn’t it?,1186411277582831616
2019-10-21 19:37:45,ASAP @ Flint Hill Elementary STEM class making Lava Lamps - they were amazing... @ DeenajSams @ FuhreySamanthapic.twitter.com/Hc0rZ5zBbB,1186411277201137665
2019-10-21 19:37:44,"Em 7 minutos, advogado dá aula de ética, decência e direito a ministros do STF e a advogados de criminosos da Lava Jato (Veja o Vídeo) https://www.jornaldacidadeonline.com.br/noticias/16933/em-7-minutos-advogado-da-aula-de-etica-decencia-e-direito-a-ministros-do-stf-e-a-advogados-de-criminosos-da-lava-jato-veja-o-video …",1186411274692898816
2019-10-21 19:37:43,"CASO: Mensalão/R$ 55 milhões/2005 CASO: Sanguessuga/R$ 140 milhões/2006 CASO: Operação Navalha/R$ 610 milhões/2007 CASO: Vampiros da Saúde R$ 2,4 bilhões/1990 a 2004 CASO: Lava Jato/2014/ R$ 8 trilhões Quadrilhão do pt",1186411267621380097
2019-10-21 19:37:37,Época de lava jato kkkkk,1186411241608302595
2019-10-21 19:37:26,a schana esses dias falou algo sobre nossos jalecos tudo manchados pq a gente lava uma vez por ano eu me senti pessoalmente atingida pois meu jaleco eh lavado apenas nas férias de verão e inverno e agora tem a mostratec e eu vou parecer uma sobrevivente de um acidente nuclear,1186411196108423168
2019-10-21 19:37:19,Deltan recusa promoção e fica na Lava Jato - https://www.oantagonista.com/brasil/deltan-recusa-promocao-e-fica-na-lava-jato/ …,1186411168447041537
2019-10-21 19:37:17,ta e vai lava aonde se é morador de rua?,1186411159613837313
2019-10-21 19:37:13,"3 - OS SEIS cavaleiros QUE querem VÊ o FIM da LAVA JATO, o fracasso do GOVERNO e a SEMPRE DESGRAÇA do BRASIL sempre DEPENDENTE deles.",1186411142282911744
2019-10-21 19:37:12,"PORQUE SERÁ QUE ESSES ESTÃO DO LADO DO STF e CONTRA A LAVA JATO? 1 - As GRANDES midias NEM MESMO tem interesse de NOTICIAR para que o POVO de nada saiba. 2 - O CONGRESSO, através dos seus presidentes, POIS TEM MEDO do rabo preso, com o próprio STF.",1186411140164849666
2019-10-21 19:37:08,Deltan recusa promoção e fica na Lava Jato - https://www.oantagonista.com/brasil/deltan-recusa-promocao-e-fica-na-lava-jato/ …,1186411122892640256
2019-10-21 19:37:07,Levo o carro no lava jato e no dia seguinte chove,1186411118627041283
2019-10-21 19:37:05,"ARE able to the remote lava boost state to move a goomba, the distance 50 units.",1186411108313239553
2019-10-21 19:37:03,"Parabéns Deltan! O Brasil é muito grato a você, o Ministro Sérgio Moro e a toda a força tarefa da Lava Jato! https://www.oantagonista.com/brasil/deltan-recusa-promocao-e-fica-na-lava-jato/ …",1186411102474768384
2019-10-21 19:37:03,"pode lavar, só lava de manhã p estar seco até a noite",1186411102453862400
2019-10-21 19:36:58,Deltan recusa promoção e fica na Lava Jato - O Antagonista https://www.oantagonista.com/brasil/deltan-recusa-promocao-e-fica-na-lava-jato/ …,1186411080903544832
2019-10-21 19:36:56,"Esse é o sem vergonha do Gilmar Mendes ....Dizia isso mas agora que caiu na Lava Jato mostra a que veio! Descarado, nojento!!! pic.twitter.com/RP6D49QsmK",1186411072414257153
2019-10-21 19:36:49,Deltan Dallagnol abre mão de promoção para ficar na Lava Jato https://istoe.com.br/deltan-dallagnol-abre-mao-de-promocao-para-ficar-na-lava-jato/ …,1186411041577668609
2019-10-21 19:36:47,Airport doodle.pic.twitter.com/r3Q3hd4vqv,1186411034069716992
2019-10-21 19:36:46,Victoria vai lava a casinha dos cachorro,1186411031356215297
2019-10-21 19:36:41,コア・アースは面白いとこたくさんだよな！,1186411007691771904
