date,text,id
2019-10-28 20:59:16,AS INSCRIÇÕES PARA PC ESTÃO ABERTAS !! Inscrições pelo Instagram @copacobre pic.twitter.com/RRvMuoiJw9,1188968504583741441
2019-10-28 20:50:47,Fiscal da Saresp 2019: inscrições abertas para trabalhar https://www.horabrasil.com.br/119756/fiscal-da-saresp-2019-inscricoes-abertas-para-trabalhar/ …,1188966371570401283
2019-10-28 20:48:31,"Na página do subprograma, onde tem os editais, mas o resultado foi adiado por conta da prorrogação das inscrições",1188965798808838144
2019-10-28 20:48:26,"passando p relembrar que está aberta as inscrições para a seletiva feminina do ghosts. qualquer dúvida só me chamar no whats, ou por aq https://twitter.com/BorghiEduarda/status/1188400325750853634 …",1188965781901590529
2019-10-28 20:44:53,"sim, fiz a minha ano passado e estava tudo organizado, agora quando eu entro no site não aparece nada só indicando as inscrições do eja",1188964885239156741
2019-10-28 20:43:49,"# Repost @ debyspersonal (get_repost) ・・・ Devido a algumas inscrições não terem sido confirmadas, conseguimos liberar mais duas vagas do programa! ⠀ Aproveite, pois o programa começa no dia 04 de novembro! Ainda dá… https://www.instagram.com/p/B4LkXjdATLx/?igshid=164epockmryxu …",1188964617634144256
2019-10-28 20:40:10,Inscrições para professor substituto do IFF abertas até sexta-feira -,1188963701463961600
2019-10-28 20:36:53,Minha escola bateu nesse ano o recorde de inscrições do PAS. Uma grande vitória. Quinta passada levei muita gente que não iria se inscrever e fizemos dar tudo certo. Vale muito a pena o perrengue do dia-a-dia,1188962875043450886
2019-10-28 20:35:18,"eu, a marina e a esther surtando na dm pq as inscriçoes abriram",1188962473426206720
2019-10-28 20:34:40,"Estão abertas as inscrições para o Grupo de Estudos em Odontologia Miofuncional. Será um evento online onde os alunos poderão enviar casos clínicos voltados para a Odontologia Miofuncional, onde alguns serão selecionados (seguindo nossos critérios),… https://ift.tt/2NpwhPE pic.twitter.com/hhX0H9s1jb",1188962313388343296
2019-10-28 20:34:34,IF Bento abre inscrições. https://www.facebook.com/permalink.php?story_fbid=1224625664404299&id=100005706308090 …,1188962288365166592
2019-10-28 20:32:34,sério fiz umas 3 inscrições será que alguma valeu ?,1188961786432765953
2019-10-28 20:31:35,"Olha a dica: estão abertas as inscrições para seletiva de bandas e artistas para a edição 2019 do Festival BR 135, que acontece nos dias 28, 29 e 30/11, em São Luís-MA. Se liga, inscrições até 30/10! https://www.instagram.com/p/B3-jGFtgMXX/?utm_source=ig_web_copy_link …",1188961540113911808
2019-10-28 20:31:14,"@ jdoriajr Senhor Governador João Dória estou preocupado, sou Professor categoria O da rede estadual de São Paulo, e lhe pergunto, vamos pider fazer este ano inscrições para atribuições de aula para 2020, visto que não abriu até agora nada todos is professores contratados estão",1188961450108297216
2019-10-28 20:30:12,"As inscrições para a Semana Acadêmica da @ UemaOficial 2019 estão abertas e seguem até o primeiro dia do evento, que acontecerá de 4 a 8 de novembro, no Campus Paulo VI. http://bit.ly/2MqTOk5 # GovernoDeTodosNóspic.twitter.com/DMDTAHw68c",1188961190321577985
2019-10-28 20:29:31,Fábrica da Volkswagen # Caminhões e Ônibus abre inscrições para Formare http://www.truckbrasil.com.br/wp/?p=99218 # geral,1188961019978305536
2019-10-28 20:29:24,"Inscrições gratuitas e limitadas, confirme sua inscrição o quanto antes e garanta a participação de sua empresa! https://www.facebook.com/100000913618700/posts/3577621102278308/ …",1188960988239978498
2019-10-28 20:27:51,Prefeitura de Luís Eduardo abre inscrições para oficina de coral de natal Acesse: https://sigabahia.com.br/cidades/prefeitura-de-luis-eduardo-abre-inscricoes-para-oficina-de-coral-de-natal/ …,1188960598278709248
2019-10-28 20:27:02,Hahahaha foda foi perder a grana das inscrições.,1188960393491820544
2019-10-28 20:25:46,"O YouTube pode ter alguns problemas, mas ele me entrega por email 100% das notificações dos canais que eu ativei o sininho e cliquei em ""Todas"". O padrão é estar ativado o sininho do meio (""Personalizadas""). Verifica as suas inscrições p/ não perder vídeo dos canais q vc gosta ;) pic.twitter.com/F7omtYeImT",1188960076968714240
2019-10-28 20:25:03,Inscrições pro suicídio coletivo: ______michael_____,1188959895724445696
2019-10-28 20:25:03,Inscrições em http://www.camporeal.edu.br pic.twitter.com/7MgfvTswIj,1188959895112036356
2019-10-28 20:23:33,"Qria mt, mas tô tendo tempo nem pra cagar..., Tô meio desligado, por acaso já encerrou as inscrições ?",1188959515720503303
2019-10-28 20:23:10,"Veja o resumo de 28 OUT a 01 NOV com os # concursos com edital publicado, inscrições abertas e previstos. ⠀ Fique preparado com nossos cursos: http://damasio.com.br ⠀ # damasio # concursopic.twitter.com/8MxlzbzU3f",1188959419842859013
2019-10-28 20:19:51,"Bora participar da Corrida e Caminhada de Heliópolis As inscrições já estão abertas Para participar da prova é bem simples, acesse agora o link e inscreva-se. https://www.sympla.com.br/14-corrida-e-caminhada-de-heliopolis__695761 …pic.twitter.com/39QMoxA4G6",1188958585319055362
2019-10-28 20:19:33,Inscrições abertas para meu namorado!!! Regras: Tem que existir.,1188958513260912641
2019-10-28 20:17:56,Inscrições: link na bio,1188958106325340160
2019-10-28 20:17:37,"ATENÇÃO, VEM AÍ O II COLÓQUIO PET - MATEMÁTICA E MEIO AMBIENTE! ACONTECERÁ NO DIA 31/10, NA PRÓXIMA QUINTA-FEIRA Inscrições no link: https://forms.gle/A2eHQQ4J35R1ngeK9 … Evento no facebook: https://www.facebook.com/events/p747697475656475/ …",1188958024423165952
2019-10-28 20:15:04,já abriu as inscrições??,1188957384623955968
2019-10-28 20:14:58,Secretaria de Desenvolvimento Econômico recebe inscrições para curso gratuito na área de turismo em Caicó http://glaucialima.com/2019/10/28/secretaria-de-desenvolvimento-economico-recebe-inscricoes-para-curso-gratuito-na-area-de-turismo-em-caico/ …,1188957359277780999
2019-10-28 20:13:46,"Últimos dias de inscrições para a # CopaTayrona, na Colômbia - Em entrevista, o presidente do concurso fala sobre os destaques desta 1ª edição: https://revistabeerart.com/news/copa-tayrona …pic.twitter.com/JNcSohtS7U",1188957054419030016
2019-10-28 20:10:59,"Corra que as vagas são limitadas! Já são 2.000 inscritos na Tríplice Corrida do Fortaleza. Vem com a gente, participe da prova oficial da Nação Tricolor. 3º lote até 10/11. ST & Conselheiro: R$ 80 Não sócio: R$ 90 Inscrições http://novaletra.com.br / (85) 3109.7599pic.twitter.com/FV6yTDiS2a",1188956353311760384
2019-10-28 20:10:36,"Secretaria de Desenvolvimento Econômico recebe inscrições para curso gratuito na área de turismo em Caicó O Município de Caicó, através da secretaria municipal de Desenvolvimento Econômico e Turismo, informa que… https://www.instagram.com/p/B4LgkS6hU9G/?igshid=14xupfwbwq9r9 …",1188956260797825024
2019-10-28 20:10:35,"Tá chegando gente!!!!! Abertas as inscrições on-line: https://forms.gle/HPA727LkSEwnfxq67 … O ENCONTRO DE CINEMA NEGRO ZÓZIMO BULBUL acontecerá nos dias 6 e 7 de novembro, no Campus da Universidade Federal... https://www.facebook.com/silviocslima/posts/2812641912081399 …",1188956254133276673
2019-10-28 20:09:21,MPT ABRE INSCRIÇÕES PARA O CURSO: CONSELHEIROS TUTELARES: IMPORTANTES ATORES NO COMBATE AO TRABALHO INFANTIL - EDIÇÃO VII https://peteca2008.blogspot.com/2019/10/mpt-abre-inscricoes-7-edicao-do-curso.html …,1188955945864445958
2019-10-28 20:09:06,"Consegue simmmm , começo do ano abre as inscrições p Oficina",1188955882052345856
2019-10-28 20:07:25,"Sacerdotes, o Congressk de Homens está chegando! Marque na sua agenda os dias 26, 27 e 28. Vamos viver dias poderosos. Aguardamos você, e toda sua geração! Inscrições no link http://mir12.com.br/br/2019/inscri …pic.twitter.com/xKtFKaN1gO",1188955456183685121
2019-10-28 20:07:04,Abertas inscrições de expositores para Feira da Beleza https://www.esteio.rs.gov.br/index.php?option=com_content&view=article&id=16578:abertas-inscricoes-de-expositores-para-feira-de-beleza&catid=26&Itemid=203 …pic.twitter.com/cnlgjDCDUN,1188955371005763584
2019-10-28 20:06:45,aberta às inscrições p ser meu namorado (mas só em 2020) podem mandar currículo jae requisitos não pode ser mineiro e nem pode fumar maconha jae,1188955290202443776
2019-10-28 20:06:15,"https://www.meetup.com/pt-BR/Mulheres-de-Produto/events/265857256/ … Inscrições abertas pro próximo Mulheres de Produto Blumenau, na HBSIS, 29/10.",1188955163790401538
2019-10-28 20:05:51,"Dias 6 e 7 de novembro teremos o Encontro Zózimo Bulbul de Cinema Negro na UFF de Pádua! Oficinas de Cinema, Rodas de conversa com cineastas e exibição de filmes do encontro! Inscrições: https://forms.gle/HPA727LkSEwnfxq67 … Evento: https://www.facebook.com/events/404699990209559/ …pic.twitter.com/putp9caVJx",1188955063320043525
2019-10-28 20:03:15,família é foda bicho meu primo q n fala com a gente há milianos manda mensagem pra minha mãe pedindo 90 reais pra pagar o enem garotahh as inscrições foram em maio,1188954407532224514
2019-10-28 20:02:16,já vou abrir as inscrições pra me iludir ano que vem,1188954159984336901
2019-10-28 20:01:53,inscrições abertas p ser meu role do halloween tô brincando mas pode ser vdd dependendo da pessoa rsrs,1188954067189600256
2019-10-28 20:00:14,"Enfim, habemus inscrições! Para se inscrever, basta acessar nosso site, via este link < http://www.sites.google.com/view/fomun > (ou pelo link na nossa bio) As representações de cada comitê podem ser acessadas rapidamente pela aba ""Guias"" Esperamos todos vocês em breve!",1188953650049290245
2019-10-28 19:54:12,Terminam na quarta inscrições para Processo Seletivo do IFMG https://www.diariopopularmg.com.br/terminam-na-quarta-inscricoes-para-processo-seletivo-do-ifmg/ …,1188952131669233665
2019-10-28 19:51:48,Concurso PM BA abre inscrições para oficiais na área da saúde - SobradinhoNews http://sobradinhonews.com.br/concurso-pm-ba-abre-inscricoes-para-oficiais-na-area-da-saude/ …,1188951526582169600
2019-10-28 19:45:32,EYM2020: Croácia abre inscrições para o Festival Eurovisão de Jovens Músicos 2020 http://www.escportugal.pt/2019/10/eym2020-croacia-abre-inscricoes-para-o.html …,1188949952157884416
2019-10-28 19:45:28,CPB divulga informações e período de inscrições do programa Bolsa Atleta - Comitê Paralímpico Brasileiro http://bit.ly/2BRl5Gk,1188949932666998784
2019-10-28 19:44:46,INSCRIÇÕES ENCERRADAS – VAREJO DIGITAL – ESTRATÉGIAS PARA 2020 – EUI QUERO UM EMPREGO URGENTE AGORA JÁ NO SHOPING RECIFE Aloshop http://www.aloshop.com.br/noticias/inscricoes-encerradas-varejo-digital-estrategias-para-2020/ …,1188949757168947200
2019-10-28 19:44:37,"Oi pessoal, já começou as inscrições para o Concurso na pressão 2019 – sabor da gente Programa Sabor da Gente, da TV Jornal. QUEM PODE PARTICIPAR Pessoas maiores de 18 anos, residentes em Recife e na Região… https://www.instagram.com/p/B4LdmCrgaAz/?igshid=1eqknzp1vm10f …",1188949721336946689
2019-10-28 19:42:15,e tá rolando inscrições pro intercâmbio da uma olhada em algumas das cidades que tu pode ter a oportunidade de conhecer no ano que vem pic.twitter.com/hT2OROkBjo,1188949125821337600
2019-10-28 19:40:06,"Daora demais a iniciativa, mas acredito que o ""baixo"" número de inscriçoes seja pela data Um torneio desses em dezembro ia ser fera!",1188948584240209920
2019-10-28 19:38:19,"as inscrições para amigos fotógrafos estão abertas, interessados chamar inbox ok",1188948136062050304
2019-10-28 19:37:57,Inscrições para concurso no interior terminam na segunda-feira; veja edital http://tribunadonorte.com.br/noticia/inscria-a-es-para-concurso-no-interior-terminam-na-segunda-feira-veja-edital/463221 …,1188948040771612672
2019-10-28 19:36:04,Terminam no dia 31/10 as inscrições para a Escola de Física Experimental da Universidade Federal do Rio de Janeiro (EFEx-4) Confira os detalhes em http://efex4.if.ufrj.br,1188947566878171136
2019-10-28 19:36:02,Inscrições para cursos técnicos voltados ao ensino médio vão até 8 de novembro https://maisempregodf.com.br/inscricoes-para-cursos-tecnicos-voltados-ao-ensino-medio-vao-ate-8-de-novembro/ …pic.twitter.com/hOoQfNj97A,1188947559001276416
2019-10-28 19:31:00,Inscrição Corporativa Porto Alegre A comunidade de tecnologia de Porto Alegre vai marcar forte presença no TDC. Você vai deixar a sua equipe de fora? Temos descontos que variam de acordo com a data de pagamento! Não perca tempo! Inscrições: https://www.thedevelopersconference.com.br/tdc/2019/portoalegre/empresas …pic.twitter.com/RVE075I60c,1188946292019318785
2019-10-28 19:30:41,"Boa noite! A CDL MANAUS está com inscrições abertas para o CURSO: ANÁLISE DE CRÉDITO, COBRANÇA E NEGOCIAÇÃO. Inscreva-se já no link! Link: https://goo.gl/oBRmnf Qualquer dúvida entre em contato com o número: 3627-2894 / (92) 99371-1740 ou via e-mail: utvcursos@cdlmanaus.org.brpic.twitter.com/m3NoivZ47T",1188946212709421057
2019-10-28 19:30:27,"INSCRIÇÕES ABERTAS! Programa Bolsa Atleta 2019 vai contemplar as categorias Estudantil, Atleta de Base, Nacional, Internacional e Olímpico/Paralímpico. As inscrições são online e ficarão disponíveis até às 23h59 do dia 4 de novembro. # FJERJ # TimeJudôRiohttps://judorio.org/ministerio-da-cidadania-abre-inscricoes-para-o-bolsa-atleta-2019/ …",1188946156438642690
2019-10-28 19:30:09,CORRIDA CREVISC EM MOVIMENTO- 23/11/219 REGULAMENTO COMPLETO E INSCRIÇÕES: https://www.ticketagora.com.br/e/CREVISC-EM-MOVIMENTO-29136?origem=assessocor …pic.twitter.com/G0Npkps2nu,1188946080366510082
2019-10-28 19:29:58,alguém sabe se já acabou todos os vestibulares ou ainda tem inscrições abertas?,1188946031926546433
2019-10-28 19:23:03,As inscrições do # EditalDeEconomiaCriativa tiveram seu prazo prorrogado e você ainda pode submeter seu projeto! Aproveite: …http://editaleconomiacriativa.ce.sebrae.com.br Dúvidas e Orientações: economiacriativa@ce.sebrae.com.brpic.twitter.com/vDTFJQJud4,1188944291957297153
2019-10-28 19:22:23,"Amanhã abre as inscrições para as soberanas da 15° feicassis. Não te acanha, todas vocês são lindas!!!!!",1188944122956206080
2019-10-28 19:19:16,"Se escrevam no canal. Quanto mais inscrições, mais vcs incentivam na criação de outros crack BR de # Supergirl e # Supercorp Assistamhttps://youtu.be/pbogJKlTkmw",1188943338591969280
2019-10-28 19:18:02,Marinha está com inscrições abertas para seleção; são 405 vagas no país e salário de R$ 9 mil https://setelagoas.com.br/noticias/concursos-e-vagas/57475-marinha-esta-com-inscricoes-abertas-para-selecao-sao-405-vagas-no-pais-e-salario-de-r-9-mil …pic.twitter.com/WRm99HDT38,1188943031854161922
2019-10-28 19:17:07,"Inscrições para o Programa Futuros Engenheiros podem ser feitas até dia 2/11. Podem participar estudantes a partir do 5º período, matriculados e frequentes, nos cursos de Engenharia e engenheiros com até 1 ano de formação. Saiba mais: http://bit.ly/2PqzRM5 pic.twitter.com/Qbrj8offQu",1188942800836018176
2019-10-28 19:13:12,"Inscrições abertas para turmas do Apis (Pré Vestibular Comunitário) no Colégio de A a Z. Unidades: Barra, Botafogo e Tijuca. Baita oportunidade pra quem quer fazer um preparatório forte e não possui condições de pagar. Se quiser mais informações só chamar na dm!!! pic.twitter.com/dE1Wfe9stc",1188941811789766659
2019-10-28 19:13:00,Inscrições abertas para concurso público do CRMV-AM # jornalismoemtempo http://mwl.press/AET176820 pic.twitter.com/wMqzyjbvIt,1188941764515848192
2019-10-28 19:11:49,Estão abertas as inscrições para o Vestibular de Verão da UniSecal! Saiba mais: https://bit.ly/31XFKCZ # vestiba # vestibular # vestibaUniSecal # quemcomparaescolheaunisecalpic.twitter.com/2roZ1A5DOf,1188941464853712898
2019-10-28 19:11:03,"De olho nas oportunidades de enriquecer seu currículo e aumentar suas chances no mercado de trabalho? Então aproveita, pois o Câmpus Goiânia do IFG está com inscrições abertas para 3 cursos de pós-graduação! Mais informações é só acessar http://bit.ly/2BSFjiN pic.twitter.com/oCDD9SS6Jz",1188941271093653504
2019-10-28 19:09:55,"Lucrar em cima do valor das inscrições e sair vazado. Então por favor, tenham cuidado!",1188940987806224384
2019-10-28 19:07:12,ABERTAS AS INSCRIÇÕES Inscrições para 38ª Encenação da Fundação da Vila de São Vicente começam nesta 4ª LEIA MAIS: https://n8qhg.app.goo.gl/zMdk pic.twitter.com/TYRNLnHZhk,1188940303601950726
2019-10-28 19:07:09,Termina terça-feira (29/10) inscrições de ideias inovadoras no Programa Centelha Amazonas https://ift.tt/2opgQi1 O site de Parintins! # Parintins # parintinsnoticias,1188940292751351809
2019-10-28 19:06:47,Inscrições para a Copa Futel de Vôlei de Praia começam hoje (28) https://www.alouberlandia.com/uberlandia/inscricoes-para-a-copa-futel-de-volei-de-praia-comecam-hoje-28/ …pic.twitter.com/dXWdcpN4E1,1188940199973314561
2019-10-28 19:06:26,Termina terça-feira (29/10) inscrições de ideias inovadoras no Programa Centelha Amazonas https://ift.tt/2opgQi1 # Parintins # ParintinsNotícias,1188940110886326272
2019-10-28 19:06:05,"Termina terça-feira (29/10) inscrições de ideias inovadoras no Programa Centelha Amazonas https://ift.tt/2opgQi1 O site de Parintins! # Parintins, # parintinsnoticias # noticiasdeparintins",1188940020972957698
2019-10-28 19:05:26,12/12. INSCRIÇÕES ENCERRADAS!,1188939859341262848
2019-10-28 19:04:11,Boa noite! A CDL MANAUS está com inscrições abertas para a PALESTRA: COMO ATINGIR A QUALIDADE EM VENDAS. Inscreva-se já no link! Link: https://goo.gl/oBRmnf Qualquer dúvida entre em contato com o número: 3627-2894 / (92) 99371-1740 ou via e-mail: utvcursos@cdlmanaus.org.brpic.twitter.com/NdDu4Zs0yy,1188939543673741312
2019-10-28 19:02:00,"Circuito de Corridas Virtual Solidária - Tio Barba 5 etapas: 5 km e 10 km Uma medalha para você, uma medalha para as crianças do projeto do Tio Barba Participe! Inscrições: http://bit.ly/agendadeprovas pic.twitter.com/pTxqYo4QwU",1188938994169593858
2019-10-28 19:01:43,"INSCRIÇÕES ABERTAS Destinado apenas para médicos peritos cadastrados nos tribunais, o Conselho Nacional de Justiça (CNJ) está com inscrições abertas para a segunda turma do Curso de Perícias Médicas, a ser… https://www.instagram.com/p/B4LYrx8prjw/?igshid=8h6qfvp8cc9i …",1188938923898101760
2019-10-28 19:01:06,Oi a comunidade tá aceitando inscrições???,1188938768432148483
2019-10-28 19:01:05,O Prof. Lenio Streck é um dos palestrantes do I Simpósio de Direito Público de Londrina e II Fórum da Advocacia Pública da OAB Londrina! Inscrições: https://www.sympla.com.br/i-simposio-de-direito-publico-de-londrina-e-ii-forum-da-advocacia-publica-da-oab-londrina__679795 …pic.twitter.com/jfel7XNjaa,1188938763474485248
2019-10-28 19:00:38,Convide um amigo para participar do curso de atualização sobre 'M&A de ativos digitais' e receba descontos de 10% para 2 inscrições e 15% para 3 ou mais inscrições. Acesse o link: https://capitalaberto.com.br/cursos/mea-de-ativos-digitais/ …pic.twitter.com/WjI4eWlyrj,1188938652312842240
2019-10-28 19:00:30,Inscrições: https://www.sympla.com.br/i-simposio-de-direito-publico-de-londrina-e-ii-forum-da-advocacia-publica-da-oab-londrina__679795 …pic.twitter.com/AY3paZUDHr,1188938615503671302
2019-10-28 19:00:00,"O Aprofundamento Radical existe para revolucionar a sua vida por meio de uma experiência com CRISTO. Garanta sua inscrição o quanto antes, pois as vagas são limitadas!⠀Informações e Inscrições: http://bit.ly/RVJ2020 # RVJ # RVJ2020 # AprofundamentoRadical # inscrição",1188938492224557056
2019-10-28 19:00:00,"Alô, guias de turismo de Campos do Jordão e região! No dia 5/11, às 9h30, acontece no Museu e Auditório um curso para guias que será ministrado pela gerente dos equipamentos, Marina Falsetti. Inscrições até 4/11, no telefone (12) 3662-6000 ou contato@museufelicialeirner.org.br pic.twitter.com/c8qmFZ5EOq",1188938491830378498
2019-10-28 18:55:40,"problemas que nós precisávamos resolver, então nos enrolamos um pouco nessa questão, MAS fizemos todas as inscrições pelo bem dos alunos, ignorando tudo que estava acontecendo. O que a gente precisava fazer era isso, porém foi criada uma comissão que iria se responsabilizar+",1188937401521053697
2019-10-28 18:54:14,"Devido aos comentários que estamos lendo a respeito do trabalho do Grêmio, nós resolvemos nos pronunciar. Na quarta-feira à noite nós fomos informados que teríamos que fazer as inscrições da Semana da Normalista, que começou na quinta-feira às 10:20h. No mesmo dia, houve alguns+",1188937040458665984
2019-10-28 18:52:34,1:10 pra abrirem as inscrições pra fomun e eu nem comitê escolhi ainda,1188936620172627973
2019-10-28 18:52:33,"COMUNICADO SOBRE A SEMANA DA NORMALISTA: O diretor geral abriu mais uma palestra sobre Direitos Humanos na quinta-feira (ainda não há horário definido) no auditório, portanto, serão mais 150 vagas. As inscrições começam amanhã às 8:00h e vão até as vagas acabarem!",1188936618557792262
2019-10-28 18:51:58,Encerradas as inscrições para figuração nos desfiles do ‘Natal Iluminado’ de Maricá https://leisecamarica.com.br/encerradas-as-inscricoes-para-figuracao-nos-desfiles-do-natal-iluminado-de-marica/ …,1188936470347862019
2019-10-28 18:50:55,"O enfoque é o sistema atual de solicitação e emissão do visto, as providências e recomendações aos interessados no visto. Participe e tire suas dúvidas sobre o assunto. Inscrições gratuitas nos emails amadeulisboa1@hotmail.com com cópia gerencia@taguaturturismo.com.br",1188936205871865856
2019-10-28 18:50:07,Vem aí a 6ª edição do Startup Weekend! As inscrições estão abertas! Confira mais detalhes e participe! https://www.inatel.br/imprensa/noticias/empreendedorismo/3372-6-edicao-do-startup-weekend-sera-realizada-em-novembro-no-inatel …,1188936003295367170
2019-10-28 18:50:05,"Nós não podemos esquecer que também tem responsabilidade o estudante que não foi procurar saber das inscrições e agora que as vagas acabaram, estão reclamando que não conseguiram se inscrever.",1188935997364559873
2019-10-28 18:50:01,"Venha fazer parte do Pavilhão Brasil na Expomin 2020. As inscrições estão abertas até 04 de novembro. A feira para a indústria de mineração acontece entre os dias 20 e 24 de abril, em Santiago, no Chile. Inscreva-se no link: https://mla.bs/7c18ecf3 # expominpic.twitter.com/H6Gqba0BQB",1188935978225995776
2019-10-28 18:49:26,"VOCÊS SABIAM QUE FALTAM 2 DIAS PRA FECHAREM AS INSCRIÇÕES PRA COORDENADORES DA SEMID? então vai se inscrever! vou deixar o link do edital aqui, ta bem? tá bem! https://drive.google.com/file/d/1GOkHKJ71PgPbK6tiRPDi4BKfoY-reBIj/view …",1188935830901010433
2019-10-28 18:49:22,INSCRIÇÕES ABERTAS PARA PROCESSO SELETIVO DO TJMS https://midianewscampogrande.com.br/2019/10/28/inscricoes-abertas-para-processo-seletivo-do-tjms/ …,1188935817198219264
2019-10-28 18:49:06,"aaaaaa vocês são perfeitos obrigada por isso! pode esperar viu, estou so aguardando aqui abrirem as inscrições pra diretora aaaaaa",1188935750026440704
2019-10-28 18:47:19,Inscrições abertas para o confronto final do Paranaense de Velocross http://mancini.esp.br/inscricoes-abertas-para-o-confronto-final-do-paranaense-de-velocross/ …pic.twitter.com/Ac3tTkkV3V,1188935298417332224
2019-10-28 18:45:35,Vamos abrir inscrições,1188934862696259586
2019-10-28 18:44:39,Santo André ESGOTOU! Inscrições disponíveis para Sao Bernardo do Campo: https://www.eventbrite.com.br/e/familias-apostolicas-sao-bernardo-do-campo-sp-tickets-71720003461 …https://www.eventbrite.com.br/e/familias-apostolicas-sao-bernardo-do-campo-sp-tickets-71720003461 …,1188934630004662272
2019-10-28 18:44:38,"As inscrições para testar, de graça, o protetor solar Anthelios Hydraox de La Roche-Posay ainda estão abertas! Acessem o LINK A SEGUIR e tenham a chance de experimentar esse lançamento incrível. http://bit.ly/33Dcvqt # AntheliosHydrAOX # TheInsidersBrasilpic.twitter.com/VqL9j5gG7V",1188934624157863937
2019-10-28 18:43:01,"O consultor, mentor coach e palestrante Douglas Castro estará dia 7/11 no Sebrae com a palestra Espiritualidade no Trabalho! Participe, as vagas são limitadas! Investimento: R$ 50,00 Inscrições na Loja Virtual http://www.vendas.ap.sebrae.com.br pic.twitter.com/KHbiAT9xkM",1188934216882491393
2019-10-28 18:41:16,"Atenção A UNDB está promovendo a segunda Pós-Graduação em Lean, Gestão e Inovação em São Luís. Temas que serão abordados: Origem do Lean; Metodologia Lego Serious Play Inovação, entre outros temas. Informações e Inscrições: https://www.undb.edu.br/pos/producao-lean-manufacturing …pic.twitter.com/S6dgaYwilP",1188933777868898306
2019-10-28 18:37:52,"Concurso PM BA 2019 - Vagas, Inscrições - https://www.concursosatuais.com/2019/10/25/concurso-pm-ba-2019-vagas-inscricoes/ …",1188932923573129222
2019-10-28 18:35:08,CONCURSO DA UEMS: INSCRIÇÕES SÃO PRORROGADAS ATÉ DIA 08 DE NOVEMBRO https://midianewscampogrande.com.br/2019/10/28/concurso-da-uems-inscricoes-sao-prorrogadas-ate-dia-08-de-novembro/ …pic.twitter.com/GwRle1ThxB,1188932231768825857
2019-10-28 18:33:14,"ATENÇÃO!! A Fiocruz PI realizará o I Fórum de Saúde da População LGBTQI+ que ocorrerá dia 06/11, no auditório do Ministério da Saúde, Teresina-PI. Inscrições gratuitas! Divulguem e participem! Link para inscrição e mais informações: https://www.even3.com.br/iforumdesaudelgbtqreexistencialutaecidadaniamoniquesantos/ …pic.twitter.com/0rOw1k7uWD",1188931756298293254
