date,text,id
2019-10-20 16:50:26,"Intento de Golpe en Perú por parte de la ex Vicepresidenta en mi opinión, le duró sólo 24 horas el intento. Perú retoma su sendero constitucional. Y creo que intento de desestabilización en Ecuador, con dificultad las fuerzas democráticas tratan de avanzar, espero triunfen.",1186006784215076864
2019-10-20 16:49:44,@ sebastianpinera señor presidente y ahora que ??? Como termina esto y se retoma la cordura de la ciudadanía???,1186006605462147072
2019-10-20 16:32:49,# Bolivia | @ SDoriaMedina: 'Hoy se decide si se retoma la democracia o el camino hacia Venezuela' https://www.eldia.com.bo/index.php?c=Portada&articulo=Samuel:--Hoy-se-decide-si-se-retoma-la-democracia-o-el-camino-hacia-Venezuela-&cat=1&pla=3&id_articulo=289855 …,1186002347614494720
2019-10-20 16:32:49,Equador retoma exportações de petróleo que foram suspensas por protestos https://wp.me/p7K2Bq-fi5S,1186002347606138880
2019-10-20 16:18:42,"Polvo, opera prima del ahora director José María Yaspik, bien lograda, entretenida y retoma temas como la pérdida de la inocencia y como telón de fondo cuál tema creen: el narcotráfico. https://www.instagram.com/p/B32fn-hgtzu/?igshid=1x8rdejc0ai6l …",1185998794896367616
2019-10-20 16:15:51,"El # JuvNegro retoma la senda de la victoria con un 3-1 ante @ chv1995. Partido en el que nos tocó sufrir por nuestros propios errores, pero sumamos 3 importantes puntos. # VamosVPM",1185998080182800384
2019-10-20 16:12:20,cerra el orto la reputisima madre que te parió wacho no esta bien que esten lasminado a la gente de esa manera ya estan protestando o no y el señor nisiquiera eso estaba haciendo deja de ser tan pendejo y retoma tu cuenta,1185997193301385216
2019-10-20 16:08:44,Regina Casé retoma seu lado atriz em filme e como estrela de novela das 9 https://www1.folha.uol.com.br/ilustrissima/2019/10/regina-case-retoma-seu-lado-atriz-em-filme-e-como-estrela-de-novela-das-9.shtml?utm_source=twitter&utm_medium=social&utm_campaign=comptw …,1185996288858513408
2019-10-20 16:05:01,Vikings retoma la ventaja anotando Touchdown. La defensa de @ lions está para llorar. # OnePride # NFL100,1185995352798707712
2019-10-20 16:04:22,# Mundo Sanders retoma campaña electoral en EU tras infarto https://bit.ly/2MvRCYp pic.twitter.com/DNc6SQWE4u,1185995188155510784
2019-10-20 15:54:29,Regina Casé retoma seu lado atriz em filme e como estrela de novela das 9 https://www1.folha.uol.com.br/ilustrissima/2019/10/regina-case-retoma-seu-lado-atriz-em-filme-e-como-estrela-de-novela-das-9.shtml?utm_source=twitter&utm_medium=social&utm_campaign=comptw …,1185992701835120646
2019-10-20 15:45:21,"Sanders retoma campaña electoral en EU tras infarto El senador y precandidato a la presidencia de EU celebra un mitin en Nueva York arropado por la congresista Alexandra Ocasio-Cortez, su primer acto de campaña desde que sufrió un infarto el 1 de octubre http://www.acento21.com.mx/sanders-retoma-de-campa-a-electoral-en-eu-tras-infarto.html …pic.twitter.com/mbXXoCvxjS",1185990402408669184
2019-10-20 15:38:46,Elite: EHC retoma el camino de la victoria http://www.espanyahc.com/pagina/noticias/item/364-elite-ehc-retoma-el-camino-de-la-victoria …,1185988747646717952
2019-10-20 15:36:41,da vontade de sacudir pelo braço p ver se retoma o juízo,1185988224226861056
2019-10-20 15:36:16,La org IDEA impulsa y patrocina la retoma del ne liberalismo en el Cte.Pastrana y exptes algunos presos,1185988117469323265
2019-10-20 15:34:50,Celtic goleia Ross County e retoma liderança do Campeonato Escocês - https://www.torcedores.com/noticias/2019/10/celtic-goleia-ross-county-e-retoma-lideranca-do-campeonato-escoces …pic.twitter.com/rk9MWOyZmW,1185987758730428416
2019-10-20 15:26:23,"Vc já assistiu a O Ornitólogo? É um filme português que retoma esse mito de São Sebastião, mas sob um enfoque mais atual. Vale a pena conferir",1185985628732903424
2019-10-20 15:23:31,Petroecuador retoma a las exportaciones de crudo tras protestas https://reut.rs/2qv2a1C pic.twitter.com/KF5FmxyIqZ,1185984910391218177
2019-10-20 15:20:55,Estatal Petroecuador dice retoma exportaciones de crudo tras protestas https://reut.rs/2qv2a1C pic.twitter.com/eKpl2fYhDo,1185984256524333058
2019-10-20 15:12:01,"Que grande el colo, el otro día publicaron que salió bien del tratamiento y ya retoma las giras ¿Te gusta el metal Dana?",1185982014085894144
2019-10-20 15:10:49,Estatal Petroecuador dice retoma exportaciones de crudo tras protestas https://reut.rs/2MvvkpI pic.twitter.com/u98WBmczHO,1185981711110299648
2019-10-20 15:08:49,"TOUCHDOOOOWN GREEN BAY!!! Se retoma la ventaja, tras un pase de anotación de @ AaronRodgers12 a @ jswaggdaddy. Ambos de los RBs de Green Bay ya tienen recepción de TD el día de hoy. OAK 10-14 GB # OAKvsGB # GoPackGo",1185981208498442242
2019-10-20 15:03:32,"Los múltiples desenlaces del Continuum Shift de BalzBlue dejan con sensaciones mixtas. En un final de la historia de Arakune, prácticamente retoma control de sí mismo y se acerca a escapar de la visión de Takamagahara, pero en el final verdadero sigue",1185979878186934273
2019-10-20 15:01:12,"SE RETOMA EL CASAMIENTO: Dice que come poco, así que con unos paquetes de galletas de arroz lo solucionamos. https://twitter.com/cabragnr/status/1185977623278706688 …",1185979291890311168
2019-10-20 14:47:43,"CINISMO EL DE TRUMP LOS ABANDONA Y AHORA LOS RETOMA PROVOCA UNA TRAGEDIA PARA EL PUEBLO KURDO ASESINAN EL PUEBLO HUMILDE Y LE DIO POR VOLVER A LO SUYO, LA GUERRA POBRE MAGNATE LO ÚNICO QUE TIENE ES DINERO https://twitter.com/almayadeen_es/status/1185699769341169665 …",1185975901428895744
2019-10-20 14:35:12,"Final Four Nacional U23, Chimaltenango 2019 Guatemala retoma el cetro de campeones de la Liga Nacional U23 en el 2019 de la mano de su entrenadora Susy Sanchez quien hizo un gran trabajo. Felicidades al Club Force de Guatemala!!! Guatemala campeón!!! pic.twitter.com/BGumn1vYOb",1185972751078756354
2019-10-20 14:28:22,"O ano do Fla nem terminou e vcs já estão julgando? Em Dezembro a gente retoma essa conversa. 2011 já passou, 2019 não! Aquele Santos pode ser superado, ou não? Eu hein!",1185971031900639233
2019-10-20 14:23:22,Regina Casé retoma seu lado atriz em filme e como estrela de novela das 9 https://www1.folha.uol.com.br/ilustrissima/2019/10/regina-case-retoma-seu-lado-atriz-em-filme-e-como-estrela-de-novela-das-9.shtml?utm_source=twitter&utm_medium=social&utm_campaign=comptw …,1185969772967673856
2019-10-20 14:15:39,Pedro Sánchez retoma este lunes la precampaña con el acto en Alcázar de San Juan http://manchainformacion.com/noticias/85231-Pedro-Snchez-retoma-este-lunes-la-precampaa-con-el-acto-en-Alczar-de-San-Juan …,1185967828840714240
2019-10-20 14:13:47,Sanders retoma de campaña electoral tras infarto https://www.elarsenal.net/2019/10/20/sanders-retoma-de-campana-electoral-tras-infarto/ …pic.twitter.com/QqCh39jqXi,1185967359355506690
2019-10-20 13:58:58,"Discordo miga, pq isso retoma a um discurso conservador. É uma pena q o corpo seja visto só na zona sexual, acho q a gente tem q naturalizar o corpo sim, até hj nudez é tabu. Tb acho q tudo pode ser material de punhetagem no final das contas",1185963629637701635
2019-10-20 13:58:42,# Mundo Sanders retoma de campaña electoral en EU tras infarto Más información-. https://rio19.mx/2019/10/20/sanders-retoma-de-campana-electoral-en-eu-tras-infarto/ …pic.twitter.com/Hs5aAb2vNh,1185963562260406273
2019-10-20 13:57:04,Vecchi retoma el tercer lugar tras adelantar a Cosío # NASCARPue,1185963151138807808
2019-10-20 13:51:49,# Mundo Sanders retoma de campaña electoral en EU tras infarto Más información: https://muropolitico.mx/2019/10/20/sanders-retoma-de-campana-electoral-en-eu-tras-infarto/ …pic.twitter.com/3fmBWg81vT,1185961831518625792
2019-10-20 13:40:45,"Gabriel soy fan tuyo, tienes ideas que no van con las mías pero eres un tipo que no se calla y dice lo que piensa, hasta ahí todo correcto. Un consejo te puedo dar, consejo de un simple ciudadano... callate un par de días reseateate, actualiza tu software y retoma tus ideas. Sort",1185959047670972418
2019-10-20 13:26:00,"A concordância deve ser feita com o termo cujo pronome relativo retoma. Geralmente é sempre o sujeito da oração, que nem sempre é uma pessoa, a propósito.",1185955336747921408
2019-10-20 13:25:13,El presidente @ sanchezcastejon retoma mañana lunes su agenda de precampaña con un mitin en Alcázar de San Juan (Ciudad Real). # 10N,1185955139938668546
2019-10-20 13:20:00,Regina Casé retoma seu lado atriz em filme e como estrela de novela das 9; artista comenta guinada na carreira e missão de erguer pontes entre o Brasil pobre e os 'lugares chiquérrimos' ( @ ilustrissima)https://www1.folha.uol.com.br/ilustrissima/2019/10/regina-case-retoma-seu-lado-atriz-em-filme-e-como-estrela-de-novela-das-9.shtml?utm_source=twitter&utm_medium=social&utm_campaign=twfolha …,1185953823895904256
2019-10-20 13:16:19,Los Rios vuelven a correr. La vida retoma su curso. La fantasía de este sistema se cae. El ser recuerda su origen. SOMOS UNO https://twitter.com/Sepulinares/status/1185920771035717632 …,1185952898771017728
2019-10-20 13:07:15,Sanders retoma de campaña electoral en EU tras infarto https://expresion-sonora.com/sanders-retoma-de-campana-electoral-en-eu-tras-infarto/ …,1185950614595002373
2019-10-20 13:06:24,Sanders retoma de campaña electoral en EU tras infarto - https://www.ensenadaonline.net/?p=89487,1185950402585473026
2019-10-20 13:03:49,¡BARÇA RETOMA EL LIDERATO! El Real Madrid cedió la primera posición de # LaLiga a su máximo rival https://www.marca.com/claro-mx/futbol-internacional/la-liga/2019/10/20/5dac6b0922601dc03a8b45c8.html …pic.twitter.com/4mbynETjXk,1185949751260274688
2019-10-20 13:02:51,Pedro Sánchez retoma mañana la precampaña con un acto en Alcázar de San Juan (Ciudad Real) http://bit.ly/32xxRFE # noticias,1185949507239976960
2019-10-20 12:59:38,Es decente que la gente viaje 4 horas para llegar a la pega y 4 horas para volver ? Porque no se hacen las cosas bien y se evalúan viajes mañana y se retoma el martes para que la gente no tenga que caminar horas ??,1185948697684828166
2019-10-20 12:51:00,. @ designweekmex retoma un espacio abandonado el cual es transformado por talentosos diseñadores # ElNuevoMéxico por # ADNOpinión @ adn40pic.twitter.com/yySRedbP4U,1185946526130036737
2019-10-20 12:49:10,Sanepar retoma rodízio de água em Cascavel neste domingo (20); confira os bairros atingidos https://noticias.conexaocorbelia.com/noticia/153315/sanepar-retoma-rodizio-de-agua-em-cascavel-neste-domingo-20-confira-os-bairros-atingidos/ …pic.twitter.com/FcNF459vVF,1185946064484032513
2019-10-20 12:39:01,"Aprovecha tu fin de semana y retoma tu proyecto de remodelación con descuentos especiales al pagar con Tarjetas de Crédito HSBC. Consulta requisitos, términos y condiciones de la promoción directamente en el comercio o en http://grp.hsbc/60181GqpM pic.twitter.com/LTAqdxjYWL",1185943510882672641
2019-10-20 12:36:28,". @ BernieSanders, superado el problema de salud, retoma su candidatura presidencial con una numerosa manifestación en Nueva York y el respaldo de la influyente representante Alexandria Ocasio Cortez @ aocpic.twitter.com/KTXuacYq6T",1185942867795152897
2019-10-20 12:24:07,Regina Casé retoma seu lado atriz em filme e como estrela de novela das 9 em # AmorDeMãe https://www1.folha.uol.com.br/ilustrissima/2019/10/regina-case-retoma-seu-lado-atriz-em-filme-e-como-estrela-de-novela-das-9.shtml …pic.twitter.com/2DLyAeOQI3,1185939760692498436
2019-10-20 12:20:50,"Retoma el rumbo y pon a cada uno en su lugar. Un último apunte. Errejón es más PSOE. Lo sabemos, si lo dices no pasa nada, quedarías como un señor.",1185938937195319296
2019-10-20 12:12:48,Pedro Sánchez retoma este lunes la precampaña con un acto en Alcázar de San Juan https://www.lasnoticiasdelamancha.com/2019/10/20/pedro-sanchez-retoma-este-lunes-la-precampana-con-un-acto-en-alcazar-de-san-juan/ …,1185936915616423937
2019-10-20 12:11:52,"Sad. Tranquilo. Retoma los estudios. Cuándo los acabes, busca trabajo. Intenta mantenerlo, y a lo mejor antes de los 35 te has ido de casa de tus padres. Madrugar te hará ver la vida de otra forma.",1185936680710299650
2019-10-20 12:06:41,"Barcelona, España.-“¿Por qué irse? Todo va bien por aquí y además hace buen tiempo"". Al día siguiente de las escenas de violencia en el centro de Barcelona, la calle retoma este sábado su actividad con los turistas dispuestos a quedarse. Sentado https://elquisqueyano.com.do/turistas-y-extranjeros-deciden-quedarse-en-barcelona-a-pesar-de-las-violentas-protestas/ …pic.twitter.com/1ZgXmFkqBD",1185935375338004481
2019-10-20 12:00:08,SKY retoma voos diretos entre Florianópolis e Santiago https://goo.gl/fb/AfWa5i # aviaçãocomercial # brasil # mundo,1185933725353168897
2019-10-20 11:55:01,"En el año 1986 aparece Clip creado por Ñañon Jurado quien con temas propios retoma la nueva generación d grupos compositores, luego vienen ,Contravia , Barro, Tranzas ,Right, 3er mundo",1185932439203520512
2019-10-20 11:47:16,Prefeitura de Goiânia retoma projeto para lançamento de 223 livros. Iniciativa vai movimentar mercado literário. https://aredacao.com.br/cultura/125355/prefeitura-de-goiania-retoma-projeto-para-lancamento-de-223-livros …pic.twitter.com/2OvSgpVhyw,1185930489913327620
2019-10-20 11:40:05,. @ sanchezcastejon retoma este lunes la precampaña con un acto en Alcázar de San Juan ( # CiudadReal) @ GarciaPage @ DiputacionCR @ carmencalvo_http://dlvr.it/RGZv9g,1185928678510739456
2019-10-20 11:35:06,"El # INDH2019 retoma la discusión sobre el papel de del Estado y las instituciones para que sean verdaderos facilitadores del desarrollo. Los esperamos esta semana: Santiago, 22/oct Penonomé, 23/oct Centro Regional Universitario 6:00pm http://ow.ly/5hiC50wO8Tq",1185927426033045506
2019-10-20 11:27:23,"Una vaki para este par, por favor. Se atreve a hablar de transparencia, retoma el lugar común que da votos ""Venezuela"". https://twitter.com/ClaudiaLopez/status/1185912472370323457 …",1185925485756325888
2019-10-20 11:20:42,. @ sanchezcastejon retoma este lunes la precampaña con un acto en Alcázar de San Juan ( # CiudadReal) @ GarciaPage @ carmencalvo_ @ DiputacionCRhttp://www.lacerca.com/noticias/ciudad_real/sanchez-retoma-lunes-precampana-acto-alcazar-san-juan-484396-1.html …,1185923802410164229
2019-10-20 11:18:17,Sanepar retoma rodízio de água em Cascavel neste domingo (20); confira os bairros atingidos https://glo.bo/2Byj15H,1185923195733446657
2019-10-20 11:18:06,Sanepar retoma rodízio de água em Cascavel neste domingo (20); confira os bairros atingidos https://glo.bo/2Byj15H,1185923148321116165
2019-10-20 11:18:04,Sanepar retoma rodízio de água em Cascavel neste domingo (20); confira os bairros atingidos https://glo.bo/2Byj15H,1185923140662239234
2019-10-20 11:16:06,"Maduro pone el dinero, pero el cerebro es el Grupo de Puebla que es la version 2.0 del foro de Sao Paulo y es el esfuerzo final para resistir a la caida de los regimenes de izquierda por lo desastroso de su desempeño y convertir este momento en la retoma de la izquierda https://twitter.com/nydiaruiz/status/1185599692987686912 …",1185922645331763200
2019-10-20 11:14:03,"¡EN VÍDEO! ¡La Real Sociedad retoma la senda de las victorias a costa de un Betis que cae en puestos de descenso! ¡El resumen, aquí! https://eldesmarque.com/actualidad/futbol/primera-laliga-santander/video-resumenes-primera/1349824-real-sociedad-real-betis-resumen-en-video-jornada-9 …",1185922128845197312
2019-10-20 11:13:39,El Trencito Azul retoma sus entrenamientos en el complejo deportivo de la Armenia. # TodosPorCatólica # Chatoleí # UCpic.twitter.com/QK6DqcIWaP,1185922029884755969
2019-10-20 11:12:45,"""meryl streep não chega aos pés de regina casé"" - Regina Casé retoma seu lado atriz em filme e como estrela de novela das 9 https://www1.folha.uol.com.br/ilustrissima/2019/10/regina-case-retoma-seu-lado-atriz-em-filme-e-como-estrela-de-novela-das-9.shtml?utm_source=twitter&utm_medium=social&utm_campaign=comptw …",1185921800636645376
2019-10-20 11:11:29,La Real retoma el camino victorioso ante el Betis (3-1) https://www.naiz.eus/eu/actualidad/noticia/20191020/la-real-retoma-el-camino-victorioso-ante-el-betis-3-1 … Crónica de @ GARA_jiturriapic.twitter.com/KGrDXSxMD0,1185921482532282371
2019-10-20 11:10:11,Casado retoma posiciones tras los altercados de los CDR https://www.economiadigital.es/politica-y-sociedad/casado-retoma-posiciones-tras-los-altercados-en-cataluna_20003195_102.html …,1185921156295090177
2019-10-20 11:10:03,Em tempos de fakenews eu me questionodobre a veracidade dos fatos. @ costa_rui Isso pode acontecer? Casos de câncer podem aumentar na Bahia; Governo Federal retoma projetos da Indústria Nuclear https://salvadornoticia.com/2019/10/20/casos-de-cancer-podem-aumentar-no-interior-da-bahia-governo-federal-retoma-projetos-da-industria-nuclear/ …,1185921121184604161
2019-10-20 10:55:42,González: Si se retoma el diálogo Maduro debe reconocer la crisis del país https://talcualdigital.com/index.php/2019/10/02/gonzalez-si-se-retoma-el-dialogo-maduro-debe-reconocer-la-crisis-del-pais/ …,1185917509620383745
2019-10-20 10:55:05,— Bahhhh acho q retoma uma amizade https://curiouscat.me/safiraperera/post/1006186647?t=1571579705 …,1185917356335357953
2019-10-20 10:55:04,Pedro Sánchez retoma mañana la precampaña con un acto en Alcázar de San Juan (Ciudad # Real) http://tinyurl.com/y5psrte5 pic.twitter.com/gAGxiOk1hj,1185917352640159750
2019-10-20 10:46:19,"Largo da Saudade, Várzea da Roça Bahia. Foto: Paulo Henrique Minha cidade é muito bonita, os tons da natureza deixa o colorido por toda cidade. Ainda bem que o Município retoma o plantio de árvores. Arborização é… https://www.instagram.com/p/B315oH8ge1d/?igshid=14ey77xr09krr …",1185915147329495042
2019-10-20 10:24:25,Cómo se retoma la vida,1185909637821931521
2019-10-20 10:21:24,@ louisdegrange Quisiera saber cuando se retoma el servicio del @ metrodesantiago porque a mí me preocupa que las Líneas # L4 y # L4A podrían a llevar meses sin funcionar Necesitamos auxilio para poder reconstruirlas para que funcione Lo vi en # MesaCentral de @ canal13,1185908877105213440
2019-10-20 10:20:47,"Enhorabuena a Ricardo Tosca, gerente del hosp general de Castelló, y compañero de curso, y a nuestro colega nefrologo Ramón Pons. Se retoma la tradición de nefrólogos gestores. Os deseamos lo mejor para una óptima gestión del sistema público @ SVNefro @ GVAclinic @ GVAdepsalutcshttps://twitter.com/SVNefro/status/1185885601339498496 …",1185908724893933569
2019-10-20 10:15:26,"Daí vem o vice, o general aquele, e retoma o projeto. Tinha que implodir a chapa toda.",1185907377893232640
2019-10-20 10:12:45,"Todo lo mejor para el Mérida, a ver si poco a poco retoma el vuelo. Que buenos recuerdos de aquel Mérida de 2ª y 1ª.Buena gente sin duda. Que me perdonen los filiales, pero prefiero a equipos como el Mérida arriba, y los filiales abajo, que al final solo adulteran la competición.",1185906703071662081
2019-10-20 09:59:04,"!Aquí vamos! Nuestro compromiso con la # comunidad en estos días de despertares comienza a tomar forma. # IdentidadesFestival2019 informa que desde hoy retoma su programación cultural en una nueva locación: el Campamento Luz Divina, en La Chimba, en Antofagasta. pic.twitter.com/64mAWLCD4e",1185903257236979712
2019-10-20 09:58:22,"Lula antecipa que, livre, retoma as caravanas da cidadania pelo país. Com ou sem tornozeleira eletrônica?",1185903082787495936
2019-10-20 09:58:02,Y como se retoma la agenda?,1185902997819351040
2019-10-20 09:53:25,"@ revistaproceso retoma entrevista de @ ErnestoRodrigA para @ Knack: "" @ realDonaldTrump nunca ganará la batalla contra nosotros. Somos más fuertes que él"": Archivaldo Guzmán. Hijo del # ChapoGuzman dice que políticos mexicanos son la mafia más legítima, tienen el verdadero poder.pic.twitter.com/uv3lOT1Thx",1185901836571742208
2019-10-20 09:49:01,Otero retoma la tradicional ‘Fiesta del Ramo de la Vendimia’ entre música y vinos del Bierzo https://www.infobierzo.com/otero-retoma-la-tradicional-fiesta-del-ramo-de-la-vendimia-entre-musica-y-vinos-del-bierzo/507215/ …,1185900730537906177
2019-10-20 09:38:28,"Se retoma la ""opción por los pobres"" desde la perspectiva de la sustentabilidad de la Casa Común. El compromiso evangélico por el ambiente, el respeto a los pueblos originarios y la justicia https://twitter.com/EnREDandoUy/status/1185888303318536192 …",1185898074369155072
2019-10-20 09:37:24,"VENOM #4 A Guerra do Vietnã já foi cenário de diversas grandes histórias no cinema e nos quadrinhos, e nessa quarta edição de Venom, Cates retoma o histórico conflito para abordar o passado de Rex Strickland e seu… https://www.instagram.com/p/B31xvhkhwXY/?igshid=67ay33uwletc …",1185897803849048064
2019-10-20 09:31:53,"Segunda Juvenil - @ RFFM_oficial @ CDCanillas""D"" @ CDSpartacM: El Canillas retoma su rumbo con una remontada. # VamosCanillas # CreoEnTi # CanillasContraCancer # FútbolBaseMadrid # futbolbase # vamosspartac Crónica y Estadísticas en: http://driwler.com pic.twitter.com/yDRMJh158s",1185896417442848768
2019-10-20 09:28:30,Uma política que dom Pedro II implementou tão bem no séc XIX e que foi esquecida pelos republicanos. Agora nosso presidente Jair Bolsonaro retoma!,1185895567496536064
2019-10-20 09:28:12,LEITURA DE DOMINGO Esquerda retoma o DCE da UnB https://chicosantanna.wordpress.com/2019/10/19/esquerda-retoma-o-dce-da-unb/ … via @ ChicoSantAnna,1185895492024184833
2019-10-20 09:27:37,Transantiago retoma con lentitud su operación en la capital https://www.mega.cl/noticias/nacional/279676-transantiago-servicios-buses-domingo-estado-de-emergencia.html …,1185895344644743168
2019-10-20 09:25:29,@ ReginaCase retoma seu lado atriz em filme e como estrela de novela das 9 https://www1.folha.uol.com.br/ilustrissima/2019/10/regina-case-retoma-seu-lado-atriz-em-filme-e-como-estrela-de-novela-das-9.shtml …,1185894807413182465
2019-10-20 08:48:58,"# ChileDespierta Esto sucedió por la soberbia, irresponsabilidad y mal manejo político del Gobierno y sus tecnócratas alejados de la vida real del chileno medio, si no sacan los militares y retoma el manejo político esto terminará muy mal. https://twitter.com/LuciaDammert/status/1185883589013102593 …",1185885617772814336
2019-10-20 08:46:57,El frente sigue hablando de lo que hacen o dicen sus adversarios. Su único plan es aumentar impuestos y poner nuevos tributos sanguinarios. Retoma te lo debo. http://www.lanacion.com.ar/2298836 via @ LANACION,1185885111545421824
2019-10-20 08:38:08,Salvini retoma su época de payaso defendiendo el secesionismo catalán. No es de fiar. El único aliado fuerte de la derecha española es Fratelli y su firme lideresa Georgia Melloni,1185882889214484480
2019-10-20 08:18:48,"08h17| # VLTInforma: Via liberada, linha 1 retoma circulação completa entre Praia Formosa e Santos Dumont.",1185878026258657282
2019-10-20 07:49:10,Estoy siguiendo por medios chilenos. La TV argentina retoma esos medios en general. TN tiene móvil propio en Sgo pero no están clarificando nada. Busco también medios alternativos como @ radioplaceres . @ biobio tiene un buen sistema de corresponsales ciudadanos que narran todo.,1185870568727425025
2019-10-20 07:46:02,"Tan sólo sé que soplan vientos Bolivarianos en América. Bolívar retoma su lucha, retoma su espada, retoma su corcel y con su arenga patriota esta generando nuevamente que su pueblo se haga eco, se haga lucha, se haga combate, y grite a los 4 vientos que queremos ser libres. https://twitter.com/profechely/status/1185538758789287936 …",1185869778906439681
2019-10-20 07:22:41,"En 2011 se creó este Consorcio para dinamizar el # Guadalquivir. Ninguna actividad desde entonces.Ahora,el nuevo gobierno no lo retoma,sino que decide liquidarlo.Tampoco éstos tienen la más mínima intención de potenciar el eje vertebrador de # Andalucíahttps://sevilla.abc.es/andalucia/sevi-nace-consorcio-guadalquivir-para-201105170000_noticia.html …",1185863905131859968
2019-10-20 07:10:06,CPI das Fake News retoma trabalho https://www.oantagonista.com/?p=266284,1185860738092556288
2019-10-20 06:19:11,"Atención: Ex líder de las FARC, Iván Márquez retoma las armas y crea una nueva guerrilla en Colombia https://www.clarin.com/mundo/ex-lider-farc-ivan-marquez-retoma-armas-crea-nueva-guerrilla-colombia_0_62zDF5dXX.html …",1185847924162547712
2019-10-20 05:41:05,El Frente retoma la iniciativa en Uruguay - http://tinyurl.com/y6osu8en pic.twitter.com/rtI0yhBsZu,1185838335421493249
2019-10-20 05:31:01,"Respetuosamente no estoy de acuerdo con parte de tu apreciación. Ya que si no ganamos,y el kirchnerismo retoma el poder ahí sí que sería el principio del fin de la república dando la bienvenida a la impunidad y el saqueo; con la complicidad de la corte suprema,Jueces,periodismo. https://twitter.com/PeroniaRepublic/status/1185759658637701120 …",1185835802464542720
2019-10-20 05:15:18,El Frente retoma la iniciativa en Uruguay: La alianza oficialista moviliza las bases y se relanza una... https://www.radiodogo.com/mundo/827658/,1185831846967480320
2019-10-20 04:58:12,"Si me fijo bien, no veo algo que gira, veo un cubo pequeño que va de derecha a izquierda y al final se hace grande y sus aristas pasan hacia atrás mientras un cubo pequeño nace y retoma el ciclo.",1185827542919450624
2019-10-20 04:37:46,# Otero retoma la tradicional ‘Fiesta del Ramo de la # Vendimia’ entre música y vinos del # Bierzo @ aytotoralvados @ CuatroPasos @ bodegaluz @ DOBierzohttps://www.infobierzo.com/otero-retoma-la-tradicional-fiesta-del-ramo-de-la-vendimia-entre-musica-y-vinos-del-bierzo/507215/ …,1185822401180946434
