date,text,id
2019-10-28 12:51:52,En # RadioActiva Damián Hueycha Dir de Juventud de @ TWMunicipalidad quien invita a la comunidad a sumarse a las clases de apoyo gratuitas que se brindan desde el área. @ ElChubutpic.twitter.com/pdzUMgtvge,1188845849096413186
2019-10-28 12:51:39,"Vem aí o primeiro evento exclusivo sobre decisões da Suprema Corte americana, em Brasília. I Colóquio “A Suprema Corte dos EUA: o que podemos aprender a partir de suas decisões”. Inscrições abertas e gratuitas no site do IDP. pic.twitter.com/BJ7PhJQva2",1188845795031863296
2019-10-28 12:48:02,REGIONALES En el marco del mes de la lucha contra el cáncer de mamas hemos atendido a 378 mujeres con ecografías mamarias gratuitas y charlas preventivas sobre el auto examen mamario... Estamos desplegados brindando atención a las mujeres de la Patria..! # Mamas # Eco,1188844882791747585
2019-10-28 12:47:41,"En el mes de la lucha contra el Cáncer de Mama, recordamos a la comunidad que el Municipio y Clínica Centro ofrecen Mamografías Gratuitas para mujeres que no poseen obra social. Se otorgan 10 turnos mensuales y coordina los mismos el Área de la Mujer. + info al 03406-15517917. pic.twitter.com/sgLPIDho1n",1188844793708843008
2019-10-28 12:44:15,"No escuchasteis a Rivera decir que hay que poner las guarderías gratuitas? A ver si le dais un toque por Andalucía, que allí gobierna y miente más que habla.",1188843933255852032
2019-10-28 12:43:35,"Conseguir una justicia independiente y consensuar entre todos los partidos políticos, una nueva y real democracia que sea de todos, que amplíe libertades y con el compromiso de llevar conjuntamente una sanidad y educación gratuitas debería ser el principio de un mejor país",1188843765429166080
2019-10-28 12:42:52,Conservatório de MPB tem 19 apresentações gratuitas em novembro # curitiba # curitibarecomenda # artecuritibana # eventoscuritiba # curitibaeventos # curitibacultural # curitibasualinda # curitibashow # hashtagcuritiba # cwbhttps://www.jornale.com.br/single-post/2019/10/28/Conservat%C3%B3rio-de-MPB-tem-19-apresenta%C3%A7%C3%B5es-gratuitas-em-novembro …,1188843584788815872
2019-10-28 12:41:02,IMPULSA MARÍA LUISA VALLEJO GARCÍA CONSULTAS GRATUITAS PARA LA FAMILIA En medicina general y dental este beneficio un día a la semana. Mantendrán bajas cuotas de recuperación en días restantes. mas información: http://www.sonart.mx/2019/10/22/p47864/ … # DIF # Tuxtepec # ConsultasGratuitaspic.twitter.com/fGXoTZuuqK,1188843120433287170
2019-10-28 12:39:14,"Falando em vicio em aprender sempre quis aprender ""libras"". fiquei feliz que havia essa materia na faculdade, mas foi aquela coisa bem porca para cumprir exigencia do MEC. achei um link com aulas EAD gratuitas na USP. quem vai querer aprender o/",1188842667599433728
2019-10-28 12:38:18,El modo Práctica de Tekken 7 recibirá mejoras gratuitas en invierno https://www.eurogamer.es/article.php?article_id=2064749 …,1188842434303811584
2019-10-28 12:34:28,Los dispositivos digitales se han convertido en los principales sistemas de # lectura para muchos usuarios. Nuestro compañero de es_Cultura @ _djtrain_ nos trae 5 # aplicaciones gratuitas para que no nos quedemos sin nada que leer. https://bit.ly/2PqJF8N pic.twitter.com/qmBWpk4wKT,1188841469265756160
2019-10-28 12:31:13,Estas cirugías son gratuitas para los ciudadanos. Informa @ keylasalazara,1188840650755719174
2019-10-28 12:30:34,Herramientas gratuitas para programar y compartir en # RedesSociales Blog Una Perla en la Red https://buff.ly/32VLrTi by @ perbea123pic.twitter.com/GqRryF1OSU,1188840485718237185
2019-10-28 12:29:37,"As inscrições gratuitas da segunda turma do projeto ′Cuidar de quem cuida′ iniciarão na próxima terça, 29, na Secretaria da Mulher (Semulher), na avenida Papa João XXIII, nº497. Confira >> http://abre.ai/cuidardequemprecisamga … # prefeiturademaringa # saudemaringa # mulhermaringa # maringanaoparapic.twitter.com/PJXjBH3C5e",1188840249394368512
2019-10-28 12:28:33,"Con tu póliza de Gastos Médicos Mayores, cuentas con consultas médicas telefónicas gratuitas. # romoasesorespic.twitter.com/kaP9Po2fDX",1188839978190589953
2019-10-28 12:26:14,ganhei 3 edits gratuitas agr,1188839395346014209
2019-10-28 12:24:47,"Instituto Mário Penna abre mais 460 novas vagas para mamografias gratuitas https://www.em.com.br/app/noticia/gerais/2019/10/28/interna_gerais,1096402/instituto-mario-penna-abre-mais-460-novas-vagas-para-mamografias-gratu.shtml …",1188839031284666368
2019-10-28 12:24:15,Pátio Alcântara promove agendamento de mamografias pelo SUS e tatuagens gratuitas para vítimas http://revistainfoco.com.br/2019/10/28/patio-alcantara-promove-agendamento-de-mamografias-pelo-sus-e-tatuagens-gratuitas-para-vitimas/ …pic.twitter.com/WrpE0800ad,1188838898606235651
2019-10-28 12:23:34,"IMI, O CTIADOR DO KRAV MAGA, MOSTRA COMO SE FAZ A DEFESA DE ATAQUE COM FACAS POR BAIXO. . Não seja mais refém da violência. Mude de vida, faça Krav Maga !! . Venha fazer 02 aulas GRATUITAS !! . PROFESSOR ADRIANO… https://www.instagram.com/p/B4KrHb3HSl4/?igshid=1yia9giw2tip …",1188838725922545665
2019-10-28 12:22:11,La administración de el Gobernador @ alfredodelmazo ha llevado a cabo alrededor de 7 mil mastografías gratuitas para prevenir el Cancer de Mama. pic.twitter.com/wj9CtIYGKv,1188838379309404162
2019-10-28 12:22:00,Conservatório de MPB tem 19 apresentações gratuitas em novembro! http://bit.ly/2q1IHFG pic.twitter.com/QYPIJvocfg,1188838330810720256
2019-10-28 12:19:33,aos meus amigos acadêmicos do tuito: tá rolando o inova iesp essa semana com um monte de palestras gratuitas em diversas áreas ótimo pra quem está em busca de horas em atividades complementares,1188837715472736256
2019-10-28 12:19:31,"Saí do twitter justamente para evitar a auto-humilhação e broncas gratuitas e hoje mesmo fiz uma inocente pergunta onde fazer escova progressiva no Instagram e levei o que? Bronca. Não existe paz nas redes sociais. Sei lá, olá de novo. kkkkk",1188837707407081472
2019-10-28 12:19:13,"Cuando hablamos de resistir estos cuatro años nos referimos a las ollas de guiso en los barrios, a las clases de apoyo escolar, a las clases gratuitas de distintos deportes, a ser nexo entre la gente y un estado con prioridades financieras, a las reuniones con los vecinos para +",1188837632098394112
2019-10-28 12:18:56,6° Convención de MAÍZ La Economía Circular . # bioeconomía # bioenergía # transformación y más... . 07 de noviembre Centro de Convenciones Córdoba . Inscripciones Libres y Gratuitas https://forms.gle/zeN9Mav6VKwLfJ5g6 … . # Maíz360 # Maíz # Sustentabilidad # AgroComprometidospic.twitter.com/F2DIrvgmH7,1188837561072082945
2019-10-28 12:18:53,"Grammarly para corrección de textos, Freepik y Flaticon para uso de imágenes gratuitas muy chulas, y Slidesgo para presentaciones. Ah, y Hunter para conseguir direcciones de emails.",1188837548984066048
2019-10-28 12:18:25,"Si claro, un país como Canada, en donde por cierto, la educación y la salud son gratuitas... y además hay subsidios por todos lados... jajaja",1188837428393586688
2019-10-28 12:15:23,Son votaciones gratuitas y te guste o no el cejas tiene muchísimos seguidores,1188836666124984320
2019-10-28 12:15:03,"Claro, ahora se entienden las provocaciones gratuitas a carabineros y militares. Quedó todo clarito. La izquierda de este país es una vergüenza, le interesa un carajo la gente, solo quieren el poder.",1188836582377304065
2019-10-28 12:13:35,"se resolveriam. Só to dizendo tudo isso porque esse fds eu excluí uma cambada de gente do fb porque faziam piadas mesquinhas, ofensas gratuitas, que enfim apesar de já terem participado um dia do meu círculo, hoje não caberiam mais.",1188836213962268672
2019-10-28 12:13:15,Joven estudiante fabricó una impresora 3D para hacer prótesis gratuitas para perritos amputados https://www.bestvice.com/joven-estudiante-fabrico-una-impresora-3d-para-hacer-protesis-gratuitas-para-perritos-amputados?utm_campaign=c_sus&utm_source=sus …,1188836128167739393
2019-10-28 12:12:57,"""Você deve godtar é de dinheiro."" Isso porque as vagas são gratuitas...",1188836054251528192
2019-10-28 12:12:37,"Comienza un proyecto, por un país de iguales, con oportunidades reales, con universidades públicas, gratuitas y de calidad. Quiero una sociedad que se interese por el otro, quiero una lucha social real y está llegando! Entiendan que nos involucra a TDS! pic.twitter.com/56I8gD5gRv",1188835971665711104
2019-10-28 12:12:18,"makes no sense, pessoas com problemas de visão ou de audição tb não escolheram ver mal/ouvir e tb têm que pagar para melhorarem as suas situações. baixar os preços concordo mas serem grátis não, se formos a ver muitas outras coisas teriam que ser gratuitas https://twitter.com/dreamingofpml/status/1188547357190868992 …",1188835891445407745
2019-10-28 12:11:48,# DiplomaciadePaz En el marco del mes de la lucha contra el cáncer de mamas hemos atendido a 378 mujeres con ecografías mamarias gratuitas y charlas preventivas sobre el auto examen mamario... Estamos desplegados brindando atención a las mujeres de la Patria..! @ JULIOLEONYARApic.twitter.com/okfHWOrRz2,1188835766652325889
2019-10-28 12:11:43,Los paladares más inquietos tienen una cita este fin de semana en el centro de interpretación @ olivaryaceite con las gratuitas de los primeros # AOVEs de nueva cosecha. https://bit.ly/2MR1eNN @ dipujaen # oleoturismo # ubedapic.twitter.com/PO96k7Snsf,1188835742056960000
2019-10-28 12:11:34,"""Creo la igualdad de oportunidades infinitas Creo que la educación, salud y comida deberían ser gratuitas Creo que el trabaja más que el otro merece ganar más Pero también creo en compartir lo que tengo con los demás"" La Cátedra @ Residente",1188835704526295041
2019-10-28 12:09:57,"MAS VAMO FALAR DE COISA BOA? Essa semana o projeto das # Diabólicas vai pro ar <3 Obras gratuitas para baixar na Amazon, dia 30 e 31, apavorando seu Halloween <3 Quer saber mais? Se liga na thread que eu vou dar RT agora! pic.twitter.com/LJ3SfGlbJD",1188835297339039745
2019-10-28 12:06:04,Bibliotecas virtuais e gratuítas para acceder a libros e documentos na súa versión dixital https://bit.ly/2pm1lb1 vía @ prensa_libre,1188834321840377857
2019-10-28 12:04:20,Tete vox es mejor económicamente porque menos impuestos y más cosas privadas hacen que me pille el iphone nuevo y claro eso es economía pipuda no como tener más cosas públicas y gratuitas,1188833887360864256
2019-10-28 12:04:16,"A tarifas gratuitas entraram em vigor no dia 18/10/2019, King",1188833867664416769
2019-10-28 12:02:34,¿Gustas del arte urbano y quieres conocer más de esta expresión artística? Asiste a las conferencias gratuitas que Escenarios Urbanos 2019 ofrece. ¡No te lo puedes perder! Agenda: https://bit.ly/2p9XON2 pic.twitter.com/pIOYFUWBFO,1188833440508137472
2019-10-28 12:02:12,"Muchos usuarios nos hemos acostumbrado a regalar nuestros datos a empresas a cambio de acceder a servicios y aplicaciones gratuitas, pero sin conocer el verdadero peligro que esto supone. Descubre todo aquí: http://bit.ly/2oOITY1 .pic.twitter.com/Zp0QusXFKR",1188833347956592640
2019-10-28 12:01:24,"Toda segunda-feira do mês de outubro, das 14h às 16h, no 3º piso, realizaremos oficinas gratuitas de artesanato ensinando a produzir lindas peças de scrapbook. pic.twitter.com/IyQD7BHSRL",1188833145598156800
2019-10-28 12:00:21,con ecografías mamarias gratuitas y charlas preventivas sobre el auto examen mamario... Estamos desplegados brindando atención a las mujeres de la Patria..! # Mamas # Eco # Yaracuy # Venezuela @ JULIOLEONYARA,1188832881403203591
2019-10-28 12:00:12,con ecografías mamarias gratuitas y charlas preventivas sobre el auto examen mamario... Estamos desplegados brindando atención a las mujeres de la Patria..! # Mamas # Eco # Yaracuy # Venezuela @ JULIOLEONYARA,1188832845357289472
2019-10-28 11:59:25,"Productos Doña Jimena. En nuestra nueva tienda puedes adquirir los productos que más te gusten, personalizar cestas... Ya sabéis que además realizamos visitas guiadas a la fábrica, y son gratuitas!! Además se… https://www.instagram.com/p/B4KoWehI3O_/?igshid=fcpnfy31qdta …",1188832647889375233
2019-10-28 11:59:13,"Faltam 3 dias para o inicio do festival, as informações sobre as sessões - todas GRATUITAS - estão no site. http://curtacinema.com.br/home/",1188832599147450368
2019-10-28 11:57:16,"N são gratuitas, é uma conta de apoio ao cRoquettismo.",1188832107298283521
2019-10-28 11:55:06,Nem vou ver q esta parvoeiras gratuitas não fazem parte da minha realidade,1188831563548676098
2019-10-28 11:54:52,"JORNADA DE PREVENCIÓN CONTRA EL CÁNCER DE MAMA EN MATANZA Fue la Plaza San Justo en el marco del mes de prevención del cáncer de mama. Se entregó folletería explicativa, y se dieron mas de 200 turnos para mamografías gratuitas. Hubo cierre musical y visita de Fernando Espinoza. pic.twitter.com/kDtuFAxakM",1188831502588665858
2019-10-28 11:50:54,Mendoza. Hay muchas obras de teatro para chicos y actividades municipales gratuitas. Hermosas plazas y comidas ricas,1188830505967456258
2019-10-28 11:50:12,"# FCELima2019 | Del 11 al 20 de Noviembre, el Festival de Cine Europeo de Lima y Eunic Perú ofrecerán actividades formativas gratuitas para profesionales de la industria cinematográfica en el marco de su nuevo programa CineLabs. ¡Conoce más aquí! https://www.facebook.com/FestivaldeCineEuropeodeLima/photos/gm.423713475010597/2484133848321670/?type=3 …",1188830327046922240
2019-10-28 11:49:26,"El pobre será ""el negro, el pichi, el vago"", el trans vuelve a ser ""el trabuco"" y vuelve todo el odio despectivo y selectivo que ellos llevan es su ADN. Se pierden consejos d salarios, FONASA, MIDES, centros caif, se van las operaciones de ojos gratuitas.",1188830134700269568
2019-10-28 11:48:09,"Nova Friburgo, RJ, terá atividades gratuitas da campanha Outubro Rosa https://glo.bo/2WkDJ2E",1188829813550780416
2019-10-28 11:48:02,"Me encanta cuando creen que las cosas son gratuitas por el simple echo de no poner plata del bolsillo directamente. Ese es uno de los grandes problemas de este país, se creen que las cosas son gratis y salen de abajo de las piedras. https://twitter.com/NaxaMonaco99/status/1188638191273828359 …",1188829783968436232
2019-10-28 11:47:03,REGIONALES 1/2 En el marco del mes de la lucha contra el cáncer de mamas hemos atendido a 378 mujeres con ecografías mamarias gratuitas y charlas preventivas sobre el auto examen mamario... # DiplomaciadePaz,1188829537523716096
2019-10-28 11:45:48,La salud y la educacion son gratuitas. Existen bienes y servicios para todos los presupuestos. El bienestar esta garantizado y es accesible a todos. Otra cosa es ser consumista y no saber de finanzas personales,1188829221751328769
2019-10-28 11:45:00,Jornadas gratuitas sobre la vacuna contra la gripe ¡Muy recomendables! https://twitter.com/DEnfermero/status/1188749747256881153 …,1188829019631845376
2019-10-28 11:44:13,"Diario @ BdE: ¿Son las líneas de autobús gratuitas una medida eficaz contra el cambio climático? https://www.ticbeat.com/tecnologias/son-las-lineas-de-autobus-gratuitas-una-medida-eficaz-contra-el-cambio-climatico/ …, see more http://tweetedtimes.com/BdE_h?s=tnp",1188828822264844290
2019-10-28 11:44:06,La Comunidad de Madrid programa 240 actividades medioambientales gratuitas para este otoño http://dlvr.it/RH6xJb via @ ElGuadarramistapic.twitter.com/Lo0dHOPK95,1188828792153788422
2019-10-28 11:43:38,"Mañana 9.30 cita imprescindible en sede @ infoRMurcia un proyecto liderado por @ sef_carm # GENEUS Si eres una PYME y quieres herramientas testadas internacionalmente, gratuitas y sin sesgo de género para tu selección de personal, este es tu evento. pic.twitter.com/HU535Hxdab",1188828677288673281
2019-10-28 11:41:34,"Para hoy lunes tenemos: Problemas de insolvencia empresarial? Procesos de reorganización. Conferencias gratuitas. Lunes 28 de octubre 4 a 6 p.m. Auditorio Cámara de Comercio de Sincelejo, Av. Ocala, Sincelejo. @ cciosincelejo @ccsincelejopic.twitter.com/LhTdgdMPxd",1188828154485510145
2019-10-28 11:40:34,"otra mentira, las tarjetas de credito de algunos bancos son gratuitas, ellos mismos te llaman para vendertela. No tienen gasto mensual ni necesitas sueldo minimo para tenerlas. Por favor, informate un poco",1188827904651747328
2019-10-28 11:40:22,Río Cuarto: entregaron escrituras gratuitas a 59 familias de distintos barrios - https://cordobainteriorinforma.com/2019/10/28/rio-cuarto-entregaron-escrituras-gratuitas-a-59-familias-de-distintos-barrios/ …pic.twitter.com/LMYIlTV5s0,1188827853904846848
2019-10-28 11:40:03,"Gente, as meninas do @ TudoOrna estão com aulas gratuitas sobre marca pessoal. Se inscreve ai! https://vrlps.co/5Xvh3Su/tw",1188827775555248128
2019-10-28 11:38:39,Milano a dar 2 pontos no H3 até dia 10 de novembro? Parece q só vou comer isso nas próximas semanas e acumular refeições gratuitas à maluca,1188827422189408258
2019-10-28 11:38:13,"Este 1º de noviembre festivo, te proponemos dos actividades gratuitas por si estás por # Almería: 10:00h. Visita interpretada Conoce tu Alcazaba. 11:00h. Visita temática Mujeres tras los muros de la Alcazaba, con @ _artmuse. Reserva en el 600142982. # jep2019pic.twitter.com/vnXsQEYAFL",1188827312281804800
2019-10-28 11:37:51,El modo Práctica de Tekken 7 recibirá mejoras gratuitas en invierno https://www.eurogamer.es/articles/2019-10-28-el-modo-practica-de-tekken-7-recibira-mejoras-gratuitas-en-invierno …,1188827222972522496
2019-10-28 11:33:07,"Quieres entradas gratuitas para la @ DavisCupFinals ? Lo puedes llamar al mismo Gerard Piqué . Eso si, no pidas mas de 2, porque hay una extraordinaria demanda. Suerte !pic.twitter.com/R5PakQBC2O",1188826028992552965
2019-10-28 11:32:13,"Oi galera, com ajuda de um apoiador do canal, teremos 11 vagas gratuitas (em vez de 10) para pessoas trans, negras e indigenas no curso de ecossocialismo do Rio. O formulário de inscrição pra seleção é esse aqui: https://forms.gle/fNvdKzManCADedddA …",1188825801464143872
2019-10-28 11:32:07,"# Arequipa Te invitamos a conocer sobre la reclamación y apelación en el procedimiento contencioso. 13 de noviembre 5 p. m. Colegio de Contadores de Arequipa, calle Sánchez Trujillo N°201, Urb. La Perla, Cercado. Inscripciones gratuitas https://www.mef.gob.pe/es/seminarios-aduaneros-y-tributarios/calendario-de-seminarios …pic.twitter.com/NqvYw0Q4Qi",1188825777254649858
2019-10-28 11:31:22,"""Descubre ahora mis guías gratuitas para despejar tus dudas"" https://lttr.ai/JbEo # Neurociencia # Formación # Neuropsicología # DivulgaciónCientíficapic.twitter.com/GmvGB9V7x3",1188825588359946251
2019-10-28 11:31:15,El modo Práctica de Tekken 7 recibirá mejoras gratuitas en invierno https://ift.tt/2pUSIo2,1188825561071833089
2019-10-28 11:30:45,"aproveitando seu tweet, o lab de praticas integrativas da ufrn (LAPICS) oferece vários serviços de terapias alternativas gratuitas pra usuarios do SUS e estudantes da UF, no HUOL (dá pra acompanhar as atividades no insta também @lapicsufrn pic.twitter.com/bD45GKxBfR",1188825434223468545
2019-10-28 11:30:31,El modo Práctica de Tekken 7 recibirá en invierno mejoras gratuitas y un DLC de pago con visualización de datos de frames http://bit.ly/32Ut3uf,1188825375259987975
2019-10-28 11:30:22,Las actividades semanales de # ConsuladoDeMéxico son gratuitas y no requieren cita. ¡Te esperamos pic.twitter.com/ekS8n2rLSX,1188825339356700672
2019-10-28 11:28:54,"É amanhã! Inscreva-se no webinar ""Casa segura: aprenda a prevenir acidentes domésticos"": http://bit.ly/webinarcasasegura … As inscrições são gratuitas! # casasegura # dicasdeseguranca # criancasegura # eviteacidentes # bebeseguro # crianca # infancia # cuidadoscomcriancas # cuidadoscombebepic.twitter.com/IgiPCfglJ2",1188824968265715714
2019-10-28 11:27:05,"Hola Jorge, las transferencias son gratuitas dentro de Europa siempre y cuando sea en Euros. Un saludo.",1188824512084824068
2019-10-28 11:25:22,Capacitaciones gratuitas en la Ciudad http://diariod3.com/inicio/index.php/2019/10/28/capacitaciones-gratuitas-en-la-ciudad-3/ …pic.twitter.com/9KqK7tRdOk,1188824079182258184
2019-10-28 11:19:06,"Na Feira de Profissões Senac PR, você vai encontrar a programação certa pra quem quer ser PRO! Esperamos você no Senac mais próximo, inscrições gratuitas: https://www.pr.senac.br/profissoes/ Vem ser Pro. Vem pro Senac.pic.twitter.com/6mZXYg69Ex",1188822502551752705
2019-10-28 11:10:19,"""Descubre ahora mis guías gratuitas para despejar tus dudas"" https://lttr.ai/Ja95 # Neurociencia # Formación # DivulgaciónCientífica # Neuropsicologíapic.twitter.com/udZ2UrlSm4",1188820294154276864
2019-10-28 11:06:49,# DiplomaciaDePaz En el marco del mes de la lucha contra el cáncer de mamas hemos atendido a 378 mujeres con ecografías mamarias gratuitas y charlas preventivas sobre,1188819409772695557
2019-10-28 11:05:36,REGIONALES En el marco del mes de la lucha contra el cáncer de mamas hemos atendido a 378 mujeres con ecografías mamarias gratuitas y charlas preventivas sobre el auto examen mamario... Estamos desplegados brindando atención a las mujeres de la Patria..! # Mamas # Eco,1188819103118778369
2019-10-28 11:05:02,Apoyará DIF Matamoros a mujeres con 400 mamografías gratuitas http://www.lavozdetamaulipas.mx/apoyara-dif-matamoros-a-mujeres-con-400-mamografias-gratuitas/ …,1188818963024756748
2019-10-28 11:03:02,"Se puede ser muy crítica con lo queer y no hacer deducciones gratuitas por un tweet chorra. Interpretación libre no es, que la llama pedófila alegremente.",1188818460832403456
2019-10-28 11:00:58,"Este miércoles ofreceremos mastografías gratuitas a mujeres de 40 a 69 años de edad. Echa un vistazo aquí, conoce los detalles y comparte esta información: pic.twitter.com/7N1hWD6vLp",1188817939576717312
2019-10-28 11:00:25,"Que ternura me dan esos boludos que saltan siempre con la ""Ayñññ mira que la educación y la salud no son gratuitas!!! Hay que pagar mantenimiento, sueldos..."" Y si pelotudo, sé diferenciar un hecho económico de un hecho comercial. Ponete a estudiar algo en serio pic.twitter.com/3eERPehxhU",1188817800162398209
2019-10-28 10:59:35,"Formación especializada en violencia de género_Convenio ICI-ESSSCAN El Instituto Canario de Igualdad, en colaboración con la Escuela de Servicios Sanitarios y Sociales de Canarias, pone en marcha varias acciones formativas gratuitas dirigidas tanto... https://www.facebook.com/1316878458387891/posts/2598930893515968/ …pic.twitter.com/BwNC9LTHXN",1188817591713828868
2019-10-28 10:57:15,"Casa de la Literatura Peruana: exposiciones, talleres y otras actividades culturales gratuitas [VIDEO] https://larepublica.pe/cultural/2019/10/27/casa-de-la-literatura-peruana-guia-para-aprovechar-los-servicios-culturales-gratuitos-ministerio-de-educacion-escritores-libros-cultura-video/ …",1188817002728755200
2019-10-28 10:55:43,"Si por favor, de cual banca sionista israelí estás hablando? No empecemos con las calumnias y difamaciones gratuitas, seamos responsables.",1188816619369357312
2019-10-28 10:54:26,"Bueno, yo hablo de mi caso. También hay opinadoras gratuitas. No voy a entrar en consideraciones ni ir contando a nadie mi vida privada, pero en mi caso, niego la mayor. Hay machirulos, cierto. También hay femirulas.",1188816293237006337
2019-10-28 10:50:36,"Muestras Gratis - Muestras Gratuitas - Prueba productos gratis de belleza, para bebes, y de todo tipo http://www.muestrasgratis.es/?org=fb_share",1188815331931885569
2019-10-28 10:50:06,"Creo la igualdad de oportunidades infinitas Creo que la educación, salud y comida deberían ser gratuitas Creo que el trabaja más que el otro merece ganar más Pero también creo en compartir lo que tengo con los demás",1188815203313602564
2019-10-28 10:47:00,"Sem falar nas outras atividades que vão ocorrendo durante o ano como palestras e outras exibições tbm gratuitas. Eles dedicam tempo planejando isso, traduzem os materiais gringos, cuidam das redes sociais, investem em material de divulgação...",1188814425819619328
2019-10-28 10:43:12,"Si la # DeudaEstudiantil fuera un problema médico, sería una pandemia y no queremos una pandemia, ¿verdad? Debemos cancelar TODAS las deudas estudiantiles existentes y hacer que las universidades/colegios /escuelas vocacionales públicas sean gratuitas. https://berniesanders.com/es/issues/universidad-gratis-cancelar-deuda/ …",1188813467857424384
2019-10-28 10:42:51,"Atenção empreendedores! Hoje é o último dia de inscrições para o programa AmazôniaUP! As inscrições se encerram as 23h59 desta segunda-feira, 28 de outubro! Não deixe para a última hora! Mais informações e inscrições gratuitas em: http://centroamazonia.org.br/amazoniaup/ pic.twitter.com/ecPHi5sTHN",1188813379550502924
2019-10-28 10:40:00,"# Recursos # DiseñoGrafico Gran colección de fuentes ""bold"" gratuitas ideales para encabezados https://bit.ly/32SNHuO",1188812661678587905
2019-10-28 10:39:56,Conservatório de MPB tem 19 apresentações gratuitas em novembro. Veja a programação - Bem Paraná https://www.bemparana.com.br/noticia/conservatorio-de-mpb-tem-19-apresentacoes-gratuitas-em-novembro.-veja-a-programacao#.Xbbvq9iwT3c.twitter …,1188812647296307200
2019-10-28 10:39:27,"Prova será no dia 3 de novembro (domingo), na Esplanada dos Ministérios, em comemoração ao Dia do Servidor. As inscrições são gratuitas. https://jornaldebrasilia.com.br/cidades/ministerio-da-economia-realiza-primeira-corrida-de-integracao-e-acao-social/ …",1188812523577008129
