date,text,id
2019-10-28 15:25:45,"Consulado Inter de São Leopoldo abre as inscrições para eleger a MUSA COLORADA 2020 Precisa ser SÓCIA do Inter e estar em DIA com a MENSALIDADE, Ser maior de 18 anos completos até dia 25/01/2020, Maiores informações: Fone/Whats: Andressa Sorgetz (51) 98150-4758 pic.twitter.com/w3is2RrJOF",1188884572383207426
2019-10-28 15:25:10,As inscrições gratuitas estão abertas até o dia 04 de dezembro. Inscreva-se: https://midi.as/1rT2 # PrefeituradeJundiaí # Jundiaí # CulturaJundiaípic.twitter.com/wxKyItpdMn,1188884427436384257
2019-10-28 15:25:09,"Amor, devido a demanda de muitas pessoas quererem lotamos muitas atividades de hoje. Amanhã vamos abrir inscrições para as atividades de quinta.",1188884422369648642
2019-10-28 15:24:49,Sesi abre inscrições para Corrida de Rua em alusão ao aniversário de Araguaína https://t1noticias.com.br/a/106852/ pic.twitter.com/pUNtTRXrnb,1188884340379475975
2019-10-28 15:24:33,ARAGUAÍNA| Inscrições para a SESI Corrida de Rua estão abertas http://dlvr.it/RH7hgF pic.twitter.com/PP16mNSuzp,1188884272666406917
2019-10-28 15:24:33,ARAGUAÍNA| Inscrições para a SESI Corrida de Rua estão abertas http://dlvr.it/RH7hdh pic.twitter.com/w0l3KbgtmN,1188884271974346757
2019-10-28 15:24:26,Colégio João XXIII abre inscrições para sorteio de vagas em Juiz de Fora https://glo.bo/2PnVHzM,1188884241683304448
2019-10-28 15:24:16,Colégio João XXIII abre inscrições para sorteio de vagas em Juiz de Fora https://glo.bo/2PnVHzM,1188884199253647370
2019-10-28 15:22:31,"Veja o resumo de 28/10 a 01/11 com editais publicados, inscrições abertas e previstos. ⠀ Fique preparado com nossos cursoshttp://www.damasio.com.br ⠀ # damasio # damasiorbr # radardosconcursos # concurso # vaiterconcursopic.twitter.com/QVtPNpB5vR",1188883762316304386
2019-10-28 15:21:50,http://www.vestibularfatec.com.br Inscrições somente até dia 11 de novembro. https://www.instagram.com/p/B4K_UfnF4ab/?igshid=nrepatb1id2i …,1188883589871685642
2019-10-28 15:21:32,"SESI Corrida de Rua, em Araguaína, abre inscrições para categorias adulto e infantil https://orlanoticias.com.br/sesi-corrida-de-rua-em-araguaina-abre-inscricoes-para-categorias-adulto-e-infantil/ …",1188883513266917378
2019-10-28 15:21:29,Os concursos e processos seletivos com inscrições abertas para os próximos dias ofertam 2.956 vagas de trabalho. # HiperNotícias # hnthttps://www.hipernoticias.com.br/cidades/concursos-e-seletivos-ofertam-quase-3-000-vagas-com-salario-de-ate-r-10-mil/145227 …,1188883501820592130
2019-10-28 15:20:31,Inscrições abertas ! Ligue (37) 3221-7888 # unifenas # direitounifenasdivinopolis # soumaisunifenaspic.twitter.com/YHb9wTnnx5,1188883258823659522
2019-10-28 15:20:21,"6º TechTalks Parque Tecnológico SJC 30/10/19, 15h Inscrições: https://bit.ly/34dIIEX # parquetecnologicosjc # parquesjc # startup # startupbrasil # parquetecnologico # saojosedoscampos # sjc # sanja # valedoparaiba # sjcampos # business # clubedaciencia # clubedacienciasenacsjc # networkingpic.twitter.com/D76iNjRMxY",1188883213281845248
2019-10-28 15:20:13,A @ Vivobr está com inscrições abertas para o seu Programa de # Estágio 2020 e estudantes de todos os cursos são bem-vindos. São 120 vagas disponíveis para estagiar em várias cidades do Brasil. Inscreva-se até 13/11: http://www.programaestagiovivo.com.br/ # VempraVivo,1188883180528517125
2019-10-28 15:19:03,Sesi Corrida de Rua abre inscrições em Araguaína; saiba como participar https://gazetadocerrado.com.br/sesi-corrida-de-rua-abre-inscricoes-em-araguaina-saiba-como-participar/ …pic.twitter.com/OcLJbe2um2,1188882888932155393
2019-10-28 15:17:55,Concurso público do Conselho Regional de Medicina Veterinária do Estado do Amazonas: inscrições abertas http://www.clicksergipe.com.br/concursosemprego/8/55850/concurso-publico-do-conselho-regional-demedicina-veterinariado-estado-doamazonas-inscricoes-abertas.html …pic.twitter.com/UTusCHTz49,1188882601941053441
2019-10-28 15:16:53,http://bit.ly/35pIXyt Estão abertas as inscrições até 06/11 para o Concurso Prefeitura de Angra dos Reis 2019. A prova está prevista para ser realizada no dia 15 de dezembro de 2019.,1188882340979924993
2019-10-28 15:15:48,"Como o monitoramento biométrico afeta o futuro da privacidade? Reunimos um creative coder, um advogado e uma professora de arte e tecnologia para falar sobre o assunto. Vem trocar com a gente. Inscrições pelo link: https://bit.ly/32VN9nI pic.twitter.com/R11YKKM3vn",1188882069813899269
2019-10-28 15:15:26,"“A residência no Hospital Edmundo Vasconcelos foi transformadora. Com profissionais que exercem a medicina com excelência e equipamentos de alta tecnologia à disposição”, Dr. Fernando Oto Balieiro, otorrinolaringologista e ex-residente. Em breve, inscrições para a Residência 2020 pic.twitter.com/ie3C6zHpHe",1188881977845436420
2019-10-28 15:14:10,Confira! – Concurso Prefeitura Morro Reuter RS: inscrições abertas! https://jornaisvirtuais.com.br/confira-concurso-prefeitura-morro-reuter-rs-inscricoes-abertas/ …,1188881657287176194
2019-10-28 15:14:09,Inscrições para a SESI Corrida de Rua em Araguaína estão abertas http://surgiu.com.br/2019/10/28/inscricoes-para-a-sesi-corrida-de-rua-em-araguaina-estao-abertas/ …pic.twitter.com/8pEjszEwlk,1188881654791790594
2019-10-28 15:12:13,"Você sabia???? Repassando!!!!!!!! Comunicado Social Antenção você que deseja legalizar sua união . Casamento comunitário para oficializar sua união: Noivos , estáveis , héteros e homoafetivos As inscrições... https://www.facebook.com/100000303344626/posts/2824499250903492/ …",1188881166633504778
2019-10-28 15:10:31,"Reserve o dia 25/11 na agenda! Em mais uma parceria entre a Trevisan e o IREE, evento reunirá grandes nomes para debater os impactos da Lava Jato. Com apoio do CIEE e do IBRACON. Evento gratuito. Inscrições em breve! Assine nossa newsletter em http://iree.org.br pic.twitter.com/McWyybuvsS",1188880741209427969
2019-10-28 15:08:11,"# Caraguatatuba # SP # ConcursoPúblico # GCM Inscrições: 29/10 a 22/11 VUNESP: https://www.vunesp.com.br/PMCR1901 Taxa de Inscrição: R$ 67,00 Data da Prova: 22/12 Compre a apostila no site: http://bit.ly/ApostilaCaraguatatubaGCM … # GuardaCivilMunicipal # ApostilasOpção # Apostila # Impressa # Digital # Caraguápic.twitter.com/vdvrCR860W",1188880152824107008
2019-10-28 15:05:51,Inscrições abertas para o Circuito Sesc de Corridas 2019 - etapa Fortaleza - Blog do Raimundo Moura https://raimundomoura.blogspot.com/2019/10/inscricoes-abertas-para-o-circuito-sesc.html …,1188879566909136896
2019-10-28 15:05:48,http://bit.ly/2pEb0tp Inscreva-se já! Inscrições até 20/11 para o Tribunal de Justiça do Estado do Pará / PA – TJ PA 2020.,1188879553277681664
2019-10-28 15:05:47,E eu que sonhei que perdia as inscrições AAA alguém me interna,1188879548491935745
2019-10-28 15:05:42,Inscrições para o processo seletivo em Rondonópolis começa nesta segunda - https://ift.tt/2WlfelQ,1188879526153072641
2019-10-28 15:05:07,"Império da Tijuca abre inscrição para ala das crianças. Os interessados devem ter entre 9 e 12 anos e precisam comparecer à quadra de ensaios, na Rua Medeiros Pássaro n° 84 - Tijuca. As inscrições acontecem todas as… https://www.instagram.com/p/B4K9m4PhWRd/?igshid=1uhjyx8b9zx4m …",1188879379973079040
2019-10-28 15:03:16,Inscrições abertas! Garanta sua vaga! Acesse o SigEventos através do link: https://bit.ly/2JtvTyr pic.twitter.com/wLrsXItRKL,1188878915445624833
2019-10-28 15:02:30,"Olá, pessoal, amanhã será a nossa palestra! Por isso, garanta já sua inscrição com preço promocional e, também, leve um acompanhante por só mais 1 real! Aproveite! Inscrições apenas pelo link:... https://www.facebook.com/fabricio.demoura/posts/10157651735429921 …",1188878722050465792
2019-10-28 15:01:53,Inscrições de novos alunos em escolas do DF terminam sexta https://www.blogbueno.com.br/blogbueno/inscricoes-de-novos-alunos-em-escolas-do-df-terminam-sexta/ …pic.twitter.com/rHh2WGK8QE,1188878566752182274
2019-10-28 15:01:11,# PortalUFPA | Te liga que o nosso Campus Altamira está com inscrições abertas para Cursos Livres de Inglês e Libras. Mais informações: http://ow.ly/4Fcn50wUoah,1188878392789262336
2019-10-28 15:00:32,Boa tarde! A CDL MANAUS está com inscrições abertas para a PALESTRA: COMO ATINGIR A QUALIDADE EM VENDAS. Inscreva-se já no link! Link: https://goo.gl/oBRmnf Qualquer dúvida entre em contato com o número: 3627-2894 / (92) 99371-1740 ou via e-mail: utvcursos@cdlmanaus.org.brpic.twitter.com/f0AlgaqwHD,1188878229618282501
2019-10-28 15:00:23,São Gonçalo BJJ Open com inscrições bombando. Aproveite o desconto e confirme seu nome hoje! http://meiaguarda.com.br/sao-goncalo-bjj-open-com-inscricoes-bombando-aproveite-o-desconto-e-confirme-seu-nome-hoje/ … via @ Meiaguarda,1188878189898190848
2019-10-28 15:00:00,Continuam abertas as inscrições da Fatec 2020 Prazo de inscrições vai até dia 11 de novembro Veja mais: http://bit.ly/2pdZjd5 pic.twitter.com/1LSPiCyU2B,1188878095530508288
2019-10-28 15:00:00,Olha que bacana! Estão abertas as inscrições p/ o Concurso de Fotografias “Meu Olhar de # Búzios 2019”. A iniciativa tem como objetivo estimular o surgimento de novos talentos através da divulgação e valorização de imagens do município. Saiba mais http://bit.ly/2MopCWL pic.twitter.com/Vo7wiC0zcT,1188878095446499328
2019-10-28 15:00:00,Inscrições para curso de conselheiros tutelares iniciam nesta terça-feira (29) http://bit.ly/34bZpAC Prefeitura de São João da Barra - RJ/Governo Federalpic.twitter.com/2vBhhWisPO,1188878094150426624
2019-10-28 15:00:00,"Estão abertas as inscrições para o 7º Congresso em Envelhecimento Ativo e Saudável | 20 de novembro, no Convento São Francisco, em Coimbra. Saiba mais em: http://www.omcentro.com/divulgacoes/detalhe/330 …pic.twitter.com/O6GVL1s3q3",1188878094041538560
2019-10-28 14:59:00,"http://bit.ly/2BM4YKd Concurso Público para Prefeitura Municipal de Joinville – SC, para o cargo de Guarda Municipal. As inscrições até 13 de novembro de 2019.",1188877843071152130
2019-10-28 14:58:33,"O supervisor de Fiscalização da Mineração do Crea-MG, engenheiro de minas Newton Reis de Oliveira Luz, realizará palestra no evento “Fornecedores de tecnologias para gestão e manejo de rejeitos de mineração”, realizado pelo IBRAM. Inscrições gratuitas em: http://bit.ly/2fornecedores .pic.twitter.com/OdCmcVD7JQ",1188877727480385537
2019-10-28 14:57:58,"Últimos dias de inscrição para o Processo Seletivo da Prefeitura Municipal de Jaboticabal/SP, que destina-se à contratação temporária de docentes. As inscrições estarão disponíveis até às 17h00 do dia 31/10. Para inscrições e mais informações, acesse: https://bit.ly/2lVffPZ pic.twitter.com/amwFvBKAFJ",1188877584131600386
2019-10-28 14:57:06,3ª edição do Campeonato Municipal de Vôlei de Areia está com inscrições abertas http://www.clicpaverama.com.br/noticia/3-edicao-do-campeonato-municipal-de-volei-de-areia-esta-com-inscricores-abertas …,1188877362676588545
2019-10-28 14:56:57,Começam as inscrições em escolas públicas nesta terça-feira http://www.pelotas.com.br/noticia/comecam-as-inscricoes-em-escolas-publicas-nesta-terca-feira … # prefeituradepelotas,1188877326467112967
2019-10-28 14:53:46,"É NESTA QUINTA (31), a partir das 18h30! CAA/RS e o Cremers irão promover evento para debater a Síndrome de Burnout. Na oportunidade, será lançada cartilha sobre o tema, que explica como lidar com o problema. Inscrições GRATUITAS em https://bit.ly/2IIigv1 pic.twitter.com/Sdngib4jnv",1188876526764417025
2019-10-28 14:52:59,"Veja o resumo de 28 OUT a 01 NOV com os # concursos com edital publicado, inscrições abertas e previstos. ⠀ Fique preparado com nossos cursos http://api.whatsapp.com/send?1=pt_BR&phone=55015997146883 … ⠀ # damasio # concursopic.twitter.com/hRyVAHXSXl",1188876329443307525
2019-10-28 14:51:58,# Treinamento # ImpactoAmparoPleno # ConvençãoBatistaCarioca INFORMAÇÕES E INSCRIÇÕES EM http://www.missoesrio.com.br/impactoamparopleno … em PIB de Irajá https://www.instagram.com/p/B4K8Gn4AFZI/?igshid=17liohgg627s5 …,1188876071434719232
2019-10-28 14:50:49,"O FIESP e o SENAI selecionarão 3 startups em estágio pré-operacional para o UpLab, Programa de aceleração do Senai-SP. As inscrições vão até dia 01/11. Saiba mais: https://auin.unesp.br/noticias//493/fiesp-e-senai-selecionarao-3-startups-para-programa-de-aceleracao …",1188875782812307463
2019-10-28 14:47:03,http://bit.ly/2N7KkJO Não perca! Inscrições até 06/11/2019 para o Concurso Prefeitura de Quixeramobim 2020. Nível: Fundamental e Médio.,1188874835784556544
2019-10-28 14:45:13,Tá chegando Já pensou em estudar de graça e ainda ter estágio garantido? Na Faculdade Canção Nova você pode. Confira o regulamento do site http://fcn.edu.br e inscreva-se agora para o Vestibular 2020. Inscrições até 4 de… https://www.instagram.com/p/B4K7VM1JWvO/?igshid=1ogjv7x245fjh …,1188874374654283776
2019-10-28 14:40:21,"Se você está interessado em realizar em 2020 o EJA para Ensino Fundamental 2 e Ensino Médio. Não perca os prazos! Inscrições até 31/10/2019 – quinta-feira Secretária Escolar Av. Presidente Kennedy, 886 – Cidade… https://www.instagram.com/p/B4K6xdUnlml/?igshid=43eslbszjbdy …",1188873146893389825
2019-10-28 14:37:15,"Já estão abertas as inscrições para o 6º # ClubeDeLeitura JHSP + @ quatrocincoum. Desta vez, o livro discutido será Ayako, de # OsamuTezuka. + http://bit.ly/2JulhQ2 pic.twitter.com/cFOb7TCl7m",1188872370511110144
2019-10-28 14:34:58,Últimas inscrições para a 11ª Jornada Científica do Avaí Futebol Clube. Faça sua inscrição aqui: http://bit.ly/jornadamedica2019 … # JornadaCientífica2019pic.twitter.com/gYfMwCGrLQ,1188871793509048322
2019-10-28 14:34:26,"Dica: Escola Corporativa do STJ abre inscrições para o curso on-line sobre novo Código de Processo Civil Confira no Blog ""Arbitragem, Conciliação e Mediação"", acesse; https://arbitragem9307.blogspot.com/2019/10/dica-escola-corporativa-do-stj-abre.html …pic.twitter.com/tAefnGh82j",1188871657693286400
2019-10-28 14:33:48,Tá chegando a hora !!! vamos fazer do Inven.tiv o maior e melhor evento de Quality Engineering do Brasil. Inscrições em : https://bit.ly/356BfZD # inventiv # sre # qualityengineering # srebrazil # devops # cloud # aiops # continuousdelivery # automatedtestinghttps://lnkd.in/dfDs89U,1188871502004924416
2019-10-28 14:33:29,Concurso Prefeitura de Porto Velho RO 2019 - Inscrições - https://www.concursodaprefeitura.com/2019/05/14/concurso-prefeitura-de-porto-velho-ro-2019-inscricoes/ …,1188871419758858241
2019-10-28 14:32:33,"Meu padrasto quem comentou, devido ao número de inscrições, pra CFOPM BM com certeza é bem menor, relaxa",1188871184579997697
2019-10-28 14:30:48,Boa tarde! A CDL MANAUS está com inscrições abertas para a PALESTRA: REFORMA TRABALHISTA E AS MUDANÇAS NA PREVIDÊNCIA SOCIAL. Inscreva-se já! Link: https://goo.gl/oBRmnf Entre em contato com o número: 3627-2894 / (92) 99371-1740 ou via e-mail: utvcursos@cdlmanaus.org.brpic.twitter.com/NgEcn7JJPV,1188870747164499968
2019-10-28 14:30:47,"Viagem ao México com Elisa Freixo e Flávio Gil 8 a 23 de Fevereiro de 2020 Cidade do México, Oaxaca, Tlaxcala e Puebla Informações e inscrições: efreixo @http://terra.com.br pic.twitter.com/eAHysZtVKQ",1188870742894661632
2019-10-28 14:30:21,INSCRIÇÕES ABERTAS - EJA no # dj70anos Maiores informações em: https://bit.ly/334b5pj pic.twitter.com/RJ5bHdejc2,1188870630529257473
2019-10-28 14:30:18,"Veja o resumo de 28 OUT a 01 NOV com os # concursos com edital publicado, inscrições abertas e previstos. ⠀ Fique preparado com nossos cursos: http://www.damasio.com.br ⠀ # Damasio # Concursopic.twitter.com/jcdKWaW3E0",1188870618013405184
2019-10-28 14:29:03,"Período de inscrições do concurso SPPrev já iniciou. Com organização da FCC, as inscrição do concurso finalizam no dia 13 de novembro e custam R$ 33, para o cargo de Técnico, e R$ 54, para a carreira de Analista http://bit.ly/2PiFr36 # lsconcursos",1188870306552791042
2019-10-28 14:28:30,INSCRIÇÕES PARA EJA 2020 https://domjose.wordpress.com/2019/10/28/inscricoes-para-eja-2020/ …,1188870167016693761
2019-10-28 14:26:28,procuro melhores amigos assim kkkkkkkkkkkk inscrições abertas https://twitter.com/appletapebts/status/1188489589297532928/video/1 …,1188869656028819456
2019-10-28 14:25:42,"vyado, meu curso tem 36 vagas e tem 55 inscrições homologadas, o que dá uma concorrência de 1,53 por vaga",1188869462390398977
2019-10-28 14:25:32,"seeduc meu amor se decide que dia vai começar as inscrições para o matrícula fácil, é dia 29/10 ou 05/11??",1188869418236948480
2019-10-28 14:25:28,A ETEC Parque da Juventude está com inscrições abertas até 12 de novembro de 2019 às 15h para o Vestibulinho - 1º semestre de 2020. São vários cursos e você fica por dentro de tudo em http://www.etecparquedajuventude.com.br/ . Foto: Facebook/Divulgação. # etecparquedajuventudepic.twitter.com/8epKTd3MG9,1188869405159186434
2019-10-28 14:24:50,Curso online: Métodos e técnicas de documentação aplicadas à arte paleolítica.II Ediçao Universidade de Burgos. Espanha Inscrições abertas: http://bit.ly/2oWRVmq informação: ivandiazsm@gmail.com Totalmente online através da internet. Compatível com o seu horário de trabalho.,1188869245192552448
2019-10-28 14:24:33,Guia Crissiumal - Notícias - Secretaria de Educação de Crissiumal está com inscrições abertas para o cargo emergencial de Auxiliar de Educação Infantil http://guiacrissiumal.com.br/noticias/28-10-2019-Secretaria-de-Educacao-de-Crissiumal-esta-com-inscricoes-abertas-para-o-cargo-emergencial-de-Auxiliar-de-Educacao-Infantil …,1188869172459167745
2019-10-28 14:24:31,"Atualizando o Feed! repost - @ PraFeBrum Tá chegando!!!! Você vai ficar de fora? Não acreditoooo! Esse ano temos muitas surpresas pra você! Chama suas amigas, marca geral aqui. Homens tbm podem ir. Inscrições:… https://www.instagram.com/p/B4K49nUH0MK/?igshid=f1wo8ky268sk …",1188869163470606340
2019-10-28 14:23:44,"# Repost @ cursodamasio with make_repost ・・・ Veja o resumo de 28 OUT a 01 NOV com os # concursos com edital publicado, inscrições abertas e previstos. ⠀ Fique preparado com nossos cursos: http://www.damasio.com.br ⠀ # damasio… https://www.instagram.com/p/B4K43gbjEVY/?igshid=cm6qg7l9r8hg …",1188868966858412034
2019-10-28 14:23:23,QUINTA-FEIRA (31/10) - Fieg promove em Goiânia 7º Encontro Internacional de Comércio Exterior. Inscrições são gratuitas https://aredacao.com/negocios/125688/fieg-promove-em-goiania-7-encontro-internacional-de-comercio-exterior …pic.twitter.com/C47wfwvFvX,1188868879977766912
2019-10-28 14:21:56,Governo abre edital e dá oito dias para inscrições no Bolsa Atleta https://olharolimpico.blogosfera.uol.com.br/2019/10/25/governo-abre-edital-e-da-oito-dias-para-inscricoes-no-bolsa-atleta/ …,1188868515413012482
2019-10-28 14:21:44,"SELETIVA DE PATROCÍNIO COM INSCRIÇÕES ABERTAS! A segunda edição da seletiva ""Meu Primeiro Patrocínio É Aqui"", promovida pela AtletasNow, já está com inscrições abertas! Quer participar? Você só precisa cumprir… https://www.instagram.com/p/B4K4pKoneLp/?igshid=1pvg083d7nt9s …",1188868463202201600
2019-10-28 14:19:58,Abertas inscrições para etapa Fortaleza do Circuito Sesc - Corremah! http://blogs.opovo.com.br/corremah/2019/10/28/abertas-inscricoes-para-etapa-fortaleza-do-circuito-sesc/ …,1188868016987082752
2019-10-28 14:19:54,Quando abrir as inscrições pra rj e minas eu vou fazer Me aguarde,1188868000218275840
2019-10-28 14:19:28,Corrida Insana acontece neste domingo em Curitiba; inscrições terminam nesta terça - Bem Paraná https://www.bemparana.com.br/noticia/corrida-insana-acontece-neste-domingo-em-curitiba-inscricoes-terminam-nesta-terca#.XbcjHr9EIAA.twitter …,1188867893926203393
2019-10-28 14:18:46,"Veja o resumo de 28 OUT a 01 NOV com os # concursos com edital publicado, inscrições abertas e previstos. ⠀ Fique preparado com nossos cursos: http://damasio.com.br ⠀ # damasio # concursopic.twitter.com/Q1OKqkFQpF",1188867715966087173
2019-10-28 14:18:06,"# Emprego # Concursos | País tem pelo menos 214 concursos com inscrições abertas para cerca de 23,4 mil vagas. Oportunidades são para cargos são em todos os níveis de escolaridade. Clique na imagem abaixo para saber mais. https://g1.globo.com/economia/concursos-e-emprego/noticia/2019/10/28/pais-tem-pelo-menos-214-concursos-com-inscricoes-abertas-para-cerca-de-234-mil-vagas.ghtml …",1188867548852490242
2019-10-28 14:17:12,"Inscrições abertas! Venha conhecer um pouco de como é produzir um podcast e as ferramentas de discurso que podem ser utilizadas. Teremos parte prática e teórica. É gratuito, aqui na UFSCar durante as quintas e sextas do mês de novembro, das 18h as 19h30. pic.twitter.com/KXUFr9NCbP",1188867322485891072
2019-10-28 14:17:00,Entendi... É que vai rolar umas inscrições pra designação essa semana e eu quero me inscrever kkk muito obrigado olha lá que se pá tu consegue tb,1188867274536640513
2019-10-28 14:16:05,Opa! Quando irão abrir as inscrições? Apoio total. Enfim um partido verdadeiramente de direita.,1188867042386034688
2019-10-28 14:14:08,"tomara que abram as inscrições no início do ano, vou até ver isso tb pq se não abrirem início do ano vou ter que me inscrever o quanto antes... já perdi muito tempo",1188866553053437953
2019-10-28 14:13:19,"Veja o resumo de 28 OUT a 01 NOV com os # concursos com edital publicado, inscrições abertas e previstos. ⠀ Fique preparado com nossos cursos: http://www.damasio.com.br ⠀ # damasio # concursopic.twitter.com/pOtaFZqbXK",1188866344781078528
2019-10-28 14:13:13,"Inscrições abertas para p Método Tudo É Design! Eai galera foi d mais fazer essas Master Class nos dias 21, 23 e 25 de Outubro... Falamos de precificação, de como ter ideias de na hora da criação e no ultimo dia… https://www.instagram.com/p/B4K3qwvphMN/?igshid=1hhu6d64pglsk …",1188866318885253121
2019-10-28 14:10:14,"filmin na minha casa sexta, façam suas inscrições",1188865568910299136
2019-10-28 14:09:15,Atenção Formoso do Araguaia TO Amanhã dia 29/10 a Unopar Gurupi estará com banca de inscrições gratuitas para o vestibular em sua cidade! Estaremos na calçada da Araguaia Tecidos (próximo ao Banco do Brasil e… https://www.instagram.com/p/B4K3NxKFmG0/?igshid=1r72y4u2ceeqh …,1188865322171928578
2019-10-28 14:08:19,RINHA DE DIREITA!! ~ SEU COMBATENTE DEVE COMPARECER NA LUTA COM: -Uma arma -Camiseta preta e branca com a estampa do Bolsonaro ou Nando Moura -Traje padrão: Cabelo muito curto ou careca -Rockeiro ou pai de familia! INSCRIÇÕES ABERTAS PARA A PRIMEIRA RINHA!!,1188865087710420992
2019-10-28 14:07:49,Inscrições para concurso da UEMS são prorrogadas https://www.fatonews.com.br/2019/10/28/inscricoes-para-concurso-da-uems-sao-prorrogadas/ …pic.twitter.com/1KBwfhOGPL,1188864960702697478
2019-10-28 14:07:16,"Veja o resumo de 28 OUT a 01 NOV com os # concursos com edital publicado, inscrições abertas e previstos. ⠀ Fique preparado com nossos cursos: http://www.damasio.com.br ⠀ # damasio # concursopic.twitter.com/EnxTEgl0uq",1188864824014528512
2019-10-28 14:06:02,OAB e ONG gaúchas abrem inscrições para prêmio Direitos Humanos de Jornalismo http://dlvr.it/RH7RtL pic.twitter.com/YztQ06Cnmm,1188864513627443201
2019-10-28 14:05:59,"Concursos Alap: As inscrições se encerram nesta quarta-feira, dia 30, às 14h. pic.twitter.com/D1gzHx9Ptt",1188864498859479041
2019-10-28 14:05:16,últimos dias de inscrições para vagas de trainee e estágio · JC Concursos https://concursoeapostilas.com.br/ultimos-dias-de-inscricoes-para-vagas-de-trainee-e-estagio-%c2%b7-jc-concursos/ …pic.twitter.com/niPXeIZZ6q,1188864317795586050
2019-10-28 14:03:47,"Scandinavian Day debate, na próxima quarta-feira, 06/11, visão escandinava sobre valores e negócios com representantes da Dinamarca, Finlândia, Islandia, Noruega, Suécia e Brasil http://bit.ly/2Pqbj67 Inscrições aqui http://www.scandinavianday.com.br pic.twitter.com/i2NB4yDNGu",1188863947379744769
2019-10-28 14:03:41,"Nos dias 29, 30 e 31 de outubro, o Museu Militar do Comando Militar do Sul realizará o III Encontro de História Militar/II Colóquio de Pesquisas do GEHM, em Porto Alegre (RS). Inscrições: (51)3226-5883/3220-6366 Participe! http://www.defesanet.com.br/ecos/noticia/34682/CMS---III-Encontro-de-Historia-Militar-II-Coloquio-de-Pesquisas-do-Grupo-de-Estudos-em-Historia-/ …pic.twitter.com/pYQlEmrdw6",1188863921333121024
2019-10-28 14:03:37,Já começou as inscrições para afiliação no PDN?,1188863906187534337
2019-10-28 14:02:38,"Tu faz um baita trabalho, e quem acompanha sabe da tua disponibilidade, acessibilidade e qualidade. Segue pedindo os likes, inscrições e sininho",1188863655376510976
2019-10-28 14:02:06,"É estudante universitário e busca fazer um estágio num órgão internacional? Agora tem uma oportunidade! Abertas as inscrições, até 30/10/19, para estágios na Secretaria do @ mercosul # SomosMercosul https://www.mercosur.int/pt-br/abertas-as-inscricoes-para-estagios-na-secretaria-do-mercosul …pic.twitter.com/lqsJCoNC18",1188863524568813569
2019-10-28 14:01:26,"# PPAG Quais as reivindicações do # ValeDoJequitinhonha p/ o Plano Plurianual, q estabelecerá as ações do Estado p/ os próximos 4 anos? Em 4/11, os deputados irão a Araçuaí ouvir a população. As inscrições p/ participar do debate ficarão abertas até 1º/11. http://bit.ly/31HMrco pic.twitter.com/LOLCPnZRsG",1188863353168498690
