date,text,id
2019-10-28 10:58:28,# política via # UOL - OAB e ONG gaúchas abrem inscrições para prêmio Direitos Humanos de Jornalismo https://ift.tt/340PMF4,1188817310640955392
2019-10-28 10:58:24,"As vagas estão abertas no site da @ atadosgenteboa, plataforma que conecta pessoas a ações de voluntariado: http://www.atados.com.br/poploadsocial Inscrições duplicadas serão anuladas! Após o voluntariado, cada vaga dará direito a 1 ingresso exclusivo, nominal e intransferível para o show",1188817294841012226
2019-10-28 10:58:12,"País tem pelo menos 214 concursos com inscrições abertas para cerca de 23,4 mil vagas https://apoliticacomoprofissao.wordpress.com/2019/10/28/pais-tem-pelo-menos-214-concursos-com-inscricoes-abertas-para-cerca-de-234-mil-vagas/ …pic.twitter.com/TKp2G1zI4m",1188817241309089792
2019-10-28 10:57:43,"País tem pelo menos 214 concursos com inscrições abertas para cerca de 23,4 mil vagas https://apoliticacomoprofissao.wordpress.com/2019/10/28/pais-tem-pelo-menos-214-concursos-com-inscricoes-abertas-para-cerca-de-234-mil-vagas/ …pic.twitter.com/BEYLQeWSwm",1188817122375417856
2019-10-28 10:57:08,# política via # Folha - OAB e ONG gaúchas abrem inscrições para prêmio Direitos Humanos de Jornalismo https://ift.tt/340PMF4,1188816973234429953
2019-10-28 10:56:37,Inscrições abertas para segunda etapa do Pedal em Sampa | https://www.mtbbrasilia.com.br/2019/10/28/inscricoes-abertas-para-segunda-etapa-do-pedal-em-sampa/ …pic.twitter.com/3NNDM9H7ky,1188816845413015559
2019-10-28 10:55:25,"# ÉHOJE # SenarMS # SistemaFamasul Segundou e já começamos a semana com Encontro Jovens da Agropecuária, uma agenda que reúne muita gente com vontade de aprender e de compartilhar conhecimento. Encerraremos as inscrições às 15h desta segunda-feira (28). https://bit.ly/2JusFuB pic.twitter.com/ahbcwnvvYy",1188816542445776897
2019-10-28 10:55:17,"País tem pelo menos 214 concursos com inscrições abertas para cerca de 23,4 mil vagas https://contilnetnoticias.com.br/2019/10/pais-tem-pelo-menos-214-concursos-com-inscricoes-abertas-para-cerca-de-234-mil-vagas/ …pic.twitter.com/SRHgpQypjU",1188816509319241728
2019-10-28 10:54:32,Inscrições do fazendo gênero prorrogadas ela me sondas d++++++,1188816320919429120
2019-10-28 10:54:04,"País tem pelo menos 214 concursos com inscrições abertas para cerca de 23,4 mil vagas: Oportunidades são para cargos são em todos os níveis de escolaridade. Os salários chegam a R$ 30.404,45 no TJ do RJ. selo concursos opcao 01 Editoria de arte/G1 Pelo… http://dlvr.it/RH6mDm pic.twitter.com/eetNPl8yXD",1188816201733902336
2019-10-28 10:53:00,Curso em Itabira 19 e 20/ outubro 2019 Inscrições: Iana Carvalho 9.9648-8800 https://www.instagram.com/p/B4KgwesgTkM/?igshid=1g0ie90x4lf2v …,1188815934313512965
2019-10-28 10:52:43,"Estude no IFRS: Inscrições abertas para cursos técnicos, superiores e especializações http://rdplanalto.com/noticias/39926/estude-no-ifrs-inscricoes-abertas-para-cursos-tecnicos-superiores-e-especializacoes …",1188815862012284929
2019-10-28 10:50:39,"Nesta quinta-feira (31) no IFAM-CMC. Inscrições em jade.ifam em IFAM - Instituto Federal de Educação, Ciências e Tecnologia do Amazonas https://www.instagram.com/p/B4KgdJgnhpa/?igshid=cklpcomol3nh …",1188815342186852352
2019-10-28 10:50:09,Tens uma ideia ou projeto de negócio e queres iniciá-lo? Desenvolver uma nova linha de negócios na tua empresa? Participa no Programa de Aceleracão para Projetos Portugueses! Inscrições até 30 de outubro http://bit.ly/2MURyla @ poctep @ e_avante @ univdeevorapic.twitter.com/xOHNNbmMxR,1188815216957677568
2019-10-28 10:50:00,As inscrições para o Serviço Militar Voluntário de Oficiais Temporários estão abertas até o dia 4 de novembro. Fique atento e não perca o prazo! Veja as vagas no site e faça a sua inscrição! http://bit.ly/2GURSuV # VemPraMarinhapic.twitter.com/tMe6UXgWm1,1188815178143391744
2019-10-28 10:46:33,CDL abre inscrições para o curso de Inovação e experiencia com cliente http://dlvr.it/RH6kmh # CDL # PRINCIPALpic.twitter.com/zbiYMQz8bU,1188814308974612480
2019-10-28 10:45:57,TURMA PRESENCIAL - DELTA/RJ . Inscrições abertas para nossa turma de novembro_dezembro. . SERÁ NOSSA ÚLTIMA TURMA DO ANO. E provavelmente a última turma antes do edital sair. . Cronograma: . 09/nov - Penal… https://www.instagram.com/p/B4Kf8pJj7Af/?igshid=ghyo35jigmoc …,1188814157958668294
2019-10-28 10:45:42,"# Oportunidade: As inscrições para o Concurso Público da Prefeitura de Colinas do Tocantins começam nesta segunda-feira, 28, a partir das 14 horas http://bit.ly/2BQqUUs",1188814095987986434
2019-10-28 10:44:06,Povo de Jundiaí inscrições pro centro de línguas está liberada,1188813693649379328
2019-10-28 10:43:52,Alo @ TalDaLia inscrições pro centro de línguas está liberada,1188813633633030144
2019-10-28 10:43:00,CURSO E-SOCIAL – INSCRIÇÕES ATÉ 31/10 Programa: - Evolução da fiscalização - eSocial: Uma nova era nas relações trabalhistas - Implantação do eSocial – decreto 8.373/2014 - Sequenciamento lógico do eSocial E mais... Inscrições no site: https://bit.ly/2PpQ5VP pic.twitter.com/qsvLQ3mtcc,1188813417768988672
2019-10-28 10:42:51,"Atenção empreendedores! Hoje é o último dia de inscrições para o programa AmazôniaUP! As inscrições se encerram as 23h59 desta segunda-feira, 28 de outubro! Não deixe para a última hora! Mais informações e inscrições gratuitas em: http://centroamazonia.org.br/amazoniaup/ pic.twitter.com/ecPHi5sTHN",1188813379550502924
2019-10-28 10:41:43,"Uema abre inscrições para seis processos seletivos. Em regime de trabalho de 20h semanais, os profissionais contratados farão jus à remuneração equivalente a R$ 2.095,45 http://jornaleiroma.com/2019/10/28/uema-abre-inscricoes-para-seis-processos-seletivos/ …pic.twitter.com/kTJBw5HBkS",1188813093238902784
2019-10-28 10:41:34,Estão abertas as inscrições para última edição do ano do curso de Hipnose e Hipnoterapia do Instituto Bazzi. Com novidades exclusivas e material de apoio especialmente preparado para você que deseja... https://institutobazzi.com/curso-formacao-em-hipnose-e-hipnoterapia-2019/ …,1188813054869409794
2019-10-28 10:41:18,"As inscrições para o @ amerek_ufmg, especialização em Comunicação Pública da Ciência apoiada pelo # CampSerrapilheira, foram prorrogadas até as 18h desta segunda-feira, 28. Aproveite!https://twitter.com/amerek_ufmg/status/1188811981014339585 …",1188812990906294275
2019-10-28 10:40:38,"Para falar sobre a recuperação judicial voltada ao produtor rural, nossa sócia @ julianabiolchi participa de uma discussão na subseção da @ oabrs em Carazinho. O evento é gratuito, mas as vagas são limitadas. As inscrições devem ser feitas na sede da entidade. pic.twitter.com/hjfKi0HVfv",1188812822102327299
2019-10-28 10:40:03,Se preparem! Vem aí o Encontro Estadual de Jovens Lideranças do Agro dia 09 de novembro. . . Inscrições: http://bit.ly/EusouLiderdoAgro … . . # FaegJovem # SistemaFaeg # SenarGoiás # SebraeGoiáspic.twitter.com/iBi6I7Rpgm,1188812676757147650
2019-10-28 10:39:27,"Prova será no dia 3 de novembro (domingo), na Esplanada dos Ministérios, em comemoração ao Dia do Servidor. As inscrições são gratuitas. https://jornaldebrasilia.com.br/cidades/ministerio-da-economia-realiza-primeira-corrida-de-integracao-e-acao-social/ …",1188812523577008129
2019-10-28 10:38:47,"UEMA: abertas inscrições para processos seletivos nos campus Caxias, Balsas e Pinheiro https://bit.ly/2MRhJt2 pic.twitter.com/39wgtjGqJO",1188812355981004800
2019-10-28 10:37:45,Programa Centelha Amazonas encerra inscrições nesta terça-feira (29) >> http://bit.ly/2pjlYVr pic.twitter.com/kPD4YToZoj,1188812094919073792
2019-10-28 10:37:33,OAB e ONG gaúchas abrem inscrições para prêmio Direitos Humanos de Jornalismo https://novoemfolha.blogfolha.uol.com.br/2019/10/28/oab-e-ong-gauchas-abrem-inscricoes-para-premio-direitos-humanos-de-jornalismo/ …,1188812047884140550
2019-10-28 10:37:33,"País tem pelo menos 214 concursos com inscrições abertas para cerca de 23,4 mil vagas http://jornaldealagoas.com.br/nacional/29220/2019/10/28/pais-tem-pelo-menos-214-concursos-com-inscrices-abertas-para-cerca-de-234-mil-vagas …",1188812046105825281
2019-10-28 10:37:28,As inscrições para a edição dessa semana já estão abertas! Se inscrevam logo pois as vagas são limitadas https://smash.gg/tournament/kombat-klub-street-fighter-v-league-week-5/details …,1188812027080445952
2019-10-28 10:37:28,"Infelizmente eu baixei, quebro 100% do app antigo, tinha uma margem de 5gb de download no app antigo, tudo sumiu da lista mais ainda ta ocupando espaço, as inscrições também foram resetadas e o app ainda mostra que me inscrevi em podcast desconhecidos pra mim.",1188812024651890688
2019-10-28 10:37:23,Inscrições para o @ amerek_ufmg reabertas. Mas é só até às 18h de hoje. http://www.cursoseeventos.ufmg.br/CAE/DetalharCae.aspx?CAE=9575 …pic.twitter.com/BAG8WiV0GK,1188812005773381632
2019-10-28 10:37:01,Programa Centelha Amazonas encerra inscrições nesta terça-feira (29) >> http://bit.ly/2pjlYVr pic.twitter.com/ZjgCFErmBR,1188811911196008448
2019-10-28 10:35:51,As inscrições da esg estão abertas até quando?,1188811618509041665
2019-10-28 10:34:01,bom dia famiglia!! hoje comeca as inscrições pra ser meu namorado namorada namorade pra me levar pra ceia de natal !!!!!....... chega na dm,1188811155697012738
2019-10-28 10:33:01,Bom dia do Servidor Público. Mesmo que seja trabalhando (monitorando as inscrições da pós).,1188810906316226561
2019-10-28 10:32:55,Inscrições para eleição de conselheiros deliberativos e fiscais do CaraguaPrev terminam dia 1º de novembro https://falacaragua.com.br/inscricoes-para-eleicao-de-conselheiros-deliberativos-e-fiscais-do-caraguaprev-terminam-dia-1o-de-novembro/ …pic.twitter.com/BiU8KsGbcF,1188810878734553088
2019-10-28 10:32:29,to pensando se eu faço as inscrições ainda esse ano ou eu faço depois do enem (próximo ano) pq é muita prova pra fazer pqp,1188810771565862912
2019-10-28 10:31:33,Campo Grande abre inscrições para curso de formação de Jovens Empreendedores http://mspontocom.com.br/site/campo-grande-abre-inscricoes-para-curso-de-formacao-de-jovens-empreendedores/ …pic.twitter.com/xGx0U6p3o5,1188810535816564736
2019-10-28 10:31:10,"País tem pelo menos 214 concursos com inscrições abertas para cerca de 23,4 mil vagas http://www.blogdotoninho.com.br/pais-tem-pelo-menos-214-concursos-com-inscricoes-abertas-para-cerca-de-234-mil-vagas/ …",1188810439079190529
2019-10-28 10:31:08,"País tem pelo menos 214 concursos com inscrições abertas para cerca de 23,4 mil vagas http://www.blogdotoninho.com.br/pais-tem-pelo-menos-214-concursos-com-inscricoes-abertas-para-cerca-de-234-mil-vagas/ …",1188810433194610688
2019-10-28 10:31:00,"eu prometo que dessa vez é a ultima pergunta, as inscrições pra fazer aula de hipismo:",1188810399547875329
2019-10-28 10:30:29,"CONCURSO 10 órgãos abrem inscrições nesta segunda-feira para 1,8 mil vagas https://www.lagartonoticias.com.br/2019/10/28/10-orgaos-abrem-inscricoes-nesta-segunda-feira-para-18-mil-vagas/ … Curta nossa página no Facebook: https://www.facebook.com/lagartonoticiasoficial/ … # LagartoNotícias # PrincipaldoInterior # 4anos",1188810265653059585
2019-10-28 10:30:13,"Se inscreva para as MasterClasses do Escreva! Com as nossas aulas você têm a chance de aprender o melhor do mundo dos roteiros e audiovisual. Para inscrições e mais informações, entre em contato conosco através deste email: escrevaroteiros@gmail.com. pic.twitter.com/4LJNpJYkzs",1188810199882178560
2019-10-28 10:30:13,Bom dia! A CDL MANAUS está com inscrições abertas para a PALESTRA: REFORMA TRABALHISTA E AS MUDANÇAS NA PREVIDÊNCIA SOCIAL. Inscreva-se já no link! Link: https://goo.gl/oBRmnf Entre em contato com o número: 3627-2894 / (92) 99371-1740 ou via e-mail: utvcursos@cdlmanaus.org.brpic.twitter.com/gVLtz9yejC,1188810198812680193
2019-10-28 10:29:04,"4ª temporada do Processo Seletivo Portland, em parceria com a Cultura Inglesa, está com as inscrições abertas https://falacaragua.com.br/4a-temporada-do-processo-seletivo-portland-em-parceria-com-a-cultura-inglesa-esta-com-as-inscricoes-abertas/ …",1188809909674098688
2019-10-28 10:28:18,"No dia 17/10 abrem as inscrições para mais um IABsp, é livre a candidatura de profissionais associados ou não. Teve uma grande ideia? Acredita que possa ser referência na área? Inscreva-se e conto conosco para encontrar a melhor solução ao apresentar seu projeto. pic.twitter.com/qjKV9HJHvv",1188809716744499201
2019-10-28 10:27:31,Estranho que não tem informações detalhadas ... inscrições. ..,1188809520333635587
2019-10-28 10:27:25,Prefeitura de Porto Alegre abre inscrições para alunos novos na educação infantil - https://www.poa24horas.com.br/prefeitura-de-porto-alegre-abre-inscricoes-para-alunos-novos-na-educacao-infantil/ …,1188809496786800641
2019-10-28 10:26:10,Inscrições abertas para o curso de Especialização em Instrumentação Cirúrgica; Saiba como se inscrever https://www.meganesia.com.br/noticias/11-esporte/3794-inscricoes-abertas-para-o-curso-de-especializacao-em-instrumentacao-cirurgica-saiba-como-se-inscrever …pic.twitter.com/RIrdr6J00P,1188809181761069061
2019-10-28 10:24:56,Alô magos! Ainda estamos aceitando inscrições. Só tivemos uma aula até agora. Corra e venha ser um mago do fogo divino! # magiadivina # magiarj # magiadivinarj # fogosagrado # escritamagica # pontoriscado # espacomagico… https://www.instagram.com/p/B4Kdi2KHjJe/?igshid=vdur6wuuqlwn …,1188808872107986945
2019-10-28 10:23:47,"As inscrições para o Seminário do Sistema Municipal de Informações e Indicadores Culturais estão abertas até 5/11: http://bit.ly/31llVp6 O encontro busca debater a estruturação do Sistema para identificar o impacto, a eficiência e a eficácia das políticas públicas culturais.pic.twitter.com/R5cu7M1ld8",1188808580973113345
2019-10-28 10:21:51,Pedal em Sampa está com inscrições abertas para segunda etapa em novembro http://zdl.pressroom.com.br/371301f846,1188808094500970496
2019-10-28 10:20:15,Começa nesta segunda-feira prazo de inscrições e matrículas para redes municipal e estadual de ensino - http://guaiba.com.br/2019/10/28/abertas-inscricoes-e-matriculas-para-rede-municipal-e-estadual-de-ensino/ …pic.twitter.com/Ck4PbWIQcl,1188807691088453632
2019-10-28 10:20:03,A Febraban e a Faculdade Zumbi dos Palmares estão com inscrições abertas para a capacitação de 60 jovens negros e negras interessados em aproveitar oportunidades do setor financeiro. Leia na coluna de Priscila Natividade https://glo.bo/3497iqy # correio24h # SóSeVêNoCorreiopic.twitter.com/fjdeqyI8Dw,1188807641344163841
2019-10-28 10:19:55,Crissiumal: Escola Ponche Verde abrirá inscrições para o Curso Técnico em Contabilidade a partir do dia 1º https://www.radioaltouruguai.com.br/crissiumal-escola-ponche-verde-abrira-inscricoes-paro-curso-tecnico-em-contabilidade-a-partir-do-dia-1o/ …,1188807606728626176
2019-10-28 10:16:35,"Na próxima quinta-feira, acontece o minicurso Tribunal do Júri e Teoria dos Jogos. As inscrições estão sendo realizadas no Centro Acadêmico do curso de Direito. Participe! pic.twitter.com/0i8FUAqYx8",1188806767993589761
2019-10-28 10:16:08,tô só esperando as inscrições das irmãs Cecyn,1188806654491582464
2019-10-28 10:15:48,"Quinta-feira tem # AdobeDayBrasil, o nosso webinar gratuito. Nesta semana, trouxemos o Henrique Ribas para uma aula sobre Lightroom Mobile. Chame os amigos! Inscrições abertas: https://adobe.ly/2Q0kokg .pic.twitter.com/NiLXy7XD1e",1188806573482745858
2019-10-28 10:15:31,"Inscrições para 2ª Copa Futel de Vôlei de Praia estão abertas # Futel | A partir desta segunda (28), os interessados em participar da 2ª Copa Futel de Vôlei de Praia podem realizar as inscrições. pic.twitter.com/k2lsX7GUOI",1188806501227487233
2019-10-28 10:14:12,Concurso de Redenção CE abre inscrições para 979 vagas · JC Concursos https://concursoeapostilas.com.br/concurso-de-redencao-ce-abre-inscricoes-para-979-vagas-%c2%b7-jc-concursos/ …pic.twitter.com/fovhnYgAZS,1188806170091380737
2019-10-28 10:13:34,Concurso da UEMS: Inscrições são prorrogadas até dia 08 de novembro: As inscrições para o concurso público de provas e títulos da Universidade Estadual de Mato Grosso do Sul (UEMS) foram prorrogadas até o… https://www.tererenews.com/concurso-da-uems-inscricoes-sao-prorrogadas-ate-dia-08-de-novembro/?utm_source=dlvr.it&utm_medium=twitter … # tererenews # tererenewsjornal # ultimasnoticiaspic.twitter.com/CR9yNLxOSY,1188806012481851393
2019-10-28 10:12:41,Participe do Sarau de Artes e Poesias de Verão ANBA 2020 inscrições abertas. https://www.facebook.com/578354154/posts/10157930608584155/ …,1188805786866241539
2019-10-28 10:11:59,# vestibular | Faculdade Fipecafi abre inscrições para processo seletivo de Graduação http://rviv.ly/Ibe2Ny,1188805610508177411
2019-10-28 10:10:27,Fique atento! . . Vamos começar as inscrições para nosso curso de Especialização Clínica em Gestalt-terapia. . . Começamos por quem já é de casa. # SempreAlunoSATI . . Se você participou das atividades do SATI entre… https://www.instagram.com/p/B4Kb4YnD2YU/?igshid=3xc8w7576uas …,1188805227379482624
2019-10-28 10:09:30,"FALTAM 9 DIAS Dia 06 de novembro, os CAMPEÕES de 2019, estarão se confrontando pela premiação de R$ 4.000,00. Transmissões: • http://facebook.com/ewars.torneios • http://youtube.com/ewarstorneiosbrasil … As inscrições para 2020 já estão abertas: http://ewars.com.br Are you ready for the battle?pic.twitter.com/RpYHHm7mi2",1188804988132302848
2019-10-28 10:09:07,Não perca! – Estão abertas as inscrições do certame! https://jornaisvirtuais.com.br/nao-perca-estao-abertas-as-inscricoes-do-certame-9/ …,1188804888995590145
2019-10-28 10:08:37,DESENVOLVIMENTO SOCIAL | Casamento Comunitário está com inscrições abertas. Confira https://bit.ly/32T1Sjx # prefeituradejataipic.twitter.com/S5I1PYnsCO,1188804763149918215
2019-10-28 10:04:55,As inscrições para o Programa de Estágio 2020 da Corteva Agriscience ainda estão abertas! Mas corre que o prazo está chegando ao fim! Quer saber mais? Acesse: http://www.ciadeestagios.com.br/corteva pic.twitter.com/ys5aZfFp37,1188803835470516230
2019-10-28 10:03:45,Educar é a nossa MISSÃO! Vestibular de # Medicina UniREDENTOR! 30 de Novembro em Itaperuna-RJ! INSCRIÇÕES: http://redentor.edu.br/vestibular?utm_source=social&utm_medium=Twitter&utm_campaign=Vestibular&utm_term=Vestibular&utm_content=Vestibular%20Twitter … # OFUTUROÉAGORA # UNIREDENTORpic.twitter.com/3sDdYSwoTt,1188803541919584259
2019-10-28 10:03:44,"Inscrições abertas, garanta já sua vaga em http://www.fereformadanordeste.com.br pic.twitter.com/HF2OhdtP4h",1188803534709514241
2019-10-28 10:03:42,Inscrições abertas para a 4ª Mostra de Árvores Natalinas de Indaial https://clikado.com.br/noticia/14473/inscricoes-abertas-para-a-4--mostra-de-arvores-natalinas-de-indaial#.XbbmvesX5fI.facebook …,1188803527717588992
2019-10-28 10:01:19,Inscrições podem ser feitas até dia 1º de novembro. https://www.waldineypassos.com.br/juazeiro-prefeitura-abre-selecao-para-preencher-vagas-na-ama-e-ipj/ …pic.twitter.com/9FyEnW63Nf,1188802927676350464
2019-10-28 10:00:53,Bolsas do governo francês para pós-graduação na França com inscrições abertas http://zpr.io/6eYzV # travel # trip # viajar # viagem # turismo # vistoconsular,1188802817768787968
2019-10-28 10:00:00,Boas oportunidades em 2020 para vagas de estágio e trainee; inscrições começam nesta segunda http://hoje.vc/2jebm,1188802596762308608
2019-10-28 09:59:47,Muitas e boas razões para visitar Penacova no fim de semana de S. Martinho. Inscrições no # PNTC2019 em: http://www.carlossanatureevents.com/pntc https://www.facebook.com/carlos.sa.5011/posts/2967817819912857 …,1188802540516921344
2019-10-28 09:59:14,Inscrições para o seletivo da Força Estadual de Saúde terminam nesta segunda: https://oimparcial.com.br/concursos-e-emprego/2019/10/inscricoes-para-o-seletivo-da-forca-estadual-de-saude-terminam-nesta-segunda-feira-28/ … # OImparcial # AsNotícias,1188802404478849026
2019-10-28 09:58:54,estão abertas as inscrições vantagens: esse bombom da foto desvantagens: o bombom que tirou a foto https://twitter.com/ehotaldokike/status/1188801871089192960 …pic.twitter.com/oiTD1YP38z,1188802320970199040
2019-10-28 09:58:47,"# ConexãoEducação | # Taquara | # TransformaçãoDigital Projeto Transformação Digital na Educação está com as inscrições abertas Desde abril deste ano, 600 educadores já participaram do projeto. Confira detalhes. Apoio: Super da família http://www.conexaonoticiasvp.com.br/noticias/educacao/883076/1 …",1188802290808963074
2019-10-28 20:59:40,Bueno yo creo que las encuestas se hacen Solo que los resultados buenos se los quedan. Eso sí. Pero las encuestas las hacen. Tenlo seguro. Que así tienen encuestas gratuitas,1188968605058326530
2019-10-28 20:55:20,"Del 30 de octubre al 3 de noviembre disfruta del Festival del Mictlán en # LaJoyaDeLaCorona con actividades gratuitas para toda la familia. Habrá música, danza, exposiciones, talleres, recorridos de leyendas, concursos de calaveras y proyecciones de películas. ¡No te lo pierdas! pic.twitter.com/Dv8B8X0nMh",1188967517726953483
2019-10-28 20:54:42,"As melhores coisas da vida são gratuitas: abraços, sorrisos, amigos, beijos, família, dormir, amor, risos e boas lembranças. # exercitodeamor",1188967354916573184
2019-10-28 20:54:03,Cummins se sumó a la lucha contra el cáncer de mama otorgando 110 mastografías y asesorías gratuitas. https://bit.ly/2BP7yPv,1188967191644901376
2019-10-28 20:52:27,hoje eu to me segurando pra não tecer críticas gratuitas que nenhuma pessoa pediu sobre elas,1188966792456294400
2019-10-28 20:51:00,Nuevo acuerdo para derivar consultas jurídicas gratuitas en # CABA +info: http://argentina.gob.ar/noticias/acuerdan-unificar-la-derivacion-de-consultas-juridicas-gratuitas-en-la-ciudad … @ mfrodriguezokpic.twitter.com/iZHffBGk9U,1188966424661909510
2019-10-28 20:49:08,Un abrazo al cielo para tí @ sotomayor_el Se t extraña x aquí Envía tu luz y protege a tu familia de las agresiones gratuitas recibidas estos días en la red.Oscuros humanos abundan tú lo sabes # Sotito en tu nombre le ha devuelto la sonrisa a la abuelita Lila.Sigues akipic.twitter.com/CpJ1gzA9kR,1188965955168358400
2019-10-28 20:46:33,"Confira o que vai rolar na segunda edição da maior feira literária de Niterói! Dia 7 a 10 de novembro no Praia Clube São Francisco com entrada e atividades gratuitas, NÃO PERCA! # flinit # praiaclube # infantil # feiraliteraria # literatura # leitura # literaturanacional # livropic.twitter.com/MhaAXdA3bP",1188965306611449856
2019-10-28 20:45:00,El lunes 11 de noviembre llega al Parque Simón Bolívar la quinta edición de Planetario al Parque con actividades gratuitas → http://bit.ly/2PxU3vs,1188964914976772102
2019-10-28 20:43:31,"Como mínimo a uno lo detuvieron. En concreto al que llevaba el chaleco militar. Después de dispersar en Pau Claris, dejaron que ese grupo se fuera a las Ramblas, donde hicieron un barrido. Bajaban los mossos por las ramblas formando como el puto Bolshoi, nada de hostias gratuitas",1188964542707130368
2019-10-28 20:42:53,"El sacerdote es la mediación simbólica personal de Cristo, la visibilización corporal de la capitalidad de Cristo. El cuidado de la Creación obrada por Dios Padre, no puede reducirse a una ñoñería de pajaritos y helechos. Más Catecismo y teología y menos banalidades gratuitas.",1188964383961108487
2019-10-28 20:42:46,SEJUS NOS CEUs DAS ARTES DO DISTRITO FEDERAL Oficina de Artesanato em nosso Ceu das Artes do Recanto das Emas Temos 1 vezes por semana - Oficinas Gratuitas de Artesanato no CEU das Artes do Recanto das Emas… https://www.instagram.com/p/B4LkNPLhKjj/?igshid=195sar8id769x …,1188964355913768968
2019-10-28 20:38:41,"El problema no es Macri.. los izquierdistas dañan al estado y el q viene, sea quien sea, tardará tiempo en reconstruir y mientras la gente con cerebro de pollo quiere todo funcionando rápido y en vez de aportar, buscan de nuevo al Verdugo para q prometa más ilusiones gratuitas.",1188963326405021696
2019-10-28 20:38:36,SEJUS NOS CEUs DAS ARTES DO DISTRITO FEDERAL Todos os dias os moradores de todas as idades do Recanto das Emas acordam cedo para fazerem ginástica em nosso Ceu das Artes. Temos 3 vezes por semana - Aulas Gratuitas… https://www.instagram.com/p/B4Ljs70BvcO/?igshid=n042u5dwockw …,1188963305127329793
2019-10-28 20:35:32,EJA do Sesc Amazonas oferece 77 vagas gratuitas https://amazonasnoticias.com.br/eja-do-sesc-amazonas-oferece-77-vagas-gratuitas/?utm_source=dlvr.it&utm_medium=twitter …,1188962532133724160
2019-10-28 20:35:07,"El Consulado General de Guatemala en Phoenix, Arizona le agradece a @ SaludMaricopa por brindar revisiones de presión arterial gratuitas a la comunidad guatemalteca. # AlServiciodelacomunidadGuatemalteca # GuatemaltecosenArizonapic.twitter.com/NFQEDd3zcf",1188962428643471360
2019-10-28 20:32:28,"# Consultas # Gratuitas La Traumatología es la rama de la medicina que se dedica al estudio de las lesiones del aparato locomotor. Abarca también el estudio de aquellas congénitas o adquiridas, en sus aspectos… https://www.instagram.com/p/B4LjEdXFSvm/?igshid=dutt8wl5t0kj …",1188961761602539523
2019-10-28 20:29:24,"Inscrições gratuitas e limitadas, confirme sua inscrição o quanto antes e garanta a participação de sua empresa! https://www.facebook.com/100000913618700/posts/3577621102278308/ …",1188960988239978498
