date,text,id
2019-10-21 19:21:45,A Globo continua insistindo em falar em Lava Jato. A Lava Jato acabou! Sabemos que a Globo age assim porque é sócia da Lava Jato.,1186407250992259078
2019-10-21 19:21:27,"Em 7 minutos, advogado dá aula de ética, decência e direito a ministros do STF e a advogados de criminosos da Lava Jato (Veja o Vídeo) https://www.jornaldacidadeonline.com.br/noticias/16933/em-7-minutos-advogado-da-aula-de-etica-decencia-e-direito-a-ministros-do-stf-e-a-advogados-de-criminosos-da-lava-jato-veja-o-video …",1186407176631439360
2019-10-21 19:21:25,PRA QUEM USA O AVIAO GRANDE DA PRESIDENCIA PRA IR DE BRASILIA A SAO PAULO QUER FALAR O QUE NÉ?SERA QUE SAI MAIS BARATO QUE UM JATO DE PEQUENO PORTE?,1186407166422503431
2019-10-21 19:20:53,"O Brasil precisa de pessoas honestas...Em 7 minutos, advogado dá aula de ética, decência e direito a ministros do STF e a advogados de criminosos da Lava Jato (Veja o Vídeo) https://www.jornaldacidadeonline.com.br/noticias/16933/em-7-minutos-advogado-da-aula-de-etica-decencia-e-direito-a-ministros-do-stf-e-a-advogados-de-criminosos-da-lava-jato-veja-o-video …",1186407031789572096
2019-10-21 19:20:39,"Mas nunca é demais expor o ridículo dessa gente,nunca!",1186406972842639361
2019-10-21 19:20:25,"Baaah, mas teve gente que acreditou que um cara que passou 344253 mil anos como deputado sem fazer nada de bom faria alguma coisa boa como presidente. Essa gente acredita em qualquer besteira, Chê.",1186406913170460672
2019-10-21 19:20:23,Lava Jato: Deputados do RJ decidirão sobre soltura presos sem ler processo. Parlamentares chamaram de 'cretina' decisão do STF de dar à Assembleia a palavra final sobre prisões. https://veja.abril.com.br/politica/lava-jato-deputados-do-rj-decidirao-sobre-soltura-presos-sem-ler-processo/ … via @ VEJA,1186406906002333696
2019-10-21 19:20:22,"André Ceciliano (PT) ,Presidente da ALERJ, articulou e optaram por soltar os deputados presos pela Op. Lava Jato. O STF não quis decidir sobre o caso dos corruptos, e concedeu autonomia ao Presidente petista para decidir. Só resta rir desse STF kkkk",1186406901258641408
2019-10-21 19:20:18,Lava Jato: Deputados do RJ decidirão sobre soltura de presos sem ler processo https://veja.abril.com.br/politica/lava-jato-deputados-do-rj-decidirao-sobre-soltura-presos-sem-ler-processo/ …pic.twitter.com/TxENv8ZmcD,1186406885282455555
2019-10-21 19:20:17,"Eu fico imaginando se o Haddad fosse eleito, ele visitando a Venezuela, regulando a mídia, desemprego aumentando, lula livre , lava jato encerrada e os esquerdas apoiando pq o aborto estava liberado e gay começaria a receber cotas nas faculdades..",1186406882904174592
2019-10-21 19:20:16,É que sempre haverá idiotas dispostos a acreditar nos maiores absurdos,1186406878923972609
2019-10-21 19:20:16,CCJ da Alerj vota pela soltura de deputados presos na Lava Jato - ISTOÉ Independente https://istoe.com.br/ccj-da-alerj-vota-pela-soltura-de-deputados-presos-na-lava-jato/ …,1186406876432519170
2019-10-21 19:20:15,Recusou promoção para continuar na Lava Jato. https://oglobo.globo.com/brasil/3046-deltan-recusa-hipotese-de-promocao-para-continuar-na-lava-jato-em-curitiba-24032438 …,1186406874306011136
2019-10-21 19:20:04,"E então, quem vai investigar os crimes cometidos pelo bandido por trás do Pavão Misterioso? https://www.brasil247.com/midia/joice-hasselmann-revela-que-carluxo-e-o-pavao-misterioso#.Xa4U6P388jU.twitter … # ForaSalles # ForaBolsonaroESeuBandoDeCriminosos # BolsonaroVagabundo # SergioMoroJuizLadrao # CPI_DA_lava_jato_JÁ # CPIdoBNDES # FalaMaisJoiceHasselmanpic.twitter.com/hvuBoJBu10",1186406828013510657
2019-10-21 19:20:02,Deltan abre mão de promoção para ficar na Lava Jato https://www.jornal21brasil.com.br/2019/10/deltan-abre-mao-de-promocao-para-ficar.html#.Xa4vAes-YXU.facebook …,1186406819947843584
2019-10-21 19:20:00,Deltan abre mão de promoção para ficar na Lava Jato http://bit.ly/33TFPJB (via @ fausto_macedo),1186406808799326208
2019-10-21 19:20:00,Deltan Dallagnol abre mão de promoção para ficar na Lava Jato - https://libe.vc/2IEUjeaerrEU/,1186406808757227520
2019-10-21 19:19:59,Só caiu quem não tem coragem de pesquisar por 2 minutos e acredita no Zap. Essa semana comecei derrubando 3 fakenews que meus pais estavam não só acreditando como espalhando. É trabalho de formiguinha.,1186406805682958337
2019-10-21 19:19:40,"Esse é um dos piores. Como está o andamento do seu processo na Lava Jato, Drácula? Desculpa, @ senadorhumberto? # ForoTerrorista NÃO",1186406725894791169
2019-10-21 19:19:22,"quando eu quero chegar ""tarde"" na faculdade, o 457 vem igual jato.",1186406651794022400
2019-10-21 19:19:02,"Né? Parece que perdeu as estribeiras... Ameaçando o Brasil, querendo implantar o # ForoTerrorista aqui... Crianças... nem tentem. Aliás, @ senadorhumberto, e o seu processo na Lava Jato, como está indo?",1186406566410539008
2019-10-21 19:18:58,Deltan Dallagnol abre mão de promoção para ficar na Lava Jato https://exame.abril.com.br/brasil/deltan-dallagnol-abre-mao-de-promocao-para-ficar-na-lava-jato/ …,1186406551692742656
2019-10-21 19:18:52,Deltan abre mão de promoção para continuar na Lava Jato https://pleno.news/brasil/deltan-abre-mao-de-promocao-para-continuar-na-lava-jato.html …,1186406523112742918
2019-10-21 19:18:50,Deltan Dallagnol abre mão de promoção para ficar na Força Tarefa da Lava Jato https://www.contextoexato.com.br/post/deltan-dallagnol-abre-mao-de-promocao-para-ficar-na-forca-tarefa-da-lava-jato20191021 …,1186406517492334593
2019-10-21 19:18:48,Deltan recusa promoção e fica na Lava Jato. Deltan Dallagnol enviou hoje ao Conselho Superior do MPF ofício em que recusa disponibilidade para ocupar vagas abertas nas Procuradorias Regionais no Rio Grande do Sul ou Brasília. # ForoDeSPTerroristahttps://www.oantagonista.com/brasil/deltan-recusa-promocao-e-fica-na-lava-jato/ …,1186406509263147008
2019-10-21 19:18:22,"Lula sairá da cadeia direto para o palanque. A Lava Jato pode ter matado o Lulinha paz e amor para criar no lugar um líder insurgente, extremado e radicalizado. Um Lula sob medida para se contrapor ao radicalíssimo Bolsonaro # LulaLivrehttps://osnovosinconfidentes.com.br/lula-saira-da-cadeia-direto-para-o-palanque-e-para-o-confronto/ …",1186406397182910470
2019-10-21 19:18:15,Novo Post: CCJ da Alerj vota pela soltura de deputados presos na Lava Jato http://bastidoresdopoder.com.br/ccj-da-alerj-vota-pela-soltura-de-deputados-presos-na-lava-jato/ …,1186406371081760770
2019-10-21 19:18:09,STF perdeu o medo da sociedade e a maioria dos ministros votou a favor de uma tese que anula condenações da Lava Jato. https://media3.giphy.com/media/v1.Y2lkPTEyMGMwMTQ3ZDFhZDk4NWViMDA5OGU3NWZhN2JhMDQ0NDJhZGM0NjFkYzU0YzRjNg/JpdjC3bCBKlA0zt8PP/giphy.gif …,1186406343558729729
2019-10-21 19:18:07,CCJ da Alerj vota pela soltura de deputados presos na Lava Jato via @ DiariodoPoderhttps://diariodopoder.com.br/ccj-da-alerj-vota-pela-soltura-de-deputados-presos-na-lava-jato/ …,1186406337456070657
2019-10-21 19:18:05,"Que tentem. Venham mexer com o Brasil, venham. Aliás, senador, como está indo o seu processo na Lava Jato? # ForoTerrorista aqui não!!!",1186406327171592193
2019-10-21 19:17:57,Ele ganha muito mais usando a lava jato para alavancar as próprias palestras,1186406294913273856
2019-10-21 19:17:49,"Em 7 minutos, advogado dá aula de ética, decência e direito a ministros do STF e a advogados de criminosos da Lava Jato (Veja o Vídeo) https://www.jornaldacidadeonline.com.br/noticias/16933/em-7-minutos-advogado-da-aula-de-etica-decencia-e-direito-a-ministros-do-stf-e-a-advogados-de-criminosos-da-lava-jato-veja-o-video …",1186406259995631616
2019-10-21 19:17:40,"cara, é desolador",1186406224448892934
2019-10-21 19:17:20,"No limiar da Lava Jato a corrupção segue a todo vapor. E ainda há os ""honestos"" com a impetuosa coragem de agir contra a maior operação anti corrupção já feita no Brasil. Por isso me tenho perguntado, quem é de verdade contra a corrupção? https://g1.globo.com/politica/noticia/2019/10/21/pf-mira-deputado-em-operacao-para-desarticular-esquema-fraudes-em-fundos-de-pensao.ghtml …",1186406137027010565
2019-10-21 19:17:18,A VAZA JATO DA MUITOOOOOOO MAIS DINHEIRO este cara pode ser idiota mas nao e burro. pic.twitter.com/PKKaLDMOLS,1186406129020084225
2019-10-21 19:17:03,Era melhor o Deltan ou qualquer outro que apoia a Lava Jato ...,1186406066462121985
2019-10-21 19:16:57,Firme Lava Jato!,1186406041136828416
2019-10-21 19:16:38,Agora com Essa Lei de Abuso de Autoridade nenhum Canalha vai temer a CORRUPÇÃO ou a lava jato... O STF está Legislando em favor da bandidagem.... Corja protegem corjas.....,1186405963038953473
2019-10-21 19:16:33,CCJ da Alerj vota pela soltura de deputados presos na Lava Jato - https://www.agoranoticiasbrasil.com.br/ccj-da-alerj-vota-pela-soltura-de-deputados-presos-na-lava-jato/ …,1186405941736067072
2019-10-21 19:16:33,# ForaSalles # ForaOfficeBoyDeRuralista,1186405940188327936
2019-10-21 19:16:23,"Em geral, tudo que a direita acusa... é aquilo que ela mesma faz. Não falha nunca.",1186405900141117440
2019-10-21 19:16:18,"Dr Gilmar, o desemprego já éra grande, somado ao desmonte q a lava jato fez nas empresas de construção civil, por extensão no comércio de mat de construção, varias outras. O desemprego cresceu de forma assustadora, extrema pobreza aumentando como poupar.",1186405880004251648
2019-10-21 19:16:02,"Todo apoio ao @ deltanmd e à toda equipe da força tarefa da Lava Jato. Que não se intimidem com esse maldito PGR Aras, infelizmente determinado a blindar corruptos. # PacoteAntiCrimeJa # PrisaoEm2aInstanciaSim # LavaTogaJá",1186405813340033025
2019-10-21 19:15:55,"Não se apavorem, a água bate na bunda de todos. A polícia federal não descansa. A Lava Jato vai te pegar.",1186405781257818114
2019-10-21 19:15:04,Deltan Dallagnol abre mão de promoção para ficar na Lava Jato http://dlvr.it/RGgbqQ # ariquemesonline # emrondonia # ultimasnoticias,1186405567385890816
2019-10-21 19:15:00,Dallagnol abre mão de promoção para ficar na Lava Jato http://leiaja.me/7vPBbK # TánoLeiaJápic.twitter.com/hJJLfRu2bj,1186405550474567680
2019-10-21 19:14:56,Nao duvido isso ter sido uma manobra pra tirar ele da lava jato ..... porém ainda existem pessoas q não visão poder mas a ética e justiça,1186405535622553601
2019-10-21 19:14:54,Leoni a Jato Ministro da destruição https://twitter.com/Leoni_a_jato/status/1186322297910677504 …,1186405525950472192
2019-10-21 19:14:18,Deltan recusa promoção e fica na Lava Jato!! Para terminar de EXTERMINAR os corruptos!! Valeu Deltan!! Estamos contigo!! https://www.oantagonista.com/brasil/deltan-recusa-promocao-e-fica-na-lava-jato/ …,1186405373814738944
2019-10-21 19:14:10,Pra Quem acreditou na mamadeira de piroca....rebelião no Chile com apoio do foro de São Paulo é fichinha.,1186405342437167104
2019-10-21 19:14:03,Depois não entendem porque os estádios ficam vazios. Tem que demonstrar raça e determinação. Tem gente fazendo corpo mole. Era jogo pra levar 3 no mínimo.,1186405311156051969
2019-10-21 19:13:59,"Em 7 minutos, advogado dá aula de ética, decência e direito a ministros do STF e a advogados de criminosos da Lava Jato (Veja o Vídeo) https://www.jornaldacidadeonline.com.br/noticias/16933/em-7-minutos-advogado-da-aula-de-etica-decencia-e-direito-a-ministros-do-stf-e-a-advogados-de-criminosos-da-lava-jato-veja-o-video …",1186405294877921280
2019-10-21 19:13:44,"Deltan é um homem íntegro. Atacaram seu trabalho, denegriram sua imagem. Continuo firme nas convicções que tenho em relação ao seu excelente trabalho frente a operação Lava jato.",1186405233863397378
2019-10-21 19:13:42,Lava Jato: Deputados do RJ decidirão sobre soltura presos sem ler processo. https://wp.me/p7qnr3-dFpc,1186405222442262528
2019-10-21 19:13:33,Deltan recusa promoção e fica na Lava Jato - https://www.oantagonista.com/brasil/deltan-recusa-promocao-e-fica-na-lava-jato/ …,1186405185863553024
2019-10-21 19:12:57,"Glenn: Lava Jato foi facção, liderada por Moro, que exerceu poder por 5 ... https://youtu.be/1KYJhVoOlqw via @ YouTube",1186405035476959233
2019-10-21 19:12:25,"Se se candidatar ele vence com folga, não importa o que tenha dito. Moro é reconhecido internacionalmente pelo seu belo trabalho na Operação Lava-jato.",1186404903272550400
2019-10-21 19:11:49,"Destemido, Deltan desmascara Toffoli e pede apoio da sociedade para salvar a Lava Jato http://disq.us/t/37cvx3q",1186404752470564869
2019-10-21 19:11:33,Deltan recusa hipótese de promoção para continuar na Lava-Jato em Curitiba Procurador pediu nesta segunda-feira ao Conselho Superior do MPF para não integrar lista de aptos a serem promovidos https://www.agoranoticiasbrasil.com.br/deltan-recusa-hipotese-de-promocao-para-continuar-na-lava-jato-em-curitiba/ …,1186404683713335296
2019-10-21 19:11:19,"Parabéns Deltan, seu trabalho na Lava Jato é mais importante para o Brasil, apesar de que todos nós o queríamos na PGR que Bolsonaro pisou na bola !",1186404624867254273
2019-10-21 19:11:11,Deltan recusa hipótese de promoção para continuar na Lava-Jato em Curitiba Procurador pediu nesta segunda-feira ao Conselho Superior do MPF para não integrar lista de aptos a serem promovidos https://www.agoranoticiasbrasil.com.br/deltan-recusa-hipotese-de-promocao-para-continuar-na-lava-jato-em-curitiba/ …,1186404591807676416
2019-10-21 19:11:01,Poucos trouxas caem nesse papinho... A maioria é mal intencionada mesmo e manipula o gado incauto.,1186404549642407936
2019-10-21 19:10:53,Deltan recusa hipótese de promoção para continuar na Lava-Jato em Curitiba Procurador pediu nesta segunda-feira ao Conselho Superior do MPF para não integrar lista de aptos a serem promovidos https://www.agoranoticiasbrasil.com.br/deltan-recusa-hipotese-de-promocao-para-continuar-na-lava-jato-em-curitiba/ …,1186404516478046209
2019-10-21 19:10:49,Deltan Dallagnol decide recusar promoção e permanece na Lava Jato https://mblnews.org/noticia/deltan-dallagnol-decide-recusar-promocao-e-permanece-na-lava-jato/ …,1186404499155501056
2019-10-21 19:10:44,Deltan recusa promoção e fica na Lava Jato https://www.oantagonista.com/?p=266988,1186404476560838657
2019-10-21 19:10:38,"É a guerra híbrida do Steve Bannon, a familícia está usando o canhão de fakenews p espalhar mentiras e lucrar c o caos",1186404452707815425
2019-10-21 19:10:37,Deltan recusa hipótese de promoção para continuar na Lava-Jato em Curitiba Procurador pediu nesta segunda-feira ao Conselho Superior do MPF para não integrar lista de aptos a serem promovidos https://www.agoranoticiasbrasil.com.br/deltan-recusa-hipotese-de-promocao-para-continuar-na-lava-jato-em-curitiba/ …,1186404447867588609
2019-10-21 19:10:28,Deltan recusa hipótese de promoção para continuar na Lava-Jato em Curitiba Procurador pediu nesta segunda-feira ao Conselho Superior do MPF para não integrar lista de aptos a serem promovidos https://www.agoranoticiasbrasil.com.br/deltan-recusa-hipotese-de-promocao-para-continuar-na-lava-jato-em-curitiba/ …,1186404410815078405
2019-10-21 19:10:15,Deltan abre mão de promoção para ficar na Lava Jato https://politicalivre.com.br/2019/10/deltan-abre-mao-de-promocao-para-ficar-na-lava-jato/ …,1186404354938621954
2019-10-21 19:09:50,Chats mostram que Sergio Moro também direcionava ações da Polícia Federal na Lava Jato https://theintercept.com/2019/10/19/sergio-moro-policia-federal-lava-jato/ …,1186404252815675392
2019-10-21 19:09:45,"“Ninguém foi preso injustamente na Lava Jato e nada vai mudar essa verdade”, diz Moro https://republicadecuritiba.net/2019/10/11/ninguem-foi-preso-injustamente-na-lava-jato-e-nada-vai-mudar-essa-verdade-diz-moro/ …",1186404231466672129
2019-10-21 19:09:40,A lava jato É uma farsa.,1186404209782149120
2019-10-21 19:09:35,É pra desviar o foco da vasa jato!,1186404190358249472
2019-10-21 19:09:22,Deltan recusa promoção e fica na Lava Jato - O Antagonista https://www.oantagonista.com/brasil/deltan-recusa-promocao-e-fica-na-lava-jato/ …,1186404131927408641
2019-10-21 19:09:05,Quando você usa os critérios da lava-jato para falar de cinema https://twitter.com/chicobarney/status/1186001711019778048 …,1186404061337268225
2019-10-21 19:08:50,https://twitter.com/fecmar1/status/1185576067010048000?s=19 …,1186403999903309826
2019-10-21 19:08:45,Charpter 11 vindo à jato em menos de 1 ano. https://twitter.com/brains9/status/1186346902050263047 …,1186403980437577729
2019-10-21 19:08:31,"Sé que esto probablemente a Glovo ni le importe ni lo sienta, pero hoy en vez de pedir Glovo (como hago muy seguido) hice mi pedido directamente en el menucito que queda por mi jato. No podemos ser cómplices de # GlovoAbusivo",1186403918542192641
2019-10-21 19:08:30,Deltan recusa promoção e vai continuar na Lava Jato - https://noticiasamericadosul.com/2019/10/21/deltan-recusa-promocao-e-vai-continuar-na-lava-jato/ …,1186403914754805766
2019-10-21 19:08:21,"Esse povo gosta mesmo é de ser alienado e manipulado pelo mau caráter que se diz presidente. Não pode questionar a maldade não, tem que assinar embaixo.",1186403878000058370
2019-10-21 19:08:16,"No confundas las cosas, la corrupción en America Latina es un hecho. Lava Jato, OAS en Brasil, los Kirchner con sus bolsas de dólares en Argentina y acá con Soquimich. En resumen la política en general es una mierda, sea de izquierda o derecha.",1186403857141768194
2019-10-21 19:08:03,Deltan abre mão de promoção para continuar na Lava Jato https://pleno.news/brasil/deltan-abre-mao-de-promocao-para-continuar-na-lava-jato.html?utm_source=Social&utm_medium=facebook …,1186403801642754048
2019-10-21 19:07:45,Deltan recusa promoção e fica na Lava Jato https://www.oantagonista.com/?p=266988,1186403728791920642
2019-10-21 19:07:22,o brasil tá afundado em corrupção e lava jato e a petrobras já não é a mesma há mto tempo. a transpetro tb já foi vendida ou pq vc acha q tá pagando mais de 5$ pela gasolina? cara para de encher meu saco pq pelo jeito vc não sabe nada,1186403628850057216
2019-10-21 19:07:10,Dallagnol rejeita prêmio de consolação para afastar-se do comando da Lava Jato https://www.diariodocentrodomundo.com.br/essencial/dallagnol-rejeita-premio-de-consolacao-para-afastar-se-do-comando-da-lava-jato/ … via @ iG,1186403582293225472
2019-10-21 19:07:09,Não dá para acreditar que um monte de gente caiu nessa conversinha maluca de que as manifestações populares na América Latina são tramadas pelo Foro de São Paulo. Se tivesse essa força não tinha tido golpe. A maluquice do astrólogo federal parece ser muito contagiosa!,1186403577432031237
2019-10-21 19:06:54,Pelo que eu entendi o dono do alub foi preso pq tava envolvido na lava jato e meio que sumiu com todo o dinheiro. Aí os professores tavam até de greve pq não tavam recebendo salário,1186403515171782656
2019-10-21 19:06:52,Deltan recusa promoção e fica na Lava Jato https://www.oantagonista.com/?p=266988,1186403503981449220
2019-10-21 19:06:21,"Em 7 minutos, advogado dá aula de ética, decência e direito a ministros do STF e a advogados de criminosos da Lava Jato (Veja o Vídeo) https://www.jornaldacidadeonline.com.br/noticias/16933/em-7-minutos-advogado-da-aula-de-etica-decencia-e-direito-a-ministros-do-stf-e-a-advogados-de-criminosos-da-lava-jato-veja-o-video …",1186403374201278464
2019-10-21 19:06:20,Jato de tinta é muito inferior?,1186403370480930819
2019-10-21 19:05:31,E eu um lava jato pqp https://twitter.com/littlevsnx/status/1186402331073699840 …,1186403164188270592
2019-10-21 19:04:59,"Um pilar do idealismo é a autoridade do povo na defesa dos seus desejos gerais, numa democracia bem representada. É nesse sentido que eu vejo o Dr. Deltan Dallagnol como um grande defensor do povo. Parabéns, Dr. Dallagnol, pela sua decisão de permanecer da Lava Jato de Curitiba.",1186403029303676928
2019-10-21 19:04:46,As únicas opções viaves era o Deltan ou Alguém com forte atuação na lava jato.,1186402974593159168
2019-10-21 19:04:15,"PARABÉNS @ deltanmd Os Brasileiros do BEM tem um GRANDE orgulho pelo excelente trabalho exercido à FRENTE da Lava Jato!!! É verdade que não tem sido Fácil aos Senhores, no entanto o legado será SEMPRE lembrado!!!! Muitíssimo Obrigado",1186402845060468736
2019-10-21 19:04:09,Vaza Jato: Moro autorizou busca e apreensão que 'não foi pedida por ninguém' - Sul 21 https://www.sul21.com.br/ultimas-noticias/politica/2019/10/vaza-jato-moro-autorizou-busca-e-apreensao-que-nao-foi-pedida-por-ninguem/ …,1186402820150452230
2019-10-21 19:04:04,O Ailton nao fez nenhuma contribuição pra lava jato. Na verdade em todos seus anos de carreira nunca vi ele move um processo contra um politico. Isso só pode dizer duas coisas Ou na região que atua não existe político corrupto ou ele tá pouco se lixando pro cbt a corrupção,1186402801691348992
2019-10-21 19:04:03,"De Qual Liberdade Estamos Falando, em 7 minutos advogado dá aula de ética, decência e direito a ministros do STF e a advogados de criminosos da Lava Jato. pic.twitter.com/mfDi8Porfv",1186402795534069760
2019-10-21 19:03:54,Deltan Dallagnol abre mão de promoção para ficar na Lava Jato - ISTOÉ Independente https://istoe.com.br/deltan-dallagnol-abre-mao-de-promocao-para-ficar-na-lava-jato/#.Xa4rRxrEsyc.twitter …,1186402759769235458
2019-10-21 19:03:48,"Deltan abre mão de promoção, para continuar na Lava Jato É patriota, tanto qto o Min Moro Se toda nossa política fosse conduzida por pessoas, comprometidas com o Brasil Hoje estaríamos ao lado do USA Em qualidade de vida, para todos os brasileiros Sem Pts",1186402732669833218
2019-10-21 19:03:47,"Em 7 minutos, advogado dá aula de ética, decência e direito a ministros do STF e a advogados de criminosos da Lava Jato (Veja o Vídeo) https://www.jornaldacidadeonline.com.br/noticias/16933/em-7-minutos-advogado-da-aula-de-etica-decencia-e-direito-a-ministros-do-stf-e-a-advogados-de-criminosos-da-lava-jato-veja-o-video …",1186402730509787136
2019-10-21 19:03:34,@ jairbolsonaro @ GeneralMourao @ SF_Moro @ policiafederal @ JusticaGovBR Esse é o Senador Humberto Costa. Esta citado na Lava Jato e RECEBEU PROPINA da ODEBRECHT e ameaça Jair Bolsonaro e seu Governo? Policia Federal cadeia nele com foro ou sem foro. pic.twitter.com/ARuQaIZXkT,1186402672183828480
2019-10-21 19:03:07,Deltan recusa promoção para continuar na Lava Jato em Curitiba https://www.brasil247.com/brasil/deltan-recusa-promocao-para-continuar-na-lava-jato-em-curitiba#.Xa4rF9Lfsek.twitter …,1186402561500336131
2019-10-21 19:02:29,,1186402402083246080
2019-10-21 19:02:24,"Em 7 minutos, advogado dá aula de ética, decência e direito a ministros do STF e a advogados de criminosos da Lava Jato (Veja o Vídeo) https://www.jornaldacidadeonline.com.br/noticias/16933/em-7-minutos-advogado-da-aula-de-etica-decencia-e-direito-a-ministros-do-stf-e-a-advogados-de-criminosos-da-lava-jato-veja-o-video …",1186402378817396738
2019-10-21 19:02:17,Decisão de Carmen Lúcia acaba com a Lava Jato - e a culpa é do Moro https://www.youtube.com/watch?v=qDwKsqOX61E&feature=share …,1186402349797007360
2019-10-21 19:02:15,mano te quedaste jato en el teclado,1186402343971180544
2019-10-21 19:01:50,"É difícil entender por q o Bolsonaro escolheu o Aras, sabidamente de esquerda, totalmente contra a Lava Jato... Este Aras, foi aprovado pelo Toffoli, tudo combinado para sepultar a Lava Jato !!! Presidente Jair,por q, abandonou a bandeira de combater a corrupção, promessa sua PR",1186402237708414981
2019-10-21 19:01:18,Este senadorzinho não é investigado pela Jaula Jato?,1186402105847930880
2019-10-21 19:01:14,Maaaaaas a Lava Jato já não foi sepultada??? É o que se ouve por aí...,1186402088659632128
2019-10-21 19:01:14,"Sem promoção, Deltan fica na Lava Jato http://bit.ly/2p3aFjV",1186402088202440705
2019-10-21 19:00:35,Não quebrou. Houve uma queda nos preços das commodities no final de 2014 e em 2015 o Cunha(com medo da lava--jato) não deixou a Dilma governar.,1186401924179988481
2019-10-21 19:00:26,"Agora a máscara do Aras irá cair, com o Deltan a frente da Lava Jato saberemos o que realmente está ocorrendo com a força tarefa. Parabéns Deltan, que orgulho # EuApoioDeltan",1186401887563722752
2019-10-21 19:00:26,Deltan Dallagnol recusa promoção e mudança para Porto Alegre para ficar na Lava Jato https://www.videversus.com.br/deltan-dallagnol-recusa-promocao-e-mudanca-para-porto-alegre-para-ficar-na-lava-jato/ …,1186401884527087617
2019-10-21 19:00:26,"Em 7 minutos, advogado dá aula de ética, decência e direito a ministros do STF e a advogados de criminosos da Lava Jato (Veja o Vídeo) https://www.jornaldacidadeonline.com.br/noticias/16933/em-7-minutos-advogado-da-aula-de-etica-decencia-e-direito-a-ministros-do-stf-e-a-advogados-de-criminosos-da-lava-jato-veja-o-video …",1186401883730141184
2019-10-21 19:00:15,Deltan recusa promoção e vai continuar na Lava Jato https://portaldfm.com/deltan-recusa-promocao-e-vai-continuar-na-lava-jato/ …,1186401840998600705
2019-10-21 19:00:00,Deve ter gente com medo dele contar toda a sacanagem que foi feita na lava jato.,1186401774598590464
2019-10-21 18:59:58,Recebi um jato de água benta que me sinto abençoada pelas próximas 3 gerações,1186401767891914753
2019-10-21 18:59:35,Se esse sujeito fosse presidente censurava a imprensa e fechava o congresso. É um perigo pra democracia e a vaza jato mostrou.,1186401669845868545
2019-10-21 18:59:22,"Vc quer vê, o quanto que a política é vergonhosa, vai pra ALERJ amanhã, vê a votação para os 5 políticos presos na Operação Furna da Onça (desdobramento da Lava Jato) ~ Nojo define",1186401617916170241
