date,text,id
2019-10-10 20:59:57,"@ jairbolsonaro avisou ao Vaticano que não comparecerá a cerimônia de canonização da Irmã Dulce. Eita Santa porreta, não foi nem canonizada e já afastou o demônio!",1182445694503866368
2019-10-10 20:59:56,"Af, só queria tá bebendo litrao com a irmã que eu gosto",1182445692658298881
2019-10-10 20:59:56,"México les agradece este gran esfuerzo: @ susanroseackerm, @ Irma_Sandoval y @ JohnMAckerman. Saludos desde la alcaldía de # Azcapotzalco.",1182445692507361281
2019-10-10 20:59:53,"e hj a fui levar minha irmã e meu afilhado na escolinha e não lembrava se meu afilhado tinha entrado pra dentro, tive q voltar lá na escola kkkk",1182445679689510913
2019-10-10 20:59:53,Eu sou o alter ego positivo de @ OdeioMadonna. Única e verdadeira irmã.,1182445678846451712
2019-10-10 20:59:53,To indo pro shopping com a minha irmã,1182445678812975104
2019-10-10 20:59:51,Marido da minha irma e insuportável até não sei como a Lay aguenta ele olha,1182445672022364161
2019-10-10 20:59:51,"La investigación de la estafa maestra la hizo un trío de periodistas. Por qué descalificas sin haberla consultado repito, yo ya la leí y es verídica. Además de que jamás andaría defendiendo a un ladrón como lo haces tú. Y para colmo priístas. Echa a andar tus dos neuronas.",1182445670583734272
2019-10-10 20:59:50,"Terminando uma porção generosa de farofa de cuscuz, minha irmã liga chamando pra comer temaki, e eu disse o quê? Vamos. Rolando pra cama, pode apagar a luz. pic.twitter.com/flry6zT4jH",1182445665194041344
2019-10-10 20:59:49,"meu deus eu espero muito q o problema do meu cel seja so tela, pq tem uma aqui e namo da minha irma ta vindo ver se da pra concertar...deus me sonda dessa vez por favor",1182445663495344128
2019-10-10 20:59:49,Meu pai baixava e gravava pra mim e minha irmã kkkkkk https://twitter.com/jccguk/status/1182078063187841024 …,1182445663126216704
2019-10-10 20:59:47,Minha irmã faz três hora que foi no mercado compra coisa pra mim fazer janta e não volto,1182445653324107776
2019-10-10 20:59:46,"Fui fazer uma vitamina de maracujá e em questão de segundos minha irmã jogou um tanto de palito de dente dentro do liquidificador e eu n vi, agora virou vitamina de palito",1182445648387416065
2019-10-10 20:59:44,MANO ROUBARAM O CARRO DA MINHA IRMA,1182445643408826368
2019-10-10 20:59:44,"Deve ter aprendido com a irmã, certeza kakaka",1182445640766369792
2019-10-10 20:59:42,IRMÃ A GENTE VAI,1182445634672037889
2019-10-10 20:59:42,# LANOCHEPOP Ya llega..... @ VeroMerigo @ ChauChaumodorra @ manuele27676553 @ CrisaMarce @ RamonaGonzalezz @ soo_Legui @ silgarabilla @ solchi_pop @ rhbdj @ lolygirardi @ claudiaLivok @ irma_pintos @ lokademya @ TanqueRojo66 @ minipollo18 @ popradio1015 @ elgriegokelu @ Eltano2019 @ ElHombredeGris1pic.twitter.com/ESXtJ85IPs,1182445633090871296
2019-10-10 20:59:39,sim irmã galvão bueno tá chegando,1182445622441533441
2019-10-10 20:59:39,Acho que vou no upa cm minha irmã,1182445621111934976
2019-10-10 20:59:37,"Mnao e a minha mãe que quase me matou do coração, pq achou que o cara ia nos assaltar e fez minha irmã arrancar o carro a mil kkk e era meu vizinho",1182445613700530178
2019-10-10 20:59:37,segue o caminho da sua irmã mano,1182445613314691072
2019-10-10 20:59:31,"Minha irmã tatuou o nome do meu tio, queria ser o próximo",1182445587909791745
2019-10-10 20:59:31,a amiga da minha irmã chamou nosso irmão de macaco EU TO SÓ O ÓDIO EU VOU TACAR FOGO NESSA GAROTA,1182445585774862337
2019-10-10 20:59:29,"Make up by me Wedding Sertu Jaka Apriyansyah&Irma Amd.keb Bpk sahari rolista&ibu siti sarmah Way huwi jati agung lam sel Mua by juartiagusriaspengantin Boking WA 082375208484 Ig,… https://www.instagram.com/p/B3dP201lcua/?igshid=1mjljynm8c8yz …",1182445580905136128
2019-10-10 20:59:29,mas cadê minha irmã inferno,1182445578606858240
2019-10-10 20:59:27,"Mais um milagre de irmã Dulce: A ""multiplicação das passagens aéreas""",1182445569584914432
2019-10-10 20:59:19,Se decide irmã,1182445539172012033
2019-10-10 20:59:19,"Botei minha foto e do come rt no papel de parede do meu cel, vai dá mo ciúme já estou até vendo!!! Irmã ama mtttt merda",1182445537209004032
2019-10-10 20:59:17,AHAHAHAHAH eu amo sua irmã,1182445528728117248
2019-10-10 20:59:17,não é possível vitória. eu mostrei pra minha irmã ela lembrou na hora.,1182445528048648198
2019-10-10 20:59:07,O relacionamento da minha irmã é mais complicado que as minhas provas de física,1182445487754022914
2019-10-10 20:59:06,"Pocos alcaldes serios y decentes en el PNP, Kiko Aviles uno de ellos. Felicidades Alcalde y mucha salud!",1182445480669843457
2019-10-10 20:59:03,To vendo o jogo em um barzinho mais não vou tocar um pingo de álcool na minha boca por conta do pai da minha irmã,1182445469307494404
2019-10-10 20:59:03,Eu sou o alter ego negativo de @ AmoMadonna. Única e verdadeira irmã.,1182445468158218240
2019-10-10 20:59:02,minha colega falando que a família dela é tóxica só pq a tia pediu pra ela ajudar a irmã dela a subir as compras TANKO NÃO VEIBKJJJKKKKKKKKKKKK o pior é que ela tá falando sério,1182445467529035776
2019-10-10 20:59:00,tua irmã eh braba mlk kkkkkkkkkk,1182445457890578432
2019-10-10 20:58:59,"arranquei o dente da minha irmã, tô muito emocionada kkkkk",1182445452769320960
2019-10-10 20:58:55,Eu tenho as melhores amiga e irmã estão me ajudando MT amo vcs Neca Débora Karen e vidinha sao as que sei que posso conta sempre,1182445436944240640
2019-10-10 20:58:53,"Minha irmã:""vou pegar um absorvente aqui"" Eu:""tá, pega meu creme aí"" Minha irmã:""tá folgada hein"" Eu:""blz, devolve meu absorvente aqui""",1182445428240990209
2019-10-10 20:58:52,"eu minha mãe e minha irmã desde cedo em casa sozinhas, trocando maior papo e rindo de tudo kkkkk momento único cara, amo muito e vou sentir muita saudade dos nossos momentos juntas",1182445422159241217
2019-10-10 20:58:48,"Tenho certeza que Irmã Dulce, preferiria que esse dinheiro, fosse para as pessoas carentes https://twitter.com/folha/status/1182444461105799168 …",1182445408859099137
2019-10-10 20:58:48,"minha irmã chegou chorando falando q quase foi morta e minha mãe se acabando de rir achando q era brincadeira, terminou c as pernas bambas q n conseguia nem ficar em pé",1182445407802220544
2019-10-10 20:58:47,me chama no zap irma,1182445403519754240
2019-10-10 20:58:45,sdd quando minha irmã era um bebê,1182445395319898115
2019-10-10 20:58:43,"o amigo da minha irmã (que tá dando em cima de mim) me convidou pra beber, mas não disse se seria hoje ou não. resumo, tô indo pra casa",1182445385949831168
2019-10-10 20:58:41,"Minha irmã me irrita muito, não da pra combinar nada com ela namorar",1182445378668519424
2019-10-10 20:58:35,"Minha irmã tá que pede coisas p pele na revista p mim,se empolgando",1182445354081574913
2019-10-10 20:58:33,E tem irmã tbm Caraí,1182445343830691841
2019-10-10 20:58:28,falei arrombada com carinho irmã p nois aq nem é xingamento desculpa se você se ofendeu,1182445324301950982
2019-10-10 20:58:28,minha irmã tá queimando em febre eu to muito preocupada,1182445324046127104
2019-10-10 20:58:27,Done FB : Irma Sulastri Ig : Irma.Sulas3 @ Dayatnur28 @ trieplay # JTOgiveaway # JTO1stanniversary,1182445317922246656
2019-10-10 20:58:24,"CABEÇA QUE PARECIA ser muito putinha mesmo. Ele se sentir a pulsação de seu pau em riste em direção ao shopping eu tirava a bermuda e tênis, e minha irmã não esboçava nem uma puta.",1182445308502052864
2019-10-10 20:58:23,minha irmã é mt figura kkkkkkk,1182445303825346561
2019-10-10 20:58:22,Kkkķkk minha irmã é virginiana tb e reclama igualzinho,1182445297605197824
2019-10-10 20:58:20,Não penso em ter filho Obstáculo: a fofura da minha irmã,1182445291703799811
2019-10-10 20:58:20,"Idiot officials think cell is everywhere and it is reliable. The truth is not what they want to hear. Ham Radio is far from useless, Just ask people in Florida after Irma, when cell, internet and telephone were all down.",1182445289459900418
2019-10-10 20:58:17,Vou ver minha irmã,1182445278667902977
2019-10-10 20:58:16,quando minha irma era pequena ela roubou uma camisinha de morango q achou nas gavetas dos meus pais e saiu mascando achando q era chiclete https://twitter.com/wwwmlna/status/1182407757422583809 …,1182445271348924418
2019-10-10 20:58:11,a conversa da minha irmã com minha mãe kkkkkkkkkkkk pic.twitter.com/tKw7vycLFb,1182445253615374336
2019-10-10 20:58:10,"fui fumar um rosh c minha irmã e a mochila caiu em cima do fogareiro, sai lá fora só o fogo, pqp o susto que eu levei",1182445245914636289
2019-10-10 20:58:09,vei eu vi sua irma postou kkkkkkkkkkkkkk quando eu vi essa trollagem eu so pensei no ricardo,1182445243888816128
2019-10-10 20:58:07,"Agradeço a Deus todo dia ,pela sua amizade,Te amoo irmã @ fannyzinhapvcspic.twitter.com/4sLV9WExqo",1182445234325803009
2019-10-10 20:58:06,"eu e a vitória em chamada e do nada a irmã dela fala ""a mas tu não gostava dela"" kdmdkdmdk",1182445231595315202
2019-10-10 20:58:05,coloquei um filme p maior de 14 aqui minha irma de 9 anos “ eu tenho 14 anos livia? muito menos minha mae nem oce”,1182445227115761671
2019-10-10 20:58:01,minha irmã fez um suco q salvou minha noite,1182445211672297473
2019-10-10 20:58:00,"Amiga da minha irmã é muito privilegiada, veio aqui em casa, comeu pipoca, assistiu Netflix e ainda tá comendo um japa... privilegiada pra caralhooo kkkk",1182445205951258624
2019-10-10 20:57:57,perguntei de bobeira se minha irmã tinha uma namorada e ela disse que ela não sou eu ai eu: **gay silence**,1182445194161119232
2019-10-10 20:57:57,as vezes eu só queria ser a minha irmã chegar em casa olhar oq tem pra comer e comer,1182445192806313984
2019-10-10 20:57:55,Minha irmã tbm não,1182445183121661953
2019-10-10 20:57:54,"sim mas se tu for ver nem era tanto mas coitada, chata era aquela irmã dela que puta merda",1182445181049692162
2019-10-10 20:57:54,"Minha irmã descobriu que vai ter Wallows no Lolla e ta aqui SURTADA querendo ir e me pilhando p ir junto, to aqui me perguntando como pq eu NAO TIRO DINHEIRO DO CU",1182445180202422273
2019-10-10 20:57:51,Essa serve pra tua irmã aí pic.twitter.com/4X5P1Hndai,1182445167363706882
2019-10-10 20:57:49,minha irmã escolhendo anel pra loli eh mole,1182445157670707200
2019-10-10 20:57:42,"Minha irmã com 13 anos virou pro pedreiro hoje e lançou: Até que você trabalha bem, mas fala muito!",1182445128469929984
2019-10-10 20:57:40,tmb te amo irmã,1182445123029950466
2019-10-10 20:57:34,Comprei umas canetinhas da faber pra minha irmã (de presente de dia das crianças) e o que pagou o esforço q eu fiz pra conseguir esse dinheiro foi o sorriso dela quando viu,1182445094940676104
2019-10-10 20:57:33,GNT MINHA IRMA AKAKKAAKKA,1182445093145456640
2019-10-10 20:57:33,VAMOS DEMAIS IRMÃ,1182445090712772609
2019-10-10 20:57:31,"Hoje eu descobri que o drama é de familia. Fiquei sabendo que meu tio ficou desolado com a minha mudança e que soltou ""nossa, to sentindo como se tivesse perdido um irmã"" MEU SENHOR EU ESTOU A 40min DA SUA CASA",1182445086128398337
2019-10-10 20:57:31,"Ai q deselegante, não é mais minha irmã",1182445083678957569
2019-10-10 20:57:30,Comitiva dos três Poderes vai à canonização de Irmã Dulce na Itália. https://bit.ly/2MBROVc pic.twitter.com/8Fn9Ire10B,1182445080252223488
2019-10-10 20:57:26,Vou brota lá na minha irmã p toma um gelo,1182445061327462401
2019-10-10 20:57:24,[10/10 20:49] +55 21: Te amo irma [10/10 20:49] Estefani Gomes : amo você também sdd,1182445056051077121
2019-10-10 20:57:24,"basas tu acusación en el vil y cobarde Loret, se demuestra que su investigación no es firme y tú sigues echando espuma por la boca, sé honesta, acepta que te mueves por prejuicios.",1182445055736344576
2019-10-10 20:57:21,Rezemos para que a Irmã Dulce faça esse milagre para o país inteiro https://twitter.com/albertocalmeida/status/1182390689688104960 …,1182445041354235904
2019-10-10 20:57:18,"nossa eu tenho muito ciúmes da minha irmã com as amiga dela, pra q ter amigas se ela tem eu q além de amiga sou IRMÃ, não dá mais",1182445028368703488
2019-10-10 20:57:17,Eu tenho... Minha irmã me enviou o podcast a uns meses atrás,1182445026883887107
2019-10-10 20:57:15,Amém irmã,1182445017861967880
2019-10-10 20:57:15,Minha irmã me fez ir lá na rua levar umas parada pra ela bem na hora do jogo,1182445015441854465
2019-10-10 20:57:12,"irmã, achei que dinheiro hoje em dia não fosse problema, inclusive que a senhora iria pagar pra mim",1182445006130483203
2019-10-10 20:57:11,é kkkkk perguntei minha irmã o dia e eu contando que era hoje kkkk,1182445001785131010
2019-10-10 20:57:11,"Gostaria de dizer que depois desse omelete minha irmã já pode casar, interessados mandar currículo via dm",1182445000933761027
2019-10-10 20:57:11,Irmã Dulce já pode ir fazendo milagres ..,1182444999797022720
2019-10-10 20:57:06,"Sinto falta do meu irmão mas ao msm tempo acho q foi melhor ele ter ido embora pq eu ficava preocupada tempo td com ele e sentindo mal, quem diria irmã mais nova se virando mais sozinha kkkkk",1182444977290465280
2019-10-10 20:57:04,minha irmã foi fazer entrevista de emprego na escola de inglês da h*ma kim*k já falei pra ela que se ela for contratada nao vai ter 13° kk,1182444972810887169
2019-10-10 20:57:04,eu roubei o fone da minha mae em 2016 e ate hj ela acha que minha irma pegou e deu pro meu cunhadokkkjjj pic.twitter.com/VAGRkQhsQk,1182444972357881857
2019-10-10 20:57:04,"A irmã de 'Sim ou Não' , 'Bang' e 'Show das Poderosas' é perfeita !!",1182444972336910336
2019-10-10 20:57:00,Poxa irmã kkkkkkkkk acabou com a minha graça kkk,1182444952867037184
2019-10-10 20:56:56,depois dessa semana estressante só quero passar o fds com a irmã perfeita que eu amo @ beamazim,1182444939189391360
2019-10-10 20:56:54,Acho q é porque uma das únicas lembranças que eu tenho com a minha irmã era de nós duas assistindo esse filme,1182444930561724422
2019-10-10 20:56:53,"Queria sair hj, mais minha prima e irmã demoraram tanto que fechou o lugar onde nos iríamos",1182444926602223616
2019-10-10 20:56:46,Irmã vai no wpp,1182444897032376322
2019-10-10 20:56:44,Minha irmã fez strogonoff pra mim,1182444887691743232
2019-10-10 20:56:41,"Eu e minha irmã falando de jogar videogame, e meu pai fala que minha irmã não joga nem charme, pq ela não tem",1182444876375515137
2019-10-10 20:56:39,Gente é sério.. desejo q vcs tenham um irmã/ão pisciana/o kkkkkkk,1182444866833391617
2019-10-10 20:56:38,como assim minha irma acabou de ser pedida em casamento ?????????? pqp n to acreditando caralho gente,1182444862538485761
2019-10-10 20:56:38,qual as pira da minha irmã fica enfiando o dedo no meu cu mn,1182444862525886465
2019-10-10 20:56:38,"Gerson, minha humilde irmã/mãe são suas",1182444860470648834
2019-10-10 20:56:32,"a professora pediu alguns pais q pudessem ir pra ajudar a cuidar da criançada e minha mãe aceitou nota: minha sobrinha tinha uns meses só e precisou ir junto pq minha irmã trabalhava, ou seja, ela não cuidou de ninguém e ficou de olho nela",1182444836496035841
2019-10-10 20:56:30,A MINHA IRMA FALA ISSO Q INFERNO GURIA RIDÍCULA VONTADE DE AVANÇAR NA CARA DELA https://twitter.com/lanadelmusics/status/1182444018032107520 …,1182444830271651840
2019-10-10 20:56:27,eh sua irma??,1182444813930643457
2019-10-10 20:56:25,"eu queria ser metade que minha irmã é, nem é por querer ser igual a ela mas sei lá",1182444805911142400
2019-10-10 20:56:23,E minha irmã q caiu enquanto andava na esteira KKKKKKKKKKK ACADEMIA LOTADA BICHO,1182444798927613952
2019-10-10 20:56:22,"minha irmã não podia ter escolhido uma cidade melhor que Santa Cruz, chop e Oktober, começou o final de semana",1182444794062225408
2019-10-10 20:56:20,kkkkkkkkkkkkk só falta money irmã,1182444788509036544
2019-10-10 20:56:16,"minha irmã ta puta, pq o canal portugues que pega aq em casa, n ta passando novela.... Ela quer aprender o portugues de portugal primeiro q eu",1182444771295617024
2019-10-10 20:56:12,"Desgraça é essa doido, vi minha irmã ficando com um cara meu deos",1182444754132488192
2019-10-10 20:56:11,"Atena perdeu a mãe, a irmã e depois o amigo dela pqp",1182444748193390594
2019-10-10 20:56:10,Irmã Dulce já está incluída na esfera de culto à memória da Igreja Católica https://cautentica.com.br/irma-dulce-ja-esta-incluida-na-esfera-de-culto-a-memoria-da-igreja-catolica/ …pic.twitter.com/u2KR4Q3KfP,1182444743613210624
2019-10-10 20:56:08,"hoje ia pra academia, minha irmã: me espera que eu quero ir junto pra andar no shopping, só vou tomar um banho rapidinho *o banho não foi rapidinho* Eu já tava ficando com preguiça, saímos, o ônibus num passava nunca, desisti, voltei pra casa e pedi um lancho pro almoço",1182444737846022144
2019-10-10 20:56:07,Irmã Dulce já está incluída na esfera de culto à memória da Igreja Católica https://bahianow.com.br/irma-dulce-ja-esta-incluida-na-esfera-de-culto-a-memoria-da-igreja-catolica/ …pic.twitter.com/ZTubvukBLH,1182444733903392768
2019-10-10 20:56:07,"Amanhã e aniversário da minha irmã, vo passa la antes de ir pro mansão",1182444733383229440
2019-10-10 20:56:03,Gente? Kkk agora qur vi isso...essa irmã da Hariany e doida né https://twitter.com/uoltvefamosos/status/1182386913757532160 …,1182444716698275840
2019-10-10 20:56:00,GENTE OLHA A SINA E A HINA COM A MINHA IRMA!!! SIM ESSA FOTO É TUDO PRA MIM pic.twitter.com/BOv7mkEk2K,1182444703473717248
2019-10-10 20:55:53,Irmã da Yasmim é tão fofaaaaa,1182444672385507328
2019-10-10 20:55:51,11 anos Estava na cs da @ Luana25827070 até q fingi q estava procurando o banheiro qnd na vdd estava indo roubar o bolo c minha amiga Lully Desistimos do bolo e fomos no banheiro e taraaan Liguei p minha mãe desesperada e minha irmã atendeu e fez questão de gritar pra casa toda https://twitter.com/ayressamy/status/1182434867117772801 …,1182444665196470272
2019-10-10 20:55:46,Só esse noivado da minha irmã sábado mesmo,1182444644589813761
2019-10-10 20:55:46,"Minha mãe, sobre Irmã Dulce: Ela andando parecia que flutuava, de tão magra e frágil que era, naquela roupa surrada. Ela rodava a cidade, pedindo aos ricos doações para os pobres. Só saía quando conseguia. O povo no hospital a abraçada, ela retribuía, com aquela feição de amor.",1182444642870202368
2019-10-10 20:55:43,"Tô de saia e fui no trabalho da minha irmã, a cliente dela falou que eu tava só de cinto kkkkkk Essa saia encolheu muito vey",1182444630501187584
2019-10-10 20:55:42,oh *dou um abraço doce e confortante nela* é bom te ver denovo irmã,1182444628366299136
2019-10-10 20:55:40,Jesus te abençoe irmã,1182444620254502912
2019-10-10 20:55:37,Isso é tipo eu implicando minha irmã KKKKKK,1182444605679296515
2019-10-10 20:55:35,somos duas irmã,1182444598112727042
2019-10-10 20:55:35,engraçado eu achar minha irmã tão bonita e eu mesma terrível sendo que eu sou a cópia de cabelo curto e colorido dela,1182444597865340928
2019-10-10 20:55:33,"Pronto, mucho más pronto que el caso de los Moreno Valle?",1182444589291958272
2019-10-10 20:55:33,Sair com minha irmã só é prejuízo,1182444589090791424
2019-10-10 20:55:32,sinceramente........minha irmã é a mulher mais linda que existe,1182444586691633157
2019-10-10 20:55:32,"faço questão demais de mostrar quem é minha irmã pro mundo, amanhã a peita do time tá na mão e ela vai tá lá de novo",1182444586645385218
2019-10-10 20:55:31,E minha irmã falando q hj o megatron foi no trampo dela kkkkkkkkkk sortuda,1182444579364233222
2019-10-10 20:55:28,Fiz a barba e minha irmã disse que to parecendo reiver então vo deixa assim pic.twitter.com/M55IJy78aw,1182444567536308224
2019-10-10 20:55:27,tem vez q a minha irma bate na porta do banheiro perguntando se to VIVO,1182444564487069696
2019-10-10 20:55:26,"# Repost @ Igreja_Na_Midia Confira onde assistir a transmissão da Cerimônia de Canonização de Irmã Dulce, que acontece neste domingo (13), a partir das 5h da manhã (horário de… https://www.instagram.com/p/B3dPY_ggi1WwNOuoplwMTJ6pkn828TICISKyDk0/?igshid=16a9bj1jx2e6o …",1182444558057201664
2019-10-10 20:55:26,"Eu te amo mais ainda, minha irmã carioca",1182444557859987456
2019-10-10 20:55:25,"Minha irmã me acordou me dando vários beijinhos, ela é muito fofa",1182444556610088962
2019-10-10 20:55:25,"Cara, me desculpem os demais professores de matemática (inclusive a minha irmã) mas a Karine é a melhor do universo, eu mando a sua questões que eu não sei resolver e ela manda vídeozineow explicando e resolvendo, que mulher meu amigos que mulher",1182444554693365761
2019-10-10 20:55:24,"mnh irmã é doidonaa, comprou 5 açaí",1182444552063508483
2019-10-10 20:55:24,Siempre Hermosa https://www.facebook.com/100002171252182/posts/2500691166679901/ …,1182444550171828224
2019-10-10 20:55:22,isso significa q vc é minha irmã e tem o direito de vir pra cá a hora q quiser ué KKKKK,1182444545134473218
2019-10-10 20:55:22,"O peso dos 20 years tá chegando mais rápido que pensei, agr mamãe me pede pra levar minha irmã mais nova pra fazer um exame às 7 da manhã, pelo fato de ter idade pra isso! Mdsss",1182444542676688897
2019-10-10 20:55:21,meu pai e o cunhado da minha irmã conversando sobre anime,1182444537144369157
2019-10-10 20:55:20,minha casa é 100% assim e ainda tem eu e minha irmã tirando onda qdo isso acontece https://twitter.com/LisJulia1/status/1182099772792098816 …,1182444533285642243
2019-10-10 20:55:19,Digo que estou com fome e a Anthea me manda foto de diversas coisas gostosas. Que tipo de irmã mais velha eu tenho?,1182444529506574336
2019-10-10 20:55:18,Quando vi a minha irmã a mexer no meu telefone kkkkkkk pic.twitter.com/98TJi42VUC,1182444524532092933
2019-10-10 20:55:16,Kkkkkk triste irmã,1182444518517411840
2019-10-10 20:55:15,Minha irmã de 12 tem figurinhas pornográficas de anime mank,1182444512016306178
2019-10-10 20:55:14,Quantas semanas sua irmã ta?,1182444510934163456
2019-10-10 20:55:14,3 menino que dá em cima de mim e da minha irmã tá foda,1182444507742248960
2019-10-10 20:55:13,Minha irmã ta virando hippie,1182444503673774080
2019-10-10 20:55:11,Minha irmã é muito chata kkkkkkk,1182444497852162048
2019-10-10 20:55:08,"@ RatoRlk: Ql foi irma, jaca? @ crl_enzo: tô querendo, tu vai? @ RatoRlk: Eu vou se tu for @ crl_enzo: e eu só vou se tu for @ RatoRlk: Entao bora @ crl_enzo: bora akkkkkkkk",1182444484795215872
2019-10-10 20:55:06,"mais fresca que minha irmã não existe, até minha cachorra come mais coisa q ela",1182444477744603136
2019-10-10 20:55:04,gatinho da irma,1182444469536342017
2019-10-10 20:55:03,e minha irmã perguntando se o @ kennedynascime1 era meu namorado kkkkkkkkk,1182444462737412096
2019-10-10 20:55:02,Parlamentares engordam comitiva ao Vaticano para canonização de Irmã Dulce https://www1.folha.uol.com.br/poder/2019/10/parlamentares-engordam-comitiva-ao-vaticano-para-canonizacao-de-irma-dulce.shtml?utm_source=twitter&utm_medium=social&utm_campaign=twfolha …,1182444461105799168
2019-10-10 20:55:01,Deixa em of minha irmã,1182444453614817282
2019-10-10 20:54:56,"Eu tenho rosas do deserto e hortaliças, cachorros, galinhas, filho e minha irmã cadeirante. pic.twitter.com/v9vzKIKgon",1182444432236384256
2019-10-10 20:54:55,"forças aos meus pais que vão ter que lidar com três seres com ansiedade em casa: eu, minha irmã e meu cachorro.",1182444429581398016
2019-10-10 20:54:55,minha irma me fez gostar de pagodeKKKJKJJKKKK hoje,1182444428084035584
2019-10-10 20:54:54,A MINHA IRMA FEZ UMA FILMAGEM DE DRONE MEU DEUS,1182444426389544960
2019-10-10 20:54:53,E minha irmã q disse q quer ir pra praia fnds cmg e eu falei q não vou por que não quero usar biquini,1182444419825442816
2019-10-10 20:54:51,"É eu ficar 2h fora, minha irmã já pergunta se eu tava bebendo kkkk até parece nem bebo",1182444413290733568
2019-10-10 20:54:50,"tava vendo esse povo mandando foto do dog do insta pros pais e os pais surtando sendo mega grossos mandando tirar o dog da casa e etc, fiquei até feliz de ver a reação da mãe e da irmã da pietra digo e repito: não confio em quem não gosta de cachorro",1182444407368441857
2019-10-10 20:54:47,Jodohin sama Irma klop dahh,1182444397427712000
2019-10-10 20:54:47,Caralho que sdd da minha irmã af,1182444395733409792
2019-10-10 20:54:45,"Eu to vendendo minha irmã, interessados mandar dm Motivo: preciso de dinheiro pro lolla @ drezza_ferrigno",1182444387588100096
2019-10-10 20:54:44,"cheguei na fila e já tava dando volta na esquina então já pensei “hmmmm vim atoa nesse carai” deu uma hr e nada deles, uma e meia, duas hrs e eu já quase comendo a minha irma viva pq tava cansada mas umas duas e pouca começaram a subir",1182444383578267649
2019-10-10 20:54:42,Minha irmã me fez lembrar de tanta coisa ruim que nós passamos juntos que nem vinham mais na minha memória,1182444375420178432
2019-10-10 20:54:41,I Irma!,1182444372933169153
2019-10-10 20:54:40,Irmã emprestada kkk,1182444367782563840
2019-10-10 20:54:40,Sua presença é imprescindível lá na missa da irmã Dulce Manuzinha...,1182444365316317184
2019-10-10 20:54:35,"Fui brincar com a minha família com o filtro do cachorro e minha irmã estragou dizendo que era montagem... mano, sem condições!",1182444346630725647
2019-10-10 20:54:33,vo matar a minha irmã.,1182444337080221697
2019-10-10 20:54:32,@ karolsilton1,1182444334748188672
2019-10-10 20:54:31,"¿Y que opinas de la actual administración? Cancelar NAIM Nepotismo del presidente (sus hermanos) De Bartlett Citlaly, Guevara, los parientes de Irma Sandoval y Ackerman, ley Bonilla, la partida secreta de amlo, cuantos corruptos de estancias, NAIM, Salud están presos, EPN libre",1182444329161371648
