date,text,id
2019-10-20 20:55:59,"If Mann's numbers are so valid, why did he refuse to provide them to the BC Court case against Dr. Ball, putting him in contempt and sinking his libel suit? American climate scientist, Dr Judith Curry, has submitted to the court an Amicus Curiae legal brief exposing Mann.",1186068577465421825
2019-10-20 20:55:58,"In case you didn't know, I'm crazy about you",1186068574605062145
2019-10-20 20:55:55,Even if that’s not the case there’s no way he only loses five. The best five rn beat him,1186068559035883520
2019-10-20 20:55:51,I was told thet saying “folks” like that was like culturally appropriative or exclusive to Enbies. Didn’t see a problem either way whether it was the case or not so it just kinda stuck so I didn’t make anyone upset.,1186068544984944640
2019-10-20 20:55:49,Hello Vaishnav. The option to delete all the threats in quarantine is not available. The main reason would be that you could delete by mistake a file that belongs to an app you are using and this might cause a lot of inconvenience in some cases.,1186068536642412545
2019-10-20 20:55:49,And if we make a call to Kaepernick just in case # Bears100,1186068535199453190
2019-10-20 20:55:49,Mean case of the ole Colombian Flu today,1186068533119197185
2019-10-20 20:55:48,case.2がはいるなら3も入るかなって思ったんだけどな〜〜無印劇場版見直そうかなぁ,1186068528836694016
2019-10-20 20:55:47,All political parties are full of QC and present and former solicitors they had nearly a year before article 50 was triggered and The last 2 and half years to sort it out. Then suddenly in extra time we see talking law and having court cases sounds and looks dodgy to me.,1186068525846269952
2019-10-20 20:55:46,HOW JUSTICE THOMAS CAN BANKRUPT THE MSM WITH A SINGLE SCOTUS CASE IN 2020 SEE THREAD > https://twitter.com/3Days3Nights/status/1185398713822396416 … # Trump # Qanon # Trump2020 # WWG1WGA # News # FakeNews # EnemyOfThePeople # StopTheCouppic.twitter.com/F7e7HVUqUX,1186068520892882945
2019-10-20 20:55:45,Mo,1186068517310861313
2019-10-20 20:55:45,This claim is weak as either the gate was damaged already and not repaired or was of such poor quality that wind could take it off its hinges. In either case this would not be an Act of God in my view. It is communities liability for this IMHO.,1186068516732059648
2019-10-20 20:55:43,Not if you listen to them. With the exception of one case off the top of my head.,1186068511849877505
2019-10-20 20:55:43,@ JumpmanOG 5-2,1186068510407090178
2019-10-20 20:55:43,"Isn’t that something, a socialist making a “freedom “ case for socialism! https://twitter.com/tomselliott/status/1185641994510618624 …",1186068508750307329
2019-10-20 20:55:40,Pretty much. It is unheard of elsewhere. A handful of cases a year.,1186068497505361921
2019-10-20 20:55:40,"No, because as often is the case, your logic & comparisons are flawed.",1186068495211085826
2019-10-20 20:55:39,Magic Eraser is great. What was she using to write with? Hairspray can do the trick on most inks without damaging what's underneath (in most cases).,1186068493432692737
2019-10-20 20:55:39,If that’s the case why does terrible Henderson keep starting?,1186068491876622339
2019-10-20 20:55:38,"in case you didn’t know, @ kookiexjiminiee is a legend and here is the proofpic.twitter.com/ULxRKPST76",1186068486931517445
2019-10-20 20:55:35,"Starting the movie, she made it clear what steps it took to get it going, in case he wanted to do it on his own another time. She loved this movie, Tinkerbell and her attitude was a big hit for Pru. ""Would you want to go to Neverland?""",1186068476412268545
2019-10-20 20:55:33,thank you! so it's fine for me to call myself gay in this case?,1186068469143523333
2019-10-20 20:55:33,I even had this album downloaded which is not the case I always listen to music on Spotify pic.twitter.com/cDpQMkpepc,1186068466450751495
2019-10-20 20:55:33,i did some cool halloween paintings here they are in case u wanna take a lol peak pic.twitter.com/le2gjWLFt8,1186068466337484801
2019-10-20 20:55:32,"So sorry to hear that & I thought it was the case. I just got confused because I thought she was having her ice bath before the Jazz show, instead of after which made me think that somehow she was in more pain than usual. Thanks for sharing your poem.",1186068465326723073
2019-10-20 20:55:32,"426 child victims were moved by CPS and returned into harm’s way, now unaccounted for after horrific abuses were revealed in that giant case. Only 13 of the abusers were prosecuted & all the others dismissed.",1186068464546414592
2019-10-20 20:55:32,"“The shoe and the camera were too far away for this to be a suicide case. In a suicide case, both shoes are together”- wise police inspector in Rodan (1956)",1186068463984500736
2019-10-20 20:55:31,where can i get a black phone case with louis’ smiley on it for an iphone i can’t find any,1186068460826222595
2019-10-20 20:55:31,just need your whatsapp number facebook handle ig handle email house number even your twitter handle just in case,1186068458934587392
2019-10-20 20:55:28,I hope that’s the case. I’ll wait for others to watch it first and report back.,1186068445680558081
2019-10-20 20:55:26,"If they requested assistance through official channels, you can be sure Trump would be bellowing it from the rooftops. He isn't, therefore he didn't. Beside which, in order for them to request help, U.S. authorities (eg. the FBI) must have an open case. They don't.",1186068439519125504
2019-10-20 20:55:25,"Cool. In case it works, I am not Apple so you do not have to pay me a lot of money",1186068433605148672
2019-10-20 20:55:24,"Sigo esperando a que te cases conmigo y me hagas 3 hijos México/españoles, cuando vaya para España te buscaré además no nos llevamos muchos años de edad, besos.",1186068431210192897
2019-10-20 20:55:24,we still missing some cases,1186068431012913152
2019-10-20 20:55:24,"$ JNJ settling opioid cases rather than fighting them in court, why? https://finance.yahoo.com/news/johnson-johnson-talks-divergence-of-opioid-lawsuits-120030244.html …",1186068430723731458
2019-10-20 20:55:23,"He laughed a little at Adrien's joke, putting his hands in his jacket pockets. ""I brought some snacks just in case it'd be a wait, by the way."" He nodded back to his backpack. Of course he brought snacks.",1186068423983452161
2019-10-20 20:55:22,"If the fucking Russians and our own Republican Party have any say, this may very well come to pass in which case alternative methods will be needed to secure our national well being!",1186068420359421952
2019-10-20 20:55:21,Yeah it actually makes a very very bad case for billionaires and all the power they have,1186068417335451649
2019-10-20 20:55:19,"You don't have to? In this case I saved it from the original quoted tweet, since the laptop it was originally created on crashed. I'm pretty proud of it, though!",1186068411131908099
2019-10-20 20:55:17,This. Is. Powerful.https://twitter.com/gregstier/status/1186013235901648896 …,1186068400973533184
2019-10-20 20:55:17,Who wants a header 1.follow me with notis in case I do more headers 2. Like this tweet and comment with your favorite social media’s you might want on your header 3.have fun and don’t be sad if I don’t make you one more of these tweets to come,1186068400520519680
2019-10-20 20:55:16,"A completely undefined set of principles. For instance, very many people would accept that implementing existing FoM rules is a taking back control. Many dont know the rules exist. For some this wouldn't go far enough, but aint that always the case? pic.twitter.com/Kbcp6bEgvd",1186068397370556417
2019-10-20 20:55:16,1- Regina Casé 2- dirigindo carro 3- instalando ar condicionado,1186068395764174851
2019-10-20 20:55:15,"How does institutional classification of an ethnoracial group shape one’s ethnoracial identity and ethnoracial assignment by others? I use the experiences of Middle Eastern and North African Americans as case study. Or, you MENA I’m white?!",1186068390911365121
2019-10-20 20:55:14,GUILTY Banker Admits Using Secret Affair to Pocket $45 Million in $2 Billion Fraud Case https://youtu.be/5bHXa5bhKuU via @ YouTube,1186068389694980097
2019-10-20 20:55:14,BREAKING DOWN THE HACKING CASE AGAINST JULIAN ASSANGE – http://wiki-story.com https://wiki-story.com/breaking-down-the-hacking-case-against-julian-assange/?utm_campaign=mTn6Leuoex&utm_medium=paid&utm_content=newsfeed&utm_term=fbads …,1186068389107773446
2019-10-20 20:55:14,"One thing I can say about being +30 tho. Quality sleep at least for me plays a huge role in my productivity and mood. That wasn’t the case in my 20s. Could sleep 5hrs and function easily, not the case now lol...",1186068388457652224
2019-10-20 20:55:13,I broke my case a little bit,1186068382522707973
2019-10-20 20:55:12,Documentary Hopes To Spark New Leads In 2017 Missing Case Of Baltimore Woman Akia Eggelston https://cbsloc.al/2J6K5gQ#.Xazz2iskTbg.twitter …,1186068380039745536
2019-10-20 20:55:11,"Good point We are at a very critical crossroad in our country! Do we want Socialism(Real, not what AOC & others think it is!), Atheism,open borders,massive taxes,etc OR Patriotism,Capitalism,Real religious freedom,incl Prayer& Bibles I hope the later,in which case reelect Trump https://twitter.com/Har_vey007/status/1186033622836490241 …",1186068373832130560
2019-10-20 20:55:10,"CASE, you ready? - 케이스, 준비 됐나? Ready! - 준비 됐습니다!",1186068372242305024
2019-10-20 20:55:10,When you go out for a drink and dont know what to choose... Then you see your favorite at the top of the list! # easychoice If you ever in need to stock up for a gathering. Come pick up a 4 pack or even a case here at the Minhas Craft Brewery! pic.twitter.com/TQXWeECHxn,1186068371143573506
2019-10-20 20:55:07,"I see very little reason for Thielen to play in the ""Case Keenum"" revenge game on Thursday night https://twitter.com/ProFootballTalk/status/1186067331346243584 …",1186068359567175680
2019-10-20 20:55:06,"maybe correlation without causation, but still stands as evidence against the case wealth concentration in market-winners’ hands causes quality investment. if so, you’d expect the opposite correlation. you have to propound confounding factors to save the theory.",1186068356698296320
2019-10-20 20:55:06,Follow us # case # hardcase # apple # iphone # casesph # samsungpic.twitter.com/TZrQ0OsAgU,1186068354823536640
2019-10-20 20:55:05,Will the rest of your tribe be attending???,1186068350348206085
2019-10-20 20:55:04,"My oppinion is that part of it comes to know that you are what you are. But every case is different, so I'm not one to judge, you know? So, definitely, go see your (trusted) doctor and see what can be done. I have to totally agree with you.",1186068346955075584
2019-10-20 20:55:04,Report: Justice Anne Burke ruled on 10 Supreme Court cases involving clients of her indicted husband https://illin.is/2MtJXd9,1186068346699223041
2019-10-20 20:55:03,Wtf happened? I still have no clue. DJ played. He had something on the scoreboard. I had Edmunds on the bench in case I needed a handcuff. If he wasn’t healthy why didn’t they just say so damnit.,1186068342542622720
2019-10-20 20:55:03,"In case you missed it, here’s our timeout performance from the @ KStateFB vs. TCU game! # KStateCheer # EMAWpic.twitter.com/TG7etcd7Hn",1186068342156734464
2019-10-20 20:55:03,Beware of Dog I Am Not Responsible For My Over Affectionate Dog You Have Been Warned Gift For Dog T-Shirt Case/Skin for Samsung Galaxy https://www.redbubble.com/people/dog-gifts/shop/top+selling+border+collie+samsung-galaxy-cases?accordion=product&ref=artist_shop_product_refinement&asc=u …pic.twitter.com/fVvfFqasH5,1186068340609048577
2019-10-20 20:55:02,"Even if bodies are (as biologists have discovered seems to be the case) ""survival machines for genes"" - they have developed some fabulous emergent properties that makes us possibly some of the coolest matter in the universe! And, we can still enjoy it & all the sensations of awe.",1186068336330756096
2019-10-20 20:55:01,# RELEASED: Chrisropher Thompson of # GoodlettsvilleTN was released from the Metro Nashville Jail ( # PreTrialRelease) via Pretrial on 10/18 on the charge of No Driver's License in case: GS902737 TCA: 55-50-301*1 OCA: #592805 http://www.NashvilleArrests.com # PTR,1186068332275032067
2019-10-20 20:55:01,"once again, mostly on purpose in that case sometimes it's not on purpose and that /does/ suck. but, also: generally intended with the 87 artorias and 15 Jeannes and etc;",1186068332044271616
2019-10-20 20:55:00,case one: shinjiro. Actual hobo. case two: Cullen. Racist sweetheart and also almost a hobo case three: Erik. Another hobo case four: Claude. Thinks horse piss is cologne,1186068330651631616
2019-10-20 20:55:00,"Here's some really bad journalism, from @ PhillyInquirer, about a case where it hasn't mattered from the start that the accused is black to anyone but the Inky. I'm relieved it didn't matter to the jury, who clearly recognized a coked-out thug. https://www.inquirer.com/news/philadelphia/michael-white-sean-schellenger-gospel-tabernacle-church-20191020.html …",1186068330182008835
2019-10-20 20:55:00,"The Government's own engagement paper for last year's consultations about a possible ban said: ""In all cases the data does not conclusively demonstrate that these handgun or assault weapon bans [in AUS, US, UK] have led to reductions in gun violence"" https://www.publicsafety.gc.ca/cnt/cnslttns/hndgn/_fls/rdcng-vlnt-crm-en.pdf …",1186068329250705409
2019-10-20 20:55:00,"Sen. Amy Klobuchar: ""There's just a lot of excitement out there and I think it's because I was able to make the case for a lot of people who are tired of the noise and nonsense, telling them that they've got a home with me."" pic.twitter.com/VcsX1kWWyh",1186068328223145984
2019-10-20 20:55:00,"Are those the same prosecutors who said there’s no case against the cops involved in EJKs?, diba @ pnppio?",1186068328030375937
2019-10-20 20:55:00,just in case,1186068327468322816
2019-10-20 20:54:59,If that's the case then ERG members have a lot of explaining to do... https://www.express.co.uk/news/uk/1034719/Brexit-news-ERG-MPs-Theresa-May-Michel-Barnier-Chequers-Ireland-UK-EU-latest …,1186068327183126528
2019-10-20 20:54:59,Then you have the special cases that put you as their whatsapp dp or Facebook dp,1186068325547302913
2019-10-20 20:54:58,"No matter what happens, tomorrow is sure to be an embarrassment for the LPC, polling in Papineau, has justin poised to lose his seat to the NDP. Even if he keeps his seat and a minority, or best case scenario ,Scheer majority, the LPC, is going to feel the repercussions.",1186068319515877377
2019-10-20 20:54:57,"Hahaha believe whatever you want I view you in the same category as a flat-earther or Trump supporter. No facts, no evidence. Nothing to support your case or narrative I base my opinions on facts, statistics, video evidence, common sense. You should use occam's razor for once.",1186068318626729986
2019-10-20 20:54:57,"In case you haven't heard like most did over 2 years ago, that corrupt president Obama & his corrupt DOJ over abused power& broke many laws to spy on his political rivals and fool gullible people like you . Just like you fell for the ""Extremely Careless"" & Trump Collusion . pic.twitter.com/SOumNarE9a",1186068317775245317
2019-10-20 20:54:57,"That's always been the case. A dog can act like a cat as much as it wants. It can even be called a cat. But at the end of the day, a dog is not a cat. Never has, never will.",1186068315187400705
2019-10-20 20:54:56,"You complete the steps in my giveaway posts. And your twitter is automatically entered into a draw using Pickaw software. If you are selected at draw time, I private msg the winner. Upon which I will send them their prize. In this case the prize was 10 chainlink.",1186068312825856000
2019-10-20 20:54:56,"Today, 21st October, is the 27th anniversary of the Kindaichi Case Files! Happy anniversary, Hajime-Chan! Stay tuned for a special release later today :D # irregularscans # kindaichicasefiles # kindaichilovers # kindaichishonennojikenbo # kindaichihajime # mangadex # detectivemangapic.twitter.com/bAKdEdXAwl",1186068311563358208
2019-10-20 20:54:56,I saw this live and saw it coming from a mile away I thought Case was going to call a timeout or change the protection but nope,1186068311077015552
2019-10-20 20:54:52,In any case still looking forward to your next leave and catching up on this and many other subjects!,1186068296212176896
2019-10-20 20:54:52,Yes! Last is best in this case! https://www.facebook.com/story.php?story_fbid=10206906390773809&id=1698922180 …,1186068296069763072
2019-10-20 20:54:52,How is it not sustainable? If this system has been maintained for so long how can the bitcoin network not be? It might not be as efficient as other digital assets but to be a global store of value is still a massive use case. I don’t own btc just giving my opinion,1186068294861774848
2019-10-20 20:54:52,Case closed https://twitter.com/SallyMayweather/status/1185885947155628032 …,1186068293934649344
2019-10-20 20:54:51,Trump you love to break the law. You weasel around and state your case even though it is ridiculous. You blame everybody else but yourself for the hot water you get yourself into. You’re so scared right now because you know you’re wrong! And you’re going to trumpet that every day,1186068291086880768
2019-10-20 20:54:50,I have nothing to wear unless the occasion calls for an @ astros tshirt in which case I have many options,1186068289354686469
2019-10-20 20:54:50,FACTSSSSS Just in case they thought otherwise https://twitter.com/danynestar/status/1186055413818679298 …,1186068286288662529
2019-10-20 20:54:50,WOW! Great work by @ kbolan. # journalism REAL SCOOP: Why did Canada's largest money laundering case fail? https://vancouversun.com/news/staff-blogs/real-scoop-why-did-canadas-largest-money-laundering-case-fail/ …,1186068286275870722
2019-10-20 20:54:49,In that case you'll join us in condemning the Labour Party's actions (as per the thread) wont you.....,1186068284157902849
2019-10-20 20:54:46,"""The problem with cyber warfare is that its very hard to work out who launched the attack in the first place,i n many cases, nobody will claim responsibility for the attacks"" # bcm206 https://www.itpro.co.uk/security/28170/what-is-cyber-warfare …pic.twitter.com/wWnkh4AfDV",1186068268777263104
2019-10-20 20:54:45,He sits there and watches bumass case Keenum have another shitty game and they tell the world time and time again that Haskins isn't ready. That he couldn't go out there and throw for 70yds in a GAME. That he'd do worse. That's not PROTECTING your QB. That's driving a wedge,1186068264646074368
2019-10-20 20:54:43,Not in Jolyon’s case.,1186068258333614080
2019-10-20 20:54:43,PYE: Rand Paul Makes The Case Against Socialism https://dailycaller.com/2019/10/17/pye-paul-case-socialism/ … via @ dailycaller,1186068257364676608
2019-10-20 20:54:40,hey y’all in case you forgot # HockeyIsForEveryonehttps://twitter.com/Canes/status/1109891823223402497 …,1186068247138975744
2019-10-20 20:54:40,lemme tweet my cash app & paypal just in case y’all feeling generous bc i am 100% BROKE & i know y’all got the coin: http://paypal.me/fraybomb http://cash.me/fraybomb,1186068243871608832
2019-10-20 20:54:39,"Chinese journalism at its finest. It may seem laughable in the level of fake news in this, but it’s been successful to drive public opinion multiple incidence, in this case, they might be plotting ways to frame HKers into terrorists https://twitter.com/jeongminnkim/status/1185955465802371072 …",1186068241807863808
2019-10-20 20:54:39,"In fact, in the first 2 weekends overseas AQM was only playing in 42 countries, so I preferred to use in this case its 3rd domestic weekend (fifth weekend overseas) where it was playing in 70 countries for at least 3 weekends, and had debuted in all markets except Japan",1186068240402931713
2019-10-20 20:54:38,Let me break it down for you. 1-Someone is accused of a crime or in your case crimes. 2-An investigation takes place. 3-It goes to trial if enough evidence is found. The house is doing step 2. You don't get to confront witnesses unless there is a trial. So STOP BITCHING.,1186068237236260864
2019-10-20 20:54:38,"corrupt media and democrats thru a fit thinking he was going to make money off the stay. It was at cost and nothing from the federal government, Sad how bad the lies got and bring up the emolument which he has already won 2 cases",1186068235810066432
2019-10-20 20:54:37,"Here’s my two tips to being a “good” cinephile: Dig what you dig without being defensive, cuz you never want to force anyone to watch something. And every once and awhile, watch something you normally wouldn’t. Worse case, you give it 45 mins before you turn it off.",1186068235038482432
2019-10-20 20:54:37,(In case you haven’t checked Harvin played one game in 2013 and had 1 return for 58 yards.),1186068233104871425
2019-10-20 20:54:37,Got some stats on the ‘so many cases’?,1186068232005963777
2019-10-20 20:54:36,"she murmured, sparing him a glance before redirecting her attention back towards her pride and joy. Satisfied with the checkup, she lowered the rifle back into its case, her focus on the sound of the locks as it snapped shut.",1186068230647042048
2019-10-20 20:54:34,Any judge in America can see whats going on. I hope this lady see thru this girls lies. Its not a criminal case but who wants a restraining order on their record???,1186068222208032768
2019-10-20 20:54:33,"I’m a glass half full person, sometimes too much so. But, in this case, it’s true. We need to work on that in case we really need it to win a game.",1186068215345991680
2019-10-20 20:54:32,i probably wont but... just in case,1186068213907513345
2019-10-20 20:54:32,"It easiest way to loss your weight BUT As metabolism levels You should to know the end product of keto dite?(keto bodies ) these has limited range so it's raised to long term cases ""metabolic syndrome"", it's harmful causes another condition.",1186068212972171266
2019-10-20 20:54:32,Oomfs who’s in your phone case rn I’m curious pic.twitter.com/C6JsUArp71,1186068210078097408
2019-10-20 20:54:31,"If the # Saints are smart, they start the undefeated Teddy Bridgewater next week and have Brees as the backup in case of emergency. Then you have a bye in week 9, and Brees can start in week 10.",1186068206705881089
2019-10-20 20:54:31,Thanatos just blanket stared at the bear. “Well at least it isn’t a rabbit. I would’ve been convinced you were for sure a princess for sure if it was the case.”,1186068206458421248
2019-10-20 20:54:27,dude's already wearing clothes designed to be disposable in case you get blood on them,1186068191140823041
2019-10-20 20:54:27,"In this case anyone w cancer, God bless them, should be exempt from sales tax for anything the purchase even remotely connected to their disease.",1186068190289448961
2019-10-20 20:54:27,"In case you've forgotten, Ben Carson was polling as high at this point in the 2016 cycle as Biden is now.",1186068189936902144
2019-10-20 20:54:24,Bitch went out her way to call dcf to tell them I hit my baby dad with a car and lied to them about so much shit the dcf lady knewwww she was crazy and dismissed the case that same week y’all whores are delusional!,1186068179489099776
2019-10-20 20:54:22,"; In Lucina's case, it makes Chrom a grandfather. And it's hilarious. https://twitter.com/FELLSFALCHIDYNE/status/1186067794087026688 …",1186068170269958144
2019-10-20 20:54:18,I wish this was my case https://twitter.com/xtruuClassic/status/1185949141958045696 …,1186068151706046465
2019-10-20 20:54:15,"So we got a case of sweet potatoes in yesterday with this abomination on the box so I would like to introduce you all to ""Cajun King"". Your new unholy yam god... pic.twitter.com/DGrtKVGvmF",1186068141841014786
2019-10-20 20:54:14,I'm having to jump through hoops to find parts that aren't fucking christmas trees. It was bad enough to find a case that was simple and not a goddamned rave party.,1186068137457922049
2019-10-20 20:54:13,"and, surprisingly, they do it. Their case is the more difficult only because they so often seem approachable and understandable for a moment. Have never understood how it is possible for almost everyone who writes to objectify his sufferings",1186068133724987393
2019-10-20 20:54:12,"Pautang, pambili lang case ng phone sa shoppee",1186068128289054720
2019-10-20 20:54:12,There are people who do it that don't complain..my mom does it..my aunt does it..we find ways to circumvent our circumstances.. getting extra jobs..not saying that should be the case but currently it is,1186068127043457024
2019-10-20 20:54:11,Except history has shown McCarthy was right in HUNDREDS of cases...Adam hasn't EVER been right. https://twitter.com/Hoosiers1986/status/1185922179332018179 …,1186068125978185728
2019-10-20 20:54:09,"I see. That's your favorite food... In that case, I shall learn to make it, just for you~",1186068114296803328
2019-10-20 20:54:09,lol I’m walking my dog and this dude come asking me for case quarters.,1186068113718153216
2019-10-20 20:54:07,@ realDonaldTrump just in case you didn’t see this! Enjoy! https://twitter.com/DesignationSix/status/1186050074733879296 …,1186068107904708608
2019-10-20 20:54:07,You can’t be dismissive of mental illness in cases like this. You don’t understand because you’re not I’ll that way but to others it’s very real.,1186068107099623425
2019-10-20 20:54:06,https://www.newsandtribune.com/news/fifth-arrest-made-in-new-albany-murder-case/article_8a94266c-a9bd-11e5-b78a-8750b623cf3d.html … | Fifth arrest made in New Albany murder case,1186068101776969728
