date,text,id
2019-10-20 20:59:57,"The evidence has never come into question such as it has since KZ has taken the case. If there’s nothing to be found, then U should be sitting back & laughing yet your not. The state should hold no objections 2 anything being retested at her expense.",1186069576833847296
2019-10-20 20:59:57,"Hi Rebecca, we're sorry to hear about the trouble you're experiencing with your account. To confirm, have you checked your spam/junk e-mail folder just in case correspondence was routed there by mistake? Please let us know; we're here to help as best we can. ^LO",1186069573570875392
2019-10-20 20:59:56,Black people.. stop putting water in your hand soap.. go to the damn dollar store and buy a case,1186069573017260032
2019-10-20 20:59:55,Never understood the rational behind that proposed use case; I mean did the original white paper mention anything about BTC being a SOV?,1186069568688574464
2019-10-20 20:59:50,"I'll send this tweet to our product team with the email title ""cat proof case.""",1186069545506627584
2019-10-20 20:59:48,Yeah it’s fucking brutal.. this is worst case. This season sucks so much,1186069537562746880
2019-10-20 20:59:47,Life saver ung nag iipit ka ng pera sa case ng phone. Magandang Buhay Everyone,1186069534815318016
2019-10-20 20:59:47,"A child's mind is the easiest to manipulate. Predators create from scratch, a false reality. In the child's world, that false reality is as real as the world you believe. They will become accustom to, and even defend, lie, and in extreme cases kill for their false beliefs.",1186069533007724544
2019-10-20 20:59:46,"Only way I could do it was by train, and they’re paying £70 towards my travel so I’ve got a first class ticket, as that was £84. I keep staring at the E-ticket and the email confirmation of the show in case the date on either changes.",1186069530658914310
2019-10-20 20:59:46,"What did you decide? Just got home - it was superb. Sending second hand joy, in case you didn’t make it.",1186069530478559232
2019-10-20 20:59:44,No face no case,1186069522433789952
2019-10-20 20:59:44,GTA RP gonna be spicey today One of the biggest court cases against one of the most popular Gangs Terrorism charges and Murder Gonna be so interesting and great to watch,1186069521850781696
2019-10-20 20:59:44,"Selling Case iPhone X sand neon Rp 50,000 https://id.carousell.com/p/257762873 # carousell @ carousell_idpic.twitter.com/7VceF7gJyC",1186069521292939265
2019-10-20 20:59:44,"Sir, Just in case you haven’t heard, I’m sorry to inform you that Speaker Pelosi’s older brother has passed away. As our President, it would behoove you, and your surrogates, to refrain from any public criticism of Ms. Pelosi during this mourning period. The country thanks you.",1186069520944975873
2019-10-20 20:59:44,연단 올라가야 합니다 이런 저런 이야기 하기 싫고 구호도 쑥스러워서 싫으면 찬송가 성가라도 하시죠 ㅎ 개독 서이비 먹사 신부 땡중 등 종교인들 반성 좀 하라고요 ㅎ 좌우지간 !! 무조건 !! 연단 올라 가시라 !!pic.twitter.com/9wsiSYzTzx,1186069520743428098
2019-10-20 20:59:43,This thread is barely 24 hours old and there's already a new case study. https://twitter.com/JajaPhD/status/1185868055122993152 …,1186069516461248513
2019-10-20 20:59:41,I am a Mandarin speaker. I have never been to Hongkong. But i think people didn’t respect you in most cases are because of youself. Most of the mandarin speaker are miserable and rude. They serve it!,1186069509603500033
2019-10-20 20:59:41,In case you missed it... https://amp.cnn.com/cnn/2019/09/12/politics/ivanka-trump-women-empowerment-us-policy/index.html …,1186069507300827136
2019-10-20 20:59:40,Cold Case Files / Netflix,1186069502900834305
2019-10-20 20:59:39,"Selling Case iPhone X sand neon Rp 50,000 https://id.carousell.com/p/257762873 # carousell @ carousell_idpic.twitter.com/p7pYRS4fbv",1186069501088944128
2019-10-20 20:59:39,"cold jarritos, mythic on and shopping for a case for my new phone has convinced me i am capable of a happy sunday evening pic.twitter.com/rnf3hIQVR2",1186069498903912448
2019-10-20 20:59:37,"Sweats, slacks or jeans, short sleeved shirts, and a thin sweater/jacket/hoodie in case it gets chilly. I don't like wearing socks much so I have ice cold feet.",1186069491156828160
2019-10-20 20:59:37,Here are two concrete examples: (1) https://www.podbike.com/en/ (2) https://www.velometro.com/ . The use case for large/heavy private cars is evaporating.,1186069489986572288
2019-10-20 20:59:34,In case anyone was curious how excited Beavercreek Friends got during the costume reveal for the 2019-2020 season pic.twitter.com/tMNCpEF3SI,1186069477022195713
2019-10-20 20:59:33,We’ve got a bottle of champagne. And a bottle of vodka. Ready to go. Depends on election results. # ConservativeMajority - champagne worst case # LiberalNDP - vodka. Hang in. Gonna be glad when it’s over.,1186069474618695680
2019-10-20 20:59:31,"True (and unfortunately so), but that’s the case for only a rather short list of issues. There are a ton of political positions in the US which are amazingly conservative by most European standards. Many of which are quite hard to grasp from a distance, tbh",1186069464950943749
2019-10-20 20:59:31,Do you plan to correct your error here and admit that all of these cases happened under the Obama administration? # liberalslie,1186069464233590784
2019-10-20 20:59:28,# 90DayFiance let’s do this!! I may even have a beer in case Darcey cries...,1186069455119536129
2019-10-20 20:59:28,"I have Toyota’s tire protection plan & a Milwaukee tire inflator in my car just in case, but this weekend I lend it to my dad who went up north & now I got a flat tire..",1186069451730341888
2019-10-20 20:59:27,"Dean Z (Explorer shape) Case Bartolini dual coil pickup Gives a very RIDE THE LIGHTNING tone $220 # forsale # instrument # bassguitar # bass # bassporn @Van Nuys, California https://www.instagram.com/p/B32_zNmjCl-/?igshid=tj6tgriyrpvw …",1186069451202015232
2019-10-20 20:59:27,"— cafe. Namjoon's heart ached in regret, his work wasn't supposed to be his lifeline but this case was just too great and important to remove from reality, even if it was for an hour's coffee date with his husband. Namjoon cupped his husband's face and —",1186069447632719872
2019-10-20 20:59:26,"You don’t read reply tweets? Yes. D’Oh! http://Amazon.com - huge business.. lots of employees. My point is that those 650k employees are horribly exploited in very many cases. People not paid sufficient, certainly not a fair wage, in order to cover cost of life.",1186069447070617600
2019-10-20 20:59:26,Shit man. You're giving a compelling case to get a burner,1186069446940614656
2019-10-20 20:59:26,"@ JamesDa40238647 looks like the classic bot BUT seems OK to me. Give him a follow, unless you know more than I do - in which case, let me know.",1186069445795598336
2019-10-20 20:59:24,The real cases catch the eye and draw customers in. I don’t like the rule at all and feel like the company should provide GameStop with an extra few cases to display or at least some extra inserts for their generic plastic cases.,1186069437360885760
2019-10-20 20:59:23,Drinking pickle juice just in case,1186069434147860481
2019-10-20 20:59:23,"And in case you're thinking that maybe these adopters really love these children and want to give them a better life, they don't. They're racists who believe that raising ""heathens"" in fundamentalism will get them into heaven. A lot of these children end up abused or dead.",1186069431765606402
2019-10-20 20:59:22,The NXIVM Case: Catherine Oxenberg Shares Her First Experiences with The Alleged Cult https://famousdoctorshow.com/?p=516635,1186069429349769216
2019-10-20 20:59:22,"Okay so can I have a Daniel Caesar too ? Paris, the 20th Case study 01 Tour pic.twitter.com/8yZRCQeBAV",1186069427537747969
2019-10-20 20:59:22,"And yes, I've had an issue with it since day 1. Today is nothing new. I could at least accept the chase because all 10 races mattered. But now that's not the case and it's stupid. Not to mention the racing this year has been the worst it's ever been in my 32 years on earth.",1186069426354958338
2019-10-20 20:59:17,"Now moving from # Plasmodium/ # malaria detection methods to clinical cases. In this case report, 3 instances of resistance to artemether-lumefantrine combination therapy (ACT) in Benin City, Nigeria are presented. Important to keep an eye on these cases: http://www.scielo.br/scielo.php?script=sci_arttext&pid=S0037-86822019000100729&lng=en&nrm=iso&tlng=en …",1186069407421915136
2019-10-20 20:59:16,but man this one is a special case.,1186069404305494017
2019-10-20 20:59:16,"The winter mornings were always crisp and bitter. But that also reflected Jin's personality as he stared at his husband from across the table, head buried in his phone as he was answering countless emails to do with the update in Yoongi's case. It hurt to —",1186069402883678208
2019-10-20 20:59:16,"Shelf dusted and slightly rearranged. I think I need like display cases for all of my weeb/game figures. I can't let go of the shelves. Ah, one day. pic.twitter.com/HYBhI5N9fS",1186069402585849858
2019-10-20 20:59:16,I loved that LEMII Case Files just assumes that you know what a Dead Apostle is but EXPLAINS THE HOLY GRAIL WAR. Who’s the target audience??,1186069401554112512
2019-10-20 20:59:15,Or do the same with YouTube & Google (for history & geography in my sons case),1186069397594464256
2019-10-20 20:59:14,ありがとうCase.2…,1186069393937068033
2019-10-20 20:59:12,"Honestly, it was way more appropriate than a lot of other cases. Two-face is very much in control, he just wants to concede guilt of his actions to a higher power to absolve himself of his moral failing.",1186069388585246720
2019-10-20 20:59:12,In case you missed this extremely wholesome thread: https://twitter.com/sarahfor5/status/1185993832770523136 …,1186069387314421760
2019-10-20 20:59:11,I don't wish any harm to Hillary. I do wish however that she gets a really bad case of diarrhea and sneezes in rush hour traffic on the freeway in the far left lane.,1186069382113320960
2019-10-20 20:59:10,"Seriously, folks should stop making this case from founders or precedent. The very first presidential impeachment was Andrew Johnson, in 1868; it ended under 6 months from his eligibility for election & came within one vote of removal at impeachment trial by the Senate.",1186069379722764290
2019-10-20 20:59:08,"October 20th, 2019 Just in case and I hate the person who put this on my TL",1186069368922398720
2019-10-20 20:59:06,"You're trying to convince people that you and your wife agree 100% of the time, on 100% of decisions. That simply cannot be true (and attempting to make marrieds think otherwise does them a disservice). In those cases, who makes the final decision, you, or your wife?",1186069360999157760
2019-10-20 20:59:05,"Thread by @ 3Days3Nights: ""1) HOW JUSTICE THOMAS CAN BANKRUPT THE MSM WITH A SINGLE SCOTUS CASE IN 2020 Since 1964, reporters can make up fakeBLIC figure with virtually no risk of being sued for DEFAMATION. This thread explores how Justice Thomas will […]"" https://threadreaderapp.com/thread/1185398713822396416.html …",1186069358075957248
2019-10-20 20:59:05,"You're ""telling me"" the ""moral event horizon "" is the point of consideration. If that's the case then you're equating the potential (likely) loss of life in war to someone asking for 32 (72 in Cali) genders and says biological men have periods. That's beyond folly.",1186069356750528514
2019-10-20 20:59:01,Case and point: my shrimp pasta I made tonight didn’t need banana but I cannot eat without a banana on the side pic.twitter.com/cJO2pwiz7B,1186069342045310976
2019-10-20 20:59:01,Whoop! Whoop! End of day report for 20/10/2019. Over 400 million tweets analysed. *The Positive Case for the Union* was not found.,1186069339704823809
2019-10-20 20:59:00,"If that's the case, why haven't Buhari been convicted????",1186069337578377216
2019-10-20 20:58:59,In my targeting case here. I’m believing that perp. Has the ability to see incoming and outgoing air traffic?,1186069331102326787
2019-10-20 20:58:58,"There's a body of work on this, finding legal scholars are substantially worse than political scientists at predicting case outcomes (https://cpb-us-w2.wpmucdn.com/sites.wustl.edu/dist/4/1744/files/2019/01/The-Supreme-Court-Forecasting-Project-Legal-and-Political-Science-Approaches-to-Predicting-Supreme-Court-Decision-Making-2bvpcdb.pdf …). Yet, empirics also show ""surprises"" happen most in 5-4 splits (https://journals.plos.org/plosone/article?id=10.1371/journal.pone.0027188 …). These are ""close"" ones. 3/5",1186069327251935232
2019-10-20 20:58:57,"https://instinctmagazine.com/uncertainty-reigns-following-the-supreme-courts-recent-lgbtq-non-discrimination-cases/ … I wrote an indulgently long piece assessing the Title VII Supreme Court cases. There are loads of insights in the links -- folks at Out, LGBTQ Nation, Vox, BuzzFeed News, and more, both news orgs and individuals, are doing exceptional work. Read them! 1/5",1186069325096144896
2019-10-20 20:58:57,"In that case, please contact us directly using this link: http://amzn.to/NASkipLogin , which will not require you to sign in to your account. Please let us know how it goes! ^JH",1186069325083533312
2019-10-20 20:58:57,I frequently discuss pleas with officers. It’s not a matter of obtaining their permission though. Detectives that investigate a case for significant periods of time frequently have insights I might not have that are helpful to me in deciding what I think is appropriate,1186069324198535168
2019-10-20 20:58:56,CASE Y’ALL 4GOT it’s still R.I.P Nippsey Hustle FOREVER,1186069319488327681
2019-10-20 20:58:54,"hello beautiful ppl, just in case you haven’t heard this in a while, i love you very much and hope you’re alright",1186069312722702337
2019-10-20 20:58:51,I thought you could only sue for fraud or defect. But if the product was manufactured as intended and there was an injury... they are unable to be sued...and the case must be heard in vaccine court.,1186069299909271552
2019-10-20 20:58:50,In that case... Tinas ——> polish,1186069292955119617
2019-10-20 20:58:49,Welllll you get a 3 for one in my case https://twitter.com/sjdess00/status/1185607443977388032 …,1186069289394008064
2019-10-20 20:58:48,"You sent me the defense spending bill for 2017 (which is why I couldn't find a specific GMA vote). You just made my case for me! Maybe she disagreed with something else in the bill, and as a member of the military she may have had some specific insight!!! pic.twitter.com/L2CHEQJeIh",1186069287464779777
2019-10-20 20:58:48,"Saying ""triggered"" in this case.. not a good idea. It can imply that they were in the wrong about reasonably criticising the claim, which is an insult. Also what others said about trauma. https://twitter.com/NordVPN/status/1185979478205485056 …",1186069285925511168
2019-10-20 20:58:46,"Just in case you don't have time to read this, let me summarise... Blah blah blah, some scientific info, blah blah blah, God.",1186069279533346818
2019-10-20 20:58:46,"U are so wrong on this. Everything . @ HillaryClinton warned Americans about is materializing. # Hillary made her case, Americans made their choice.",1186069278400757761
2019-10-20 20:58:44,"goodmorning, in case no one greeted u.",1186069268649009153
2019-10-20 20:58:44,"They invest time on it, to support and *correct* your analysis, and in most cases push your science forward, substantially, to the extent you'd never achieve by yourself. How would you call it? I would call it as a contribution that deserves an authorship. (5/n)",1186069268238090240
2019-10-20 20:58:41,"In this case I must add it was one main perpetrator and the majority of people rose up against his shitty comments and called him out, and the admins removed him in record time once they saw the tone and direction he was going in, so fair play to them. Not an easy job! https://twitter.com/JayRow/status/1186068083284303874 …",1186069255520948225
2019-10-20 20:58:37,"Troops sign up to be in the line of fire, Senator Cornyn. Literally. In this case, in the fight against ISIS. No one wants war, but sometimes we have no choice. Safe troops in a war put everyone else in danger.",1186069240828383233
2019-10-20 20:58:37,Mistrial declared in Corte Madera rape case https://bayareane.ws/2BvppuM,1186069239695921159
2019-10-20 20:58:33,The Dodgers can offer them much better players if that's the case. Better than that butcher Andujar for sure. They'll hand that kid a contract with a blank figure and let him put the 300 million on it.,1186069223828869122
2019-10-20 20:58:31,I walk into a room and treated as a nonentity. Even like grunt in many cases. I've been sent there to fix their major technology issues. But viewed as someone only worthy of getting donuts and coffee. And i let them struggle with their disrespect until that moment of collapse.,1186069213988954112
2019-10-20 20:58:31,caught a case https://twitter.com/ga_simba21/status/1156237480577736704 …,1186069212562886658
2019-10-20 20:58:29,Bro that's a case https://twitter.com/extendedclip2/status/1186000502502371334 …,1186069207861153792
2019-10-20 20:58:29,"Some cases of autism are brought on by physical trauma, some may be brought on by toxins and others may be brought on by vaccines and some... even by heredity. But, it makes no sense that all cases are brought on by heredity... all of a sudden, since 1965 or so.",1186069206850138112
2019-10-20 20:58:27,Google Pixel 4 and MNML Case international giveaway! https://wn.nr/LD2NEE,1186069197329092608
2019-10-20 20:58:25,1/2 My season 11 theory: Before the event the visitor sent out a crew (A.L.T.E.R) to go find a new island just in case of the zero point explodes during the event (more on that in a second). The zero point does explode ending up in a black hole and killing the players on the—,1186069188571521025
2019-10-20 20:58:25,"This might sound crazy but just upgrade to the 11 pro, it’ll probably be worth it in your case.",1186069188206649345
2019-10-20 20:58:24,well in that case we should have hope! :),1186069186356940801
2019-10-20 20:58:22,"I got my screen and case for my new phone. So like, can my phone come now??",1186069178828103681
2019-10-20 20:58:21,A second with lashings of butter in my case. Definitely brekkie,1186069174344470528
2019-10-20 20:58:20,"8-8 best case scenario. Everything on the offense side is terrible from the QB to the O line to the pathetic play calling. Defense, on the field way too much, clearly missing Hicks.",1186069169831202816
2019-10-20 20:58:20,"The infamous Insular Cases ""seen"" and discussed at the Supreme Court of the United States have only served to perpetuate our colonial status.",1186069169458032642
2019-10-20 20:58:20,"Hey there, we haven't forgotten about your case — could you tell us if you're still experiencing the same thing when casting YouTube?",1186069168157646848
2019-10-20 20:58:20,WAIT COME BACK- link me in case,1186069167822327808
2019-10-20 20:58:19,Then I think it would be fine in any of both cases. I mean being Romani does not means you can only be dark skinned there are many factors that can alter that but yeah if they get an actual Romani actor to play him it will be 100 times better,1186069163149627392
2019-10-20 20:58:16,Chauncey Gardner Johnson might have to replace him hope that's not the case but you never know.,1186069151082790912
2019-10-20 20:58:16,In Case It’s Fumes... Smoke,1186069150055227392
2019-10-20 20:58:14,Unfortunately Austlii only lists the top 20 most cited decisions in the High Court. There is no 'page 2'. And those are the only 2 criminal cases in the top 20 cited HCA decisions. But there is more on Jade.,1186069141255417856
2019-10-20 20:58:13,She is turning into a full fledged nut case. Be careful if you come in contact with Babs. In other words run like hell to keep your sanity.,1186069137501519872
2019-10-20 20:58:12,"THREAD/ Following last week's threads on the most-cited criminal appeal cases in each state/territory, here's the one you've been waiting for: what are the 5 most cited @ HighCourtofAus criminal cases? Credit: @ austlii and @ barnetjade.",1186069134930411520
2019-10-20 20:58:08,"Unsurprisingly, my audience thinks EM should be the expert witness (I tend to agree). The actual case had an IM doc and a thoracic surgeon. The original expert witness opinions will go out to http://medmalreviewer.com subscribers in the next 1-2 months.https://twitter.com/efunkEM/status/1185670427651313664 …",1186069119726243841
2019-10-20 20:58:08,"Thread by @ GregRubini: ""1. Gen. Flynn case - the Mifsud Blackberry phones [THREAD] the two Blackberry phones that were given to Mifsud did not have an Italian SIM. […]"" https://threadreaderapp.com/thread/1185488360959291393.html …",1186069118958653442
2019-10-20 20:58:08,"Robo debt HUGELY benefits big insurance co's using dodgy ""C'link offsets"" to understate IP income to C'link recipients. Insurers happily pay any debt raised because it's less than half the amount they really should pay. Here's how it works - a real case study for DSP recipient pic.twitter.com/Llkrxccabv",1186069117725315072
2019-10-20 20:58:08,"Sadly their accents and race point to the source of their homophobia, so in this case it’s not discrimination but pointing out why they are the way they are... isolated in their own community and think their behaviour is OK.",1186069116806934528
2019-10-20 20:58:08,"Honestly. Best case scenario is a wildcard. But that means they would need a competent OL. A good play caller. A Defense capable of making tackles. It isn’t looking good right now. 2-5 is hard to climb out of, especially with how they’re playing https://twitter.com/ReeseGarciaa/status/1186068126414204928 …",1186069116743909377
2019-10-20 20:58:06,Anyway in case anyone asks why I never wanna see Shishikai again this is why,1186069109987041280
2019-10-20 20:58:06,"Yeah, well, it is pretty much a no-brainer for people who actually know how to investigate and prosecute cases. Most of the people popping off on Twitter about this have no idea what they're talking about. (Am I fed up with it? Yup.)",1186069107676012544
2019-10-20 20:58:05,This...this is an endorsement???https://twitter.com/DrakeUGriff/status/1186062454624792577 …,1186069106287693825
2019-10-20 20:58:03,"Seriously? WTF? Meanwhile, #45 tweets have been cited in 40 cases of assaults and hate crimes, famously including the guy who sent pipe bombs right before 2018 elections; the El Paso killer; and the Pittsburg synagogue shooter. But #45 keeps on tweeting.",1186069097101946880
2019-10-20 20:58:02,"https://youtu.be/pzg_T5FuH4s In case you haven't watched it, around the 1:30 mark",1186069093939499010
2019-10-20 20:58:01,"Absolutely. If this is a case of, ‘is it okay to defend our ideology with violence if need be?’ it absolutely is, hardly a discussion. At first glance it just came across as like a Potsdam Conference situation à la « so what do we do with the Nazis? »",1186069087300063232
2019-10-20 20:58:00,Got some drank just in case this game have me feeling some type of way.,1186069082677960705
2019-10-20 20:57:59,"My Uber driver tn had this drunk girl in his front seat that he didn’t know, he said she got in the wrong car and he was gonna take her home after me I PRAY that’s actually what he does. Buuuuut I took a video of us in the car just in case",1186069082262687744
2019-10-20 20:57:57,"Sadly, it's only warranted when technology doesn't allow for foot-stamping frustration with disagreement to be effected. In any case you're not going to grow up because I tell you to so indulge yourself.",1186069073605648384
2019-10-20 20:57:55,The neko’s stubborn nature made her eyebrow twitch. “In that case I guess we can share this room together.”,1186069064868777984
2019-10-20 20:57:54,"Its typically me to say the latest version of one of my things is ""the best ever"" but, # BohemianRhapsody could be my new favorite biopic!?...2nd only to Walk Hard ""Dewy Cox Story...obviously!?! //edit// Case in... https://www.facebook.com/1339309945/posts/10214952165181154/ …",1186069060997599232
2019-10-20 20:57:54,YES I KNOW I DO BUT I WILL CATCH A CASE MAAM UNLESS HE MOVES TO THE UK THEN ILL BE FINE,1186069060804628482
2019-10-20 20:57:54,Just wanted to show due to the wait and me being out with my FAMILY I said I would throw in a free glow skin and I even also said I would of refunded if the case wasn’t open so then it doesn’t end up me paying twice HATE STUFF LIKE THIS pic.twitter.com/HPgbQctvw5,1186069057600016390
2019-10-20 20:57:52,"If the other woman slept with someone else, he'd be pissed using the same logic. Unless she's also cheating by being with him, in which case he's ""stealing"" the other woman for himself from another man. But he still wishes he ""had exclusive rights"" to the other woman.",1186069050255912960
2019-10-20 20:57:51,@ CassandraRules libel case is over pic.twitter.com/gTQozg2GPg,1186069046086819840
2019-10-20 20:57:51,That’s a threat in case you couldn’t tell! corruption and lies!,1186069045826555904
2019-10-20 20:57:50,sees i have a case study and exam this week on top of the usual 2 discussion q's and reading work: pic.twitter.com/aLzeCpySdp,1186069044157394946
2019-10-20 20:57:49,"Obstruction charges could prove useful in Australian antitrust investigations, former head of US DOJ’s criminal antitrust enforcement unit @ lisa_m_phelan told me in an interview for @ mlexclusive We discussed @ acccgovau case against @ BlueScopeAus and former manager Jason Ellis",1186069039329599491
2019-10-20 20:57:49,He's not making a good case to get paid,1186069036490280961
