date,text,id
2019-10-21 20:15:37,Deltan recusa hipótese de promoção para continuar lutando contra corrupção na Lava-Jato – Noticia Brasil Online https://noticiabrasilonline.com/deltan-recusa-hipotese-de-promocao-para-continuar-lutando-contra-corrupcao-na-lava-jato/amp/ … via @NBO04169435,1186420804352925696
2019-10-21 20:15:26,"Moro direcionou ações da PF na Lava Jato sem pedido do MP, diz Intercept https://youtu.be/XkhQdRep1-k via @ YouTube",1186420762061750272
2019-10-21 20:15:15,Show de bola perfeito. Fora petralhas do inferno. Avante senhor procurador da lava jato. Deltan Dallagnol.,1186420713294651392
2019-10-21 20:15:01,"Mañana 22 de octubre a las 8:00 a.m. en # APensarMás con @ rmapalacios, estará el expresidente de la Comisión Lava Jato del @ congresoperu , @ juan_pari, quien hablará sobre los últimas revelaciones del caso Odebrecht que implican al fallecido ex mandatario @ AlanGarciaPeru.pic.twitter.com/JwISr2mHHQ",1186420655589384192
2019-10-21 20:14:50,Bombardier revela modelo renovado de jato executivo para competir com Embraer http://zpr.io/tG7q3,1186420609288421376
2019-10-21 20:14:36,"Mañana 22 de octubre a las 8:00 a.m. en # APensarMás con @ rmapalacios, estará el expresidente de la Comisión Lava Jato del @ congresoperu , @ juan_pari, quien hablará sobre los últimas revelaciones del caso Odebrecht que implican al fallecido ex mandatario @ AlanGarciaPeru.pic.twitter.com/Dx5ykJEmaz",1186420550291378177
2019-10-21 20:14:24,"diz que a lava jato é organização criminosa, impeachment é golpe, o Lula é inocente e a Marina Silva se importa com meio ambiente, é pra acabar com tudo.",1186420500500795392
2019-10-21 20:14:22,Barroso parte para o ataque e exalta Operação Lava Jato https://republicadecuritiba.net/2019/10/07/barroso-parte-para-o-ataque-e-exalta-operacao-lava-jato/ …,1186420490887401477
2019-10-21 20:14:18,Deltan Dallagnol abre mão de promoção para ficar na Lava Jato https://www.agoranoticiasbrasil.com.br/deltan-dallagnol-abre-mao-de-promocao-para-ficar-na-lava-jato/ …,1186420472990355457
2019-10-21 20:13:53,Deltan dobra a aposta e agora só sairá da Lava-Jato se for tirado do cargo https://veja.abril.com.br/blog/radar/deltan-dobra-a-aposta-e-agora-so-saira-da-lava-jato-se-for-tirado-do-cargo/ … via @ VEJA,1186420368862523393
2019-10-21 20:13:24,Deltan recusa promoção e fica na Lava Jato https://www.oantagonista.com/?p=266988,1186420246518910977
2019-10-21 20:13:19,"Meu caro @ Leoni_a_jato, fico pensando qual seria e quem daria o primeiro passo para acabar com esta palhaçada. Nada de confortável me vem a cabeça. O que fazer quando o inimigo é um estado fascista apoiado por um povo fascista?",1186420226461749256
2019-10-21 20:13:02,https://www.nytimes.com/reuters/2019/10/17/world/americas/17reuters-ecuador-protests.html …,1186420155473113088
2019-10-21 20:12:57,"É um lixo, né? Como alguém teve coragem de votar naquilo! O cara é um desorientado. E um oportunista. Não vale nada.",1186420135147515905
2019-10-21 20:12:44,Deltan Dallagnol abre mão de promoção para ficar na Lava Jato https://www.agoranoticiasbrasil.com.br/deltan-dallagnol-abre-mao-de-promocao-para-ficar-na-lava-jato/ …,1186420080235761665
2019-10-21 20:12:09,"Qual o problema com o Foro? Não há outra entidade de Esquerda latino-americana com participação tão ampla. O Jaime Vargas, presidente da CONAIE, que liderou o levante indígena no Ecuador de ser candidato a presidente pelo Partido Pachakutik. O Pachakutik é membro do Foro.pic.twitter.com/8B9qlShHDg",1186419933586083841
2019-10-21 20:11:57,SÉRIE - A FONTE. CAPÍTULO 1. VEJA PORQUE A LAVA JATO SÓ COMEÇOU https://youtu.be/DvYaE5tQkyo via @ YouTube,1186419883157970944
2019-10-21 20:11:50,Deltan Dallagnol abre mão de promoção para ficar na Lava Jato https://www.agoranoticiasbrasil.com.br/deltan-dallagnol-abre-mao-de-promocao-para-ficar-na-lava-jato/ …,1186419852929650693
2019-10-21 20:11:48,Deltan recusa promoção e fica na Lava Jato - https://www.oantagonista.com/brasil/deltan-recusa-promocao-e-fica-na-lava-jato/ …,1186419847783157761
2019-10-21 20:11:46,Deltan Dallagnol abre mão de promoção para ficar na Lava Jato https://www.agoranoticiasbrasil.com.br/deltan-dallagnol-abre-mao-de-promocao-para-ficar-na-lava-jato/ … via @ AgoraNoticiasBr,1186419837486145537
2019-10-21 20:11:36,Vem cá gente kkkkkk @ lelispatricia @ delucca @ flaviogomes69 @ Leoni_a_jato pic.twitter.com/9sJsgqhE85,1186419795052380161
2019-10-21 20:11:30,"ConJur - ""Lava jato"" usou ajuda internacional para criar fundo bilionário https://www.conjur.com.br/2019-out-18/limite-penal-lava-jato-usou-ajuda-internacional-criar-fundo-bilionario … via @ ConJur_Oficial",1186419768649244672
2019-10-21 20:11:10,Deltan recusa promoção e decide continuar na Lava Jato em Curitiba https://www.brasil247.com/brasil/deltan-recusa-promocao-para-continuar-na-lava-jato-em-curitiba …,1186419687829262336
2019-10-21 20:11:07,Deltan Dallagnol abre mão de promoção para ficar na Lava Jato https://www.agoranoticiasbrasil.com.br/deltan-dallagnol-abre-mao-de-promocao-para-ficar-na-lava-jato/ …,1186419672528371713
2019-10-21 20:10:53,"Eu com emocional já lascado, mainha gritou cmg, sai de casa a jato pq tem dia que só Deus na causa",1186419616165384193
2019-10-21 20:10:52,Deltan Dallagnol abre mão de promoção para ficar na Lava Jato https://www.agoranoticiasbrasil.com.br/deltan-dallagnol-abre-mao-de-promocao-para-ficar-na-lava-jato/ …,1186419609907408901
2019-10-21 20:10:49,"Não, pior... condena ditaduras, mas também é um ditador.",1186419596405948416
2019-10-21 20:10:44,"@ RodrigoMaia cadê a prorrogação da CPI do BNDES? Se mexe, fosse algo contra a Lava Jato já teria feito com urgência né?",1186419578311720960
2019-10-21 20:10:09,"kkkkkkkkk, esse é o tipo de flexão que eu faço, nao posso julgar....kkkkkkk",1186419430613499904
2019-10-21 20:10:03,Deltan rejeita interesse em promoção que o afastaria do comando da Lava Jato http://ow.ly/QSPf50wQKsl,1186419403308568584
2019-10-21 20:09:54,"A crise, acima de tudo, é estética",1186419367032082432
2019-10-21 20:09:37,o milicano e o juiz ladrão enterraram a lava jato pic.twitter.com/r1fcGXbOwA,1186419294713864192
2019-10-21 20:09:36,"É verdade, o senador foi bem ""melindrado"" pela Lava jato",1186419291471654917
2019-10-21 20:09:33,Deltan recusa promoção e fica na Lava Jato https://www.oantagonista.com/?p=266988,1186419281245999105
2019-10-21 20:09:25,Deltan Dallagnol abre mão de promoção para ficar na Lava Jato https://istoe.com.br/deltan-dallagnol-abre-mao-de-promocao-para-ficar-na-lava-jato/ …,1186419246160646144
2019-10-21 20:08:36,"Eles não caem na conversa. É uma guerra de narrativas, então eles acham conveniente narrar assim. A verdade não vive mais entre nós.",1186419039008153605
2019-10-21 20:08:11,"Pelo andar da carruagem os desentendimentos no MPF continua. O PGR parece não ter poder sobre o Chefe da Lava Jato, é isto Ministros @ gilmarmendes @ RicLewandowski e @ marcoamello ?https://youtu.be/N7lrnI21S3M",1186418937199824897
2019-10-21 20:07:52,@ deltanmd é outro Herói Nacional. É lamentável o q fizeram e o q ainda estão fazendo com este homem temente a Deus e q durante estes anos de Lava Jato arriscou sua própria vida e a paz de sua família na luta por um País livre da Corrupção. # EuApoioDeltanDallagnol # LavaJatohttps://twitter.com/DadsDaughter777/status/1186415274297311232 …,1186418854739795972
2019-10-21 20:07:39,Deltan recusa hipótese de promoção para continuar na Lava-Jato em Curitiba - https://noticiasamericadosul.com/2019/10/21/deltan-recusa-hipotese-de-promocao-para-continuar-na-lava-jato-em-curitiba/ …,1186418799370784771
2019-10-21 20:07:14,"Essa não é a população! Só vejo jovens, aparentemente universitários idiotas úteis, rebeldes destrutivos.",1186418696627130368
2019-10-21 20:07:13,"""Impeachment de Dilma foi manipulado pela Lava Jato"", diz Aloysio Nunes - CartaCapital https://www.cartacapital.com.br/politica/impeachment-de-dilma-foi-manipulado-pela-lava-jato-diz-aloysio-nunes/amp/?__twitter_impression=true …",1186418691774267393
2019-10-21 20:06:55,"“Ninguém foi preso injustamente na Lava Jato e nada vai mudar essa verdade”, diz Moro https://republicadecuritiba.net/2019/10/11/ninguem-foi-preso-injustamente-na-lava-jato-e-nada-vai-mudar-essa-verdade-diz-moro/ …",1186418616322973696
2019-10-21 20:06:31,Othon foi condenado injustamente por corrupção pela operação fraudulenta e golpista da Lava Jato em 2016. Então com 77... https://www.causaoperaria.org.br/acervo/blog/2017/10/14/almirante-otho-finalmente-livre-o-mais-importante-cientista-nuclear-brasileiro/#.Xa453U8GsH7.facebook …,1186418516385239041
2019-10-21 20:06:24,Se ajoelhando pro Trump.,1186418485284474881
2019-10-21 20:05:52,São poucos os... Me engana que eu gosto,1186418352660635648
2019-10-21 20:05:45,"""Pra Bom Entendedor Meia Palavra Basta "", Agarre-se A Ela @ deltanmd ou # PessaPraSair Que é Mais Digno ! Dallagnol rejeita prêmio de consolação para afastar-se do comando da Lava Jato https://www.diariodocentrodomundo.com.br/essencial/dallagnol-rejeita-premio-de-consolacao-para-afastar-se-do-comando-da-lava-jato/ …pic.twitter.com/A6ph6JFTNH",1186418321928966145
2019-10-21 20:04:12,Até isso é fake nesse sujeito,1186417934165577728
2019-10-21 20:04:01,"A Bia tem um jato privado, ela só não conta a ninguém...",1186417888510578689
2019-10-21 20:03:27,Quando a lava jato vai alcançar os bandidos do senado? STF protege? # STFVergonhaNacional # STFGabineteDoCrimeOrganizado,1186417743412809728
2019-10-21 20:02:41,A lava-jato q ele ajudou a enterrar? https://twitter.com/exame/status/1186399292417806336 …,1186417551003324418
2019-10-21 20:02:22,Dallagnol abre mão de promoção para ficar na Lava Jato - http://guaiba.com.br/2019/10/21/dallagnol-abre-mao-de-promocao-para-ficar-na-lava-jato/ …pic.twitter.com/VaGTbSWlHP,1186417469876928512
2019-10-21 20:02:19,"Bora , vamos já hoje para Vegas no meu jato privado",1186417459089362944
2019-10-21 20:01:49,"Auditor da Lava Jato, que multou o Instituto Lula, tem R$ 11 milhões escondidos na conta de mãe https://antropofagista.com.br/2019/10/04/auditor-da-lava-jato-que-multou-o-instituto-lula-tem-r-11-milhoes-escondidos-na-conta-de-mae/ …",1186417334128463873
2019-10-21 20:01:21,Crime é não punir bandidos. Lugar de bandido e corruptos é a cadeia. Felizmente o Brasil iniciou a depuração pela lava jato.,1186417215664513025
2019-10-21 20:01:16,"Não há como “dourar a pilula”. Depois dos R$ 2,5 Bi retirados da Petrobras e destinados a Fundação Privada Lava Jato, aparecem mais R$ 6,63 Bi de dinheiro da Odebracht negociado nos Estados Unidos, indo para a “tchurma” do Dallagnol e Moro administrarem. São BILHÕES pessoal... https://twitter.com/weston_jose/status/1186040460625743874 …",1186417194147680257
2019-10-21 20:00:31,"ESO # Flashback: Jato galaksija Abell 370 sa gravitacionim lukom odmah ispod centra. Fotografija je dobijena kao deo prvih testova za SOFI, ESO-vu infracrvenu kameru / spektrometar koja je počela sa radom 1997. godine. Prava: @ ESO http://socsi.in/pKxEi pic.twitter.com/KUTb6X9CIK",1186417006309969920
2019-10-21 20:00:27,KKKKKKKKKKK briza que lute pra comprar um jato,1186416988022661120
2019-10-21 20:00:17,Querem saber o que parece coisa do Foro de São Paulo? Só falar de Petista na PGR Criar falsas Narrativas contra procurador da lava-jato Falsas Narrativas contra a própria lava-jato Falsas Narrativas contra lava-toga Mentir que á Enfraquecimento da COAF MBL e CPMI das fake news,1186416945505230848
2019-10-21 20:00:16,Deltan recusa promoção e fica na Lava Jato https://www.oantagonista.com/?p=266988,1186416943210881024
2019-10-21 20:00:11,Você votou a lei de abuso de autoridade feita para acabar com a lava jato.,1186416924386828288
2019-10-21 20:00:11,"Roubo na petrobras Esquema da odebrech Compra ilegal de Passadina Dinheiro na cueca Dinheiro em mala Dinheiro pra Venezuela, pra enterrar o pobre povo venezuelano No tempo do Lula tinha Pornografia infantil Lei rouanet para Caetano gol Jato para Luciano Huck com dinheiro bande",1186416922252009472
2019-10-21 20:00:00,Mais alto que os berros do bisão-americano ou do bugio - e um pouco mais baixo que uma turbina de avião a jato. https://glo.bo/2J9cMcY # G1,1186416877397889025
2019-10-21 20:00:00,"O que Louis Brandeis e Oliver Holmes diriam sobre a Lava Jato. Célebres Juízes da Suprema Corte advertiram que o Estado acusador não pode contornar as leis em nome de uma ‘causa maior’. Por Cássio Casagrande, na coluna 'O Mundo Fora dos Autos': https://bit.ly/2BydAUG pic.twitter.com/uKHkbmrALe",1186416876353720321
2019-10-21 19:59:53,Que porra é essa??? Impossível de acreditar numa cena tão patética!!!,1186416846687391745
2019-10-21 19:59:47,Cai por terra esse negócio de que Deltan estava se aproveitando da lava jato para se promover.,1186416820384927745
2019-10-21 19:59:36,Vai vir no jato invisível kkkk,1186416774687920129
2019-10-21 19:59:19,Entenda pq a LAVA-JATO será o divisor de águas https://www.oantagonista.com/brasil/tre-cassa-mandato-de-relator-da-lei-de-abuso-de-autoridade/ …https://www.oantagonista.com/brasil/tre-cassa-mandato-de-relator-da-lei-de-abuso-de-autoridade/ …,1186416703447715843
2019-10-21 19:59:06,palhaço,1186416648758140930
2019-10-21 19:59:04,Não consigo nem opinar.,1186416639723618304
2019-10-21 19:58:56,"primo, ontem um bolsominion-parente me perguntou pelo consórcio dos governadores comunistas do nordeste para resolver a questão do óleo nas praias. e que o PT mandou fazer isto junto com maduro. aí eu paro, vejo que é uma pessoa esclarecida e tô assim: não me surpreendo.",1186416609314902019
2019-10-21 19:58:42,"“Obviamente, os americanos não queriam o êxito da Lava Jato porque eram bonzinhos, mas porque tinha interesse em abrir o mercado da América Latina para suas empresas”, confessa Rodrigo Janot. https://ptnosenado.org.br/lava-jato-operou-para-abrir-mercado-a-empresas-estrangeiras/ …",1186416547860045824
2019-10-21 19:58:41,"e enterrar a Lava Jato sob o comando de Gilmar Mendes, o risco de uma guinada peruana no Brasil não pode ser descartado. Neste momento, não há ninguém nas ruas protestando e os espertalhões podem achar que está na hora de dar uma marretada mortal no lavajatismo.",1186416545288871936
2019-10-21 19:58:40,"instituições à Lava Jato (e ao combate à corrupção) pode ensejar uma legítima revolta popular contra as elites da cleptocracia. Transcrições do áudio de Diogo Mainardi: “A popularidade do presidente do Peru chegou a 79%, porque ele fechou o Congresso e esmagou o Supremo.",1186416539689463808
2019-10-21 19:58:33,Deltan Dallagnol recusa promoção e pede para ficar na Lava Jato em Curitiba https://paranaportal.uol.com.br/politica/deltan-dallagnol-recusa-promocao-lava-jato-em-curitiba/ …,1186416510786519041
2019-10-21 19:58:32,Esse animal está comendo capim? ????,1186416507900891136
2019-10-21 19:58:20,Até a flexão é fake,1186416457736970243
2019-10-21 19:57:52,Tem que ter uma mente muito perturbada pra acreditar nos devaneios desse cara.,1186416337427542022
2019-10-21 19:57:26,"Cara, impressionante... É difícil assistir ao que só víamos em livro de história sobre um povo hipnotizado.. Assustador.",1186416229956886528
2019-10-21 19:57:24,"O que # STFOrgulhoDoPT e seus semelhantes não entendem: quanto mais eles tentam inocentar Lula, J Dirceu e os presos da operação lava jato, mais eles assustam o povo, que corre para defender uma intervenção militar.",1186416222151282696
2019-10-21 19:57:02,Deltan recusa promoção e fica na Lava Jato - https://www.oantagonista.com/brasil/deltan-recusa-promocao-e-fica-na-lava-jato/ …,1186416129855623169
2019-10-21 19:57:00,"Si descalificamos la protesta actual de los chilenos, estamos deslegitimando las protestas con destrozos, heridos y detenidos, que hicieron que Dilma fuera enjuiciada, que Lula esté preso, que el lava jato viera la luz y que Bolsonaro y Macri sean hoy Presidentes.",1186416121706090496
2019-10-21 19:56:51,Deltan recusa hipótese de promoção para continuar na Lava-Jato em Curitiba https://www.agoranoticiasbrasil.com.br/deltan-recusa-hipotese-de-promocao-para-continuar-na-lava-jato-em-curitiba/ … via @ AgoraNoticiasBr,1186416081419808769
2019-10-21 19:56:34,Deltan Dallagnol abre mão de promoção para ficar na Lava Jato https://politica.estadao.com.br/blogs/fausto-macedo/deltan-abre-mao-de-promocao-para-ficar-na-lava-jato/?utm_source=facebook:newsfeed&utm_medium=social-organic&utm_campaign=redes-sociais:102019:e&utm_content=:::&utm_term= …,1186416010506723334
2019-10-21 19:56:33,Um ano nada de Nova Previdência e Lei Anti Crime Lava jato sendo desmantelada e políticos brasileiros .... Tá bom pra vc Anjoka ?? pic.twitter.com/i4QoE8EnuQ,1186416006262079488
2019-10-21 19:56:24,Drácula fica esperto que a lava jato vai te pegar kkkkkkkkkkk So não vem c k mesmo discurso dos seus amigos vagabundos curruptos de perseguiçao. Ninguem acredita mais...,1186415968748216322
2019-10-21 19:56:18,CCJ da Alerj vota pela soltura de deputados presos na Lava Jato https://www.agoranoticiasbrasil.com.br/ccj-da-alerj-vota-pela-soltura-de-deputados-presos-na-lava-jato/ … via @ AgoraNoticiasBr,1186415946598146049
2019-10-21 19:56:15,"Assistindo o filme sobre @ Snowden e me perguntando quando Oliver Stone irá fazer um filme sobre @ ggreenwald e sua luta para mostrar a verdade sobre a Lava Jato, no Brasil.",1186415932350124032
2019-10-21 19:55:57,"Se for um bom profissional deverá optar pela promoção e sair do foco dos ataques a lava jato. Todos sabem o que está em jogo, liberdade para os corruptos. https://twitter.com/OGloboPolitica/status/1186231936148279297 …",1186415855015518210
2019-10-21 19:55:54,Funcionário de lava-jato perde controle da direção e colide carro de cliente com postes... # cadaminuto http://bit.ly/2Jbhabi,1186415843493765120
2019-10-21 19:55:53,"@ STF_oficial Em 7 minutos, advogado dá aula de ética, decência e direito a ministros do STF e a advogados de criminosos da Lava Jato (Veja o Vídeo) https://www.jornaldacidadeonline.com.br/noticias/16933/em-7-minutos-advogado-da-aula-de-etica-decencia-e-direito-a-ministros-do-stf-e-a-advogados-de-criminosos-da-lava-jato-veja-o-video …",1186415838812921856
2019-10-21 19:55:49,"Não dá pra não rir da cara dele, né? É muito tosco.",1186415821691801601
2019-10-21 19:55:34,CCJ da Alerj vota pela soltura de deputados presos na Lava Jato https://www.agoranoticiasbrasil.com.br/ccj-da-alerj-vota-pela-soltura-de-deputados-presos-na-lava-jato/ … via @ AgoraNoticiasBr,1186415762166206464
2019-10-21 19:55:23,Deltan dobra a aposta e agora só sairá da Lava-Jato se for tirado do cargo https://portalvarada.com/deltan-dobra-a-aposta-e-agora-so-saira-da-lava-jato-se-for-tirado-do-cargo/ …pic.twitter.com/2BMkZo4yWD,1186415715533885440
2019-10-21 19:55:22,Uma perna está dobrada! Assim não vale! Kkkkkkkk,1186415709984874501
2019-10-21 19:55:10,Deltan Dallagnol abre mão de promoção para ficar na Lava Jato https://ift.tt/2W2GO7s,1186415660664020992
2019-10-21 19:54:46,"Deus lhe confiou uma missão. À frente da Lava Jato, Deltan e Moro resgatam a Dignidade do nosso pivo, do nosso país. Obrigada, Deltan. Deus te guarde https://twitter.com/VemPraRua_br/status/1186414058007941121 …",1186415558302060544
2019-10-21 19:54:20,"Em 7 minutos, advogado dá aula de ética, decência e direito a ministros do STF e a advogados de criminosos da Lava Jato (Veja o Vídeo) https://www.jornaldacidadeonline.com.br/noticias/16933/em-7-minutos-advogado-da-aula-de-etica-decencia-e-direito-a-ministros-do-stf-e-a-advogados-de-criminosos-da-lava-jato-veja-o-video …",1186415451066253313
2019-10-21 19:54:19,Eu tô achando assustador a proporção que essas mentiras tomam forma e tamanho,1186415444749668355
2019-10-21 19:54:14,"RIO de JANEIRO, ""Furna da Onça"" CCJ da Alerj vota pela liberaçao deputados presos na Lava Jato pic.twitter.com/xd0St6KGqx",1186415422914138117
2019-10-21 19:54:07,"Entendi perfeitamente ....o inicio de Lula contra a ditadura,a segunda uma foto mais recente que nos lembra toda farsa da lava jato e a terceira nem precisa explicar https://twitter.com/eualine84/status/1186414591045230594 …",1186415395923734528
2019-10-21 19:54:04,Aqui nao ver ser jato de agua e sim chumbo quente no lombo de terroristinha de meia tigela!,1186415384007757825
2019-10-21 19:53:50,Deltan recusa promoção e fica na Lava Jato https://www.oantagonista.com/?p=266988,1186415322598952960
2019-10-21 19:53:40,Parabéns!!! A lava jato precisa muuuuito de vc e o Brasil tb!!! Força e que Deus continue te protegendo!!! @ deltanmd,1186415280634978306
2019-10-21 19:53:38,"Deltan Dallagnol recusou uma promoção e preferiu permanecer como coordenador da Lava Jato. Deltan não é somente um homem honrado e corajoso, ele também é um exemplo a ser seguido pelas gerações que virão. O Brasil precisa de muitos Deltans. Vamos apoiar seu trabalho na Lava Jato!",1186415274297311232
2019-10-21 19:53:37,"Juiz era ladrão! Procuradores eram ladrões! Agentes da PF eram ladrões! Desembargadores eram ladrões! Delatores eram ladrões! Por incrível que pareça, na lava jato, o único inocente é o reu! # LulaLivreJÁpic.twitter.com/4VAHu9SozS",1186415270384017413
2019-10-21 19:53:23,"Parabéns, @ deltanmd ! Isso NÃO foi promoção. Isso foi ESTRATÉGIA para enfraquecer a Operação Lava Jato. https://twitter.com/claudioedantas/status/1186400158667476992 …",1186415212171321344
2019-10-21 19:52:51,Mas gente o que significa isso??,1186415075369852930
2019-10-21 19:52:45,Querem afastá-lo da Lava Jato a qualquer custo.,1186415049893711873
2019-10-21 19:52:35,Esse Bolsolixo é muito ridículo! Pqp!,1186415011561902081
2019-10-21 19:52:04,Deltan Dallagnol recusa promoção e pede para ficar na Lava Jato em Curitiba https://paranaportal.uol.com.br/politica/deltan-dallagnol-recusa-promocao-lava-jato-em-curitiba/ …,1186414878392799234
2019-10-21 19:51:45,tinha esquecido do @ Joao_P_Romero,1186414798902304768
2019-10-21 19:51:18,Sabemos de quem foi o erro! Pra mim seria o @ AiltonBenedito o PGR perfeito ou @ deltanmd também pela sua história na lava jato,1186414684875964422
2019-10-21 19:51:12,Hahahahahahahttps://twitter.com/Boscardin/status/1186411063031537671 …,1186414663610880001
2019-10-21 19:51:06,Multifuncional Jato de Tinta Colorida Epson Ecotank L3150 https://redir.lomadee.com/v2/294c28a4568,1186414636276600834
2019-10-21 19:50:55,"Vc está fazendo a alusão correta de 2 tempos, primeira foto a Ditadura Militar 1964, onde varias pessoas foram presas, torturadas e etc, e a condição de preso político de Lula montada pela farsa a jato. O cérebro de algum modo ainda funciona né?",1186414591045230594
2019-10-21 19:50:29,Depois do que esse astrólogo picareta falou sobre os Beatles nada surpreende!,1186414479883603971
2019-10-21 19:50:19,CCJ da Alerj vota pela soltura de deputados presos na Lava Jato https://www.noticiasaominuto.com.br/politica/1092510/ccj-da-alerj-vota-pela-soltura-de-deputados-presos-na-lava-jato?utm_medium=social&utm_source=twitter.com&utm_campaign=buffer … via @noticiaaominutobr,1186414438003466240
2019-10-21 19:50:00,Dallagnol recusa promoção e quer ficar na Lava Jato https://www.conversaafiada.com.br/brasil/dallagnol-recusa-promocao-para-ficar-na-lava-jato … via @ ConversaAfiada,1186414358450057216
2019-10-21 19:49:47,Deltan Dallagnol abre mão de promoção para ficar na Lava Jato https://bit.ly/2By76VO pic.twitter.com/GwHEkSa30J,1186414304935010305
2019-10-21 19:49:43,Uma ação positiva no meio de ataques a lava-jato e ajudas para o projeto de corrupção do sistema e você quer que o Nando coloque ele como um cara bom. Vá se lascar.,1186414288921083905
2019-10-21 19:49:32,Bombardier revela modelo renovado de jato executivo para competir com Embraer https://moneytimes.com.br/bombardier-revela-modelo-renovado-de-jato-executivo-para-competir-com-embraer/ …,1186414243983364101
2019-10-21 19:48:52,Deltan recusa hipótese de promoção para continuar na Lava-Jato em Curitiba https://www.agoranoticiasbrasil.com.br/deltan-recusa-hipotese-de-promocao-para-continuar-na-lava-jato-em-curitiba/ … via @ AgoraNoticiasBr,1186414075351392257
2019-10-21 19:48:47,Cara corajoso.É disso que o Brasil precisa e não de gente querendo acabar com a Lava Jato.,1186414052135882752
2019-10-21 19:48:43,"Ao invés da Prisão, Promoção! Deltan Dallagnol, rejeitou nesta segunda-feria 21/10 concorrer a uma vaga de procurador regional da República, o que significaria uma promoção. Disse ele em carta ao conselho do MPF, que prefere ficar na Lava-Jato. https://oglobo.globo.com/brasil/deltan-recusa-hipotese-de-promocao-para-continuar-na-lava-jato-em-curitiba-24032438 …",1186414036646277120
2019-10-21 19:48:37,Por mi jato debería haber una tía veneno,1186414009492357121
2019-10-21 19:48:28,Deltan abre mão de promoção para ficar na Lava Jato https://politica.estadao.com.br/blogs/fausto-macedo/deltan-abre-mao-de-promocao-para-ficar-na-lava-jato/?utm_source=estadao:twitter&utm_medium=link …,1186413974520258562
2019-10-21 19:48:26,"O Globo: ""Deltan recusa hipótese de promoção para continuar na Lava-Jato em Curitiba. Procurador pediu nesta a segunda-feira ao Conselho Superior do MPF para não integrar lista de aptos a serem promovidos."" Deixe aqui o seu aplauso.",1186413965368352768
2019-10-21 19:47:56,"Passa o end, vou pegar o jato e tô indo pra aí agoraaaaaa",1186413839337828352
2019-10-21 19:47:41,Promoção??? Estavam falando que iriam tirar ele a força da Lava Jato.,1186413778516283392
