date,text,id
2019-10-10 20:56:46,"Que grosera amiga culera, ya lo leí, JAJAJAJA papa dulce que suerte, las papas de la Villegas a mi siempre me han gustado, deberíamos ir a cenar el fin",1182444896780771328
2019-10-10 20:56:46,DULCE TIERNO Y ROCKERO OSCURO JAJAJAJAJA,1182444896327798786
2019-10-10 20:56:41,Verte feliz Haciendo lo que te gusta Y que lo compartas con tu hermosa madre Son cosas que me hacen feliz enormemente Te adoro precioso Por muchísimas más presentaciones así # JoacoEnPerfecTour # JoaquinBondoni https://twitter.com/marisolmontao1/status/1182444145312485376 …,1182444875440103424
2019-10-10 20:56:28,"— Picarona...vaya, creo que se me ven las intenciones —ha acariciado su mejilla con los dedos, de forma lenta. E inclinándose hacia él, ha lamido sus labios, entrecetrando sus ojos para poder ver su expresión al hacerlo. — Sabes...dulce~ —susurró.",1182444818338910209
2019-10-10 20:56:24,Se busca novia: - Preciosa - De hermosa sonrisa - Inteligente - Cariñosa - Dulce - Romántica - Apasionada ... Es demasiado evidente que la estoy describiendo a ella...,1182444803830800384
2019-10-10 20:56:24,Lo unico que me gusta de esta parte del año no es ni el calor ni el soles que regreso del pan dulce a la venta,1182444801515540480
2019-10-10 20:56:16,"Café, ou morceaux de chocolat, ou dulce de leche, ou... y en a bin trop en fait",1182444769387143169
2019-10-10 20:56:15,Encontrá el mejor chocolate para Mamá en CASA ZUVIRIA !!! ・・・ tiegelchocolatier Para las mamás que nos protegen y miman! Bombones rellenos de dulce de leche # mothersdaygift # giftideas @ casazuviria en Casa Zuviría https://www.instagram.com/p/B3dPfBABbl4/?igshid=iy3ggj9tfo46 …,1182444765389840385
2019-10-10 20:56:10,Irmã Dulce já está incluída na esfera de culto à memória da Igreja Católica https://cautentica.com.br/irma-dulce-ja-esta-incluida-na-esfera-de-culto-a-memoria-da-igreja-catolica/ …pic.twitter.com/u2KR4Q3KfP,1182444743613210624
2019-10-10 20:56:09,Awesome woman. Love you so,1182444742245847041
2019-10-10 20:56:07,Irmã Dulce já está incluída na esfera de culto à memória da Igreja Católica https://bahianow.com.br/irma-dulce-ja-esta-incluida-na-esfera-de-culto-a-memoria-da-igreja-catolica/ …pic.twitter.com/ZTubvukBLH,1182444733903392768
2019-10-10 20:56:02,"nao é recuo, é respeito pela Santa Dulce",1182444712780804097
2019-10-10 20:55:51,"Ayúda a remar la conversación aunque sea, a dulce de leche repostero estoy remando",1182444663460057095
2019-10-10 20:55:47,"Claro, pero ese sello de goma está asociado a un montón de viejos que le cuentan a los jóvenes que evita les daba el pan dulce. Quizás tenés una dirigencia zurda populista, pero tenés una base importante de peronistas totalitarios de partido único y nacionalismo cerrado.",1182444646347218945
2019-10-10 20:55:46,"Minha mãe, sobre Irmã Dulce: Ela andando parecia que flutuava, de tão magra e frágil que era, naquela roupa surrada. Ela rodava a cidade, pedindo aos ricos doações para os pobres. Só saía quando conseguia. O povo no hospital a abraçada, ela retribuía, com aquela feição de amor.",1182444642870202368
2019-10-10 20:55:38,"Ps ésa es la de mi dulce niña, mko Les faltó la del vato que chifla media rola (peishens)",1182444610976505856
2019-10-10 20:55:32,*este le miró fijamente y al notar que le caia una lágrima se preguntó el porque pues aun no le habia dicho lo suficiente. No pudo evitar alzar su mano y acariciarle la mejilla sin darse cuenta de lo que hacía. No se podia creer que alguien asi de dulce existiera... >,1182444585852788736
2019-10-10 20:55:26,"# Repost @ Igreja_Na_Midia Confira onde assistir a transmissão da Cerimônia de Canonização de Irmã Dulce, que acontece neste domingo (13), a partir das 5h da manhã (horário de… https://www.instagram.com/p/B3dPY_ggi1WwNOuoplwMTJ6pkn828TICISKyDk0/?igshid=16a9bj1jx2e6o …",1182444558057201664
2019-10-10 20:55:22,Yo merengues en segundo primaria y si le pase la lengua al dulce para saber si tenia sabor,1182444542009790465
2019-10-10 20:55:19,No hay nada más dulce e irritable que los viejos en videollamada con la chuky,1182444529057783808
2019-10-10 20:55:17,Como pueden comer manzana verde con dulce de leche???????? locas,1182444523382853633
2019-10-10 20:55:09,Mitad salada y mitad dulce (caramelo en los cines pero en mi casa uso azúcar morena)...son ricas,1182444487089541121
2019-10-10 20:55:02,Parlamentares engordam comitiva ao Vaticano para canonização de Irmã Dulce https://www1.folha.uol.com.br/poder/2019/10/parlamentares-engordam-comitiva-ao-vaticano-para-canonizacao-de-irma-dulce.shtml?utm_source=twitter&utm_medium=social&utm_campaign=twfolha …,1182444461105799168
2019-10-10 20:54:59,"Sí, me molesta que hable con Dulce. Cambio y fuera. PD: No digo que no lo haga, tiene todo el derecho, no hay bronca.",1182444447772168194
2019-10-10 20:54:58,"Claro man, los que le gusta el amargo no toman dulce, y nosotros que tomamos dulce igualmente tomamos amargo... Ustedes son los trolos acá",1182444442743181318
2019-10-10 20:54:50,"Amiga mira que yo te regalo las trufas y algo para la mesa dulce, pero vos me das La Plata para comprar las cosas ok?",1182444410472194048
2019-10-10 20:54:42,"Amor tú eres mi dulce, eres mi bien.",1182444375281938438
2019-10-10 20:54:40,Sua presença é imprescindível lá na missa da irmã Dulce Manuzinha...,1182444365316317184
2019-10-10 20:54:14,"Estoy antojada de helado! Quierooooo chocolate, banana split, dulce de leche y coco",1182444259955429376
2019-10-10 20:54:10,Abrí la cámara frontal sin querer y me di cuenta que tengo dulce de leche en la mitad de la pera y llevo una hora afuera de mi casa más o menos,1182444243002023936
2019-10-10 20:54:10,Sábias Palavras Deputada! A nossa irmã Dulce é merecedora e uma grande serva de DEUS! Todas as honras a nossa Santa!,1182444240313442306
2019-10-10 20:54:07,"Se una piña siempre de pie, viste una corona y se dulce por dentro.",1182444230310019074
2019-10-10 20:54:06,Dulce # ElDragón || # RenataNotnipic.twitter.com/RqEOxfyBHQ,1182444224245129221
2019-10-10 20:54:03,El acceso a pan dulce de calidad como Derecho Humano.,1182444213390073856
2019-10-10 20:53:55,Me mata que la gente que no escucha Lana piensa que la mina es una sorete hija de puta porque se dejan llevar por su imagen y re que es lo mas dulce y bueno que piso la tierra la amo mucho,1182444179512799232
2019-10-10 20:53:53,@ carlitosalvarez como siempre presente en los mejores eventos saludos chicos excelente transmisión saludos para mi pan de dulce q mi hija Daniela de 5 años le gusta tu voz @ RolandoNichols,1182444167772819456
2019-10-10 20:53:52,"Que le ven de rico a los jugos en sobre????? Posta no hay nada mas asqueroso que esos jugos, encima te queda o muy dulce o pura agua son una mierda.",1182444163746455552
2019-10-10 20:53:50,Awwww q dulce,1182444157014556674
2019-10-10 20:53:49,Te falta lo principal dulce de leche y manteca,1182444153776541696
2019-10-10 20:53:49,SANTA DULCE DOS POBRES em Città del Vaticano - Basilica San Pietro di Roma https://www.instagram.com/p/B3dPNLUhVpV/?igshid=29ktvi9zzch2 …,1182444151050309632
2019-10-10 20:53:39,Me quede con las ganas de comer pan dulce,1182444110663376897
2019-10-10 20:53:23,si,1182444042749186049
2019-10-10 20:53:17,Tengo un antojo de comer algo dulce,1182444018787147776
2019-10-10 20:53:14,Irmã Dulce não virou nem Santa ainda e já afasta demônios !!,1182444008360034305
2019-10-10 20:53:14,"""El Aire el sol la tierra la dulce lluvia habrán de repetirse como lo han hecho por mucho tiempo. Tú mismo habrás de volver a las andadas. Así que prepárate para las emergencias. Y la emergencia será… https://www.instagram.com/p/B3dPI8AHhXQ/?igshid=8djjse722p4q …",1182444007412129792
2019-10-10 20:53:07,"Imaginem se Bolsonaro tivesse ido ver a canonização de Irmã Dulce . O que a Imprensa não estaria aos gritos , nos jornais da Globo e da GLOBONEWS. Afinal , ele é o Presidente da República e é católico . Não teria nada de mais .",1182443976575668237
2019-10-10 20:52:48,Su voz tan dulce y delicada cuando el estribillo me pone blandita # DimeJuliaMedina,1182443896174993408
2019-10-10 20:52:44,"Such a bright future ahead of us; thankful to be able to call you mine, princess. we deserve it all",1182443881176190976
2019-10-10 20:52:44,El peor campeonato de la historia? El peor campeonato de la historia. Después terminas jugando con 50° y pateando un pan dulce. Lamentable,1182443879724920837
2019-10-10 20:52:34,ventajas del pan dulce,1182443837232431104
2019-10-10 20:52:29,Mentira vai ser dulce pic.twitter.com/NImOV9tBIT,1182443815463989248
2019-10-10 20:52:20,Una buena tentación,1182443778545799168
2019-10-10 20:52:13,Gente esquece vai ser dulce né @ sabina Coloca dulce pfv Eu nunca te pedi nada sabina DULCE E NAO SE FALA MAIS NISSO O nome da sua filha vai ser dulce e pronto https://twitter.com/feelsmaliwal/status/1182442368815063040 …,1182443750926274564
2019-10-10 20:52:08,"Mhmm, Glaseada chocolate, chocolate y Chispas, vainilla, de fresa y chispitas, y.. Dulce de leche. ¿Cual prefieres?",1182443728335769600
2019-10-10 20:52:03,Quiero ite pan dulce con tete...,1182443707590688768
2019-10-10 20:51:33,Irmã Dulce: comitiva terá Mourão e 19 parlamentares https://blogdacidadania.com.br/2019/10/irma-dulce-comitiva-tera-mourao-e-19-parlamentares/ …,1182443582575304706
2019-10-10 20:51:33,"La participación de colaborador, el ""Chiapaneco"", cada vez se me hace más pedante, mira que es atrevido al denostar a Dulce y a Lucía Méndez. Para hablar de clase y elegancia es la persona menos indicada. Inventada CC @ miguechiapaneco",1182443581379710976
2019-10-10 20:51:32,"Necesito helado, una tazita comestible, dos bochas gdes, dulce de leche granizado y mousse de chocolate, de La Victoria, NADA, éso..",1182443578598903808
2019-10-10 20:51:32,Hoy el corazon lo tengo dulce y derretido,1182443577688907776
2019-10-10 20:51:26,Hace años tuve Telmex y no me falló.,1182443555282997248
2019-10-10 20:51:24,E viva irmã Dulce!!! https://www.facebook.com/1143476441/posts/10220053465663950/ …,1182443543882805248
2019-10-10 20:51:21,Choose wisely,1182443531803213825
2019-10-10 20:51:11,"Jamás voy a conocer a otra persona igual que Joaquín, tan dulce, tan compañero, tan él",1182443490279657473
2019-10-10 20:51:08,Hahaha parang kanta lang ni Dulce.. Ako ang nag wagi.. Ako pa rin ang nasawi # AwitAwardsSCAM,1182443478728531969
2019-10-10 20:51:08,Kilos y kilos tomaría! Y de dulce de lecheee,1182443478141329413
2019-10-10 20:51:08,"Si tienen sobrinos chicos y conviven constantemente, háganle sus gustos cuando quieran un dulce, un juguete, una ropa, alguna vez alguien cuando éramos pequeños lo hizo por nosotros y tengan la certeza que alguna vez alguien lo hará por sus hijos, esa felicidad es inigualable.",1182443477910597632
2019-10-10 20:51:02,"Ya fui hoy a pedir informes, en dos semanitas más termino con Izzi y van a instalarme Telmex. Mil gracias.",1182443454036660227
2019-10-10 20:51:02,Parlamentares engordam comitiva ao Vaticano para canonização de Irmã Dulce https://www1.folha.uol.com.br/poder/2019/10/parlamentares-engordam-comitiva-ao-vaticano-para-canonizacao-de-irma-dulce.shtml?utm_source=twitter&utm_medium=social&utm_campaign=twfolha …,1182443453403324416
2019-10-10 20:50:54,"En si queremos una torta (sin tacc) con dulce de leche obvio si no,no es torta y también velitas y globos porque cumple sin globos no existe y te lo puede afirmar @ FloDotta",1182443417185460225
2019-10-10 20:50:54,Hogar dulce # Hogar # home sweet home en Vilo Rooftop https://www.instagram.com/p/B3dO33kgPKt/?igshid=f4p13l9yso5j …,1182443417009303557
2019-10-10 20:50:45,LA DULCE CANTA Y BAILA. Este sábado en Necochea. http://www.ladulcedigital.com/2019/10/la-dulce-canta-y-baila/#more-29931 …pic.twitter.com/B08mEDRWnz,1182443379566751744
2019-10-10 20:50:41,"No es tan grave, eres muy dulce",1182443363590647809
2019-10-10 20:50:37,This Dulce De Leche White Chocolate Cheesecake is a an absolute crowd pleaser. It's soft and creamy and totally scrumptious. https://soo.nr/FTPH # cheesecake # caramel # dulcedeleche # nobakecheesecake # whitechocolatepic.twitter.com/scKdVmcwME,1182443347576791040
2019-10-10 20:50:24,"Eles cairão,tenho fé em irmã Dulce! Mas que o papa é vermelho é...",1182443292992135168
2019-10-10 20:50:23,A Santa Irmã DULCE vai se mexer n caixão vendo tantos chupadores d sangue d povo brasileiro em s CANONIZAÇÃO A Sta Fé tá enraizada c os comunistas Até o papa é esquerdista e não esconde Se ele fosse 1 verdadeiro membro da Igreja d São Pedro não permitiria esse SACRILÉGIO,1182443287786983424
2019-10-10 20:50:19,"Escuchó las palabras del más bajo, y después de hace mucho tiempo se sintió nervioso ante lo dulce de ése alago, ¿Qué clase de hechizo le estaba haciendo el más bajo? — Si es un apodo de tí para mí, me encanta— sonrió con un sonrojo observando atento al más bajo (+)",1182443271706071041
2019-10-10 20:50:15,Bueno inténtalo todo lo que puedas así serr mas dulce la victoria,1182443253527990278
2019-10-10 20:50:12,Será o maior milagre de Irmã Dulce,1182443241419005952
2019-10-10 20:50:08,PAN DULCE QUE DECÍS??,1182443227527467009
2019-10-10 20:50:06,¿Por qué se ponen splash dulce a esta hora si van a meterse al metro taquiado de gente? ¿Por qué se ponen splash dulce a cualquier hora?,1182443216756531200
2019-10-10 20:50:05,"Qué dulce, gracias.",1182443212583194625
2019-10-10 20:50:02,"Conversación con mi mamá Yo: hay chocolates? Ella: no te gusta el que queda Yo: conitos? Ella: bueno que queres, salado o dulce? Yo: TODO LO QUE SE ME CRUCE POR LA CABEZA",1182443201749237760
2019-10-10 20:50:00,Lucia me dio altas ganas de comer pan dulce lpm,1182443192874082304
2019-10-10 20:49:56,Nada dulce en esta casa la puta madre,1182443177883656192
2019-10-10 20:49:47,"+ Como respirar . Eres tan dulce cuando dices esas palabras , como no sacarte ese tono rojizo a tus mejillas si me haces darte lo mejor de mi ? * si estaba intentando sacar también su lado romántico, el cual era malísimo en ello , pero no iba a desistir en ello . En cuanto +",1182443139803602944
2019-10-10 20:49:39,Irmã Dulce deve revirar no túmulo diante de tanto dinheiro público mal gasto,1182443105791959046
2019-10-10 20:49:32,¿De verdad? Me alegro que he preparado algo dulce y espero que el antojo se pase despues de comer arroz con leche.,1182443077140652035
2019-10-10 20:49:29,Saco el doble jajajaja amor por lo dulce,1182443062812971013
2019-10-10 20:49:27,"A los Iglesias-Montero se les acaba su dulce luna de miel en el casoplón de Galapagar. ¿Cómo lo pagarán? Lo mismo en cinco años tienen que volver al piso de la abuela de Pablo en Vallecas. Ante estas perspectivas van a muerte, les importa una mierda q de vox dependa el gobierno.",1182443053187063809
2019-10-10 20:49:22,A Santa Irmã DULCE vai se mexer n caixão vendo tantos chupadores d sangue d povo brasileiro em s CANONIZAÇÃO A Sta Fé tá enraizada c os comunistas Até o papa é esquerdista e não esconde Se ele fosse 1 verdadeiro membro da Igreja d São Pedro não permitiria esse SACRILÉGIO https://twitter.com/RaquelBlak/status/1182434424249561088 …,1182443032743960576
2019-10-10 20:49:13,A FARRA da canonização da Irmã Dulce!! Tudo é motivo para a corja de políticos gastarem nosso dinheiro!! https://twitter.com/augustosnunes/status/1182431841783091200 …,1182442997364994048
2019-10-10 20:49:08,"Morena rica y viciosa, saludos",1182442974795485184
2019-10-10 20:49:03,"Irmã Dulce deve estar se revirando no túmulo com a orgia de dinheiro dos turistas-políticos na viagem cercada de mordomias para, supostamente, prestarem homenagem a uma mulher que certamente usaria esse dinheiro para obras sociais em benefício dos mais pobres...vergonha alheia",1182442953236733952
2019-10-10 20:48:59,Zarate cuando vaya a la mesa dulce,1182442936736333824
2019-10-10 20:48:39,I want to help her grow also!pic.twitter.com/A76cDL80ZA,1182442854574166016
2019-10-10 20:48:35,una chica le va a regalar una rosa de oro puro a taehyung para que se la de a su mamá y eso es tan dulce,1182442835347410945
2019-10-10 20:48:26,"Últimos parciales, integradores, prácticas y finales todo eso en un mes. Creo que no llego a comer pan dulce",1182442799809159168
2019-10-10 20:48:13,"Parabéns pela reportagem sobre irmã Dulce, a sua emoção foi além da reportagem,lindo de se ver.Carreira que pretendo seguir",1182442743047565313
2019-10-10 20:48:10,My man deserves the whole entire world and I can’t wait for the day in which I can give him that and more. I feel like the luckiest girl ever.,1182442733111336963
2019-10-10 20:48:04,No se olviden las avejas llevan dulce en sus bocas y siguen picando,1182442707702243330
2019-10-10 20:48:03,O alívio que Irmã Dulce deve estar sentindo.... https://twitter.com/GDimenstein/status/1182246977783975938 …,1182442702945824768
2019-10-10 20:47:57,"Justo tenía antojo de algo dulce, solo que no sabia de que, seguro esto calmara el antojo.",1182442676349620224
2019-10-10 20:47:44,"igual, hoy con el puré aunque era una papa muy chica quede más que satisfecha y en la tarde solo me comí una manzana por que estaba antojada de algo dulce https://twitter.com/50kgg_/status/1182442437471539206 …",1182442622855634944
2019-10-10 20:47:38,"Ahi lo tenes queriendo arreglar todo con un heladito, sabes los kilos de helado que me tenes que traer para que este todo bien (? Dulce de leche y limon .. Besito en la frente",1182442598880940033
2019-10-10 20:47:28,"Espero que le sirva el tutorial de hoy, es muy dulce esa nena",1182442556170346496
2019-10-10 20:47:18,@ amancayrod salir de tu pileta y comer pan dulce con sidra 1888 NECESITO,1182442511010357249
2019-10-10 20:47:13,-Deja de hablar con mi mamá mientras me tocas el culo! *exclamó la dulce princesa,1182442490844057600
2019-10-10 20:46:59,es que sos súper dulce y te mereces lo mejor tkm te voy a abrazar ahr,1182442432019030016
2019-10-10 20:46:59,"Si,si,si,si,siiiiiiiiiiiiiii!!!!!!! Por favooor mi amor ⚘⚘⚘⚘⚘⚘⚘⚘⚘",1182442431402237952
2019-10-10 20:46:42,Buenas noches amigo.. Feliz y dulce descanso.. Un abrazo de oso polar,1182442364071231488
2019-10-10 20:46:32,...ROAD TRIP!,1182442318730878976
2019-10-10 20:46:27,"Sabes que ando en el rollo... lo peor es que me dan náuseas también. Hasta ahora me he resistido a aceptar que podría ser el azúcar, pero coincidió con la visita de mi mamá y con el aumento del consumo del café, que lo bebemos dulce y en cantidades excesivas.",1182442299076304896
2019-10-10 20:46:01,Awwww que dulce Rubén... Que generoso... Que tus deseos bonitos se retornen multiplicados Linda noche y dulces sueños Abracitos,1182442188078309376
2019-10-10 20:45:59,"Mi mamá me compro un kilo de dulce de leche, esto puede salir o muy bien o muy mal",1182442180717301764
2019-10-10 20:45:56,"Los de San Juan, se conocen como dulce de membrillo rubio. Y si bien entendí tienen denominación de origen. Aparte, el color lo da el óxido. De esos lingotes, cuando cuando encuentro, compro. Acopio más lingotes q el Bco Central en los '50.",1182442168251797504
2019-10-10 20:45:54,QUEM CHAMOU SARNEY? Planalto diz que não foi. Sarney integra a comitiva oficial que vai a Roma acompanhar canonização de Irmã Dulce no Vaticano. Hamilton Mourão é o chefe da delegação https://oinformante.blog.br/notas/quem-chamou-sarney/ …pic.twitter.com/3cyRxyTvgW,1182442159582130176
2019-10-10 20:45:50,"Irmã Dulce deve estar envergonhada com a presença de deputados @ camaradeputados e senadores @ SenadoFederal , mais parentes, todos usando nosso $ Ela faria um bom uso desse $. Jamais com esses seres obscenos. A cada dia tenho mais nojo dessa gente.",1182442145946447872
2019-10-10 20:45:39,todo dia eu e Dulce temos uma discussão diferente,1182442096923463685
2019-10-10 20:45:37,"La verdad es que yo no puedo escuchar i dont wanna miss a thing sin acordarme de la escena esa de la pelicula ""la cosa mas dulce"" jajaja",1182442090946543616
2019-10-10 20:45:37,"Bolsonaro avisa ao Vaticano que não comparecerá à cerimônia de canonização de Irmã Dulce. Eita, Santa Porreta! Nem foi canonizada, já afastou o demônio!!!! https://www.facebook.com/100000433512706/posts/2691685140855910/ …",1182442089981906945
2019-10-10 20:45:28,¿Vamos a quitar metodos solo por la responsabilidad que tiene el paciente? Igual vamos a quitarle la insulina a una persona que comió mucho dulce o evitar tratar un cáncer de un fumado?,1182442052388192256
2019-10-10 20:45:26,"Como les gusta echar a perder pan dulce, poniéndole comida salada dentro pic.twitter.com/3p0XAo7rn4",1182442041931894787
2019-10-10 20:45:21,Buenas noches Dulce,1182442022030004225
2019-10-10 20:45:06,Ayer fui a un desfile moda por primera vez en mi dulce vida: https://youtu.be/nqjEZCGMyBc,1182441958381441025
2019-10-10 20:45:04,"Hoje, Margareth Menezes # ConversaComBial sobre a emoção de participar da canonização de Irmã Dulce, no Vaticano. # tvbahia # redebahiapic.twitter.com/YYbEqfokLh",1182441949179068416
2019-10-10 20:45:01,Ya tengo antojo de dulce de calabaza,1182441939821584384
2019-10-10 20:44:53,"Fdj, la rosa de oro que le iba a regalar una army a Taehyung para su mamá me parece tan dulce. La chica dijo que era porque lo trajo al mundo y me sentí identificada, tipo gracias a ella existe un angelito el cual me hace tan feliz. Le daría el mundo entero si pudiera.",1182441905122107392
2019-10-10 20:44:47,"No recuerdo pero una variedad de palta que no es rica...creo que es dulce .. es la mejor para tratamientos de cara o de pelo ...no recuerdo el nombre pero no la venden , mi tío tenía es una palta gigante y es mala para comer",1182441880644177920
2019-10-10 20:44:43,Como siempre guapa y hermosa y tu sonrisa que enamora. Muchas felicidades y que el señor te siga dando mucha salud y fuerza para que tus admiradores te sigan siguiendo. Mi dulce angel,1182441864424837120
2019-10-10 20:44:33,"¿Quieres conocer un postre que te cambia el estado de irritación a paz o de tristeza a felicidad? Te presentamos uno de muchos... Los Profiteroles rellenos de crema pastelera y cubierta de Arequipe o Dulce de Leche... ¡Grandiosos! Ven, te esperamos en @ TivoliPast. # SaboresTivolipic.twitter.com/keE3SSUKqX",1182441822553018369
2019-10-10 20:44:30,"Ok ajahdhsjajajsjaja Eres la más tierna y dulce de las gotitas, cero dudas. pic.twitter.com/jMNJIo5OYp",1182441806610518019
2019-10-10 20:44:26,Quiero algo dulce,1182441790634373121
2019-10-10 20:44:20,Jajaja Yo tengo un par de indios q no se como hacen para detectar cualquier dulce x mas q esten bien escondidos ... nodurannaada jajaja,1182441764751314945
2019-10-10 20:44:19,me muero por comer un pan dulce y si es con frutas mejor,1182441761165250566
2019-10-10 20:44:16,Algo dulce para mi sevgilim dulce. @ xGirlOfTheMoon_pic.twitter.com/O3HktgyzLA,1182441749463076870
2019-10-10 20:44:11,"You’re the sweetest, but I think you have the most perfect babies EVER and girl I gotta find me a good man first, Bc these Gwinnett dudes not making the cut",1182441727694688256
2019-10-10 20:44:08,"Irmã Dulce nem virou Santa, já afastou o Demônio! # BozoBelzebu",1182441717296971776
2019-10-10 20:44:07,"Quiero 1kg de helado de mousse de limón, súper dulce de leche y sambayon",1182441713044021248
2019-10-10 20:43:50,"El queso y dulce no es de mis postres preferidos, y el dulce de batata no me gusta ni ahí",1182441641484935168
2019-10-10 20:43:46,"Mi hermanita me acaba de regalar un dulce y sabe tan mal, lo peor es que se me quedó mirando hasta que me lo tragué",1182441624737112065
2019-10-10 20:43:44,Gracias mi hermosa con corazón dulce y bueno. Yo te quiero a ti tambien y estoy para lo que necesites siempre. Fuerza y no me afloje que USTED YA GANÓ con ese hijo hermoso. https://twitter.com/sinenanitos/status/1182429740491313152 …,1182441617401307138
2019-10-10 20:43:41,"Hermosa, bella y dulce mujer",1182441602796572672
2019-10-10 20:43:32,"Joaquin es tan dulce y especial, que cada día lo amo más porqué es imposible que este sentimiento no crezca:(",1182441564280381443
2019-10-10 20:43:32,Maja hay un Refran en Puerto Rico. Que Dice El Amor y el interes se Fueron al CAMPO un Dia Pudo Mas el Interes Que el Amor que le Tenia. Eres Brillate Dulce y un Cuerpo Deseable. Pero no Compartes Nada. Solo Fantacias con un Proposito. Virtual. Perdona Mi Crudeza. Luv u Vicky.,1182441563890311168
2019-10-10 20:43:27,"Mi mamá es fan de lo dulce, mi papá de lo salado. A mí me descuidas dos segundos y me estoy comiendo un sándwich de mortadela y queso y simultáneamente una tarta bon o bon. Todo mal hicieron conmigo",1182441545494081536
2019-10-10 20:43:26,Quiero algo dulce,1182441539357827074
2019-10-10 20:43:19,"Jaaa! Siempre post guardia y pre siesta! Aperitivo viene saliendo Negroni... y cierra menu... cafe espresso , bocado dulce ( el que caiga) y wisky .",1182441510350086144
2019-10-10 20:43:11,"Seu moleque, jogando $ público no lixo com vc. Viajando às nossas custas p Roma. Agora quero saber o q um judeu está fazendo em Toma? Vc é uma farsa, até na sua identidade. A propósito, a irmã Dulce deve estar envergonhada da presença de vcs",1182441478586544128
2019-10-10 20:43:06,Me arrecha eso de los vende brownies u.u quiero disfrutármelos no solo atipujarme de dulce para andar bien loca,1182441457006891008
2019-10-10 20:43:01,"Que creo que... El beso que te di era muy corto... -le agarra bien de la cadera y se acerca a sus labios acorralandolo contra la pared y lo pega a esta besándole espacio de una manera dulce y tranquila. No denotaba lujuria, más bien cariño y admiración-. Tenia que hacerlo... >>",1182441437234892800
